IntelliReal,https://www.crunchbase.com/organization/intellireal,Software,"Denver, Colorado, United States",IntelliReal specialize in accurate residential real estate valuations.,"1,034,468","Greater Denver Area, Western US",,Closed,2005-09-05,day,2011-08-15,day,2011-08-15,day,For Profit,http://www.intellireal.com/,"IntelliReal, LLC provides real estate intelligence software solutions in the form of data analytics and automated property valuations to the financial services market. The company manages various data related to residential properties and housing communities in the United States. Its products include Intelligent Automated Valuation Model, a solution that transforms data grounded in real property into meaningful business intelligence; Intelligent House Price Index, a solution that provides reports on residential real estate volatility; and proprietary technology and data aggregation system, which provides enhanced data analytics and valuation solutions. The company offers solutions in the areas of residential mortgage, marketing to post closing, servicing and account management, loss mitigation and default, and secondary and capital markets. It serves banks, mortgage servicers, GSEs, and real estate companies through resellers and partners. The company was founded in 2005 and is based in Denver, Colorado. IntelliReal, LLC operates as a subsidiary of Equifax Inc.IntelliReal, LLC provides real estate intelligence software solutions in the form of data analytics and automated property valuations to the financial services market.",Software,,,,,M&A,,,,,,,,,,,Private,,,,,,
Salina Area Chamber of Commerce,https://www.crunchbase.com/organization/salina-area-chamber-of-commerce,"Employment, Non Profit, Social, Social Assistance","Salina, Kansas, United States",Salina Area Chamber of Commerce is a non-profit organisation that helps in the economic development of the community.,"1,034,470",Midwestern US,,Active,1913-01-01,year,,,,,Non-profit,https://www.salinakansas.org,Salina Area Chamber of Commerce helps to create new jobs and payrolls in the community. They're also providing opportunities for labor force training and assessment and enhance educational opportunities.,"Community and Lifestyle, Government and Military, Other, Professional Services, Social Impact",,,11-50,,,,,,,,,,,,,Private,,,,,,
TapRaise,https://www.crunchbase.com/organization/tapraise,"Crowdfunding, Finance, Mobile Payments, Non Profit, Payments","Brooklyn, New York, United States","TapRaise is the unbelievably easy way to get funding from your crowd, in tweets, Facebook posts and everywhere else you reach them.","1,034,475","Greater New York Area, East Coast, Northeastern US",$1M to $10M,Active,2014-01-01,year,,,,,For Profit,https://www.tapraise.com,"TapRaise enables casual giving, opening a new channel of revenue to anyone with an online following. TapRaise’s Dollar Button makes giving more appealing, engaging and easier, letting people give money with a single tap. This allows content creators, cause leaders and others to bring in financial support from more people than they ever could have before.","Financial Services, Mobile, Other, Payments, Social Impact, Software",2,"Abel Lenz, Chris Hinkle",1-10,,,,,,,,,,,,,Private,,,,,,
CKJT Architects,https://www.crunchbase.com/organization/ckjt-architects,"Architecture, Construction, Home Improvement, Home Renovation","Kennewick, Washington, United States","CKJT Architects is an architectural firm that offers site design, cost estimation, construction, bidding, negotiation, and project services.","1,034,476","West Coast, Western US",,Active,1957-01-01,year,,,,,For Profit,https://www.ckjt.com,,Real Estate,1,Terrance D. Casey,1-10,,,,,,,,,,,,,Private,,,,,,
Able Technology,https://www.crunchbase.com/organization/able-technology,"B2B, Information Technology, Internet","San Francisco, California, United States",Review platform for b2b services,"1,034,476","San Francisco Bay Area, West Coast, Western US",,Active,2018-04-01,month,,,,,For Profit,https://ablereviews.com,,"Information Technology, Internet Services, Other",1,Benjamin Liu,1-10,,,,,,,,,,,,,Private,,,,,,
"About Flags, Inc.",https://www.crunchbase.com/organization/about-flags-inc,"Advertising, E-Commerce","Harleysville, Pennsylvania, United States","About Flags, Inc. is an online e-commerce retail shop selling American flags and flag accessories.","1,034,484","Greater Philadelphia Area, Great Lakes, Northeastern US",$1M to $10M,Active,1981-01-01,year,,,,,For Profit,http://www.aboutflags.com,"About Flags is a leading online retailer of advertising flags and banners, state flags, U.S. flags, sports flags, construction flags, bow flags, and more! We offer both standard and custom-made flags. About Flags offers a large array of flags for your business and the home. We carry the largest selection of advertising banners and flags, new home flags, open house flags, bow flags, and more to promote your business. We also provide flag accessories to display your flags and banners proudly. Visit our website to browse our inventory and learn about flag etiquette, determining flag size, and much more!","Advertising, Commerce and Shopping, Sales and Marketing",,,1-10,,,,,,,,,,,,,Private,,,,,,
RAYWEST DESIGNBUILD,https://www.crunchbase.com/organization/raywest-designbuild,"Commercial, Construction, Consulting, Real Estate","Fayetteville, North Carolina, United States","RAYWEST DESIGNBUILD offers a wide range of general and renovative construction services including design, and building.","1,034,486","East Coast, Southern US",$1M to $10M,Active,2015-01-01,year,,,,,For Profit,https://www.raywestdesignbuild.com/,,"Other, Professional Services, Real Estate",1,Greg West,1-10,,,,,,,,,,,,,Private,,,,,,
Bruni Media,https://www.crunchbase.com/organization/bruni-media,"Advertising, E-Commerce, Marketing","Minneapolis, Minnesota, United States","Bruni Media is a modern day agency, specializing in marketing, advertising, media planning, e-commerce and digital/data transformation.","1,034,487","Greater Minneapolis-Saint Paul Area, Great Lakes, Midwestern US",Less than $1M,Active,2016-01-01,year,,,,,For Profit,http://brunimedia.com/,"Bruni Media is a modern day agency, specializing in marketing, advertising, media planning, e-commerce and digital/data transformation. We are a full-service shop with an emphasis on digital and traditional advertising.  In addition, we have one of the most robust technology teams providing digital and data transformation unlike any other agency.","Advertising, Commerce and Shopping, Sales and Marketing",,,11-50,,,,,,,,,,,,1,Private,,,,,,
L and L Metal Fabrication,https://www.crunchbase.com/organization/l-and-l-metal-fabrication,"Construction, Manufacturing, Precious Metals","Tontitown, Arkansas, United States",L and L Metal Fabrication is a custom metal fabricator of uncommon versatility and skill.,"1,034,490",Southern US,$1M to $10M,Active,1989-01-01,year,,,,,For Profit,https://www.llmetalfab.com/,,"Manufacturing, Natural Resources, Real Estate",,,11-50,,,,,,,,,,,,,Private,,,,,,
Distige,https://www.crunchbase.com/organization/distige,"E-Commerce, SEO, Web Design","Atlanta, Georgia, United States","Distige provides custom designs and print marketing, trade-show displays, business signs, and web development.","1,034,491","Greater Atlanta Area, East Coast, Southern US",$1M to $10M,Active,,,,,,,For Profit,https://distige.com,,"Commerce and Shopping, Design, Internet Services, Sales and Marketing",,,1-10,,,,,,,,,,,,,Private,,,,,,
Cornerstone Community Housing,https://www.crunchbase.com/organization/cornerstone-community-housing,"Charity, Communities, Property Development, Real Estate, Residential","Eugene, Oregon, United States",Cornerstone Community Housing is an organization that offers housing communities for the elderly and people with disabilities.,"1,034,497","West Coast, Western US",$1M to $10M,Active,1992-01-01,year,,,,,Non-profit,https://cornerstonecommunityhousing.org/,Cornerstone Community Housing is a non-profit organization. They provide housing communities for the elderly and people with disabilities. They also provide people with autism and developmental problems with residential services. Their developmental disabilities by offering residential health care and selection.,"Community and Lifestyle, Other, Real Estate, Social Impact",,,11-50,,,,,,,,,,,,,Private,,,,,,
LevelUP Digital Solutions,https://www.crunchbase.com/organization/levelup-digital-solutions,"Advertising, Marketing, Social Media","Providence, Rhode Island, United States","LevelUP Digital Solutions is an advertising agency that develops websites, SEO, Google PPC, and Social Media Campaigns.","1,034,499","East Coast, New England, Northeastern US",,Active,2020-01-01,year,,,,,For Profit,https://www.levelupdigitalagency.com,"LevelUP Digital Solutions is an advertising agency that develops websites, SEO, Google PPC, and Social Media Campaigns.  It was founded in 2020 and its headquarters is located in Providence, Rhode Island.","Advertising, Internet Services, Media and Entertainment, Sales and Marketing",,,1-10,,,,,,,,,,,,,Private,,,,,,
Krinos Foods Atlanta,https://www.crunchbase.com/organization/krinos-foods-atlanta,"Customer Service, E-Commerce, Food and Beverage, Manufacturing, Wholesale","Buford, Georgia, United States","Krinos Foods Atlanta manufacturers, importers, and distributors of foods products.","1,034,502","Greater Atlanta Area, East Coast, Southern US",,Active,2014-01-01,year,,,,,For Profit,https://krinosatlanta.com,"Krinos Foods Atlanta is a food service distributors. Their customers contact them through address, phone, mail, and online applications.","Commerce and Shopping, Food and Beverage, Manufacturing, Other, Professional Services",,,11-50,,,,,,,,,,,,,Private,,,,,,
First Capital Group,https://www.crunchbase.com/organization/first-capital-group-e587,"Credit, Finance, Financial Services, Lending","San Francisco, California, United States","First Capital Group offers a wide range of loan and refinance services including reverse mortgage, and non-conforming real estate loans.","1,034,503","San Francisco Bay Area, West Coast, Western US",Less than $1M,Active,,,,,,,For Profit,https://www.fcgmortgage.com/,,"Financial Services, Lending and Investments",,,11-50,,,,,,,,,,,,,Private,,,,,,
House Painters of Chandler,https://www.crunchbase.com/organization/house-painters-of-chandler,Construction,"Chandler, Arizona, United States","Qualified, Local Chandler Painters","1,034,508","Greater Phoenix Area, Western US",,Active,1979-11-19,day,,,,,For Profit,http://www.painterschandleraz.com,"House Painters of Chandler, AZ is a team of some of the most experienced, highly trained, and most proven painting contractors in Chandler, AZ and the surrounding area. Today, we’re happy to offer an incredibly wide variety of service solutions to homeowners and business owners throughout the region with nearly round-the-clock support, unwavering quality, and undeniable professionalism.",Real Estate,,,11-50,,,,,,,,,,,,,Private,,,,,,
Silver Stone Homes,https://www.crunchbase.com/organization/silver-stone-homes,"Civil Engineering, Construction, Home Improvement, Project Management","Edmond, Oklahoma, United States",Silver Stone Homes is a construction and home improvement company that employs building techniques and modern innovation in construction.,"1,034,509",Southern US,$1M to $10M,Active,2004-01-01,year,,,,,For Profit,https://www.sshomesok.com/,,"Administrative Services, Other, Real Estate, Science and Engineering",,,1-10,,,,,,,,,,,,,Private,,,,,,
Popbasic,https://www.crunchbase.com/organization/popbasic,"Beauty, Collectibles, E-Commerce, Fashion, Retail, Wholesale","Emeryville, California, United States",Popbasic is based in a former steam car factory in Emeryville.,"1,034,510","San Francisco Bay Area, West Coast, Western US",Less than $1M,Closed,2013-06-01,month,,,,none,For Profit,https://popbasic.com,"In late 2012 Coen and Madeline moved from sunny Australia to foggy San Francisco. With two suitcases in tow, and the dream of creating the happiest women’s fashion brand ever, they launched Popbasic in June of 2013.  Today Popbasic is based in a former steam car factory in Emeryville. The small team spends their days dreaming of colorways and cottons (Delilah dreams of sunshine and new toys) that are so soft you won’t believe they’re not butter.  Every month they lovingly create a micro collection that we think you’ll love to add to your wardrobes. Please let us know if you’re ever in the San Francisco East Bay, we’d love you to drop by and take a sneak peek at upcoming pieces!","Clothing and Apparel, Commerce and Shopping, Consumer Goods, Design",2,"Coen Hyde, Madeline Veenstra",1-10,1,Seed,99999,USD,99999,99999,USD,99999,500 Global,,1,,Private,,,,,,
Ace-Pros,https://www.crunchbase.com/organization/ace-pros,"IT Management, Project Management, Software, Staffing Agency","Herndon, Virginia, United States","Ace-Pros is an IT firm that provides custom software development, project management, staffing solutions and IT managed services.","1,034,516","Washington DC Metro Area, East Coast, Southern US",Less than $1M,Active,2007-01-01,year,,,,,For Profit,http://aceprosinc.com/,,"Administrative Services, Information Technology, Other, Software",,,11-50,,,,,,,,,,,,,Private,,,,,,
Cadence Capital Partners,https://www.crunchbase.com/organization/cadence-capital-partners,"Banking, Financial Services, Real Estate","Chicago, Illinois, United States",Cadence Capital Partners is a real estate capital markets brokerage that connects capital users with capital providers.  ,"1,034,520","Greater Chicago Area, Great Lakes, Midwestern US",Less than $1M,Active,2016-09-01,day,,,,,For Profit,https://www.cadencerec.com/,,"Financial Services, Lending and Investments, Real Estate",,,1-10,,,,,,,,,,,,,Private,,,,,,
Global Manufacturing,https://www.crunchbase.com/organization/global-manufacturing,"Electronics, Industrial, Wholesale","El Paso, Texas, United States",Global Manufacturing is a distributor of industrial equipment for the manufacturing industry.,"1,034,521",Southern US,$1M to $10M,Active,1998-01-01,year,,,,,For Profit,http://gmius.com/inicio,,"Commerce and Shopping, Consumer Electronics, Hardware, Manufacturing",,,11-50,,,,,,,,,,,,,Private,,,,,,
Whittlesey & Hadley PC,https://www.crunchbase.com/organization/whittlesey-hadley-pc,"Consulting, Content Marketing, Management Consulting","Hartford, Connecticut, United States",Whittlesey & Hadley PC is a consulting company located in Hartford.,"1,034,522","East Coast, New England, Northeastern US",,Active,1961-01-01,day,,,,,For Profit,http://www.whcpa.com,,"Professional Services, Sales and Marketing",,,,,,,,,,,,,,,,Private,,,,,,
EMC Squared Vehicles,https://www.crunchbase.com/organization/emc-squared-vehicles,"Automotive, Autonomous Vehicles, Electric Vehicle","Irvine, California, United States",EMC Squared Vehicles designs and develops an enclosed electric vehicle with the aim of enhancing the travel experience.,"1,034,523","Greater Los Angeles Area, West Coast, Western US",,Active,2014-01-01,year,,,,,For Profit,https://www.emc2vehicles.com/,"EMC Squared Vehicles designs and develops an enclosed electric vehicle with the aim of enhancing the travel experience. The company's vehicle features storage space and easily swappable Li-ion batteries, eliminating the need for downtime during charging. This allows clients to substantially reduce the operating costs of their vehicle fleets.",Transportation,1,Mandar Padhye,,2,Seed,,USD,,,USD,,"Cleantech Open, Los Angeles Cleantech Incubator",2,2,,Private,,,,,,
Classes and Careers,https://www.crunchbase.com/organization/classes-and-careers,"Consulting, E-Learning, Education, Higher Education, Online Portals","Clearwater, Florida, United States",Classes and Careers is an online portal that connects students with online degree colleges with a wide range of programs and courses.,"1,034,525","Tampa Bay Area, East Coast, Southern US",,Active,2006-01-01,year,,,,,For Profit,https://classesandcareers.com/,,"Education, Internet Services, Professional Services, Software",,,51-100,,,,,,,,,,,,,Private,,,,,,
Indicon,https://www.crunchbase.com/organization/indicon-3f4a,"Advice, Employee Benefits, Financial Services, Wealth Management","Allentown, Pennsylvania, United States","Indicon is a financial services firm that offers wealth management, estate, and personal financial planning services.","1,034,527","Great Lakes, Northeastern US",,Active,1975-01-01,year,,,,,For Profit,https://www.indiconinc.com,,"Administrative Services, Financial Services, Health Care, Media and Entertainment",,,11-50,,,,,,,,,,,,,Private,,,,,,
Advanced Extrusion,https://www.crunchbase.com/organization/advanced-extrusion,Manufacturing,"Rogers, Minnesota, United States",Advanced Extrusion is a manufacturer of custom polyester roll stock.,"1,034,527","Greater Minneapolis-Saint Paul Area, Great Lakes, Midwestern US",$1M to $10M,Active,2000-01-01,year,,,,,For Profit,http://www.advancedextrusion.com/,,Manufacturing,,,11-50,,,,,,,,,,,,,Private,,,,,,
Hastest Solutions,https://www.crunchbase.com/organization/hastest-solutions,"Electronics, Hardware, Manufacturing","San Jose, California, United States",Hastest Solutions is the fastest growing provider of high quality solutions in the field of reliability testing.,"1,034,528","San Francisco Bay Area, Silicon Valley, West Coast",$1M to $10M,Active,2000-01-01,day,,,,,For Profit,http://hastest.com/,,"Consumer Electronics, Hardware, Manufacturing",,,11-50,,,,,,,,,,,,,Private,,,,,,
Allegheny Coatings,https://www.crunchbase.com/organization/allegheny-coatings,"Automotive, Building Material, Manufacturing","Ridgway, Colorado, United States",Allegheny Coatings is an automotive manufacturing company that Provides shipping across Borders and provides Proformas.,"1,034,529",Western US,$50M to $100M,Active,1981-01-01,year,,,,,For Profit,https://www.alleghenycoatings.com/,"Allegheny Coatings offers a full array of coatings for nearly any industrial application.  Allegheny Coatings' licensed materials span zinc-flake coatings, dry-film lubricants, high-temperature resistant coatings, and other specialty coatings. Contact Allegheny Coatings to identify which coating is suited for your application.","Manufacturing, Real Estate, Transportation",,,251-500,,,,,,,,,,,,,Private,,,,,,
Taylor Counseling Group,https://www.crunchbase.com/organization/taylor-counseling-group,"Fitness, Health Care, Mental Health, Therapeutics, Wellness","Dallas, Texas, United States","Taylor Counseling Group provides mental health care to individuals of all ages, couples, and families.","1,034,534","Dallas/Fort Worth Metroplex, Southern US",,Active,2015-01-01,year,,,,,For Profit,https://taylorcounselinggroup.com,"Taylor Counseling Group is a mental health center that serves individuals of all ages. Their services range from traditional individual counseling to couples counseling, family therapy, and play therapy.","Health Care, Sports",,,101-250,,,,,,,,,,,,,Private,,,,,,
Datamatrix Technologies,https://www.crunchbase.com/organization/datamatrix-technologies,"Data Center, Database, Health Care, Information Technology, Medical","White Plains, New York, United States","Datamatrix Technologies is a business service company that offers medical practice solutions, incentive management, and data entry services.","1,034,534","Greater New York Area, East Coast, Northeastern US",$1M to $10M,Active,2000-01-01,year,,,,,For Profit,https://datamatrixtech.com,,"Data and Analytics, Hardware, Health Care, Information Technology, Software",1,Ashish Ahuja,101-250,,,,,,,,,,,,,Private,,,,,,
Jbl Trinity,https://www.crunchbase.com/organization/jbl-trinity,"Auto Insurance, Commercial Insurance, Financial Services, Insurance, Property Insurance, Risk Management","Atlantic Highlands, New Jersey, United States","JBL Trinity provides auto, home, and commercial insurance services.","1,034,535","Greater New York Area, East Coast, Northeastern US",$1M to $10M,Active,1997-01-01,year,,,,,For Profit,https://www.jbltrinity.com,"JBL Trinity provides personal insurance products to protect customers' homes, automobiles, and personal possessions, along with personal liability coverages. They also provide business insurance services such as cargo, general liability, pollution, professional liability, and surety bonds.","Financial Services, Professional Services",,,11-50,,,,,,,,,,,,,Private,,,,,,
Fitness Project,https://www.crunchbase.com/organization/fitness-project,"Fitness, Health Care, Training, Wellness","Conroe, Texas, United States",Fitness Project is a wellness center that offers strength training and fitness studio services.,"1,034,535","Greater Houston Area, Southern US",,Active,2020-01-01,year,,,,,For Profit,https://fitnessproject.us,,"Education, Health Care, Sports",,,51-100,,,,,,,,,,,,,Private,,,,,,
MemoryShare,https://www.crunchbase.com/organization/memoryshare,"Funerals, Video, Video Streaming","Dallas, Texas, United States","MemoryShare provides technology solutions such as live streaming, video, streamlined webcasting and editing services to funeral homes.","1,034,536","Dallas/Fort Worth Metroplex, Southern US",,Active,2013-01-01,year,,,,,For Profit,https://www.memoryshare.com/,,"Community and Lifestyle, Content and Publishing, Health Care, Media and Entertainment, Video",,,1-10,,,,,,,,,,,,,Private,,,,,,
Biophagy,https://www.crunchbase.com/organization/biophagy,"Biotechnology, Life Science","Albuquerque, New Mexico, United States",Biophagy is a biopharmaceutical company that treats therapeutic diseases.,"1,034,546",Western US,,Active,2012-01-01,year,,,,,For Profit,https://www.biophagy.com/,"Biophagy is a biotech company that develops targeted, proprietary drugs that modulate autophagy in diseases with high unmet medical needs and help individuals increase their autophagy functioning. They develop an OTC/DTC product that focuses on autophagy stimulation for general health and longevity.","Biotechnology, Science and Engineering",1,Stuart Rose,11-50,1,,,,,,USD,,New Mexico Small Business Assistance Program,,1,,Private,,,,,,
Danrich Welding,https://www.crunchbase.com/organization/danrich-welding,"Industrial, Laser, Manufacturing","Paramount, California, United States",Danrich Welding is a metal manufacturing company.,"1,034,547","Greater Los Angeles Area, West Coast, Western US",$1M to $10M,Active,1970-01-01,month,,,,,For Profit,http://www.danrichwelding.com,"Danrich Welding is a metal fabrication company that offers sheet metal fabrication, laser cutting, punching, forming, welding fabrication, Mig, TiG welding, and robotic TiG welding services for the metals industry. They accept online payments.","Hardware, Manufacturing, Science and Engineering",2,"Dan Tuthill, Richard Schenk",11-50,,,,,,,,,,,,,Private,,,,,,
Noland Sales Corporation,https://www.crunchbase.com/organization/noland-sales-corporation,"Architecture, Commercial, Customer Service, Home Services","Wood Dale, Illinois, United States","Noland Sales Corporation is a floor-cover contracting company that offers flooring, architecture, and planning services.","1,034,547","Greater Chicago Area, Great Lakes, Midwestern US",$10M to $50M,Active,1975-01-01,year,,,,,For Profit,http://www.nolandsales.com,"Noland Sales Corporation provides flooring, architecture, and planning services. Their flooring manufacturers allow providing comprehensive floorcovering designs. They also provide technologies to create products that perform in the environments that health care represents. Their services include seam inspection, repair, adding infill, and applying an antimicrobial spray to inhibit bacteria growth.","Other, Professional Services, Real Estate",,,51-100,,,,,,,,,,,,,Private,,,,,,
Roselle Paper,https://www.crunchbase.com/organization/roselle-paper,"Manufacturing, Retail","Roselle, New Jersey, United States","Founded in 1964, Roselle Paper is one of the leading domestic manufacturers of paper supplies sold to schools and mass market retailers.","1,034,549","Greater New York Area, East Coast, Northeastern US",,Active,1964-01-29,day,2014-10-08,day,,,For Profit,http://www.rosellepaper.com/,,"Commerce and Shopping, Manufacturing",,,51-100,,M&A,,,,,,,,,,,Private,,,,,,
McKlein USA,https://www.crunchbase.com/organization/mcklein-usa,Retail,"Chicago, Illinois, United States","McKlein Company, LLC is offering travel products, such as carry-on luggage, business products.","1,034,550","Greater Chicago Area, Great Lakes, Midwestern US",$1M to $10M,Active,1998-01-01,year,,,,,For Profit,http://mckleincompany.com/,"McKlein Company, LLC is a manufacturer and supplier, offering travel products, such as carry-on luggage, business products that consist of briefcases, computer bags, laptop sleeves, and rolling totes for the business traveler, casual products, including backpacks, messenger bags, and duffel bags, as well as handbags and satchels. Through its subsidiaries, McKlein Company engages in the design, marketing, and sale of its products primarily under the McKleinUSA, Siamod, and Parinda names worldwide. It sells its products through wholesale channels, department stores, specialty luggage stores, mass merchants, and discounters, internet retailers, and retail channels. As of December 31, 2010, the company has operations in Asia, and North America. McKlein Company, LLC was founded in 1997 and is headquartered in Chicago, Illinois.",Commerce and Shopping,2,"Chettha Saetia, Parinda Saetia",11-50,,,,,,,,,,,,,Private,,,,,,
