Cloud 9 Perception LP,https://www.crunchbase.com/organization/cloud-9-perception-lp,"Artificial Intelligence (AI), Industrial Automation, Industrial Manufacturing, Machine Learning, Manufacturing, Robotics","Arlington, Texas, United States","Cloud 9 Perception is an industrial machine vision system solutions provider based in Arlington, TX. ","537,493","Dallas/Fort Worth Metroplex, Southern US",Less than $1M,Active,2016-11-01,month,,,,,For Profit,https://www.c9p.io,"Cloud 9 Perceptions provides cutting edge machine vision solutions for complex real-world problems. Their hardware products are self-contained, ruggedized perception modules providing detection, recognition, and scanning capabilities for manufacturing, material handling, logistics, e-commerce, and many other applications. Their software is customized for your specific automation and robotics needs. Coupled with custom hardware, they provide 2D/3D perception to your existing fleet of robots, and more importantly program them to act intelligently based on this newfound 'sense' given by their hardware.","Artificial Intelligence (AI), Data and Analytics, Hardware, Manufacturing, Science and Engineering, Software",2,"Christopher McMurrough, PhD, James Staud",1-10,,,,,,,,,,,,,Private,,,,,,
Tum Yeto,https://www.crunchbase.com/organization/tum-yeto,"Consumer Goods, E-Commerce, Fashion, Sporting Goods","San Diego, California, United States","Tum Yeto is a manufacturing company that provides an online store of tees, sweat, hardware accessories, and skateboards.","537,494","Greater San Diego Area, West Coast, Western US",$10M to $50M,Active,1990-01-01,year,,,,,For Profit,https://tumyeto.com/,,"Clothing and Apparel, Commerce and Shopping, Consumer Goods, Design, Sports",,,11-50,,,,,,,,,,,,,Private,,,,,,
20 Minutes to Fitness,https://www.crunchbase.com/organization/20-minutes-to-fitness,"Fitness, Training, Wellness","Sarasota, Florida, United States","20 Minutes to Fitness offers strength training, wellness, and body scan services.","537,495","East Coast, Southern US",$1M to $10M,Active,,,,,,,For Profit,https://www.20minutestofitness.com,"20 Minutes to Fitness provides wellness and fitness services. They offer services that include strength training, golf fitness, stretching, body scans, mobility, and movement. An online inquiry form is available on the company's website.","Education, Health Care, Sports",1,Virginia Phillips,11-50,,,,,,,,,,,,,Private,,,,,,
Global Partnership for Sustainable Development Data,https://www.crunchbase.com/organization/global-partnership-for-sustainable-development-data,"Big Data, Information Technology, Sustainability","Washington, District of Columbia, United States","Global Partnership for Sustainable Development Data is a network to improve lives, fighting inequality & environmental sustainability.","537,501","Washington DC Metro Area, Southern US",,Active,2015-01-01,year,,,,,For Profit,https://www.data4sdgs.org/,,"Data and Analytics, Information Technology, Sustainability",,,11-50,,,,,,,,,,,,,Private,,,,,,
Kenmore-Town of Tonawanda UFSD,https://www.crunchbase.com/organization/kenmore-town-of-tonawanda-ufsd,"Education, Primary Education, Secondary Education","Buffalo, New York, United States","Kenmore-Town of Tonawanda UFSD provides education, transportation, food service and athletic training to elementary to high school students.","537,503","Great Lakes, East Coast, Northeastern US",$100M to $500M,Active,1907-01-01,year,,,,,Non-profit,https://www.ktufsd.org/,,Education,,,501-1000,,,,,,,,,,,,,Private,,,,,,
S & K Sales Co.,https://www.crunchbase.com/organization/s-k-sales-co,"E-Commerce, Local Business, Military, Retail","Virginia Beach, Virginia, United States",S & K Sales provides brand name consumer products to the military resale market located in Virginia Beach.,"537,504","East Coast, Southern US",$50M to $100M,Active,1934-01-01,day,,,,,For Profit,http://www.sksales.com/,,"Commerce and Shopping, Government and Military, Information Technology, Sales and Marketing",,,101-250,,,,,,,,,,,,,Private,,,,,,
Des Moines Water Works,https://www.crunchbase.com/organization/des-moines-water-works,"Facilities Support Services, Water, Water Purification","Des Moines, Iowa, United States","Des Moines Water Works is a public utility company that provides leaks, detection, meter, lab testing and water service.","537,504",Midwestern US,Less than $1M,Active,1871-01-01,year,,,,,For Profit,http://www.dmww.com/,,"Administrative Services, Natural Resources, Sustainability",,,251-500,,,,,,,,,,,,,Private,,,,,,
Eckenhoff Saunders Architects,https://www.crunchbase.com/organization/eckenhoff-saunders-architects,"Architecture, Construction, Interior Design","Chicago, Illinois, United States","Eckenhoff Saunders Architects is an architecture, planning and interior design firm.","537,507","Greater Chicago Area, Great Lakes, Midwestern US",,Active,1983-01-01,year,,,,,For Profit,https://www.esadesign.com,,"Design, Real Estate",,,51-100,,,,,,,,,,,,,Private,,,,,,
Selinsky Force,https://www.crunchbase.com/organization/selinsky-force,"Construction, Rental","Canton, Ohio, United States","Selinsky Force, LLC is a specialty Industrial Services supplier with market concentrations in OH, PA, KY, WV and IN.","537,508","Great Lakes, Midwestern US",,Active,1932-01-01,year,,,,,For Profit,https://www.selinskyforce.com/,,"Commerce and Shopping, Real Estate",,,51-100,,,,,,,,,,,,,Private,,,,,,
EasyData,https://www.crunchbase.com/organization/easydata-7c66,"Analytics, Data Integration, Information Technology, Software","Netherlands, Missouri, United States",EasyData is a document capture and data analysis specialist that combines innovation and practice in the field of data solutions.,"537,509",Midwestern US,$1M to $10M,Active,1999-01-01,year,,,,,For Profit,https://www.easydata.nl/,,"Data and Analytics, Information Technology, Software",,,1-10,,,,,,,,,,,,,Private,,,,,,
Corrado Construction Company,https://www.crunchbase.com/organization/corrado-construction-company,"Civil Engineering, Construction, Project Management","New Castle, Delaware, United States","Corrado Construction Company specializes in earthwork, excavation, project cost analysis, paving, utility work, design, and demolition.","537,510","Greater Philadelphia Area, East Coast, Southern US",$10M to $50M,Active,1945-01-01,year,,,,,For Profit,https://corradoconstruction.com/,,"Administrative Services, Other, Real Estate, Science and Engineering",1,Joe Corrado Jr.,101-250,,,,,,,,,,,,,Private,,,,,,
Central Valley Specialty Hospital,https://www.crunchbase.com/organization/central-valley-specialty-hospital,Health Care,"Modesto, California, United States",Hospital,"537,510","West Coast, Western US",$10M to $50M,Active,1976-01-01,year,,,,,For Profit,https://centralvalleyspecialty.org/,"Central Valley Specialty Hospital provides these services through a team of Board Certified Physicians, critically trained Registered Nurses, Respiratory Therapists, Wound Care Nurses, Physical and Occupational Therapists, Speech Therapists, Psychologists, Psychiatrists, Dietitians, Case Managers, and Social Workers who all focused on individualized goals for each patient’s recovery, allowing the patient to regain their independence and reach their optimum level of health.",Health Care,,,11-50,,,,,,,,,,,,,Private,,,,,,
Portland Cement Association,https://www.crunchbase.com/organization/portland-cement-association,Manufacturing,"Washington, District of Columbia, United States","PCA is the premier policy, research, education, and market intelligence organization serving America’s cement manufacturers.","537,511","Washington DC Metro Area, Southern US",$10M to $50M,Active,1902-01-01,year,,,,,For Profit,http://www.cement.org,"The Portland Cement Association (PCA), founded in 1916, is the premier policy, research, education, and market intelligence organization serving America’s cement manufacturers.  PCA members represent 92 percent of US cement production capacity and have facilities in all 50 states.  The Association promotes safety, sustainability, and innovation in all aspects of construction, fosters continuous improvement in cement manufacturing and distribution, and generally promotes economic growth and sound infrastructure investment.",Manufacturing,,,251-500,,,,,,,,,,,,,Private,,,,,,
ALTS Accelerator,https://www.crunchbase.com/organization/alts-accelerator,"Blockchain, Finance, Financial Services, FinTech","Stamford, Connecticut, United States",ALTS Capital provides significant connectivity to financing and innovation resources to facilitate startup success.,"537,514","East Coast, New England, Northeastern US",,Active,2017-01-01,year,,,,,For Profit,https://www.altscapital.com/accelerator,"ALTS Capital Accelerator is an intensive program that provides significant connectivity to financing and innovation resources to facilitate startup success. They also provide a forum for preliminary business stress-testing and improvement. The program is organized into 12 value-added modules providing a comprehensive overview of key issues facing entrepreneurs. It provides an online platform for early-stage companies to prepare their businesses to source capital directly from venture capitalists, high net worth individuals, and angel investors.","Blockchain and Cryptocurrency, Financial Services, Other",,,,,,,,,,,,,,,,Private,,,,,,
Edelen Renewables,https://www.crunchbase.com/organization/edelen-renewables,"Energy, GreenTech, Solar","Lexington, Kentucky, United States",Edelen Renewables develops solar projects that drive social impact.,"537,515",Southern US,,Active,2016-01-01,year,,,,,For Profit,https://edelenrenewables.com,"Edelen Renewables develops solar projects that drive social impact. It brings coal companies together with green energy advocates and develops abandoned mine lands to create employment for displaced coal miners. The company also provides services such as land acquisition, facilitating public engagement and incentives, shepherding projects through regulatory processes, and securing corporate off-take agreements (VPPAs). Edelen Renewables' coal-to-solar projects on abandoned mines and decommissioned coal-generation power plants are located in Kentucky, West Virginia, Virginia, Ohio, Pennsylvania, Illinois, and Wyoming.","Energy, Natural Resources, Sustainability",,,,,,,,,,,,,,,,Private,,,,,,
Keanesoft,https://www.crunchbase.com/organization/keanesoft,"Consulting, Data Center, Information Technology, IT Management, Project Management","Little Elm, Texas, United States",Keanesoft is an information technology company that provides IT management and software consulting services.,"537,516","Dallas/Fort Worth Metroplex, Southern US",$1M to $10M,Active,2012-01-01,year,,,,,For Profit,http://keanesoft.com/,,"Administrative Services, Hardware, Information Technology, Other, Professional Services",,,101-250,,,,,,,,,,,,,Private,,,,,,
TheQwikFix,https://www.crunchbase.com/organization/theqwikfix,"Commercial Real Estate, Construction, Real Estate","Carlsbad, California, United States",TheQwikFix is a real state firm that helps in turning home inspection reports into repair quotes backed by licensed contractors.,"537,517","Greater San Diego Area, West Coast, Western US",$1M to $10M,Active,2019-01-01,year,,,,,For Profit,https://theqwikfix.com/,,Real Estate,1,Jeremy Henley,1-10,,,,,,,,,,,,,Private,,,,,,
NaviSync,https://www.crunchbase.com/organization/navisync,"Advertising, Brand Marketing, Marketing, Training","Morristown, New Jersey, United States","NaviSync is a marketing and advertising company that provides brand marketing, pull-through campaigns, and training platforms.","537,519","Greater New York Area, East Coast, Northeastern US",,Active,2013-01-01,year,,,,,For Profit,https://navisyncllc.com,,"Advertising, Education, Sales and Marketing",,,51-100,,,,,,,,,,,,,Private,,,,,,
DollarDays,https://www.crunchbase.com/organization/dollardays,"E-Commerce, Internet, Small and Medium Businesses","Phoenix, Arizona, United States","DollarDays is a premier online wholesale distributor and closeout company for small businesses, nonprofits, and every day consumers.","537,522","Greater Phoenix Area, Western US",$10M to $50M,Active,2001-01-01,year,,,,,For Profit,https://www.dollardays.com,,"Commerce and Shopping, Internet Services, Other",1,Marc Joseph,101-250,,,,,,,,,,,,,Private,,,,,,
Meeting Alliance,https://www.crunchbase.com/organization/meeting-alliance,"Events, Service Industry","Robbinsville, New Jersey, United States","Meeting Alliance is an event management planning various events and functions company in Washington, New Jersey.","537,523","East Coast, Northeastern US",$1M to $10M,Active,1999-01-01,year,,,,,For Profit,http://meetingalliance.com,"Meeting Alliance was established in January 1999 as a full-service meeting and event management company. They are experts in the logistical planning of meetings and events for corporate clients. The company was formed by three experienced meeting planning professionals in response to the need for better, more detailed, and hands-on service. Their  corporate offices are located in Robbinsville, New Jersey, just outside of Princeton. The foundation of the business is built on the concept of planning and executing flawless meetings and events while providing a level of client service that sets us apart from their competitors. They offer clients a unique combination of personalized service and effective, cost-efficient meeting, logistics, and event management. The idea is simple: they pay attention to the details so you may focus on content. Their  commitment to their clients is straightforward: provide a seamless program with 100% satisfaction.","Events, Media and Entertainment, Other",2,"David D'Eletto, Michael Franks",11-50,,,,,,,,,,,,,Private,,,,,,
KD Analytical Consulting,https://www.crunchbase.com/organization/kd-analytical,"Consulting, Security, Training","Lexington, Kentucky, United States","KD Analytical Consulting offers detection instruments support & services along with maintenance management, training & building protection.","537,527",Southern US,Less than $1M,Active,2003-01-01,year,,,,,For Profit,http://www.kdanalytical.com/,,"Education, Privacy and Security, Professional Services",,,11-50,,,,,,,,,,,,,Private,,,,,,
The Kelemen Company,https://www.crunchbase.com/organization/the-kelemen-company,"Angel Investment, Asset Management, Property Management, Real Estate","Irvine, California, United States",The Kelemen Company is a community-focused commercial real estate firm.,"537,529","Greater Los Angeles Area, West Coast, Western US",Less than $1M,Active,2017-01-01,year,,,,,For Profit,https://www.kelemencompany.com,"The Kelemen Company strives to be active participants in their community by engaging in activities that enhance the area and donating to charities. They believe in the importance of cultivating strong, collaborative relationships within their community. They offer an approach that creates value and minimizes risk.","Financial Services, Lending and Investments, Real Estate",,,11-50,,,,,,,,,,,,,Private,,,,,,
Robinsonfresh,https://www.crunchbase.com/organization/robinsonfresh,"Food and Beverage, Food Processing","Eden Prairie, Minnesota, United States","Robinson Fresh  best fruits and vegetables, but we go beyond supplying fresh produce to offering an abundance of fresh solutions.","537,531","Greater Minneapolis-Saint Paul Area, Great Lakes, Midwestern US",Less than $1M,Active,1901-01-01,year,,,,,For Profit,https://www.robinsonfresh.com/,"Robinson Fresh.® It’s their way of honoring their  heritage and focusing on everything fresh. From local and regional fields of crisp green asparagus and fragrant bell peppers, to tropical lands abundant with pineapples and melons. Robinson Fresh brings you quality produce and consumer-trusted brands, to help you satisfy growing demand for fresh fruits and vegetables, year-round and worldwide.",Food and Beverage,,,1001-5000,,,,,,,,,,,,,Private,,,,,,
Technology Pointe,https://www.crunchbase.com/organization/technology-pointe,"Customer Service, Cyber Security, Data Center, Document Management, Information Technology, Private Cloud, Virtualization, VoIP","Round Rock, Texas, United States",Technology Pointe work with many technologies keeping in mind just one pointe: helping our clients manage their technology strategy.,"537,531",Southern US,$1M to $10M,Active,2000-01-01,year,2022-01-20,day,,,For Profit,http://www.tech-pointe.com/,"Technology Pointe was founded in 2000 by Chuck & Marty to provide enterprise quality IT for small businesses in Austin. Along the way the company has grown significantly in several areas: - In 2007 They opened Their first datacenter in Austin, TX. Before somebody smarter than us came up with the term ""cloud"", They were hosting customer servers in a datacenter. - In 2011 Technology Pointe merged with Teople. Around 2009 Their Dallas client base began growing significantly and an opportunity to open a Dallas office came up. Since then Their Dallas presence has grown significantly, with four staff members and several large clients. - In 2012 Technology Pointe became an M-Files partner. This intuitive document management system solves organizational, access and compliance issues for companies and provides near immediate return on investment. - In 2014 the continued growth of Their private cloud services necessitated opening a second datacenter in Dallas, TX. We're now able to provide geographic high availability to the hundreds of servers and terabytes of data They host for companies across the nation.","Hardware, Information Technology, Internet Services, Messaging and Telecommunications, Other, Privacy and Security, Professional Services, Software",,,11-50,,M&A,,,,,,,,,,,Private,,,,,,
Botnick Realty Company,https://www.crunchbase.com/organization/botnick-realty-company,"Property Development, Property Management, Real Estate, Real Estate Investment","Akron, Ohio, United States","Botnick Realty Company is a real estate company that specializes in building, selling, investing in, and maintaining homes.","537,533","Great Lakes, Midwestern US",$1M to $10M,Active,,,,,,,For Profit,https://botnickrealty.com,,"Financial Services, Real Estate",,,11-50,,,,,,,,,,,,,Private,,,,,,
BlueRing Stencils,https://www.crunchbase.com/organization/bluering-stencils,"Industrial Engineering, Manufacturing, Supply Chain Management","Lumberton, New Jersey, United States",BlueRing Stencils is a stencil manufacturer committed to supplying the advanced stencil printing technologies in the assembly industry.,"537,535","Greater Philadelphia Area, East Coast, Northeastern US",,Active,2017-01-01,year,,,,,For Profit,https://www.blueringstencils.com,"BlueRing Stencils is a ""full service"" stencil manufacturer committed to supplying the most advanced stencil printing technologies in the circuit board assembly industry. We offer on-time delivery of high quality laser cut stencils, paste transfer increasing nano-coatings, printing accessories and stencil design/development services, all committed to give you the highest quality print for your specific assembly process.","Manufacturing, Science and Engineering, Transportation",,,11-50,,,,,,,,,,,,,Private,,,,,,
Firetree,https://www.crunchbase.com/organization/firetree,"Addiction Treatment, Health Care, Non Profit, Rehabilitation, Wellness","Williamsport, Pennsylvania, United States","Firetree is a non-profit addiction treatment organization that offers residential treatment, outpatient, and reentry programming services.","537,535","Great Lakes, Northeastern US",$1M to $10M,Active,1990-01-01,year,,,,,Non-profit,https://www.firetree.com/,,"Health Care, Other, Social Impact",,,251-500,,,,,,,,,,,,,Private,,,,,,
Steve Gruber,https://www.crunchbase.com/organization/steve-gruber-e968,"Advertising, Broadcasting, Internet Radio, News","Lansing, Michigan, United States",Steve Gruber is a radio broadcasting company that features podcasts and advertising programs.,"537,538","Great Lakes, Midwestern US",$1M to $10M,Active,2012-01-01,year,,,,,For Profit,https://www.stevegruber.com/,,"Advertising, Content and Publishing, Media and Entertainment, Music and Audio, Sales and Marketing, Video",,,11-50,,,,,,,,,,,,,Private,,,,,,
Kolme Group,https://www.crunchbase.com/organization/kolme-group,"Consulting, Project Management, Small and Medium Businesses","Phoenix, Arizona, United States",Kolme Group provides data-driven project and portfolio management and consulting services.,"537,539","Greater Phoenix Area, Western US",,Active,2017-01-01,year,,,,,For Profit,https://kolmegroup.com,,"Administrative Services, Other, Professional Services",2,"Kim Essendrup, Matt Henderson",11-50,,,,,,,,,,,,,Private,,,,,,
TQINet,https://www.crunchbase.com/organization/tqinet-total-solutions,"Consulting, Information Technology, Web Hosting","Cincinnati, Ohio, United States","TQINet | Total Solutions is an IT company providing services to small to medium sized companies, from support and consulting to web apps.","537,544","Great Lakes, Midwestern US",$1M to $10M,Active,1995-01-01,year,,,,,For Profit,https://tqi.solutions,,"Information Technology, Internet Services, Professional Services",1,Connie Dunmyer,51-100,,,,,,,,,,,,,Private,,,,,,
Milkshake,https://www.crunchbase.com/organization/milkshake,"Shopping, Travel","Greenwich, Connecticut, United States",Milkshake is a news website focused on spreading positivity through its content.,"537,545","East Coast, New England, Northeastern US",$10M to $50M,Active,2010-06-01,day,,,,,For Profit,http://www.getmilkshake.com,"Milkshake is a daily edition of good finds that give back. Through its hallmark daily email and growing online communities, Milkshake invites readers to discover products, people, causes and companies that are making a difference, then inspires them to take action. Read about a chic watch made of recycled wood then click to buy and support a tree-planting initiative; learn about an organization that is selling gum and mints to fund the education of children in Africa; make your next deluxe vacation matter and spend a day volunteering to protect Leatherback turtle hatchlings in Australia from extinction. Presented in compact, upbeat editorial tidbits, Milkshake is making it easy (and fun!) to be a part of all thatâ€:tm:s good. Milkshake Manifesto Milkshake was founded based on the belief that it is better to support products, initiatives, events and services that not only are innovative, unique and desired, but that also give back at the same time. Our mission is to put â€˜giving backâ€:tm: in the context of the larger world we live in: discovering ways to shop, travel, eat, read and interact with greater purpose. Our ultimate goal is to give readers a daily find that dazzles and initiates change, inspiring them to be part of all thatâ€:tm:s good.","Commerce and Shopping, Travel and Tourism",2,"Amy Jurkowitz, Pamela Caffray",1-10,,,,,,,,,,,,,Private,,,,,,
Mom Made Foods,https://www.crunchbase.com/organization/mom-made-foods,"Food and Beverage, Organic Food, Recipes","Alexandria, Virginia, United States",We are committed to using organic ingredients to make delicious and healthy food that kids love.,"537,546","Washington DC Metro Area, East Coast, Southern US",$1M to $10M,Active,2006-05-01,day,,,,,For Profit,http://www.mommadefoods.com,We are committed to using organic ingredients to make delicious and healthy food that kids love.,Food and Beverage,1,Heather Stouffer,11-50,1,Seed,,USD,,,USD,,New Dominion Angels,,1,,Private,,,,,,
Maryville,https://www.crunchbase.com/organization/maryville,"Education, Family, Non Profit","Des Plaines, Illinois, United States","Maryville is a non-profit organization that offers family support, educational, youth development services to empower intellectual growth.","537,546","Greater Chicago Area, Great Lakes, Midwestern US",$10M to $50M,Active,1883-01-01,year,,,,,Non-profit,https://www.maryvilleacademy.org,,"Community and Lifestyle, Education, Other, Social Impact",1,Patrick Feehan,251-500,,,,,,,,,,,,,Private,,,,,,
Vangaurd ID Systems,https://www.crunchbase.com/organization/vangaurd-id-systems,"Electronics, Manufacturing, Printing, QR Codes","West Chester, Pennsylvania, United States","Vangaurd ID Systems focuses on the manufacturing of bar-coded transaction cards, printing, access control and custom card solutions.","537,550","Greater Philadelphia Area, Great Lakes, Northeastern US",$10M to $50M,Active,1987-01-01,year,,,,,For Profit,https://vanguardid.com/,,"Consumer Electronics, Content and Publishing, Hardware, Manufacturing, Media and Entertainment, Software",,,11-50,,,,,,,,,,,,,Private,,,,,,
"Translate Now, Inc.",https://www.crunchbase.com/organization/translate-now-inc,"B2B, Marketing, Service Industry, Translation Service","San Francisco, California, United States",TranslateNow integrates modern translation technology with professional human translators to service the world’s leading enterprises.,"537,550","San Francisco Bay Area, West Coast, Western US",,Active,2016-01-01,year,2018-06-19,day,,,For Profit,http://www.translatenow.com,"TranslateNow delivers language solutions to drive revenue for F500 companies around the world. The company’s special features include high-impact translation and localization, white-glove multilingual sales support, and global guerrilla marketing. TranslateNow was founded in 2016 by Matt Arney.","Other, Professional Services, Sales and Marketing",1,Matt Arney,11-50,1,M&A,,USD,,,USD,,,,,,Private,,,,,,
