CrO Biosciences,https://www.crunchbase.com/organization/cro-biosciences,"Clinical Trials, Consulting, Life Science","Temecula, California, United States",CrO Biosciences is an information management consulting firm that provides regulatory submissions and clinical trial support.,"1,034,208","Greater Los Angeles Area, Inland Empire, West Coast",$1M to $10M,Active,2019-01-01,year,,,,,For Profit,https://crobiosciences.com,"CrO Biosciences offers life sciences consulting services. They provide regulatory submissions, GCP inspection readiness, clinical trial support, and R&D systems exchange services to pharmaceutical, biotechnology, and medical device organizations. Their regulatory affairs, regulatory operations, clinical operations, and R&D systems exchange.","Biotechnology, Health Care, Professional Services, Science and Engineering",,,11-50,,,,,,,,,,,,,Private,,,,,,
Janna Kay Charcuterie,https://www.crunchbase.com/organization/janna-kay-charcuterie,"Consumer Goods, E-Commerce, Gift, Retail","Detroit, Michigan, United States","Janna Kay Charcuterie delivers a comprehensive, delicious, and enjoyable session that will teach you how to make your own charcuterie board.","1,034,209","Greater Detroit Area, Great Lakes, Midwestern US",,Active,,,,,,,For Profit,https://jannakay.com,"Janna Kay Charcuterie delivers a comprehensive, delicious, and enjoyable session that will teach you how to make your own charcuterie board.","Commerce and Shopping, Consumer Goods",,,,1,,,,,,USD,,Motor City Match,1,1,,Private,,,,,,
ProPharma Distribution,https://www.crunchbase.com/organization/propharma-distribution,"Health Care, Medical, Pharmaceutical","Westminster, Colorado, United States",ProPharma Distribution renders a wide range of pharmaceutical products and services to medical specialists.,"1,034,210","Greater Denver Area, Western US",$1M to $10M,Active,1948-01-01,day,,,,,For Profit,https://www.propharmausa.com/,,Health Care,,,1-10,,,,,,,,,,,,,Private,,,,,,
RSM Enterprises,https://www.crunchbase.com/organization/rsm-enterprises,"Advertising, Graphic Design, Marketing, Mobile Apps, Social Media Marketing, Video Advertising, Web Design","Chattanooga, Tennessee, United States","Web & app development, geographically targeted advertising, pay per click advertising, social media management, and video seo. ","1,034,211",Southern US,Less than $1M,Active,1999-01-01,year,,,,,For Profit,http://www.joinrsm.com,"At RSM, our primary goal has been the same for over ten years; To ensure your business has the tools and education its needs in order to make the most cost effective decisions in your marketing departments that will ensure long term growth and an effective return on your investment.  We accomplish this by offering no cost, no obligation digital consulting while developing a cost effective strategy that works for your business. We then provide best in class web development, mobile app development, geographically targeted advertising, pay per click advertising, social media management, and video seo. ","Advertising, Apps, Design, Mobile, Sales and Marketing, Software",,,1-10,,,,,,,,,,,,,Private,,,,,,
Joey Baby,https://www.crunchbase.com/organization/joey-baby,,"Manhattan, New York, United States",Fashion Accessories Specializing In Freshwater Pearls,"1,034,212","Greater New York Area, East Coast, Northeastern US",,Active,2021-01-01,year,,,,,,https://joeybaby.com,"A jewelry brand for corporate girls. We help you to use accessories to elevate your work outfit, so you can be fashionable and confident everyday",,,,1-10,,,,,,,,,,,,,Private,,,,,,
Windermere Tower Real Estate,https://www.crunchbase.com/organization/windermere-tower-real-estate,"Property Management, Real Estate, Wealth Management","Riverside, California, United States","Windermere Tower Real Estate specializes in property management, commercial real estate, and relocation services.","1,034,213","Greater Los Angeles Area, Inland Empire, West Coast",,Active,1989-01-01,year,,,,,For Profit,https://windermeretower.com,,"Financial Services, Real Estate",2,"Brent Lee, Collette Lee",11-50,,,,,,,,,,,,,Private,,,,,,
Timbre Technologies,https://www.crunchbase.com/organization/timbre-technologies,"Manufacturing, Software","Tennessee, Illinois, United States","Timbre is a privately held company engaged in the development, manufacture and marketing of advanced software solutions for semiconductors","1,034,214","Great Lakes, Midwestern US",,Active,1998-01-01,year,2001-02-06,day,,,For Profit,http://www.timbre-tech.com/,"Timbre Technologies develops software and hardware solutions for metrology applications. Its products are used in production by memory and logic device manufacturers. The company was founded by Nickhil Jakatdar in 1998 and is headquartered in Fremont, California.","Manufacturing, Software",1,Nickhil Jakatdar,,,M&A,,,,,,,,,,,Private,,,,,,
1992 Gear,https://www.crunchbase.com/organization/1992-gear,"Consumer Goods, Fashion, Manufacturing, Retail, Sales","New York, New York, United States",1992 Gear is a company that sells clothing brands.,"1,034,216","Greater New York Area, East Coast, Northeastern US",,Active,,,,,,,For Profit,https://1992gear.com/,"1992gear design and create products that they would want to use. At 11 Industries, they are not a boardroom filled with people looking to make a profit. They are everyday men that want to create accessories that stand out and stand the test of time. It is why they create their products out of quality materials and use designs that are both fun and classic. They are constantly evolving as they grow and learn more about their customers. Due to this, their products will be changing with them.","Clothing and Apparel, Commerce and Shopping, Consumer Goods, Design, Manufacturing, Sales and Marketing",,,11-50,,,,,,,,,,,,,Private,,,,,,
The Sheppard Agency,https://www.crunchbase.com/organization/the-sheppard-agency,"Advertising, Audio, Broadcasting, Creative Agency, Information Services, Media and Entertainment, Publishing","Austin, Texas, United States",The Sheppard Agency provides voice cover services for media production.,"1,034,217",Southern US,$10M to $50M,Active,,,,,,,For Profit,https://www.sheppard.agency,,"Advertising, Content and Publishing, Information Technology, Media and Entertainment, Music and Audio, Sales and Marketing, Video",,,101-250,,,,,,,,,,,,,Private,,,,,,
Old Biscayne Designs,https://www.crunchbase.com/organization/old-biscayne-designs,"Indoor Positioning, Manufacturing, Wood Processing","Americus, Georgia, United States",Old Biscayne Designs is a manufacturer of iron beds and wooden furniture.,"1,034,225","East Coast, Southern US",$1M to $10M,Active,1990-01-01,year,,,,,For Profit,https://www.oldbiscaynedesigns.com,"Old Biscayne Designs saw constructed wooden pieces, including stools and tables.  Sometimes decorated with valuable metals or ivory the evolution of furniture design continued in ancient Greece and ancient Rome, with thrones being commonplace the klinai, multipurpose couches used for relaxing, eating, and sleeping furniture of the Middle Ages was usually heavy, oak, and ornamented readily available material that could be worked easily and turned into items for use within the household.","Manufacturing, Navigation and Mapping",,,11-50,,,,,,,,,,,,,Private,,,,,,
United Sport Apparel,https://www.crunchbase.com/organization/united-sport-apparel,"Apparel, Online Portals, Sporting Goods","Fairfield, New Jersey, United States","United Sport Apparel offers letterman jackets, custom varsity jackets, and sports apparel.","1,034,228","Greater New York Area, East Coast, Northeastern US",,Active,1933-01-01,year,,,,,For Profit,https://www.unitedsportapparel.com,"United Sport Apparel provides hand-crafted custom apparel for teams and experts. Their jackets are hand-made using only the finest wool, leather, and brass snaps available. They also offer a wide variety of colors for each material. They offer discounts for team and group orders of over 25 jackets.","Clothing and Apparel, Commerce and Shopping, Internet Services, Sports",,,11-50,,,,,,,,,,,,,Private,,,,,,
Showfx,https://www.crunchbase.com/organization/showfx,"Media and Entertainment, Performing Arts, Rental, Video","Santa Fe Springs, California, United States","ShowFX is an equipment rental company that provides engineering, design, and fabrication of entertainment equipment.","1,034,228","Greater Los Angeles Area, West Coast, Western US",$10M to $50M,Active,1984-01-01,year,,,,,For Profit,http://www.showfx.net,"ShowFX offers show props, touring shows, illusionary effects, specialty vehicles, scenery, and sets. They provide scale sculptures, mast systems, and hydraulics. Their services include lifts, custom rental equipment, elevators, and winch fabrication.","Commerce and Shopping, Media and Entertainment, Video",,,11-50,,,,,,,,,,,,,Private,,,,,,
Metropolitan Realty,https://www.crunchbase.com/organization/metropolitan-realty,"Commercial, Property Management, Real Estate, Residential","Falls Church, Virginia, United States",Metropolitan Realty is a real estate company that provides buying and selling services for residential and commercial properties.,"1,034,229","Washington DC Metro Area, East Coast, Southern US",$1M to $10M,Active,2003-01-01,year,,,,,For Profit,https://www.metropolitanrealty.co,,"Other, Real Estate",,,11-50,,,,,,,,,,,,,Private,,,,,,
LAND INFO Worldwide Mapping,https://www.crunchbase.com/organization/land-info-worldwide-mapping,Information Services,"Littleton, Colorado, United States","LAND INFO is a provider of digital topographic maps, nautical chart data, aerial and satellite imagery.","1,034,231","Greater Denver Area, Western US",$1M to $10M,Active,1993-01-01,day,,,,,For Profit,http://www.landinfo.com/,,Information Technology,,,1-10,,,,,,,,,,,,,Private,,,,,,
Banger Pickleball,https://www.crunchbase.com/organization/banger-pickleball,"Consumer Goods, E-Commerce, Manufacturing, Retail, Sporting Goods, Sports","Chicago, Illinois, United States","Banger Pickleball is a pickleball equipment and apparel company that provides paddles, balls, apparel, and accessories.","1,034,232","Greater Chicago Area, Great Lakes, Midwestern US",,Active,2020-01-01,year,,,,,For Profit,https://bangerpickleball.com,,"Commerce and Shopping, Consumer Goods, Manufacturing, Sports",,,1-10,,,,,,,,,,,,,Private,,,,,,
Leader Creek Fisheries,https://www.crunchbase.com/organization/leader-creek-fisheries,"Agriculture, Seafood, Wholesale","Seattle, Washington, United States",Leader Creek Fisheries is a seafood wholesaler that produces salmon products.,"1,034,232","Greater Seattle Area, West Coast, Western US",,Active,1999-01-01,year,,,,,For Profit,https://www.leadercreekfisheries.com/,"Leader Creek Fisheries began operations in 1999 with one goal in mind: to produce the best Bristol Bay Sockeye fillets possible. Leader Creek has always been at the forefront of quality and innovation, and our fishermen are among the best in the Bay. Our fleet paved the way for quality and best practises in handling. It's no secret that we were the first, and continue to be the only, 100% refrigerated fleet.","Agriculture and Farming, Commerce and Shopping, Food and Beverage",,,,,,,,,,,,,,,,Private,,,,,,
Plainflow,https://www.crunchbase.com/organization/plainflow,"Artificial Intelligence (AI), Marketing Automation, SaaS, Software","Walnut, California, United States",Plainflow centralizes all your customer data to help you deliver a unique customer experience with your favorite marketing and sales tools.,"1,034,238","Greater Los Angeles Area, West Coast, Western US",Less than $1M,Closed,2017-02-09,day,,,,none,For Profit,https://www.plainflow.com/,"PlainFlow is an AI-powered software as a service that helps companies to quickly bootstrap from day-0 their marketing activities by automating their internal processes and all their customer communications with workflow blueprints and behavioral email templates.  It seamlessly integrates with many different channels like Facebook Messenger, Push notifications, Emails, Web Notification, and Slack.","Artificial Intelligence (AI), Data and Analytics, Sales and Marketing, Science and Engineering, Software",1,Antonio Angelino,1-10,,,,,,,,,,,,,Private,,,,,,
Serwiz,https://www.crunchbase.com/organization/serwiz,"Cloud Management, CRM, Software","Folsom, California, United States",Serwiz is cloud based CRM software for home service businesses.,"1,034,238","West Coast, Western US",,Active,,,,,,,For Profit,https://www.serwiz.com,"Serwiz is a CRM software for home service businesses. They provide assistance to landscaping, plumbing, cleaning, HVAC, and other home service businesses. Their features include lead management, multiple pipeline views, quick estimating with e-sign, booking and scheduling, recurring work orders, easy invoicing, and payments.","Information Technology, Internet Services, Sales and Marketing, Software",,,11-50,,,,,,,,,,,,,Private,,,,,,
Industrial Transfer & Storage,https://www.crunchbase.com/organization/industrial-transfer-storage,"Construction, Manufacturing, Transportation","Southbridge, Massachusetts, United States","Industrial Transfer & Storage is manufacturing machinery, raw materials, and unfinished textile goods.","1,034,239","East Coast, New England, Northeastern US",$10M to $50M,Active,1905-01-01,year,,,,,For Profit,https://www.industrialtransfer.com,"Industrial Transfer & Storage is manufacturing machinery, raw materials, and unfinished textile goods. It offers services like manufacturing reconstruction and plant relocation. It is specialized and leads the way in plant relocation work, plant relocation, rigging, demolition, and storage, crating warehousing, and more.","Manufacturing, Real Estate, Transportation",,,11-50,,,,,,,,,,,,,Private,,,,,,
1969 Communications,https://www.crunchbase.com/organization/1969-communications,"Internet, Robotics, Software","Los Angeles, California, United States",1969 Communications is an internet company that provides system integration and web development services.,"1,034,240","Greater Los Angeles Area, West Coast, Western US",Less than $1M,Active,2001-01-01,year,,,,,For Profit,http://1969web.com,,"Hardware, Internet Services, Science and Engineering, Software",,,1-10,,,,,,,,,,,,,Private,,,,,,
Field Fresh Farms,https://www.crunchbase.com/organization/field-fresh-farms,"Agriculture, Farming, Organic","Watsonville, California, United States",Field Fresh Farms produces and packs organic food products.,"1,034,241","San Francisco Bay Area, West Coast, Western US",$10M to $50M,Active,1953-01-01,year,,,,,For Profit,https://fieldfreshproduce.com,"Field Fresh Farms maintains the productive fields, the wholesome products they produce and pack, as well as the communities and businesses they collaborate with. They have complete control over every element of their business because they are integrated growers, processors, packers, and shippers. The foodservice companies, wholesalers, and retailers they collaborate with are certain that the greens they provide to their consumers will be from start to finish.","Agriculture and Farming, Sustainability",,,11-50,,,,,,,,,,,,,Private,,,,,,
Pocatello/Chubbuck School District 25,https://www.crunchbase.com/organization/pocatello-chubbuck-school-district-25,Education,"Pocatello, Idaho, United States","Pocatello/Chubbuck School District 25 provides the highest quality educational services in a safe, supportive, & learning environment.","1,034,243",Western US,,Active,,,,,,,For Profit,https://www.d25.k12.id.us,,Education,,,251-500,,,,,,,,,,,,,Private,,,,,,
Spark Motion,https://www.crunchbase.com/organization/kinesio-capture,"Computer, Enterprise Software, Medical, Software","Bethesda, Maryland, United States",Spark Motion is a cross-practice video assessment platform that develops motion-analysis software for assessing human movement.,"1,034,243","Washington DC Metro Area, East Coast, Southern US",Less than $1M,Active,2011-01-01,year,,,,,For Profit,http://www.sparkmotion.com,"Spark Motion is a cross-practice video assessment platform that develops motion-analysis software for assessing human movement. It offers Spark Motion, a tool that enables coaches to analyze sports performance by measuring an athlete's ability to absorb, reduce, and produce force and identify energy leakages and inefficiencies in their athletes. The company’s tool is also used by medical practitioners to measure a patient's strengths and weaknesses and education professionals to communicate with their students. Spart Motions offers a HIPAA Compliant Cloud that safely and securely stores and shares valuable videos. It allows for two way communication between the practicer and the client or patient. The company was incorporated in 2011 and is based in Bethesda, Maryland.","Consumer Electronics, Hardware, Health Care, Software",2,"David W. Gottfeld, Packy Kennelly",11-50,1,Seed,300000,USD,300000,300000,USD,300000,,,,,Private,,,,,,
Anevay Resources,https://www.crunchbase.com/organization/anevay-resources,"Commercial, Leasing, Mineral","Oklahoma City, Oklahoma, United States","Anevay Resources is a land brokerage firm that provides drilling, production, and minerals for the commercial and residential sectors.","1,034,247",Southern US,$1M to $10M,Active,2011-01-01,year,,,,,For Profit,https://www.anevayresources.com,,"Financial Services, Natural Resources, Other",,,11-50,,,,,,,,,,,,,Private,,,,,,
Pacific Data Partners,https://www.crunchbase.com/organization/pacific-data-partners,"Analytics, Internet, Marketplace","Seattle, Washington, United States","Pacific Data Partners is the global B2B data marketplace, amassing over 50 billion records for use in marketing, sales and analytics.","1,034,251","Greater Seattle Area, West Coast, Western US",,Closed,2016-06-19,day,2018-02-15,day,,none,For Profit,http://www.pacificdatapartners.com/,"Pacific Data Partners is the global B2B data marketplace, amassing over 50 billion records for use in marketing, sales and analytics. Working with top tier partners and over 700+ sources, Pacific Data Partners is building one of the most comprehensive and accurate datasets of professional, firmographic and technographic data. Pacific Data Partners is a premier provider of Account Based Marketing (ABM) and Technology Based Marketing (TBM) segments. Pacific Data Partners was founded by industry veterans from Amazon, BlueKai and Oracle, who bring extensive experience from creating the first data exchange for consumer targeting. With over a decade of insight into creating data economies, collection, activation and identity management, they saw a unique opportunity to bring data targeting to the world of B2B with the launch of Pacific Data Partners B2B Data Marketplace. ","Commerce and Shopping, Data and Analytics, Internet Services",1,Pieter De Temmerman,1-10,,M&A,,,,,,,,,,,Private,,,,,,
T2 Design,https://www.crunchbase.com/organization/t2designs,"Consulting, Manufacturing, Product Design, Product Management, Product Research","Santa Monica, California, United States","T2 Design provides services to inventors such as product design, prototype development, production engineering & manufacturing.","1,034,252","Greater Los Angeles Area, West Coast, Western US",$1M to $10M,Active,1982-01-01,year,,,,,For Profit,http://www.t2design.com,,"Data and Analytics, Design, Manufacturing, Other, Professional Services",,,1-10,,,,,,,,,,,,,Private,,,,,,
Zeno Blue eMarketing,https://www.crunchbase.com/organization/zeno-blue-emarketing,"Advertising, SEM, SEO","Charlotte, North Carolina, United States",Internet Marketing Solutions Provider,"1,034,252","East Coast, Southern US",Less than $1M,Active,2007-12-01,day,,,,,For Profit,http://www.zenoblue.com,"Zeno Blue eMarketing provides a comprehensive suite of internet marketing, search engine marketing and web design services that guide clients all the way from research and strategy through implementation and measurement.","Advertising, Internet Services, Sales and Marketing",1,David Brooks,11-50,,,,,,,,,,,,,Private,,,,,,
Integrated Anesthesia Associates,https://www.crunchbase.com/organization/integrated-anesthesia-associates,"Clinical Trials, Health Care, Hospital","Hartford, Connecticut, United States","Integrated Anesthesia Associates is a healthcare facility that specialises in providing high-quality, & cutting-edge anaesthetic services.","1,034,253","East Coast, New England, Northeastern US",,Active,1963-01-01,year,,,,,For Profit,https://iaapartners.com/,"Integrated Anesthesia Associates (IAA) was founded on a basic premise: to provide the highest quality comprehensive peri-operative anesthesia services to our patients and customers. Following the successful merger of two Connecticut-based anesthesia practices in 2014; we have been working to shape the delivery of anesthesia care in the region to best serve the needs of our patients and clients. IAA retains its shared vision of an independent anesthesia practice focused upon delivering safe, high-quality, efficient, and cost-effective patient-centered anesthesia care. IAA's staff fully recognizes our roles and responsibilities within the healthcare systems in which we work and we strive for excellence in everything we do.",Health Care,,,251-500,,,,,,,,,,,,,Private,,,,,,
Big-Giant,https://www.crunchbase.com/organization/big-giant,"Advertising, Brand Marketing, Creative Agency, Interior Design","Portland, Oregon, United States","Big-Giant is a creative studio that offers brand strategy, brand design, design installation, and retail strategy services.","1,034,254","West Coast, Western US",,Active,1999-01-01,year,,,,,For Profit,https://www.big-giant.com,,"Advertising, Content and Publishing, Design, Media and Entertainment, Real Estate, Sales and Marketing",,,11-50,,,,,,,,,,,,,Private,,,,,,
Doodle.ly,https://www.crunchbase.com/organization/doodle-ly,"Art, iOS, Social Media","New York, New York, United States","Doodle.ly offers users an easy way to create and share drawings with their friends and family via an iPhone, iPad and the web.","1,034,255","Greater New York Area, East Coast, Northeastern US",$1M to $10M,Closed,2011-01-01,year,,,,none,For Profit,http://doodle.ly,"Doodle.ly is a fun, free, and easy way to create and share drawings with your friends and family!  Available as an app on iPhone, iPad and on the web.  Doodle.ly is startup based in NYC.","Internet Services, Media and Entertainment, Mobile, Platforms, Software",2,"Darren Paul, Evan Vogel",1-10,1,Seed,,USD,,,USD,,,,,,Private,,,,,,
SilverLine Consulting,https://www.crunchbase.com/organization/silverline-consulting,"Consulting, Human Resources, Recruiting, Staffing Agency","Akron, Ohio, United States",SilverLine Consulting is a recruiting and HR consulting firm.,"1,034,259","Great Lakes, Midwestern US",Less than $1M,Active,2013-01-01,year,,,,,For Profit,https://silverlinehr.com,"SilverLine Consulting provides start-up consulting services, talent acquisition strategy, performance management strategy, culture creation, organizational design & development, compensation, reward strategy, coaching & development, and career transition services.","Administrative Services, Professional Services",,,1-10,,,,,,,,,,,,,Private,,,,,,
Hele USA,https://www.crunchbase.com/organization/kvz-sports,"Local, Manufacturing, Product Design, Sporting Goods, Sports, Web Design","Phoenix, Arizona, United States",Hele USA is a design and manufacturing company focusing on the action and outdoor sports industry.,"1,034,261","Greater Phoenix Area, Western US",Less than $1M,Active,2010-01-01,year,,,,,For Profit,https://hele-usa.com/,Hele USA is to build their brands to become a fully integrated design and manufacturing company in the action sports industry.,"Commerce and Shopping, Design, Manufacturing, Sales and Marketing, Sports",2,"Cynthia Valenzuela, Matthew Boyd",1-10,1,Seed,160000,USD,160000,160000,USD,160000,MAC6,,1,,Private,,,,,,
Aleso Global,https://www.crunchbase.com/organization/aleso-global,"Aerospace, Logistics, Manufacturing","Tempe, Arizona, United States",Aleso Global is an aviation brokerage firm.,"1,034,262","Greater Phoenix Area, Western US",$1M to $10M,Active,2015-01-01,year,,,,,For Profit,https://www.alesoglobal.com,"Aleso Global provides inventory and logistics for airplane components. They provide aftermarket spare parts support to the aviation industry, which includes commercial airlines, maintenance providers, suppliers, and distributors. With the firm notion that no task is too small, Aleso Global provides service assistance for rotable components and throwaway piece parts. Aleso Global is improving the procurement needs and supply chain efficiency of the commercial aviation industry.","Manufacturing, Science and Engineering, Transportation",,,11-50,,,,,,,,,,,,,Private,,,,,,
Giles & Kendall,https://www.crunchbase.com/organization/giles-kendall-0f2f,"Home Improvement, Manufacturing, Wood Processing","Huntsville, Alabama, United States","Giles & Kendall manufactures insect repellents, cedar accessories, groove planks, cedar moldings, safe boxes, and closets.","1,034,266",Southern US,Less than $1M,Active,1939-01-01,year,,,,,For Profit,https://cedarsafe.com/,,"Manufacturing, Real Estate",,,,,,,,,,,,,,,,Private,,,,,,
