"Miron Construction Co., Inc.",https://www.crunchbase.com/organization/miron-construction-co-inc,"Building Material, Real Estate","Neenah, Wisconsin, United States",Miron Construction Co. is a construction company that provides construction management services.,"425,694","Great Lakes, Midwestern US",$1M to $10M,Active,1918-01-01,day,,,,,For Profit,http://miron-construction.com,,Real Estate,,,1001-5000,,,,,,,,,,,,,Private,,,,,,
Great Lakes Lifting Solutions,https://www.crunchbase.com/organization/great-lakes-lifting-solutions,"Automotive, Rental, Sales, Service Industry","Peotone, Illinois, United States","Great Lakes Lifting Solutions sells, rents, and services mini crawler cranes and glass lifts.","425,696","Greater Chicago Area, Great Lakes, Midwestern US",$1M to $10M,Active,2007-01-01,year,,,,,For Profit,https://www.greatlakeslifting.com,"Great Lakes Lifting Solutions is their spydercrane and wood powr-grip dealer and SmartLift distributor. They offer sales, rentals, and service on both new and used mini crawler cranes and glass-lifting machines. Their clients have built some amazing things with their innovative machines. They do the heavy lifting for their team while saving time and helping to create a safer, worker-friendly environment.","Commerce and Shopping, Other, Sales and Marketing, Transportation",,,1-10,,,,,,,,,,,,,Private,,,,,,
Glendive Medical Center,https://www.crunchbase.com/organization/glendive-medical-center,"Health Care, Hospital, Medical, Non Profit","Glendive, Montana, United States","Glendive Medical Center is a non-profit organization that provides medical, healthcare, and wellness services.","425,698",Western US,$50M to $100M,Active,1965-01-01,year,,,,,Non-profit,https://www.gmc.org,,"Health Care, Other, Social Impact",,,101-250,,,,,,,,,,,,,Private,,,,,,
SpendBoss,https://www.crunchbase.com/organization/spendboss,"Analytics, Computer, Software","Charlotte, North Carolina, United States",SpendBoss is a provider of a platform for spend management and analytics services,"425,698","East Coast, Southern US",$1M to $10M,Active,2013-01-01,year,,,,,For Profit,http://www.spendboss.com/,SpendBoss is a provider of a platform for spend management and analytics services. The company's mobile and tablet ready software helps small and medium sized retailers with analytics services.,"Consumer Electronics, Data and Analytics, Hardware, Software",,,,,,,,,,,,,,,,Private,,,,,,
MonkeysCloud,https://www.crunchbase.com/organization/monkeyscloud,"Apps, Cloud Data Services, Cloud Infrastructure, Information Technology, Internet, Mobile Apps, Software, Web Apps, Web Development","New York, New York, United States","MonkeysCloud is the WebOps platform for modern solutions, delivering technology development tools","425,699","Greater New York Area, East Coast, Northeastern US",,Closed,2021-01-22,day,,,,none,For Profit,https://www.monkeys.cloud,"The Best Software tool built for Agencies & Teams. MonkeysCloud helps each team member to agile planning, tracking, testing, and releasing software projects successfully.","Apps, Hardware, Information Technology, Internet Services, Mobile, Software",1,Jorge J. Peraza,11-50,1,Seed,,USD,,,USD,,,,,,Private,,,,,,
Shift Agent Labs,https://www.crunchbase.com/organization/shift-agent-labs,"Hospitality, Restaurants","Orlando, Florida, United States",Helping businesses save money and make incredible employee schedules fast.,"425,699","East Coast, Southern US",Less than $1M,Active,2014-03-01,day,,,,,For Profit,http://shiftagent.org/,,"Food and Beverage, Travel and Tourism",3,"Christopher Towle, David Pezzoli, Matt Webb",1-10,,,,,,,,,,,,,Private,,,,,,
My Little Salesman Inc,https://www.crunchbase.com/organization/my-little-salesman,"Advertising, CRM, E-Commerce, Internet, Lead Management, Marketing, Publishing, SaaS, Social Media Marketing","Austin, Texas, United States","All-In-One Dealer Management System (DMS), (CRM) system, inventory management, invoicing & sales, digital marketing, web design etc","425,704",Southern US,$1M to $10M,Active,1958-01-01,year,,,,,For Profit,https://www.mylittlesalesman.com/,"Heavy Equipment Dealer Technology Solution, Marketplace.","Advertising, Commerce and Shopping, Content and Publishing, Information Technology, Internet Services, Media and Entertainment, Sales and Marketing, Software",,,11-50,,,,,,,,,,,,,Private,,,,,,
"Atlas Insurance Agency, Inc.",https://www.crunchbase.com/organization/atlas-insurance-agency-inc,"Financial Services, Insurance","Honolulu, Hawaii, United States",Atlas Insurance Agency is an insurance company that provides insurance solutions.,"425,704","Asia-Pacific (APAC), Western US",$1M to $10M,Active,1929-01-01,day,,,,,For Profit,http://atlasinsurance.com,,Financial Services,1,Masayuki Tokioka,101-250,,,,,,,,,,,,,Private,,,,,,
"Calibre CPA Group, PLLC",https://www.crunchbase.com/organization/calibre-cpa-group-pllc,"Consulting, Financial Services","Bethesda, Maryland, United States","Calibre CPA Group is an accounting company that specializes in accounting, audit, and taxation services.","425,704","Washington DC Metro Area, East Coast, Southern US",$10M to $50M,Active,2003-01-01,year,,,,,For Profit,http://calibrecpa.com,,"Financial Services, Professional Services",,,101-250,,,,,,,,,,,,,Private,,,,,,
PHOENIX,https://www.crunchbase.com/organization/phoenix-d569,"Delivery Service, Manufacturing, Packaging Services","Aurora, Illinois, United States",PHOENIX manufactures and supplies packaging and closures.,"425,707","Greater Chicago Area, Great Lakes, Midwestern US",$1M to $10M,Active,1890-01-01,year,,,,,For Profit,https://phxpkg.com,"Phoenix creates closures and packaging. They also manufacture injection-molded closures for all rigid container markets. Their services include collaboration, innovation, customization, technical, distribution, and inventory.","Administrative Services, Manufacturing, Transportation",,,251-500,,,,,,,,,,,,,Private,,,,,,
Music Together LLC,https://www.crunchbase.com/organization/music-together-llc,"Communities, Education, Music","Hopewell, New Jersey, United States",Music Together is a music company that provides music training services for kids.,"425,711","East Coast, Northeastern US",$10M to $50M,Active,1987-01-01,year,,,,,For Profit,http://musictogether.com,"Fun. Fabulous. Uplifting. Magical. These are just a few of the ways that parents describe Music Together. Each week in Music Together classrooms around the world, babies, toddlers, preschoolers, big kids—and the grownups who love them!—gather to make music as a community. Offered at more than 3,000 locations and 40 countries, their early childhood music classes give families with children from birth through age 8 the chance to get in touch with their inner musician and connect with other families.  They’re on a mission to make the world a better place by making it more musical. And you can be part of it by joining one of their music classes in your neighborhood!","Community and Lifestyle, Education, Media and Entertainment, Music and Audio",,,101-250,,,,,,,,,,,,,Private,,,,,,
Pace Electronics,https://www.crunchbase.com/organization/pace-electronics,"Electronics, Manufacturing","Sodus, New York, United States","PACE Electronics is a leading provider of electronic components and electronics contract manufacturing services to consumer, automobile","425,714","East Coast, Northeastern US",$1M to $10M,Active,1966-01-01,year,,,,,For Profit,http://paceelectronics.com,,"Consumer Electronics, Hardware, Manufacturing",,,11-50,,,,,,,,,,,,,Private,,,,,,
Pelton Shepherd Industries,https://www.crunchbase.com/organization/pelton-shepherd-industries,"Health Care, Manufacturing, Medical Device","Stockton, California, United States",Pelton Shepherd Industries is a medical devices company that manufactures healthcare products.,"425,714","West Coast, Western US",$10M to $50M,Active,1950-01-01,year,2019-07-01,day,,,For Profit,http://www.peltonshepherd.com/,,"Health Care, Manufacturing",,,1-10,,M&A,,,,,,,,,,,Private,,,,,,
MIDWESTERN,https://www.crunchbase.com/organization/midwestern,"Association, Construction, Industrial Engineering, Industrial Manufacturing, Machinery Manufacturing, Manufacturing, Supply Chain Management","Tulsa, Oklahoma, United States",MIDWESTERN provides pipeline products and equipment to manufacturing and distribution industries.,"425,716",Southern US,$1M to $10M,Active,1953-01-01,year,,,,,For Profit,https://sidebooms.com,"Midwestern Pipe Line Products has a complete inventory of pipeline supplies. Their extensive line of coatings, rock shields, anodes, insulators, and other pipeline protection products includes everything needed prior to backfill. They are the industry leader side boom manufacturing, with side booms ranging from 10,000 to 230,000 lb (4 to 104 t).","Manufacturing, Other, Real Estate, Science and Engineering, Transportation",,,51-100,,,,,,,,,,,,,Private,,,,,,
Marble,https://www.crunchbase.com/organization/marble-976f,,"Venice, California, United States",Personalized coaching for your enhanced wellbeing.,"425,716","Greater Los Angeles Area, West Coast, Western US",,Active,2023-12-11,day,,,,,For Profit,https://www.feelmarble.com/,,,1,R.J. Napolitano,1-10,,,,,,,,,,,,,Private,,,,,,
Push Interactive,https://www.crunchbase.com/organization/push-interactive,"E-Commerce, Marketing, SaaS","Minneapolis, Minnesota, United States",Push Interactive is a SaaS-based eCommerce technology platform.,"425,722","Greater Minneapolis-Saint Paul Area, Great Lakes, Midwestern US",,Active,2010-01-01,year,2019-11-27,day,,,For Profit,https://pushint.com,Push Interactive offers a proprietary SaaS-based eCommerce technology platform that has been built and optimized over seven years of real-world use selling their own products online.,"Commerce and Shopping, Sales and Marketing, Software",2,"Chris Jahnke, Haig Newton",11-50,,M&A,,,,,,,,,,,Private,,,,,,
Vastika Inc,https://www.crunchbase.com/organization/vastika-inc,"Information Technology, Staffing Agency","Dallas, Texas, United States",Vastika is an IT company that provides staff augmentation services.,"425,725","Dallas/Fort Worth Metroplex, Southern US",$1M to $10M,Active,2008-01-01,year,,,,,For Profit,http://vastika.com,,"Administrative Services, Information Technology",,,251-500,,,,,,,,,,,,,Private,,,,,,
Project Pen,https://www.crunchbase.com/organization/project-pen,"Digital Media, News, Publishing, Social Media","Los Angeles, California, United States","A publishing gateway for the storytellers of the future. They discover, publish and license imaginations.","425,728","Greater Los Angeles Area, West Coast, Western US",$1M to $10M,Closed,2014-01-01,year,,,,none,For Profit,http://projectpen.com/,"Project pen is the largest platform for creative-content generation and digital distribution in the Middle East. They work with a new generation of writers and storytellers in English & Arabic, to publish books and create stories for a global audience.","Content and Publishing, Internet Services, Media and Entertainment",1,Maisa Al-Khudair,1-10,2,Seed,77000,USD,77000,77000,USD,77000,Oasis500,,1,,Private,,,,,,
Focusinc Group Corporation,https://www.crunchbase.com/organization/focusinc-group-corporation,Outsourcing,"Mahwah, New Jersey, United States",Focusinc Group Corporation is a remote staffing company that offers professional virtual assistant services.,"425,730","Greater New York Area, East Coast, Northeastern US",$1M to $10M,Active,2011-05-01,day,,,,,For Profit,http://www.focusincgroup.com,"Focusinc Group Corporation is a remote staffing company unique in its capacity to offer highly skilled, professional virtual assistant services. Our aim is to change the way people do business by giving business owners the power to delegate even the most challenging functions of their companies to our highly skilled, college educated workforce in Davao, Philippines.  We hire, train, and manage professional employees dedicated to your goals, at a fraction of the cost of meeting those goals within the confines of your office space.  Focusinc saves you money by stripping away all the salary, benefits, office space, and equipment costs associated with taking on more employees in your place of business. In fact, delegating duties to our facility can reduce your workforce-related expenses by as much as 50%, with no drop off in productivity and quality of work.",Professional Services,1,Moshe Greenfeld,101-250,,,,,,,,,,,,,Private,,,,,,
Plaudit Design,https://www.crunchbase.com/organization/plaudit-design,"Advertising, Marketing","St Louis, Missouri, United States",Plaudit Design is a web design and Internet marketing agency. ,"425,730",Midwestern US,$1M to $10M,Active,1998-01-01,year,,,,,For Profit,https://www.plaudit.com/,"Plaudit Design provides the expertise needed to leverage the Internet to your organization's advantage.But more than that, they’re a close group of dreamers and do-ers with a passion for seeing you succeed. They’re driven to help each and every client reach their greatest potential, and have fun doing it. Founded with a focus on website design and Internet marketing, Plaudit Design has maintained a position as a creative leader and innovator in the digital space for almost 20 years. They’re curious, insightful, thorough, and determined to make the best even better. As digital media continues to evolve, they’ll be there at the forefront.","Advertising, Sales and Marketing",1,Michael Schlotfeldt,11-50,,,,,,,,,,,,,Private,,,,,,
Rockford Park District,https://www.crunchbase.com/organization/rockford-park-district,"Education, Recreation, Sports","Rockford, Illinois, United States","Rockford Park District is a recreation destination that offers summer camp, leagues, and sports lessons.","425,731","Great Lakes, Midwestern US",$100M to $500M,Active,1909-01-01,year,,,,,For Profit,https://rockfordparkdistrict.org,"Rockford Park District provides outdoor recreation facilities. They offers lessons, leagues, camps for various sports. They offer therapeutic recreation and education program. Their customers contact through phone and email.","Education, Sports",,,251-500,,,,,,,,,,,,,Private,,,,,,
Action Air Systems,https://www.crunchbase.com/organization/action-air-systems,"Commercial, Construction, Heating, Ventilation, and Air Conditioning (HVAC), Mechanical Engineering","Manchester, Connecticut, United States","Action Air Systems operates as a mechanical contractor, specialized in HVAC, plumbing and piping installations.","425,733","East Coast, New England, Northeastern US",$10M to $50M,Active,1987-01-01,year,,,,,For Profit,https://www.actionairsystems.com,,"Other, Real Estate, Science and Engineering",,,1-10,,,,,,,,,,,,,Private,,,,,,
Schramm,https://www.crunchbase.com/organization/schramm,"CAD, Electronics, Manufacturing","West Chester, Pennsylvania, United States","Schramm, Inc. is a century-old Chester County, Pennsylvania manufacturer and global supplier to the hydraulic drill industry, focusing on","425,734","Greater Philadelphia Area, Great Lakes, Northeastern US",$10M to $50M,Active,1900-01-01,year,2012-07-02,day,,,For Profit,http://www.schramminc.com,"Schramm, Inc. is a century-old Chester County, Pennsylvania manufacturer and global supplier to the hydraulic drill industry, focusing on land based applications. Specializing in mobile, top-head hydraulic rotary drilling rigs, we supply to companies in the mining, energy, geothermal and water sectors worldwide. Over 75 percent of our revenues come from export sales, with global reach including major market positions in China, Chile, Brazil, Australia, Russia and South Africa. Schramm approaches all its domestic and international transactions with an emphasis on long term customer relationships, which means establishing a direct relationship with the end-user. This approach facilitates each transaction, but also establishes a fundamental user-satisfaction with products that are frequently valued in the millions of dollars. Our company has been most successful in markets where we have key partners on the ground to promote and represent the company with appropriate cultural sensitivity and friendship. Everything we do is dedicated to meeting the needs of the drilling contractor. Driven by contractor requirements, Schramm personnel design and manufacture products around the traditions of superior quality, innovation and flexibility. Utilizing the capabilities of computer aided design workstations and a fully integrated manufacturing process capability; contractor ideas are transformed into drilling solutions to meet the ever-increasing demands of the industry. An important part of Schramm’s competitive advantage is our ability to be at the forefront of technology and drilling industry standards. In a market that has been traditionally slow to adapt to change, we have progressively improved the function and quality of our products to provide world class performance and reliability.","Consumer Electronics, Design, Hardware, Manufacturing, Software",,,251-500,,M&A,,,,,,,,,,1,Private,,,,,,
Electronic On-Ramp,https://www.crunchbase.com/organization/electronic-on-ramp-inc,"Computer, Cyber Security, Information Services, Information Technology, Network Security","Rockville, Maryland, United States","Electronic On-Ramp is an IT company that provides cyber, network security, technical training, and operational support services.","425,736","Washington DC Metro Area, East Coast, Southern US",$1M to $10M,Active,2004-01-01,year,,,,,For Profit,https://www.eor.us/,"The Electronic On-Ramp, Inc. (EOR) is a Native American Indian, (8a) certified Small Disadvantaged Business, with primary offices located in a HubZone. EOR is owned by a Service Disabled Veteran (VOSB / SDVOB). EOR is skilled in providing Architectural, Engineering, Information Assurance, Intelligence, Counter-Intelligence, Forensics products and services. EOR specializes complete lifecycle solutions, and in helping the “good guys” from around the world with Assessments, Evaluations, Remediation, Configuration Management, Monitoring, Security Enhancements and in building integrated Secure Network Operation Centers (iSNOC), with a focus on detecting covert communications channels and reducing insider threat.","Consumer Electronics, Hardware, Information Technology, Privacy and Security",1,Bob Beringer,251-500,,,,,,,,,,,,,Private,,,,,,
Wilbert Plastic Services,https://www.crunchbase.com/organization/wilbert-plastic-services,"3D Printing, Manufacturing","Belmont, North Carolina, United States","Wilbert Plastic Services is a plastics company that provides thermoforming and injection molding. in Belmont, NC.","425,737","East Coast, Southern US",$50M to $100M,Active,1965-01-01,day,,,,,For Profit,https://wilbertplastics.com/,,Manufacturing,,,501-1000,,,,,,,,,,,,,Private,,,,,,
ProspectWise,https://www.crunchbase.com/organization/prospectwise,"Crowdsourcing, Financial Services, FinTech, Information Technology, Local, Sales, Small and Medium Businesses","Santa Monica, California, United States",Modernize and empower local small businesses by connecting them to the best technology vendors in the world through trusted relationships.,"425,738","Greater Los Angeles Area, West Coast, Western US",Less than $1M,Active,2012-01-01,year,,,,,For Profit,http://www.prospectwise.com/,ProspectWise is a venture-funded startup based in Santa Monica. Our mission is to modernize and empower local small businesses by connecting them to the best technology solution providers in the world.,"Financial Services, Information Technology, Other, Sales and Marketing",6,"Geoffrey Michener, Jiake Liu, Joel Clay, Robin Liao, Terry Meacham, Vince Thompson",1-10,2,Seed,,USD,,,USD,,"digi Ventures, Crosscut Ventures, Launchpad LA, Nick Green, Jason Nazar",,14,,Private,,,,,,
Amaz Property Management USA,https://www.crunchbase.com/organization/amaz-property-management-usa,"Property Management, Real Estate, Rental Property","Houston, Texas, United States",Amaz Property Management USA specializes in property management and rental services.,"425,738","Greater Houston Area, Southern US",,Active,,,,,,,For Profit,https://amazusa.com ,,Real Estate,,,,,,,,,,,,,,,,Private,,,,,,
Epic Drops,https://www.crunchbase.com/organization/epic-drops,"Consumer Goods, E-Commerce, Retail, Toys","Cleveland, Ohio, United States","Epic Drops is an e-commerce company that offers toys, clothes, home goods, and stationery products.","425,739","Great Lakes, Midwestern US",$1M to $10M,Active,,,,,,,For Profit,https://epicdrops.com,,"Commerce and Shopping, Consumer Goods",1,Bryan Salva,1-10,,,,,,,,,,,,,Private,,,,,,
eReplacements,https://www.crunchbase.com/organization/ereplacements,"Consumer Electronics, Logistics, Professional Services, Recycling","Grapevine, Texas, United States","eReplacements provides replacement parts, recycling, and repair solutions for consumer electronics, digital, and mobility products.","425,740","Dallas/Fort Worth Metroplex, Southern US",$10M to $50M,Active,2005-04-01,day,,,,,For Profit,http://www.ereplacements.com,"Consumer electronic repair, replacement parts and recycling service to dealers, extended warranty insurance companies and retailers to help extend the life cycle of current IT assets. Focus on high margin, annuity based products that need to constantly be replaced by the consumer such as power products (batteries, lamps), imaging supplies (toner, ink) and smart phones, MP3 players and tablets.  We have developed domain expertise in the repair and remarketing of IT assets in our 20 year entrepreneurial career. We are leveraging our infrastructure to expand our repair operations, with particular focus on Apple iPads, iPods and iPhones. The demand for our refurbished products is only limited by how much broken product we can buy which takes significant capital. We are looking to raise money to help support this business which will instantly more than double our revenues and profits.","Consumer Electronics, Hardware, Other, Sustainability, Transportation",1,Thomas Peck,11-50,1,Seed,400000,USD,400000,400000,USD,400000,,,,,Private,,,,,,
Adelie Logistics,https://www.crunchbase.com/organization/adelie-logistics,"CRM, Logistics, Rental, Software, Wedding","Gilbert, Arizona, United States","Adelie Logistics is transforming the event & equipment rental space with tools for online booking, inventory tracking and route management.","425,742","Greater Phoenix Area, Western US",,Active,2015-01-01,day,,,,,For Profit,https://adelielogistics.com,"Our industry specific features make all parts of your rental business easier to manage and operate. Highlighted features include: Item Availability; Know what you have available for any specific date or date range. Delivery/Pick Up Location Mapping; With Google Maps integration, you'll be able to view scheduled delivery and pick up locations for any chosen date or date range. QuickBooks Integration; Seamlessly integrate with your QuickBooks online or QuickBooks desktop company file. Full mobile apps for both iOS and Android.","Commerce and Shopping, Community and Lifestyle, Events, Information Technology, Sales and Marketing, Software, Transportation",,,1-10,,,,,,,,,,,,,Private,,,,,,
Business Forecast Systems,https://www.crunchbase.com/organization/business-forecast-systems,"Computer, Software","Belmont, Massachusetts, United States","Business Forecast Systems, Inc. is a premier provider of forecasting education.","425,743","Greater Boston Area, East Coast, New England",$1M to $10M,Active,1986-01-01,year,,,,,For Profit,http://www.forecastpro.com/,"Founded in 1986, Business Forecast Systems, Inc. (BFS), is the maker of Forecast Pro, the leading software solution for business forecasting, and is a premier provider of forecasting education. With more than 35,000 users worldwide, Forecast Pro helps thousands of companies improve planning, cut inventory costs and decrease stockouts by improving the accuracy of their forecasts. Headquartered in Belmont, Massachusetts, BFS was co-founded by Dr. Robert (Bob) Goodrich and Eric Stellwagen and is privately held.","Consumer Electronics, Hardware, Software",1,Eric Stellwagen,11-50,,,,,,,,,,,,,Private,,,,,,
"SurgiCor, LLC",https://www.crunchbase.com/organization/surgicor-llc,"Health Care, Medical Device","Franklin, Tennessee, United States",SurgiCor is a medical devices company offering orthopedic medical devices and ancillary products.,"425,751",Southern US,$1M to $10M,Active,2012-10-19,day,,,,,For Profit,http://surgicor.com,,Health Care,,,101-250,,,,,,,,,,,,,Private,,,,,,
Scanlan International,https://www.crunchbase.com/organization/scanlan-international,"Health Care, Manufacturing, Medical","Saint Paul, Minnesota, United States",Scanlan International is a manufacturer and developer of surgical instruments.,"425,753","Greater Minneapolis-Saint Paul Area, Great Lakes, Midwestern US",$1M to $10M,Active,1921-01-01,year,,,,,For Profit,https://www.scanlaninternational.com/,,"Health Care, Manufacturing",,,51-100,,,,,,,,,,,,,Private,,,,,,
