Perceptions Group,https://www.crunchbase.com/organization/perceptions-group,Association,"New York, New York, United States",Leader in providing media and technology executives with the research-based customer insight and guidance.,"1,008,574","Greater New York Area, East Coast, Northeastern US",Less than $1M,Closed,,,,,,none,For Profit,http://www.perceptionsgroup.com/,"The Perceptions Group is the leader in providing media and technology executives with the research-based customer insight and guidance necessary for strengthening brands, improving customer satisfaction and increasing sales. They  specialize in determining, analyzing and communicating what customers think – their plans, opinions and motivations. Their proprietary panels of media and technology decision makers are among the largest in the world. The proven customer survey and questionnaire development method They employ ensures optimal response. Focus and industry expertise enables us to effectively analyze and accurately interpret the research that They conduct on behalf of Their clients who represent many of the world’s largest media and technology companies.",Other,,,11-50,,,,,,,,,,,,,Private,,,,,,
Restaurant Analytics Delivered,https://www.crunchbase.com/organization/restaurant-analytics-delivered,"Analytics, Restaurants, SaaS, Software","Golden, Colorado, United States",RAD is a cloud-based SaaS that offers data analytics services for restaurants.,"1,008,576","Greater Denver Area, Western US",$1M to $10M,Active,2011-01-01,year,,,,,For Profit,https://thisisrad.io,"RAD is a data integration platform that is built for analytics. They help transform transactional systems into an enterprise, restaurant-specific data warehouse purpose-built for reporting and analytics. Their analytic layer builds on and decomposes raw source data in order to provide insightful metrics not previously seen in source systems.","Data and Analytics, Food and Beverage, Software",,,1-10,,,,,,,,,,,,,Private,,,,,,
Matthews Marine,https://www.crunchbase.com/organization/matthews-marine,"Boating, Marine Transportation, Retail","Bluffton, South Carolina, United States",Matthews Marine is a new and used boat dealership and service center.,"1,008,577","East Coast, Southern US",$1M to $10M,Active,,,,,,,For Profit,https://www.matthewsmarine.net,,"Commerce and Shopping, Sports, Transportation",1,Rob Matthews,11-50,,,,,,,,,,,,,Private,,,,,,
Meyers Associates,https://www.crunchbase.com/organization/meyers-associates,"Banking, Finance, Financial Services","New York, New York, United States",Meyers Associates is a full-service investment banking & securities brokerage firm that focuses on building trusted partnerships.,"1,008,582","Greater New York Area, East Coast, Northeastern US",$1M to $10M,Closed,1993-01-01,day,,,,none,For Profit,https://www.meyersassociateslp.com/,,"Financial Services, Lending and Investments",,,101-250,,,,,,,,,,,,,Private,,,,,,
Northwest Foam Products,https://www.crunchbase.com/organization/northwest-foam-products,"Manufacturing, Marketing, Sales","Twin Falls, Idaho, United States","Northwest Foam Products is a manufacturing company that offers roofing insulation, polystyrene foam, and packaging materials.","1,008,583",Western US,$1M to $10M,Active,,,,,,,For Profit,https://northwestfoam.com/,,"Manufacturing, Sales and Marketing",,,,,,,,,,,,,,,,Private,,,,,,
River City Elite Properties,https://www.crunchbase.com/organization/river-city-elite-properties,"Property Management, Real Estate, Residential","Midlothian, Virginia, United States",River City Elite Properties is a real estate agency that assists in buying and selling residential properties.,"1,008,587","East Coast, Southern US",$1M to $10M,Active,2017-01-01,year,,,,,For Profit,https://www.rivercityeliteproperties.com,"River City Elite Properties provides modern condos, spacious single-family houses, victorian mansions, and intelligent homes. Their homes with architecture, famous monuments, and trending decor styles together make the homes distinct.",Real Estate,,,1-10,,,,,,,,,,,,,Private,,,,,,
Cottery Group,https://www.crunchbase.com/organization/cottery-group,"Billing, Consulting, Health Care, Medical, Payments","Dallas, Texas, United States","Cottery Group is a consulting company that offers financial advice, rate analytics, healthcare administration, and medical billing services.","1,008,588","Dallas/Fort Worth Metroplex, Southern US",$1M to $10M,Active,,,,,,,For Profit,https://www.medicaidcostreport.com,,"Financial Services, Health Care, Payments, Professional Services, Software",,,11-50,,,,,,,,,,,,,Private,,,,,,
WheelsTV,https://www.crunchbase.com/organization/wheelstv,"TV, Video","Acton, Massachusetts, United States","WheelsTV reates and distributes exclusive original content for internet portals, websites, 3G mobile platforms, IPTV networks.","1,008,588","Greater Boston Area, East Coast, New England",Less than $1M,Active,2000-01-01,year,,,,,For Profit,http://wheelstvnetwork.com,"Automotive Networks Corporation, dba WheelsTV, creates and distributes exclusive original content. Patent-pending products include Top 200 Test Drives and 1:00 on One Vehicle Profiles and POV Reviews with a unique, Configurable Digital Video Template, for internet sites, 3G mobile and IPTV platforms and VOD. WheelsTV videos provide the optimal experience for in-market market consumers of both new and pre owned vehicles.","Media and Entertainment, Video",,,11-50,,,,,,,,,,,,,Private,,,,,,
Sweet Brew,https://www.crunchbase.com/organization/southern-visions,"Food and Beverage, Food Processing, Tea","Loxley, Alabama, United States","Sweet Brew is a beverage company that specializes in the production and distribution of brewed sweet teas, flavored teas and lemonade.","1,008,589",Southern US,$1M to $10M,Active,2003-01-01,year,,,,,For Profit,https://sweetbrewtea.com/,,Food and Beverage,,,11-50,,,,,,,,,,,,,Private,,,,,,
Southside Pediatrics & Adult Care,https://www.crunchbase.com/organization/southside-pediatrics-adult-care,"Health Care, Medical, Wellness","Hagerstown, Maryland, United States",Southside Pediatrics and Adult Care is an independent nurse practitioner owned and operated clinic.,"1,008,591","East Coast, Southern US",$1M to $10M,Active,,,,,,,For Profit,https://www.mysspediatrics.com,,Health Care,1,Christa Martin Rotz,11-50,,,,,,,,,,,,,Private,,,,,,
InReturn,https://www.crunchbase.com/organization/inreturn,"Employment, Health Care, Non Profit","Cincinnati, Ohio, United States",InReturn empowers individuals suffering from neurological injuries by promoting independent living through life skills training.,"1,008,592","Great Lakes, Midwestern US",$1M to $10M,Active,2005-01-01,year,,,,,Non-profit,https://www.inreturn.org,"InReturn provides viable employment to individuals who have suffered a neurological injury, disease, and disorder through manufacturing jobs and life skills programming. They offer resources related to vocational training, employment, community involvement, financial independence, recreation, continued education, and independent living.","Health Care, Other, Professional Services, Social Impact",1,Rob Groeschen,11-50,,,,,,,,,,,,,Private,,,,,,
VenElite,https://www.crunchbase.com/organization/venelite,"Information Technology, Mobile, Software, Venture Capital","San Francisco, California, United States",VenElite is a mobile technology platform enables accredited investors to invest in curated venture capital funds.,"1,008,594","San Francisco Bay Area, West Coast, Western US",,Active,2022-01-01,year,,,,,,https://www.venelite.com,VenElite is a mobile technology platform enables accredited investors to invest in curated venture capital funds.,"Financial Services, Information Technology, Lending and Investments, Mobile, Software",,,1-10,,,,,,,,,,,,,Private,,,,,,
Xtreme Trucking,https://www.crunchbase.com/organization/xtreme-trucking,"Logistics, Transportation, Travel","Maribel, Wisconsin, United States",Xtreme Trucking is a refrigerated transportation company.,"1,008,596","Great Lakes, Midwestern US",,Active,2006-01-01,year,,,,,For Profit,https://www.xtremetrucking.com/,,"Transportation, Travel and Tourism",,,,,,,,,,,,,,,,Private,,,,,,
"Allura Skin, Laser and Wellness Clinic",https://www.crunchbase.com/organization/allura-skin-laser-and-wellness-clinic,"Cosmetic Surgery, Fitness, Health Care, Laser, Wellness","Fort Collins, Colorado, United States","Allura Skin, Laser and Wellness Clinic offers cosmetic dermatology services.","1,008,599",Western US,$1M to $10M,Active,2008-01-01,year,,,,,For Profit,https://alluraclinic.com,"Allura Skin Laser and Wellness Clinic is to improve the lives of its patients both women and men by utilizing the most cutting edge tools, products, and procedures in the field of cosmetic dermatology. Its goal is to deliver individualized, secure services in a friendly setting with staff members that are skilled in the most recent medical procedures. The professionals make sure they have the training and product knowledge they need to provide clients with the most possible service, taking into account the ongoing breakthroughs in the science of skin renewal and general wellbeing. Many of the operations and treatments offered at such as wrinkle reduction, skin renewal, and weight loss, are helpful for men.","Hardware, Health Care, Science and Engineering, Sports",,,11-50,,,,,,,,,,,,,Private,,,,,,
Scotch Plains Fanwood Soccer,https://www.crunchbase.com/organization/scotch-plains-fanwood-soccer,Sports,"Scotch Plains, New Jersey, United States",Scotch Plains Fanwood Soccer,"1,008,599","Greater New York Area, East Coast, Northeastern US",Less than $1M,Active,,,,,,,For Profit,http://scotchplainsfanwoodsoccer.com,,Sports,,,1-10,,,,,,,,,,,,,Private,,,,,,
Bane Staffing,https://www.crunchbase.com/organization/bane-staffing,"Employment, Recruiting, Staffing Agency","Dayton, Ohio, United States","Bane Staffing provides a workforce for skilled trades, food processing, general labor, healthcare, administrative, and industrial works.","1,008,601","Great Lakes, Midwestern US",$1M to $10M,Active,1997-01-01,year,,,,,For Profit,https://banestaffing.com,,"Administrative Services, Professional Services",,,101-250,,,,,,,,,,,,,Private,,,,,,
EDM Americas- RIM business,https://www.crunchbase.com/organization/edm-americas-rim-business,Business Process Automation (BPA),"Scranton, Pennsylvania, United States","EDM Americas- RIM business provider of digital mailrooms, business process automation, and information management solutions.","1,008,607","Great Lakes, Northeastern US",,Active,,,2020-01-29,day,,,For Profit,,"EDM Americas- RIM business provider of digital mailrooms, business process automation, and information management solutions.",Software,,,,,M&A,,,,,,,,,,,Private,,,,,,
Air Service Hawaii,https://www.crunchbase.com/organization/air-service-hawaii,"Customer Service, Service Industry, Transportation","Honolulu, Hawaii, United States","Air Service Hawaii offers aircraft handling, fuel, and ground handling services.","1,008,608","Asia-Pacific (APAC), Western US",$10M to $50M,Closed,1948-01-01,year,2022-05-05,day,2022-05-05,day,For Profit,https://www.airservicehawaii.com,"Air Service Hawaii offers aircraft handling, fuel, and ground handling services.","Other, Professional Services, Transportation",,,11-50,,M&A,,,,,,,,,,,Private,,,,,,
Luxury Real Estate,https://www.crunchbase.com/organization/luxury-real-estate-67ca,"Commercial Real Estate, Real Estate, Residential","Seattle, Washington, United States","Luxury Real Estate is an agency that offers buying, selling and property management of villas and commercial properties.","1,008,609","Greater Seattle Area, West Coast, Western US",,Active,1986-01-01,year,,,,,For Profit,https://www.luxuryrealestate.com/,,Real Estate,,,11-50,,,,,,,,,,,,,Private,,,,,,
Artificial Intelligence In Action,https://www.crunchbase.com/organization/artificial-intelligence-in-action,"Artificial Intelligence (AI), Information Technology, Non Profit","Santa Clara, California, United States",Artificial Intelligence In Action is an organization that focuses on artificial intelligence.,"1,008,610","San Francisco Bay Area, Silicon Valley, West Coast",,Active,2020-01-01,year,,,,,Non-profit,https://www.ai-action.org,"Artificial Intelligence In Action is a non-profit organization that focuses on promoting artificial intelligence. The organization aligns its activities with the ideals of Athenian Democracy, aiming to democratize the power of AI. They organize forums and events related to AI, providing a platform for discussions and learning.","Artificial Intelligence (AI), Data and Analytics, Information Technology, Other, Science and Engineering, Social Impact, Software",,,11-50,,,,,,,,,,,,,Private,,,,,,
Greenstead Property,https://www.crunchbase.com/organization/greenstead-property,"Home Renovation, Property Management, Real Estate, Residential","Atlanta, Georgia, United States","Greenstead Property LLC is a property management company, specializing in residential properties.","1,008,612","Greater Atlanta Area, East Coast, Southern US",Less than $1M,Active,2016-01-01,year,,,,,For Profit,https://greensteadproperty.com,,Real Estate,,,1-10,,,,,,,,,,,,,Private,,,,,,
Lake Point Property Management,https://www.crunchbase.com/organization/lake-point-property-management,"Customer Service, Property Management, Real Estate","Burlington, Vermont, United States","Lake Point offers leasing, brokerage, property management, and maintenance services.","1,008,614","New England, Northeastern US",$1M to $10M,Active,2015-01-01,year,,,,,For Profit,https://lakepointvt.com,"Lake Point is a property management company. They provide customized real estate management services for property owners and their tenants. They emphasize the use of risk control programs to reduce liability and enhance financial return. Their building and maintenance team offers services to owners and tenants including monitoring and maintaining facility systems, maintenance and repair, work order management and preventative maintenance programs.","Other, Professional Services, Real Estate",,,1-10,,,,,,,,,,,,,Private,,,,,,
Lauer-Manguso & Associates Architects,https://www.crunchbase.com/organization/lauer-manguso-associates-architects,"Architecture, Commercial, Interior Design","Buffalo, New York, United States",Lauer-Manguso & Associates Architects is an architectural firm that provides engineering and interior design services.,"1,008,615","Great Lakes, East Coast, Northeastern US",$1M to $10M,Active,1982-01-01,year,,,,,For Profit,http://www.lauer-manguso.com,"Lauer-Manguso & Associates Architects is a multidiscipline architectural firm whose reputation is synonymous with quality and excellence. They keep a keen eye on improving the customers' environment they continue to make their mark on Western New York. Their innovative and expansive approach to architecture and design, a proven success for more than two decades, has made Lauer-Manguso one of the area's leading architectural firms"" as quoted from builder and architect magazine. Lauer-Manguso & Associates Architects’ goal is to team with clients to create aesthetically pleasing and environmentally friendly designs that contribute to the success of the business and the community. They value their relationships with their clients and keep them closely involved in the design process to ensure the end product is exactly what they envisioned.","Design, Other, Real Estate",,,11-50,,,,,,,,,,,,,Private,,,,,,
Taylor's Sausage,https://www.crunchbase.com/organization/taylor-s-sausage,"E-Commerce, Food and Beverage, Food Processing","Cave Junction, Oregon, United States",Taylor's Sausage is a food and beverage company that provides snack sticks and dry jerky products.,"1,008,617","West Coast, Western US",$10M to $50M,Active,1924-01-01,year,,,,,For Profit,https://taylorsausage.com,"Taylor's Sausage offers gift packs, landjaeger, snack sticks, trail busters, and dry jerky products. They provide products that include honey ham and cheese sticks. They offer products that are available online. For inquiries, telephone and email are used.","Commerce and Shopping, Food and Beverage",,,11-50,,,,,,,,,,,,,Private,,,,,,
Smith Alling,https://www.crunchbase.com/organization/smith-alling,"Advice, Law Enforcement, Legal, Professional Services","Tacoma, Washington, United States","Smith Alling is a legal services company that offers business, corporate, construction law, and litigation services.","1,008,622","Greater Seattle Area, West Coast, Western US",$1M to $10M,Active,1984-01-01,year,,,,,For Profit,https://smithalling.com,,"Government and Military, Media and Entertainment, Other, Privacy and Security, Professional Services",,,11-50,,,,,,,,,,,,,Private,,,,,,
Medx12,https://www.crunchbase.com/organization/medx12,"Computer, Software","Louisville, Kentucky, United States","Providing innovative software, and information solutions .","1,008,623",Southern US,$1M to $10M,Active,,,,,,,For Profit,http://www.medx12.com,"MedX12’s mission is to be a leader in providing innovative software, and information solutions that empower physicians to improve the success of their practices Revenue Cycle Management as well as be a total Enterprise Solution.","Consumer Electronics, Hardware, Software",,,11-50,,,,,,,,,,,,,Private,,,,,,
LSM Consulting,https://www.crunchbase.com/organization/lsm-consulting,"Consulting, Pharmaceutical, Training","Philadelphia, Pennsylvania, United States","LSM Consulting provides pharmacovigilance, gap analysis, and leadership coaching services.","1,008,623","Greater Philadelphia Area, Great Lakes, Northeastern US",$1M to $10M,Active,2008-01-01,year,,,,,For Profit,https://www.lsmconsulting.net,LSM Consulting is a safety and training consultancy working in the pharmaceutical and medical device sectors. It has been operating in the United States and serving an international clientele. They specialize in large-scale standard operating procedure (SOP) gap analysis and remediation to maintain the highest levels of regulatory compliance.,"Education, Health Care, Professional Services",,,11-50,,,,,,,,,,,,,Private,,,,,,
Sterling Mobile Services,https://www.crunchbase.com/organization/sterling-mobile-services,"E-Commerce, Robotics, Software","Phoenix, Arizona, United States","Sterling Mobile Services is a reseller that purchases, services, and sells refurbished barcode scanners, zebra printers, and computers.","1,008,624","Greater Phoenix Area, Western US",$10M to $50M,Active,2002-04-19,day,,,,,For Profit,http://sterlingmobile.com/,"We Buy, Service and Sell Refurbished Barcode Scanners, Zebra Printers, Mobile Computers & Printers! Free 90 Day Warranty + 15 Day Money Back Satisfaction Guarantee!","Commerce and Shopping, Hardware, Science and Engineering, Software",,,1-10,,,,,,,,,,,,,Private,,,,,,
AndersonPenna Partners,https://www.crunchbase.com/organization/andersonpenna-partners-inc,"Civil Engineering, Consulting","Newport Beach, California, United States",AndersonPenna Partners operates as an engineering consulting firm.,"1,008,624","Greater Los Angeles Area, West Coast, Western US",,Closed,,,2018-09-27,day,2018-09-01,month,For Profit,https://www.andersonpenna.com,"AndersonPenna Partners operates as an engineering consulting firm. AndersonPenna Partners, Inc. serves local and regional agencies, including railroads and special districts, with services focused on project delivery and staff augmentation.","Professional Services, Science and Engineering",,,101-250,,M&A,,,,,,,,,,,Private,,,,,,
HPB Insurance Group,https://www.crunchbase.com/organization/hpb-insurance-group,"Employee Benefits, Financial Services, Health Care, Insurance","High Point, North Carolina, United States","HPB Insurance Group is an insurance agency that offers employee benefits, business, health, auto, and personal insurance services.","1,008,628","East Coast, Southern US",$1M to $10M,Active,1895-01-01,year,,,,,For Profit,https://www.hpbinsurance.com/,,"Administrative Services, Financial Services, Health Care",,,11-50,,,,,,,,,,,,,Private,,,,,,
Cannons Auctions,https://www.crunchbase.com/organization/cannons-auctions,"Auctions, Online Auctions, Real Estate","Richmond, Virginia, United States","Cannons Auctions specializes in estate sales, online estate auctions, personal property sales, and estate liquidations.","1,008,628","East Coast, Southern US",$1M to $10M,Active,,,,,,,For Profit,https://www.cannonsauctions.com,,"Commerce and Shopping, Real Estate",,,11-50,,,,,,,,,,,,,Private,,,,,,
Zayas Hendrick Mediaworks,https://www.crunchbase.com/organization/zayas-hendrick-mediaworks,"E-Learning, Event Management, Graphic Design, Web Design","Bethesda, Maryland, United States","Zayas Hendrick Mediaworks provides video production, training, and education services.","1,008,630","Washington DC Metro Area, East Coast, Southern US",$1M to $10M,Active,1999-01-01,year,,,,,For Profit,https://zhmworks.com,"Zayas Hendrick Mediaworks offers instructional design, responsive web design, graphic design, animation, and event management services. They can assist them with a variety of solutions whether they need classroom training, online training, webinars, presentation training, or a combination of both.","Design, Education, Events, Media and Entertainment, Software",,,11-50,,,,,,,,,,,,,Private,,,,,,
Chesapeake Bay Aquatic & Physical Therapy,https://www.crunchbase.com/organization/chesapeake-bay-aquatic-physical-therapy,Health Care,"Bowie, Maryland, United States",Chesapeake Bay is a physical therapy company serving in Maryland .,"1,008,635","Washington DC Metro Area, East Coast, Southern US",Less than $1M,Active,2001-01-01,year,,,,,For Profit,http://cbayaquapt.com,,Health Care,,,11-50,,,,,,,,,,,,,Private,,,,,,
Shelton & Valadez,https://www.crunchbase.com/organization/shelton-valadez,"Consulting, Law Enforcement, Legal, Professional Services","San Antonio, Texas, United States","Shelton & Valadez is a law firm for business, transportation, self-insured representation, dispute resolution, and commercial litigation.","1,008,641",Southern US,,Active,1993-01-01,year,,,,,For Profit,https://shelton-valadez.com/,,"Government and Military, Other, Privacy and Security, Professional Services",,,1-10,,,,,,,,,,,,,Private,,,,,,
The Bluestone Group,https://www.crunchbase.com/organization/the-bluestone-group-d694,"Project Management, Property Management, Real Estate","New York, New York, United States",The Bluestone Group is a private investment firm that specializes in real estate market and property management services.,"1,008,644","Greater New York Area, East Coast, Northeastern US",,Active,2006-01-01,year,,,,,For Profit,https://bluestonegrp.com/,,"Administrative Services, Other, Real Estate",2,"Eli Tabak, Marc Mendelsohn",,,,,,,,,,,,,,Private,,,,,,
Woodmont Baptist Church,https://www.crunchbase.com/organization/woodmont-baptist-church,"Children, Education, Religion","Florence, Alabama, United States",Woodmont Baptist Church is a religious organization.,"1,008,648",Southern US,$1M to $10M,Active,,,,,,,For Profit,https://www.woodmontbaptist.org,"Woodmont Baptist Church offers application of scripture, pursuit of holiness, and commitment to Godly relationships. Woodmont Kids is committed to engaging kids from nursery to 6th Grade with the gospel of Jesus Christ.","Community and Lifestyle, Education",,,11-50,,,,,,,,,,,,,Private,,,,,,
miRide,https://www.crunchbase.com/organization/miride,"Mobile Apps, Ride Sharing, Transportation","Miami, Florida, United States",miRide is a mobile application and ride-hailing company.,"1,008,652","Greater Miami Area, East Coast, Southern US",$1M to $10M,Active,2015-01-01,day,,,,,For Profit,https://www.miride.com,,"Apps, Mobile, Software, Transportation",,,1-10,,,,,,,,,,,,,Private,,,,,,
Evansville Sheet Metal Works,https://www.crunchbase.com/organization/evansville-sheet-metal-works,"Industrial, Machinery Manufacturing, Manufacturing, Mechanical Engineering","Evansville, Indiana, United States","Evansville Sheet Metal Works is a manufacturing company that specializes in metal fabrication, CNC machining, and laser cutting.","1,008,655","Great Lakes, Midwestern US",$1M to $10M,Active,1946-01-01,year,,,,,For Profit,https://esmw.com/,,"Manufacturing, Science and Engineering",,,11-50,,,,,,,,,,,,,Private,,,,,,
Medway Oil & Propane,https://www.crunchbase.com/organization/medway-oil-propane,"Fuel, Home Services, Oil and Gas","Medway, Massachusetts, United States","MO&P provides heating oil, propane, fuel oil, and diesel services for the residential and commercial sectors.","1,008,660","Greater Boston Area, East Coast, New England",$1M to $10M,Active,1954-01-01,year,,,,,For Profit,https://www.medwayoilpropane.com,"Medway Oil & Propane offers fuel oil, gas, and diesel services for home and business sectors. They provide heating oil, propane gas, kerosene, anthracite coal, and diesel. They also provide home heating, air conditioning, water heating, insect control, pool, and spa heating services.","Energy, Natural Resources, Real Estate",1,Jeff Mushnick,11-50,,,,,,,,,,,,,Private,,,,,,
JSH Web Designs,https://www.crunchbase.com/organization/jsh-web-designs,"E-Commerce, Service Industry, Web Design","Knoxville, Tennessee, United States",JSH Web Designs is a Marketing And Website Design Agency.,"1,008,661",Southern US,Less than $1M,Active,2013-11-01,day,,,,,For Profit,https://jshwebdesigns.com/,"JSH Web Designs they offer website design and redesign, graphic design and branding, search engine optimization (SEO), videography, photography, social media marketing, social media management, email marketing, pay-per-click advertising, website hosting, and more.","Commerce and Shopping, Design, Other",,,1-10,,,,,,,,,,,,,Private,,,,,,
