Lucid Scientific,https://www.crunchbase.com/organization/lucid-scientific,"Biotechnology, Medical, Product Research","Atlanta, Georgia, United States",Lucid Scientific is a biotechnology company that designs and develops a series of real-time cellular activity monitors.,"36,201","Greater Atlanta Area, East Coast, Southern US",,Active,2012-01-01,year,,,,,For Profit,https://lucidsci.com/,"Lucid Scientific is a biotechnology tools company working to accelerate drug discovery and basic biological research by providing systems for real-time cellular analysis. It has invented an innovative new system for monitoring cell culture experiments. The company’s flagship technology, called RESIPHER, provides continuous and non-invasive measurement of oxygen consumption in a cell culture plate, then streams this information to a convenient web app.","Biotechnology, Data and Analytics, Design, Health Care, Science and Engineering",1,Walker Inman,1-10,5,Early Stage Venture,10000000,USD,10000000,10108806,USD,10108806,"IAG Capital Partners, Dynamk Capital, Georgia Research Alliance, GRA Venture Fund, LLC",3,4,,Private,,,,,,
Himalaya Media,https://www.crunchbase.com/organization/himalaya-inc,"Advertising, Audio, Internet, Podcast","San Francisco, California, United States","Himalaya builds a podcast platform, audio content network, and original production studio for podcasters.","36,209","San Francisco Bay Area, West Coast, Western US",$1M to $10M,Active,2015-01-01,year,,,,,For Profit,https://www.himalaya.com/,"Himalaya is an ambitious new podcast platform.Our ultimate goal is to build a one-of-a-kind podcast platform, audio content network, and original production studio for podcasters, and engage with a community of podcast lovers. The company's mission is to empower them by connecting them to their fans through our app and services. By providing production, distribution, and marketing support, Himalaya Media wants to give creators the opportunity to monetize their content and grow their audience organically and through targeted paid efforts.","Advertising, Internet Services, Media and Entertainment, Music and Audio, Sales and Marketing",1,Yu Wang,101-250,1,,100000000,USD,100000000,100000000,USD,100000000,"Ximalaya FM, Susquehanna International Group (SIG)",1,2,,Private,,,,,,
Aircon,https://www.crunchbase.com/organization/aircon-894d,"Air Transportation, Supply Chain Management","Flower Mound, Texas, United States",AirCon is the first gateway-as-a-service in the air cargo industry.,"36,212","Dallas/Fort Worth Metroplex, Southern US",,Active,2021-01-01,day,,,,,For Profit,https://www.airconai.com/,AirCon is the first gateway-as-a-service in the air cargo industry. AirCon's platform identifies opportunities across air freight shipments to maximize space and weight utilization and reduce costs,Transportation,,,11-50,3,Seed,4301000,USD,4301000,4301000,USD,4301000,"Plug and Play, Underscore VC, Schematic Ventures",2,3,,Private,,,,,,
Kennedy Wilson,https://www.crunchbase.com/organization/kennedy-wilson,"Finance, Financial Services, Real Estate","Beverly Hills, California, United States",Kennedy Wilson is a vertically integrated global real estate investment and services company.,"36,213","Greater Los Angeles Area, West Coast, Western US",$100M to $500M,Active,1977-01-01,year,2007-12-14,day,,,For Profit,http://kennedywilson.com,"Kennedy Wilson is a vertically integrated global real estate investment and services company. The Company has approximately 24 offices throughout the United States, the United Kingdom, Ireland, Spain, and Japan. It focuses on adding value for its shareholders through opportunistic investing and strategic asset management. Its business operations include two core units: KW Investments and KW Services. KW Investments invests its capital in real estate-related assets. KW Services provides a full array of real estate-related services to owners and lenders, with a focus on financial institution-based clients. In May 2014, it purchased apartments, 203-unit apartment community in Tacoma, Washington. In July 2014, it acquired a multifamily portfolio consisted of three properties located across southern submarkets of Seattle, Washington. Portfolio consists of 1,212 units.","Financial Services, Real Estate",,,1001-5000,4,IPO,700000000,USD,700000000,778367114,USD,778367114,"Fairfax Financial Holdings, Allied Irish Banks, Eldridge Industries",3,3,2,Public,2007-12-14,,,KW,https://www.crunchbase.com/ipo/kennedy-wilson-ipo--5b52a092,NYSE - New York Stock Exchange
Fenix Parts,https://www.crunchbase.com/organization/fenix-parts,"Automotive, Manufacturing, Retail","Hurst, Texas, United States",Fenix Parts engages in the recycling and reselling of automotive products.,"36,219","Dallas/Fort Worth Metroplex, Southern US",,Active,2014-01-01,year,2015-05-14,day,,,For Profit,http://www.fenixparts.com/,"Fenix Parts is a recycler and reseller of original equipment manufacturer (OEM) automotive products in the United States. Its primary business is auto recycling, which is the recovery and resale of OEM parts, components and systems reclaimed from damaged, totaled, or low-value vehicles.","Commerce and Shopping, Manufacturing, Transportation",2,"Kent Robertson, Ross Berner",51-100,1,M&A,3451000,USD,3451000,3451000,USD,3451000,,,,7,Public,2015-05-14,,,FENX,https://www.crunchbase.com/ipo/fenix-parts-ipo--ce164f54,NASDAQ
PeerIQ,https://www.crunchbase.com/organization/peeriq,"Analytics, Big Data, Credit, Financial Services, FinTech, Risk Management","New York, New York, United States","PeerIQ is a data and risk analytics firm that helps institutions analyze, access and manage risk in the alternative lending sector.","36,219","Greater New York Area, East Coast, Northeastern US",$1M to $10M,Active,2014-01-01,year,2021-06-23,day,,,For Profit,http://www.peeriq.com,"PeerIQ is a New York-based financial information services company that is creating tools to analyze, access, and manage risk in the peer-to-peer lending sector. We pool detailed loan data to provide authoritative, independent analytics and benchmarks that our institutional clients use to price instruments, value loan portfolios, develop investment views, and manage risk. PeerIQ aims to strengthen the P2P sector by increasing transparency, enabling efficient risk management, and providing analytics that support better investment decision-making.","Data and Analytics, Financial Services, Lending and Investments, Professional Services",4,"Dan Long, J M, Ram Ahluwalia, Robert Khedouri",11-50,6,M&A,20500000,USD,20500000,20500000,USD,20500000,"TransUnion, Macquarie Group, Fenway Summer Ventures, Panorama Point Partners, Uprising Ventures",2,15,,Private,,,,,,
Lore,https://www.crunchbase.com/organization/prysm-924e,"Blockchain, Cryptocurrency, Ethereum, Social Network","San Francisco, California, United States","Lore is the Co-Ownership Platform that enables groups to spin up a group wallet, pool resources and own more of crypto — together.","36,221","San Francisco Bay Area, West Coast, Western US",,Active,2020-05-01,month,,,,,For Profit,http://lore.xyz/,"Lore is the Co-Ownership Platform that enables groups to spin up a group wallet, pool resources and own more of crypto — together. We built the first group wallet to own NFTs and memecoins together. We are a 7-person, SF-based team founded by childhood friends Thomas Scaria and Shelby Thomas. We’ve raised over $7MM from Multicoin Capital, Polychain Capital and many more.","Blockchain and Cryptocurrency, Financial Services, Internet Services, Other, Payments, Software",2,"Shelby Thomas, Thomas Scaria",1-10,4,,7000000,USD,7000000,7000000,USD,7000000,"Polychain, seedclub, CMT Digital Ventures, Multicoin Capital, Infinite Capital",3,20,,Private,,,,,,
WTA,https://www.crunchbase.com/organization/wta,"Sponsorship, Sporting Goods, Sports","St. Petersburg, Florida, United States",WTA is a sports company that provides tournament sponsorship services.,"36,223","Tampa Bay Area, East Coast, Southern US",$100M to $500M,Active,1973-06-01,day,,,,,For Profit,http://wtatennis.com,WTA is a sports company that provides tournament sponsorship services.,"Commerce and Shopping, Sales and Marketing, Sports",1,Billie Jean King,101-250,1,Private Equity,30000000,USD,30000000,30000000,USD,30000000,,,,,Private,,,,,,
DEPCOM Power,https://www.crunchbase.com/organization/depcom-power,"Construction, Energy, Procurement, Renewable Energy, Solar","Scottsdale, Arizona, United States",DEPCOM Power is a renewables and environment company that designs and builds cost-effective solar power plants.,"36,237","Greater Phoenix Area, Western US",$100M to $500M,Active,2013-01-01,year,2021-11-30,day,,,For Profit,http://www.depcompower.com/,"DEPCOM Power is a renewables and environment company that designs and builds cost-effective solar power plants. DEPCOM Power provides turnkey development support services, engineering solutions, and operations and maintenance services. The company was founded in 2013 and headquartered in Scottsdale, Arizona.","Energy, Natural Resources, Real Estate, Sustainability, Transportation",3,"Jim Lamon, Jim Tyler, John Schroeder",101-250,3,M&A,18600000,USD,18600000,18600000,USD,18600000,Sorenson Capital,1,1,,Private,,,,,,
InvestEdge,https://www.crunchbase.com/organization/investedge,"Advice, Financial Services, FinTech, Wealth Management","Pittsburgh, Pennsylvania, United States","InvestEdge is a leading provider of wealth management solutions to large banks, trust companies, brokerage firms.","36,238","Great Lakes, Northeastern US",$1M to $10M,Active,2000-01-01,year,2020-10-02,day,,,For Profit,http://www.investedge.com,"InvestEdge partners with progressive leaders of investment firms who advise and serve prosperous individuals and families. Their sole focus is the delivery of innovative thinking and proven wealth management technology to help you grow your business and deliver the ultimate client experience. Today, dozens of the world's leading advisors rely on InvestEdge for managing, measuring and reporting on the assets of high net worth and ultra-high net worth clients. Their talented, knowledgeable and dedicated team-combined with their patented wealth management solutions-enables you to focus on what matters most: Building stronger, deeper and more profitable relationships with your clients.  Since inception in 2000, InvestEdge has steadily grown into the premier provider of wealth management solutions by helping firms:","Financial Services, Media and Entertainment",2,"Bob Stewart, Roland Collins",101-250,2,M&A,300000,USD,300000,5300000,USD,5300000,"Innovation Works, Vistara Growth",1,2,,Private,,,,,,
Lifekey,https://www.crunchbase.com/organization/lifekey,"Consumer Electronics, FinTech, Information Technology, Payments, Software, Wearables","Jackson, Wyoming, United States",LIFEKEY is building wearable tech and software for the post-smartphone era -- with no batteries to charge and no electronics to manage.,"36,239",Western US,$1M to $10M,Active,2018-01-01,year,,,,,For Profit,https://lifekey.co,"LIFEKEY is a cloud-based super app and wearable device company who's building tech for the post-smartphone era -- a less distracting future with no batteries to charge and no electronics to manage. LIFEKEY on. Phone off. LIFEKEY envisions a future where all personal credentials – from identity to payments – are stored and accessible to you from anywhere. It’s our mission to simplify life, so you can focus on what matters most.","Consumer Electronics, Financial Services, Hardware, Information Technology, Payments, Software",1,Jason Kintzler,1-10,4,Seed,3400000,USD,3400000,3400000,USD,3400000,,,,,Private,,,,,,
Carbonfact,https://www.crunchbase.com/organization/carbonfact,"E-Commerce, Information Services, Information Technology","Wilmington, Delaware, United States","Fast, scalable life-cycle assessments to help fashion brands lower their scope 3 emissions.","36,241","Greater Philadelphia Area, East Coast, Southern US",,Active,2021-06-01,month,,,,,For Profit,http://www.carbonfact.com,Carbonfact is a software running fast life-cycle assessments to help fashion brands lower their scope 3 emissions. The company currently serves more than 150 fashion brands and works with major fashion retailers like Yoox Net A Porter and La Redoute.,"Commerce and Shopping, Information Technology",3,"Marc Laurent, Martin Daniel, Romain Champourlier",1-10,2,Seed,2125000,USD,2125000,2125000,USD,2125000,"Y Combinator, Alven",2,2,,Private,,,,,,
Ironforge,https://www.crunchbase.com/organization/ironforge,"Apps, Developer APIs, Software","Miami, Florida, United States",A serverless Solana development platform.,"36,245","Greater Miami Area, East Coast, Southern US",,Active,2022-01-01,year,,,,,For Profit,https://www.ironforge.cloud/,,"Apps, Software",,,1-10,1,Seed,2600000,USD,2600000,2600000,USD,2600000,"Alchemy, Portage Ventures, 6th Man Ventures, Reciprocal Ventures, Monoceros",1,6,,Private,,,,,,
Bloom Community,https://www.crunchbase.com/organization/bloom-community,"Communities, Dating","Oakland, California, United States","Bloom Community offers sex-positive, gay, and edge-of-culture communities a secure online environment.","36,246","San Francisco Bay Area, West Coast, Western US",,Active,2020-01-01,year,,,,,For Profit,https://bloomcommunity.com/,"Bloom Community offers sex-positive, gay, and edge-of-culture communities a secure online environment.",Community and Lifestyle,1,Lauren Vegter,1-10,3,Seed,5000000,USD,5000000,5000000,USD,5000000,"Y Combinator, Behind Genius Ventures, Precursor Ventures, Claire Hughes Johnson, Tuesday Capital",2,6,,Private,,,,,,
Dragonfly,https://www.crunchbase.com/organization/dragonfly-capital-partners-eed4,"Business Development, Finance, Financial Services","San Francisco, California, United States",Dragonfly Capital Partners is investing in and supporting the promising opportunities in the cryptoasset class.,"36,247","San Francisco Bay Area, West Coast, Western US",,Active,2018-01-01,year,,,,,For Profit,https://www.dragonfly.xyz/,Dragonfly Capital Partners brings together the leading participants in the decentralized economy. Its global ecosystem enables us to invest in and support the most promising opportunities in the crypto asset class.,"Financial Services, Professional Services",2,"Bo Feng, Haseeb Qureshi",1-10,1,,,USD,,,USD,,Circle Ventures,,1,1,Private,,,,,,
Confiant,https://www.crunchbase.com/organization/confiant,"Advertising Platforms, Security, Software","New York, New York, United States",Confiant protects digital publisher's reputation and revenue with anti-malware software that keeps them ahead of the bad guys.,"36,259","Greater New York Area, East Coast, Northeastern US",$1M to $10M,Active,2013-09-01,month,,,,,For Profit,http://www.confiant.com,"Criminals are hijacking programmatic advertising and giving publishers a bad name. Confiant protects publishers'​ and platforms'​ reputations, revenue, and resources with always-on anti-malware software that provides protection for desktop, mobile, and video ads. Its sole focus is on helping advertising platforms and publishers rid the world of malware. This focus enables us to evolve quickly and meet our clients'​ needs for defeating the bad actors trying to undermine the industry. Programmatic technologies make it easy for criminals to use digital publishers to infect millions of consumers. Confiant protects the publisher's reputation and revenue with anti-malware software that keeps them ahead of the bad guys.","Advertising, Privacy and Security, Software",2,"Jerome Dangu, Louis-David Mangin",11-50,2,Early Stage Venture,4100000,USD,4100000,4100000,USD,4100000,"Seed4Soft, Rubicon Venture Capital, River Bay Investments",3,3,,Private,,,,,,
Innovo Therapeutics,https://www.crunchbase.com/organization/innovo-therapeutics-a25b,"Biotechnology, Medical, Product Research","San Diego, California, United States",Innovo Therapeutics is a anti-cancer drug developer committed to research and creation of medications that target protein breakdown.,"36,261","Greater San Diego Area, West Coast, Western US",,Active,2021-01-01,year,,,,,For Profit,https://www.innovotherapeutics.com,Innovo Therapeutics is a anti-cancer drug developer committed to research and creation of medications that target protein breakdown.,"Biotechnology, Data and Analytics, Design, Health Care, Science and Engineering",,,11-50,2,Seed,200000000,CNY,28869822,200000000,CNY,28869822,"CICC, Ming Bioventures, Huajin Capital, HMC Ventures, Qiandao Fund",3,8,,Private,,,,,,
Streamroot,https://www.crunchbase.com/organization/streamroot,"Content Delivery Network, Delivery, SaaS, Social Media, Video, Video Streaming, Virtual Reality","New York, New York, United States",Next-generation peer-to-peer video content delivery.,"36,262","Greater New York Area, East Coast, Northeastern US",$1M to $10M,Active,2013-01-01,year,2019-09-10,day,,,For Profit,http://www.streamroot.io,"Streamroot is a market leader in innovative OTT video optimisation technologies for content publishers, network service providers and enterprise customers. At Streamroot, we’re working to overcome one of the biggest challenges facing the internet today: the explosion of video traffic. Our goal is to revolutionise the way we deliver video online, to create more robust, cost-effective infrastructures, and to touch millions of internet users by bringing quality video to every corner of the world. Our core technology - Streamroot DNA™ -  is a crucial foundation for building profitable over-the-top video strategies. An Infrastructure as a Service solution, Streamroot DNA™ harnesses the power of distributed delivery networks to heighten QoE and drastically cut delivery cost.  This ground-breaking technology works by creating a secure mesh network to dynamically and intelligently deliver video streams from the quickest source available, whether it be a user device or a traditional CDN. By multi-sourcing content delivery, Streamroot DNA™ offers viewers lightening-quick streams of higher quality, while providing infinite scale-up potential for the content provider. Priced under a fixed-subscription model, Streamroot DNA™ cuts delivery expenses by between 55 and 85%, helping publishers scale their platforms profitably. No plug-ins, less buffering, lower cost but higher quality - Streamroot’s seamless streaming solutions revolutionise the experience for viewer and provider alike. Streamroot serves high-profile media groups including DailyMotion, Canal+ and Eurosport, enhancing the quality of experience for over 5 million viewers every day. Founded in 2013, the French-American start-up took part in the TechStars Boston accelerator and today benefits from European and US-based VC funding, with offices in both New York and Paris. For access to our services, request a trial through our website www.streamroot.io.  For more information, please visit www.streamroot.io or drop us a line at contact@streamroot.io.","Administrative Services, Content and Publishing, Hardware, Internet Services, Media and Entertainment, Software, Video",3,"Axel Delmas, Nikolay Rodionov, Pierre Louis Théron",11-50,7,M&A,5824011,USD,5824011,5942011,USD,5942011,"Techstars, Bpifrance, NUMA, Right Side Capital Management, Partech",2,15,,Private,,,,,,
Tinyhood,https://www.crunchbase.com/organization/tinyhood-inc,"Apps, Education, Parenting","Boston, Massachusetts, United States","Tinyhood offers online courses, one-on-one consultations, and moderated communities.","36,263","Greater Boston Area, East Coast, New England",Less than $1M,Active,2017-01-01,year,,,,,For Profit,https://www.tinyhood.com,"Tinyhood offers online courses, one-on-one consultations, and moderated communities. It was founded by two moms, engineers with an ability and passion to create something truly good.","Apps, Community and Lifestyle, Education, Software",2,"Becky Miller, Susan Beaudry Blinn",1-10,3,,7499998,USD,7499998,7499998,USD,7499998,"TMV, MergeLane, Zack Kanter",,3,,Private,,,,,,
Deck Commerce,https://www.crunchbase.com/organization/deck-commerce,"E-Commerce, E-Commerce Platforms, Internet, SaaS","St Louis, Missouri, United States",Deck Commerce is a cloud-based solution platform developer intended to streamline e-commerce operations.,"36,266",Midwestern US,$1M to $10M,Active,1998-01-01,year,,,,,For Profit,http://www.deckcommerce.com/,"Deck Commerce is a cloud-based solution platform developer intended to streamline e-commerce operations. It was built to address the data, system integration, and business process challenges retailers to encounter as they operate in today’s retail environment.  Its platform features enterprise inventory visibility, universal product information, and distributed order management and connects front-end shopping channels with back-end business systems, enabling small e-commerce businesses to streamline the processes for managing orders, inventory, and product data and leveraging existing back-end business systems.","Commerce and Shopping, Internet Services, Software",1,Christopher Deck,11-50,4,Early Stage Venture,12500000,USD,12500000,12500000,USD,12500000,"Riverside Acceleration Capital, Plymouth Growth, Arsenal Capital Management",2,3,,Private,,,,,,
Infinia ML,https://www.crunchbase.com/organization/infinia-ml,"Artificial Intelligence (AI), Computer, Machine Learning, Software","Durham, North Carolina, United States",Infinia ML helps businesses redefine ​ the possibilities of human potential​ with advanced machine learning.,"36,268","Research Triangle, East Coast, Southern US",$1M to $10M,Active,2017-09-01,month,2023-09-12,day,,,For Profit,https://www.infiniaml.com,Infinia ML helps businesses redefine ​ the possibilities of human potential​ with advanced machine learning.,"Artificial Intelligence (AI), Consumer Electronics, Data and Analytics, Hardware, Science and Engineering, Software",3,"Jun Liu, Lawrence Carin, Robbie Allen",11-50,1,M&A,10000000,USD,10000000,10000000,USD,10000000,Carrick Capital Partners,1,1,,Private,,,,,,
Verituity,https://www.crunchbase.com/organization/verituity,"Finance, Financial Services, FinTech, Mobile Payments","Mclean, Virginia, United States","Verituity is a verified digital payments platform that connects banks, businesses, and payees to first-time and on-time digital payouts.","36,275","Washington DC Metro Area, East Coast, Southern US",$500M to $1B,Active,2020-01-01,year,,,,,For Profit,https://verituity.com,"Verituity is a verified digital payments platform that connects banks, businesses, and payees to first-time and on-time digital payouts. Verituity’s bank-grade platform helps financial institutions meet the unique payout needs of their clients. Whether it’s insurance companies paying claims, businesses paying suppliers, service providers paying refunds, mortgage companies transferring funds, or gaming companies paying out winnings.","Financial Services, Mobile, Payments, Software",1,Ben Turner,11-50,1,Early Stage Venture,10000000,USD,10000000,10000000,USD,10000000,"Forgepoint Capital, Ardent Venture Partners",2,2,,Private,,,,,,
Highway Benefits,https://www.crunchbase.com/organization/highway-benefits,"Employee Benefits, Human Resources, SaaS, Software","Manhattan Beach, California, United States",Highway Benefits is an employee benefits platform that increases retention and attraction of top talent through modernized benefits.,"36,276","Greater Los Angeles Area, West Coast, Western US",,Active,2020-01-01,year,,,,,For Profit,https://www.highwaybenefits.com,"Highway Benefits is an employee benefits platform that increases the retention and attraction of top talent through modernized benefits. It allows employers to design a custom plan which gives them the ability to contribute to their employees' student loans, enabling companies to increase employee happiness, productivity, improve employee retention and reduce turnover costs. It was founded in 2020 and is based in Manhattan Beach, California.","Administrative Services, Health Care, Software",2,"Cory Micheel, Michael MacLaverty",1-10,3,Seed,6209993,USD,6209993,6209993,USD,6209993,"XYZ Venture Capital, Roger Ferguson",1,2,,Private,,,,,,
Core Loop Games,https://www.crunchbase.com/organization/core-loop-games,"Gaming, MMO Games, Video Games","Oakland, California, United States",Core Loop Games engages in  reimagining massively multiplayer online game.,"36,277","San Francisco Bay Area, West Coast, Western US",,Active,2020-01-01,year,,,,,For Profit,https://coreloop.ai/,"Core Loop Games engages in building the next generation of MMOs. Gameplay and social cooperation are the core of its mission. They want to reimagine how players cooperate on a large scale together. The company was founded by veterans from MachineZone, GREE, and Funzio. It is VC backed and building a remote team of engineers and artists.",Gaming,2,"Shawn Seibert, Vincenzo Alagna",1-10,2,Early Stage Venture,14400001,USD,14400001,14400001,USD,14400001,"Andreessen Horowitz, 1Up Ventures, Galaxy Digital, Dune Ventures, Sisu Game Ventures",1,6,,Private,,,,,,
