Organization Name,Organization Name URL,Industries,Headquarters Location,Description,CB Rank (Company),Headquarters Regions,Estimated Revenue Range,Operating Status,Founded Date,Founded Date Precision,Exit Date,Exit Date Precision,Closed Date,Closed Date Precision,Company Type,Website,Full Description,Industry Groups,Number of Founders,Founders,Number of Employees,Number of Funding Rounds,Funding Status,Total Equity Funding Amount,Total Equity Funding Amount Currency,Total Equity Funding Amount Currency (in USD),Total Funding Amount,Total Funding Amount Currency,Total Funding Amount Currency (in USD),Top 5 Investors,Number of Lead Investors,Number of Investors,Number of Acquisitions,IPO Status,IPO Date,Delisted Date,Delisted Date Precision,Stock Symbol,Stock Symbol URL,Stock Exchange
Delgado Travel,https://www.crunchbase.com/organization/delgado-travel,"Shipping, Travel, Travel Agency","Jackson Heights, New York, United States","Delgado Travel is a travel agency that provides money transfers, currency exchange, and international call services.","439,000","Greater New York Area, East Coast, Northeastern US",$10M to $50M,Active,1973-01-01,year,,,,,For Profit,https://www.delgadotravelusa.com,"Delgado Travel provides money transfers, currency exchange, travel agencies, international calls, prepaid minutes, packages and letters to Ecuador.","Transportation, Travel and Tourism",,,51-100,,,,,,,,,,,,,Private,,,,,,
LittleLane,https://www.crunchbase.com/organization/littlelane,"Communities, E-Commerce, Education, Internet, Parenting, Subscription Service","San Rafael, California, United States",LittleLane gives parents access to the best local kids activities. Families can explore a variety of new options seamlessly with LittlePass.,"439,002","San Francisco Bay Area, West Coast, Western US",$1M to $10M,Active,2014-01-01,year,,,,,For Profit,http://littlelane.com/,LittleLane is an online platform that provides parents with access to kids’ activities in their local area.,"Commerce and Shopping, Community and Lifestyle, Education, Internet Services, Other",3,"Brooke Thomas, Maren Thomas Bannon, Mark Thomas",1-10,2,Seed,,USD,,,USD,,MergeLane,,1,,Private,,,,,,
"Speed Networking Solutions, Inc.",https://www.crunchbase.com/organization/speednetworking-com,"Event Management, Events, Meeting Software, Professional Networking, SaaS, Software","Chicago, Illinois, United States","Corporate and Professional Networking, SaaS, Event Technology, Video Conferencing, Virtual Networking, Referral Networking","439,002","Greater Chicago Area, Great Lakes, Midwestern US",$1M to $10M,Active,2012-01-01,year,,,,,For Profit,https://speednetworking.com,"Speed Networking offers an in-person, virtual and hybrid SaaS platform with proven algorithms to help business professionals around the world expand their professional network with targeted, impactful connections through a series of one-on-one meetings within or as a standalone event.","Community and Lifestyle, Events, Media and Entertainment, Messaging and Telecommunications, Professional Services, Software",2,"Andrew Rachmiel, Michael Slater",1-10,1,Seed,,USD,,,USD,,,,,,Private,,,,,,
Money Link Financial Services,https://www.crunchbase.com/organization/money-link-financial-services,"Accounting, Bookkeeping and Payroll, Financial Services","Del Rio, Texas, United States","Money Link Financial Services provides bookkeeping services, Tax Preparation, Planning and Consulting.","439,005",Southern US,,Active,,,,,,,For Profit,http://delriofinancialplanner.com/,,"Financial Services, Professional Services",,,,,,,,,,,,,,,,Private,,,,,,
Melanie Casey Jewelry,https://www.crunchbase.com/organization/melanie-casey,Jewelry,"Andover, Massachusetts, United States","Melanie Casey creates diamond engagement rings, wedding bands, and other fine jewelry designs.","439,006","Greater Boston Area, East Coast, New England",$10M to $50M,Active,2020-01-01,day,,,,,For Profit,http://www.melaniecasey.com,"Melanie Casey is a professional jewelry artist, designer, and goldsmith. Our team is headquartered in Andover, Massachusetts, and we sell our designs worldwide through www.melaniecasey.com. We manufacture and sell directly to clients, without a middleman or retail markups.  Our focus is on quality, design, and social responsibility above all else.   Melanie’s designs are delicate and feminine, showcasing sparkling diamonds and 14k gold settings.  Our signature light and airy style can seen throughout the collection.  When designing an engagement ring, Melanie focuses on showcasing the diamond first and minimizing the distracting look of the setting.  Every element is intentional and designed thoughtfully.   Clients have described our pieces as ""the real deal"" and ""a true find in an industry that is filled with the same old stuff"".  To maintain the integrity of our collection, we only release pieces we deeply believe in and love.  Trending styles are not a focus because we want clients to love their engagement ring for 100 years and be proud to pass it down as an heirloom.",Consumer Goods,1,Melanie Casey,51-100,,,,,,,,,,,,,Private,,,,,,
Tetra Marketing,https://www.crunchbase.com/organization/tetra-marketing,"Advertising, Email Marketing","Brooklyn, New York, United States",Tetra Marketing is an independent email marketing agency specializing in performance-driven email and SMS solutions.,"439,010","Greater New York Area, East Coast, Northeastern US",,Active,2016-01-01,year,2022-06-01,day,,,For Profit,https://www.gotetra.co,Tetra Marketing is an independent email marketing agency specializing in performance-driven email and SMS solutions.,"Advertising, Sales and Marketing",,,1-10,,M&A,,,,,,,,,,,Private,,,,,,
Buildingi,https://www.crunchbase.com/organization/buildingi,Information Technology,"Bellevue, Washington, United States",Buildingi is an information technology company that offers content management and SharePoint solutions.,"439,011","Greater Seattle Area, West Coast, Western US",$10M to $50M,Active,1994-01-01,year,2022-01-05,day,,,For Profit,http://buildingi.com,Buildingi provides space utilization data management and Computer-Aided Design (CAD) services.,Information Technology,2,"Bill Nolan, Darren Edgerly",101-250,,M&A,,,,,,,,,,,Private,,,,,,
Bluesalve Partners,https://www.crunchbase.com/organization/bluesalve-partners,"Advice, Consumer Electronics","Ashburn, Virginia, United States","Bluesalve Partners is a global consulting firm focusing on consumer tech, IoT, and consumer goods.","439,015","Washington DC Metro Area, East Coast, Southern US",,Active,2009-01-01,year,,,,,For Profit,https://bluesalve.com/,"Bluesalve Partners is a global consultancy with a core focus on Consumer Technology, Consumer #IoT, and Consumer Goods. They bring together some of the most experienced minds in the industry to help you to strengthen and developed your business.","Consumer Electronics, Hardware, Media and Entertainment",,,11-50,,,,,,,,,,,,,Private,,,,,,
CHILD,https://www.crunchbase.com/organization/child-988f,"Children, Non Profit, Therapeutics","Renton, Washington, United States",CHILD is a non-profit organization that provides school-based therapy services for students.,"439,016","Greater Seattle Area, West Coast, Western US",$1M to $10M,Active,1977-01-01,year,,,,,Non-profit,https://www.childnow.org,,"Community and Lifestyle, Health Care, Other, Social Impact",,,101-250,,,,,,,,,,,,,Private,,,,,,
Vozior,https://www.crunchbase.com/organization/vozior,"Electronics, Hardware, Software","Wilmington, Delaware, United States","Vozior is focused on creating innovative technologies, products, and services with the utmost quality for a better future.","439,018","Greater Philadelphia Area, East Coast, Southern US",,Active,2023-07-05,day,,,,,For Profit,https://www.vozior.com/,"Vozior is committed to innovating and making technology more accessible to everyone. As our name implies, giving a voice to the user is one of our main priorities to establish a long-lasting relationship of trust, transparency and proximity. Our mission is to provide new and innovative technologies, products, and services with the utmost quality, to help individuals and companies achieve their best selves. For more information about Vozior, such as statements, policies, and support, visit our website.","Consumer Electronics, Hardware, Software",1,André Gonçalves,1-10,,,,,,,,,,,,,Private,,,,,,
Matcha,https://www.crunchbase.com/organization/matcha-llc,"Accounting, Financial Services, FinTech, Information Technology, Internet, Mobile, Software","Los Altos, California, United States",Disciplined Full-Stack Financial Management for Tech Startups,"439,019","San Francisco Bay Area, Silicon Valley, West Coast",,Active,2022-01-01,month,,,,,For Profit,http://www.matchacfo.com,,"Financial Services, Information Technology, Internet Services, Mobile, Professional Services, Software",2,"James Gowers, Jen Nee Tang",1-10,,,,,,,,,,,,,Private,,,,,,
Omega ATC,https://www.crunchbase.com/organization/omega-atc,"Compliance, Cyber Security, Information Technology, Network Security, Risk Management","Chesterfield, Missouri, United States","Omega ATC provides managed security, data security, PCI compliance, risk assessment, intrusion prevention and data discovery solutions.","439,020",Midwestern US,$1M to $10M,Active,1991-01-01,year,,,,,For Profit,https://www.omegasecure.com/,,"Information Technology, Privacy and Security, Professional Services",,,1-10,,,,,,,,,,,,,Private,,,,,,
Global Roofing Group,https://www.crunchbase.com/organization/global-roofing-group,"Commercial, Construction, Consulting, Residential","Phoenix, Arizona, United States","Global Roofing Group is a contractor that provides roof maintenance, inspections, consulting, emergency response, and repair services.","439,031","Greater Phoenix Area, Western US",$50M to $100M,Active,1971-01-01,year,,,,,For Profit,https://www.globalroofinggroup.com/,,"Other, Professional Services, Real Estate",,,501-1000,,,,,,,,,,,,,Private,,,,,,
Foothold Labs,https://www.crunchbase.com/organization/foothold-labs,,"Olathe, Kansas, United States",Foothold Labs has developed an artificial intelligence enabled electrochemical biosensor based rapid diagnostic platform.,"439,032",Midwestern US,,Active,2017-10-01,day,,,,,For Profit,http://www.footholdlabs.com/,,,1,Sean McIntosh,1-10,,,,,,,,,,,,,Private,,,,,,
Power Equipment Company,https://www.crunchbase.com/organization/power-equipment-company-4399,"Construction, Industrial, Mining, Rental","Knoxville, Tennessee, United States","Power Equipment Company rents, supplies, and leases heavily loaded, general, and light excavators for the construction industry.","439,033",Southern US,$100M to $500M,Active,1946-01-01,year,,,,,For Profit,https://powerequipco.com,,"Commerce and Shopping, Manufacturing, Natural Resources, Real Estate",,,501-1000,,,,,,,,,,,,,Private,,,,,,
"Deploy HR, Inc.",https://www.crunchbase.com/organization/deploy-hr-inc,Consulting,"Pleasanton, California, United States",Deploy HR is a staffing and recruiting company specializing in consultancy and risk management services.,"439,033","San Francisco Bay Area, West Coast, Western US",,Active,2011-01-01,year,,,,,For Profit,http://deployhr.com,,Professional Services,,,1001-5000,,,,,,,,,,,,,Private,,,,,,
TrustE,https://www.crunchbase.com/organization/truste-7bd9,"Consulting, Risk Management, Software, Web Development","San Francisco, California, United States","TrustE is a software company specializing in compliance, risk management, and integrated technology solutions.","439,034","San Francisco Bay Area, West Coast, Western US",$10M to $50M,Active,1997-01-01,year,,,,,For Profit,https://truste.com,"TrustE is a software company that provides integrated technology, consulting, and certification solutions with compliance and risk management. The company has developed a platform that combines deep privacy expertise with proven methodologies, backed up by seven years of operating experience across a variety of industries and use cases. Such expertise and proven methodologies have been continuously enhanced through thousands of customer engagements at TrustArc. This platform is based on the SaaS-based Data Privacy Management Platform, which provides great tools that are simple and effective - and is backed by over five years of large-scale operation experience across dozens of industries and client use cases.","Professional Services, Software",,,11-50,,,,,,,,,,,,,Private,,,,,,
AVS Underwriting,https://www.crunchbase.com/organization/avs-underwriting,"Advice, Insurance, Life Science, Market Research","Kennesaw, Georgia, United States",AVS is a pioneer in the development and promotion of improved methodologies and techniques for determining a life expectancy.,"439,035","Greater Atlanta Area, East Coast, Southern US",$1M to $10M,Active,1994-01-01,year,,,,,For Profit,http://avsgrp.com," It provides mortality profiles; life expectancy evaluations services to brokers and funding companies. The company offers insurance underwriting services. AVS Underwriting, LLC was founded in 1994 and is based in Kennesaw, Georgia.The headquarters of the AVS Group is located in Kennesaw GA with satellite offices in Atlanta (Buckhead) and Fayetteville GA and employs physicians, nurses, medical underwriters and support staff. They pride theirselves on staying attuned to the needs of their clients in today’s sophisticated marketplace. ","Biotechnology, Data and Analytics, Design, Financial Services, Media and Entertainment, Science and Engineering",,,11-50,,,,,,,,,,,,,Private,,,,,,
WindCom (Wind Composites Service Group),https://www.crunchbase.com/organization/windcom-wind-composites-service-group,"Energy, Renewable Energy","Houston, Texas, United States",WindCom is a renewables & environment company that provides maintenance and repairs on wind blades.,"439,035","Greater Houston Area, Southern US",$10M to $50M,Active,2006-01-01,year,,,,,For Profit,http://windcomservices.com,,"Energy, Sustainability",,,101-250,,,,,,,,,,,,,Private,,,,,,
Abbott Furnace,https://www.crunchbase.com/organization/abbott-furnace,"Industrial, Industrial Manufacturing, Manufacturing","Bradford, Pennsylvania, United States","Abbott Furnace is a manufacturer that offers muffles, support tubes, flow meters, heating elements, generators and maintenance services.","439,038","Great Lakes, Northeastern US",$10M to $50M,Active,1982-01-01,year,,,,,For Profit,https://abbottfurnace.com/,,Manufacturing,,,101-250,,,,,,,,,,,,,Private,,,,,,
Citadels MC,https://www.crunchbase.com/organization/citadels-mc,,"Texas, South Carolina, United States","Citadels MC is MC club comprising active and retired members of law enforcement, military, first responders, and civilian MC enthusiasts.","439,039","East Coast, Southern US",,Active,2022-06-05,day,,,,,Non-profit,https://citadelsmc.com/,"Citadels MC is an exclusive motorcycle club catering to dedicated and passionate riders who share a common bond. Our club consists of a diverse community, welcoming both active and retired members from law enforcement, military, first responders, as well as civilian motorcycle enthusiasts. We provide a platform for like-minded individuals to come together, form lifelong friendships, and engage in the exhilarating world of motorcycles. At Citadels MC, we understand the unique experiences and camaraderie that arise from serving in law enforcement, the military, and as first responders. We honor the dedication and sacrifice of our members, and our club serves as a place where they can find support, understanding, and a shared passion for motorcycles. Our club is not limited to professionals in uniform; we also embrace civilian motorcycle enthusiasts who possess a deep appreciation for the open road, two-wheeled machines, and the sense of freedom that comes with riding. Whether you are a seasoned rider or a novice, we welcome individuals from all walks of life who share a common love for motorcycles. As a member of Citadels MC, you gain access to a vibrant and active community that organizes regular rides, events, and gatherings. These experiences allow our members to forge strong bonds, exchange stories, and create memories that will last a lifetime. Our club fosters a sense of unity and belonging, providing a supportive network where riders can connect, share knowledge, and contribute to the broader motorcycle community. Join us today and become a part of a tight-knit community where friendship, adventure, and the love of motorcycles unite. Ride with purpose and ride with pride as a member of Citadels MC.",,,,11-50,,,,,,,,,,,,,Private,,,,,,
Globbing,https://www.crunchbase.com/organization/globbing,"E-Commerce, Retail, Shopping","Claymont, Delaware, United States",Globbing is an online shopping company.,"439,039","Greater Philadelphia Area, East Coast, Southern US",,Active,2014-01-01,day,,,,,For Profit,https://www.globbing.com/,,Commerce and Shopping,2,"Davit Harutyunyan, Vahe Ghazaryan",51-100,,,,,,,,,,,,,Private,,,,,,
Fresh Patch,https://www.crunchbase.com/organization/fresh-patch,E-Commerce,"Camarillo, California, United States","They say nature knows best! As its name implies, a real piece of plush, green grass is much more conducive for happy Fifis and Fidos to do t","439,040","Greater Los Angeles Area, West Coast, Western US",$1M to $10M,Active,2010-04-13,day,,,,,For Profit,http://www.freshpatch.com,"They say nature knows best! As its name implies, a real piece of plush, green grass is much more conducive for happy Fifis and Fidos to do their thing.",Commerce and Shopping,1,Andrew Feld,1-10,,,,,,,,,,,,,Private,,,,,,
Wood Fiber Group,https://www.crunchbase.com/organization/wood-fiber-group,Wood Processing,"Fitchburg, Massachusetts, United States","Wood Fiber Group provider of cutting tools, consumable supplies and tool maintenance equipment for the North American sawmill market.","439,043","East Coast, New England, Northeastern US",,Active,,,2021-11-08,day,,,For Profit,https://woodfibergroup.com/,"Wood Fiber Group provider of cutting tools, consumable supplies and tool maintenance equipment for the North American sawmill market and other wood fiber processing market segments.",Manufacturing,,,,,M&A,,,,,,,,,,,Private,,,,,,
Apple Rush Company,https://www.crunchbase.com/organization/apple-rush-company-inc,Food and Beverage,"Yorba Linda, California, United States",Apple Rush Company is a food & beverage company that provides a blend of pure apple juice with natural flavors with no added sugar.,"439,045","Greater Los Angeles Area, West Coast, Western US",,Active,1988-01-01,day,2007-11-30,day,,,For Profit,https://applerush.com/,Apple Rush Company is a food & beverage company that provides a blend of pure apple juice with natural flavors with no added sugar.,Food and Beverage,,,1-10,,IPO,,,,,,,,,,2,Public,2007-11-30,,,APRU,https://www.crunchbase.com/ipo/apple-rush-company-inc-ipo--3d6c2f28,OTCQB
ScaleMonk,https://www.crunchbase.com/organization/scalemonk,"Advertising, Internet","Palo Alto, California, United States",ScaleMonk helps mobile-first companies grow their businesses by finding users that want their product,"439,048","San Francisco Bay Area, Silicon Valley, West Coast",,Active,2019-07-01,month,,,,,For Profit,https://www.scalemonk.com,"ScaleMonk helps mobile-first companies scale distribution while maintaining a target return. By collecting post-install data from its clients, ScaleMonk is able to optimize in real-time the ad spend that goes to different campaigns across hundreds of mobile advertising channels.","Advertising, Internet Services, Sales and Marketing",2,"Doug Loyer, Henrique Vaz",11-50,1,Early Stage Venture,,USD,,,USD,,Bessemer Venture Partners,,1,,Private,,,,,,
Meridian Health Services,https://www.crunchbase.com/organization/meridian-health-services,"Health Care, Hospital, Medical, Mental Health, Non Profit, Psychology","Muncie, Indiana, United States","Meridian Health Services is an organization that specializes in providing physical health, mental wellness and social well-being services.","439,049","Great Lakes, Midwestern US",$50M to $100M,Active,1976-01-01,year,,,,,Non-profit,https://www.meridianhs.org/,,"Health Care, Other, Social Impact",,,251-500,,,,,,,,,,,,,Private,,,,,,
Clore Automotive,https://www.crunchbase.com/organization/clore-automotive,"Automotive, Battery, Manufacturing, Retail","Lenexa, Kansas, United States","Clore Automotive designs and manufactures automotive equipment like jump starters, battery chargers and power inverters.","439,051",Midwestern US,$10M to $50M,Active,2001-01-01,year,,,,,For Profit,https://cloreautomotive.com,,"Commerce and Shopping, Energy, Manufacturing, Transportation",1,Jim Chasm,101-250,,,,,,,,,,,,,Private,,,,,,
MERRY JANE,https://www.crunchbase.com/organization/merry-jane,"Cannabis, Content Creators, Lifestyle, Media and Entertainment, News, Video","Los Angeles, California, United States","MERRY JANE is the definitive cannabis resource on culture, news, video, food and style dedicated to expressing a new cannabis mentality.","439,052","Greater Los Angeles Area, West Coast, Western US",Less than $1M,Active,2015-01-01,year,,,,,For Profit,https://merryjane.com,"MERRY JANE is a lifestyle media brand with cannabis at the core. Loaded with both video content and editorial content, the MERRYJANE.com will serve as an information hub for everyone interested in cannabis.","Community and Lifestyle, Content and Publishing, Food and Beverage, Health Care, Media and Entertainment, Video",2,"Calvin Broadus, Ted Chung",11-50,3,Early Stage Venture,,USD,,,USD,,"Slow Ventures, Casa Verde Capital, Three Six Zero, Mark Gillespie",,4,,Private,,,,,,
RCN Technologies,https://www.crunchbase.com/organization/rcn-technologies-e688,"Commercial, Information Technology, Telecommunications","Knoxville, Tennessee, United States","RCN Technologies works to make sense of communications for commercial, public sector, and non-profit organizations.","439,053",Southern US,$1M to $10M,Active,2013-01-01,year,2022-03-01,day,,,For Profit,https://rcntechnologies.com/,"RCN Technologies is a full-service connectivity solutions provider with a team of 5G & LTE Enablement specialists helping customers stay connected from coast to coast. Their core solutions include fixed wireless service, wireless backup internet, managed data solutions, POTS line replacement, remote networking, rugged connected devices, out of band management, and private cellular networks.","Hardware, Information Technology, Other",2,"Geoff Yearack, Jennifer Yearack",11-50,,M&A,,,,,,,,,,,Private,,,,,,
Earthrise,https://www.crunchbase.com/organization/earthrise-nutritionals,"E-Commerce, Food and Beverage","Irvine, California, United States",Earthrise grows and sells spirulina products.,"439,054","Greater Los Angeles Area, West Coast, Western US",$10M to $50M,Active,1976-01-01,year,,,,,For Profit,http://earthrise.com,Earthrise is the spirulina farm. Spirulina is a blue-green algae that is one of the most nutrient-packed superfoods on earth. this environmentally sustainable algae has been a nutritious dietary supplement. This contains phytonutrients that have strong antioxidant and anti-inflammatory activities. These antioxidants support cellular health by protecting cells from the damaging effects of reactive oxygen radicals.,"Commerce and Shopping, Food and Beverage",,,11-50,,,,,,,,,,,,,Private,,,,,,
La Bodega,https://www.crunchbase.com/organization/la-bodega-9f9d,"Commercial, Food and Beverage, Wholesale","Chicago, Illinois, United States",La Bodega is a wholesale distributor of canned goods and packaged foods.,"439,057","Greater Chicago Area, Great Lakes, Midwestern US",$1M to $10M,Active,1987-01-01,year,,,,,For Profit,https://labodegaltd.com,"La Bodega offers imported products. They provide products to all distributors and retailers. They provide canned goods and packaged foods. They address inquiries through phone, email, and online applications.","Commerce and Shopping, Food and Beverage, Other",,,11-50,,,,,,,,,,,,,Private,,,,,,
Parents as Teachers National Center,https://www.crunchbase.com/organization/parents-as-teachers-national-center,"Children, Communities, Education, Family, Non Profit, Training","St Louis, Missouri, United States",Parents as Teachers National Center is an education management company.,"439,057",Midwestern US,,Active,1984-01-01,year,,,,,Non-profit,https://parentsasteachers.org/,"Parents as Teachers National Center provide an evidence-based, research-informed home visiting model. They help communities promote optimal early development, learning, and the health of young children by supporting and engaging their parents and caregivers.","Community and Lifestyle, Education, Other, Social Impact",,,101-250,1,,,,,,USD,,Enterprise Holdings,1,1,,Private,,,,,,
Xcutives,https://www.crunchbase.com/organization/xcutives,"Professional Services, Recruiting, Staffing Agency","Princeton, New Jersey, United States",Xcutives is a staffing agency that specialises in international talent services.,"439,059","East Coast, Northeastern US",,Active,2017-01-01,year,,,,,For Profit,https://www.xcutives.com,,"Administrative Services, Other, Professional Services",,,11-50,,,,,,,,,,,,,Private,,,,,,
WKND Skateboards,https://www.crunchbase.com/organization/wknd-skateboards,"Apparel, E-Commerce, Gift Card, Retail, Textiles","Glendale, California, United States","WKND Skateboards is an online store that offers a wide range of skateboards, decks, apparel, headwear. gift cards and other accessories.","439,061","Greater Los Angeles Area, West Coast, Western US",Less than $1M,Active,,,,,,,For Profit,https://shop.wkndbrand.com/,,"Clothing and Apparel, Commerce and Shopping, Financial Services, Manufacturing",,,1-10,,,,,,,,,,,,,Private,,,,,,
