Whole Travel,https://www.crunchbase.com/organization/whole-travel,"Search Engine, Travel","Palo Alto, California, United States",Whole Travel is a travel site that provides travelers with ratings on eco-friendly hotels.,"774,267","San Francisco Bay Area, Silicon Valley, West Coast",$1M to $10M,Active,2006-09-01,day,,,,,For Profit,http://www.wholetravel.com,"Whole Travel is a travel site that encourages eco-friendly tourism by aiming to rate hotels by how ""green"" they are. World Travel also changes the way people search for travel locations by searching for activities rather than location.","Internet Services, Travel and Tourism",,,11-50,,,,,,,,,,,,,Private,,,,,,
Vempathy,https://www.crunchbase.com/organization/vempathy,"Artificial Intelligence (AI), Consumer Research, Market Research, Product Research, Software, UX Design","Boston, Massachusetts, United States",Vempathy provides next generation customer experience research software to show companies how their customers feel.,"774,270","Greater Boston Area, East Coast, New England",Less than $1M,Active,2017-06-01,day,,,,,For Profit,http://vempathy.com,"Vempathy provides next generation customer experience research software to show companies how their customers feel using a webcam and artificial intelligence analysis. Vempathy’s proprietary emotion detection software analyzes over 4,200 data points every minute to provide valuable insights that help you improve your customer experience.","Artificial Intelligence (AI), Data and Analytics, Design, Science and Engineering, Software",1,Paul Cheek,1-10,,,,,,,,,,,,,Private,,,,,,
Premier Physical Therapy,https://www.crunchbase.com/organization/premier-physical-therapy-c50c,"Health Care, Medical, Rehabilitation, Therapeutics, Wellness","Chicago, Illinois, United States","Premier Physical Therapy is a physical therapy clinic that provides physical therapy, neuropathy treatment, and vestibular rehab services.","774,274","Greater Chicago Area, Great Lakes, Midwestern US",$10M to $50M,Active,2000-01-01,year,,,,,For Profit,https://www.premierphysicaltherapy.com,,Health Care,,,11-50,,,,,,,,,,,,,Private,,,,,,
Forensis,https://www.crunchbase.com/organization/forensis,"Document Management, Software","Miami, Florida, United States",Document Scanning E-Discovery Hosting,"774,275","Greater Miami Area, East Coast, Southern US",$10M to $50M,Active,2003-01-06,day,,,,,For Profit,http://www.forensis.com,"ForensiS is a leading provider of digital document management services and applications, specializing in offering a multitude of industries advanced options in document scanning services, E-Discovery services and document management applications.","Information Technology, Software",,,11-50,,,,,,,,,,,,,Private,,,,,,
Active Security Co.,https://www.crunchbase.com/organization/active-security-co,"Electronics, Security, Smart Home","St. Petersburg, Florida, United States","Active Security Co. installs and services residential and commercial fire alarms, access control, video monitoring, and home automation.","774,276","Tampa Bay Area, East Coast, Southern US",$1M to $10M,Active,1987-01-01,year,,,,,For Profit,https://activesecurityco.com,,"Consumer Electronics, Hardware, Privacy and Security, Real Estate",,,1-10,,,,,,,,,,,,,Private,,,,,,
Friedman & Saiyed,https://www.crunchbase.com/organization/friedman-saiyed,"Accounting, Consulting, Financial Services","Baltimore, Maryland, United States","Friedman & Saiyed specializes in accounting, taxation, compilations, payroll, write-up, attestation, bookkeeping and consulting services.","774,280","Greater Baltimore-Maryland Area, East Coast, Southern US",Less than $1M,Active,2011-01-01,year,,,,,For Profit,https://fascpas.com/,,"Financial Services, Professional Services",,,1-10,,,,,,,,,,,,,Private,,,,,,
Ergobaby Europe GmbH,https://www.crunchbase.com/organization/ergobaby-europe-gmbh,"Consumer Goods, Internet, Retail, Textiles","Los Angeles, California, United States","Ergobaby building global communities of confident parents with innovative, ergonomic baby products that enable and encourage bonding.","774,281","Greater Los Angeles Area, West Coast, Western US",$1M to $10M,Active,2003-01-01,year,,,,,For Profit,https://ergobaby.eu,"Ergobaby to make innovative baby products that support bonding between parents and their children.looking for the next Ergonaut… who believes in the benefits of babywearing, who is passionate about supporting new parents and their communities, who takes responsibility for their part in making our company","Commerce and Shopping, Consumer Goods, Internet Services, Manufacturing",1,Karin Frost,11-50,,,,,,,,,,,,,Private,,,,,,
Eustis Mortgage,https://www.crunchbase.com/organization/eustis-mortgage,"Crowdfunding, Financial Services, Venture Capital","La, California, United States",Eustis Mortgage is a financial services firm based in New Orleans.,"774,282","West Coast, Western US",$10M to $50M,Active,1956-01-01,day,,,,,For Profit,http://eustismortgage.com,,"Financial Services, Lending and Investments",,,101-250,,,,,,,,,,,,,Private,,,,,,
Braintree Properties,https://www.crunchbase.com/organization/braintree-properties,"Architecture, Construction, Interior Design, Real Estate, Real Estate Investment","Grapevine, Texas, United States","Braintree Properties specializes in real estate and investment solutions for the education, multi-family housing, and hospitality markets.","774,285","Dallas/Fort Worth Metroplex, Southern US",$1M to $10M,Active,2019-01-01,year,,,,,For Profit,https://btree-prop.com,,"Design, Financial Services, Real Estate",,,11-50,,,,,,,,,,,,,Private,,,,,,
ETA International,https://www.crunchbase.com/organization/eta-international,"Association, Consumer Electronics, Corporate Training, Education, Information Technology, Non Profit, Training, Vocational Education","Greencastle, Indiana, United States","ETA is a not-for-profit, independent technology association founded in 1978. ","774,287","Great Lakes, Midwestern US",,Active,1978-01-01,year,,,,,Non-profit,http://www.eta-i.org/,"ETA International represents electronics professionals with over 80 industry-recognized technical certifications that align with international standards & industry best practices, military & business initiatives, along with career & technical education curriculum. Developed by industry experts, ETA certifications are vendor-neutral third party assessments testing both knowledge and hands-on skills.","Consumer Electronics, Education, Hardware, Information Technology, Other, Social Impact",,,,,,,,,,,,,,,,Private,,,,,,
Athens Janitor Supply,https://www.crunchbase.com/organization/athens-janitor-supply,"Cleaning Products, E-Commerce, Retail, Small and Medium Businesses","Athens, Georgia, United States",Athens Janitor Supply is an e-commerce and supplier company of janitorial products.,"774,289","East Coast, Southern US",$1M to $10M,Active,1960-01-01,year,,,,,For Profit,https://ajs-inc.synergyomni.net,,"Commerce and Shopping, Consumer Goods, Other",2,"Agnes Davis, Charles L. Davis",,,,,,,,,,,,,,Private,,,,,,
Greensboro Science Center,https://www.crunchbase.com/organization/greensboro-science-center,"Museums and Historical Sites, Non Profit","Greensboro, North Carolina, United States",The Greensboro Science Center is a family destination in North Carolina offering multiple attractions in one destination.,"774,291","East Coast, Southern US",,Active,1957-01-01,day,,,,,Non-profit,https://www.greensboroscience.org/,,"Other, Social Impact, Travel and Tourism",,,101-250,,,,,,,,,,,,,Private,,,,,,
Gateway Development Partners,https://www.crunchbase.com/organization/gateway-development-partners-inc,Real Estate,"Chicago, Illinois, United States",Gateway Development Partners is an Illinois based commercial and residential real estate development firm.,"774,296","Greater Chicago Area, Great Lakes, Midwestern US",$1M to $10M,Active,2010-02-01,day,,,,,For Profit,http://www.gatewaydevelopmentpartners.com,,Real Estate,,,1-10,,,,,,,,,,,,,Private,,,,,,
CRI Digital,https://www.crunchbase.com/organization/cri-digital,"Consulting, Information Technology, Security, VoIP","Columbus, Ohio, United States","CRI Digital is an IT supplier that provides VoIP, security systems, printers, laser devices, mailing solutions and consulting services.","774,300","Great Lakes, Midwestern US",,Active,1991-01-01,year,,,,,For Profit,https://www.cridigital.net/,,"Information Technology, Internet Services, Messaging and Telecommunications, Privacy and Security, Professional Services",,,1-10,,,,,,,,,,,,,Private,,,,,,
Dothan Pipe and Supply,https://www.crunchbase.com/organization/dothan-pipe-and-supply,"Consumer Goods, Industrial, Supply Chain Management","Dothan, Alabama, United States","Dothan Pipe and Supply is an industrial supplier of pipe, valves, and fittings.","774,303",Southern US,$1M to $10M,Active,1992-01-01,year,,,,,For Profit,http://www.dothanpipeandsupply.com/,"Dothan Pipe and Supply is an industrial supplier of pipe, valves, and fittings. The company was established in 1992 and is based in Dothan, Alabama.","Consumer Goods, Manufacturing, Transportation",,,1-10,1,,,,,,USD,,Advantage Capital,,1,,Private,,,,,,
Whitman Hospital and Medical Clinics,https://www.crunchbase.com/organization/whitman-hospital-and-medical-clinics,"Health Care, Mental Health","Colfax, Washington, United States",Whitman Hospital and Medical Clinics is a hospital & healthcare firm that offers both physical & mental healthcare services.,"774,306","West Coast, Western US",,Active,1954-01-01,year,,,,,For Profit,https://www.whmc.org,,Health Care,,,101-250,,,,,,,,,,,,,Private,,,,,,
Wilson Law,https://www.crunchbase.com/organization/wilson-law-ccc4,"Advice, Legal, Professional Services","Raleigh, North Carolina, United States",Wilson Law is a law firm that provides advice and legal services.,"774,309","Research Triangle, East Coast, Southern US",$10M to $50M,Active,2010-01-01,year,,,,,For Profit,https://www.wilsonlawpa.com,,"Media and Entertainment, Other, Professional Services",1,Kimberly Wilson,51-100,,,,,,,,,,,,,Private,,,,,,
Bresson Associates,https://www.crunchbase.com/organization/bresson-associates,"Electronics, Industrial, Manufacturing","Baltimore, Maryland, United States",Bresson Associates is an electronic manufacturing company.,"774,310","Greater Baltimore-Maryland Area, East Coast, Southern US",,Active,,,,,,,For Profit,http://www.bressonassociates.com,"Bresson Associates assemble power distribution units, cable assemblies, and thermal management units. They provides full cabinet integration configured to customer specification.","Consumer Electronics, Hardware, Manufacturing",,,1-10,,,,,,,,,,,,,Private,,,,,,
Bemsco,https://www.crunchbase.com/organization/bemsco,"Aerospace, Machinery Manufacturing, Manufacturing, Product Design","Salt Lake City, Utah, United States",Bemsco manufactures aviation products for aerospace and commercial industries.,"774,310",Western US,$1M to $10M,Active,1967-01-01,year,,,,,For Profit,https://www.bemsco.com,"Bemsco produces complex machined components and electro-mechanical assemblies for the aerospace and commercial industries. They are dedicated and committed to meeting the aerospace industry exacting standards in the manufacture of a wide range of aircraft, commercial, OEM, and ground related accessories. The materials used in this manufacturing range from plastic laminates to cast and forged aircraft quality alloys, with assemblies ranging from two to three hundred components.","Design, Manufacturing, Science and Engineering",,,11-50,,,,,,,,,,,,,Private,,,,,,
Equipment Insurance International,https://www.crunchbase.com/organization/equipment-insurance-international,"Commercial Insurance, Financial Services, Insurance","Fayetteville, North Carolina, United States","Equipment Insurance International is an insurance firm that offers construction, landscaping, and farm equipment physical damage coverages.","774,311","East Coast, Southern US",$1M to $10M,Active,1984-01-01,month,,,,,For Profit,https://e-i-i.com/,,Financial Services,,,11-50,,,,,,,,,,,,,Private,,,,,,
DIY Retro Arcade,https://www.crunchbase.com/organization/diy-retro-arcade,"Consumer Goods, E-Commerce, Sales","Italy, Texas, United States","DIY Retro Arcade is an e-commerce company for arcade parts, game boards power supplies joysticks, and buttons.","774,312","Dallas/Fort Worth Metroplex, Southern US",,Active,,,,,,,For Profit,https://www.diyretroarcade.com,,"Commerce and Shopping, Consumer Goods, Sales and Marketing",,,,,,,,,,,,,,,,Private,,,,,,
Linguistic Society of America,https://www.crunchbase.com/organization/linguistic-society-of-america,"Education, Natural Language Processing, Neuroscience, Psychology","Washington, District of Columbia, United States",The Linguistic Society of America is a learned society for the field of linguistics.,"774,313","Washington DC Metro Area, Southern US",$1M to $10M,Active,1924-12-28,day,,,,,For Profit,https://www.linguisticsociety.org/,The Linguistic Society of America (LSA) was founded in 1924 to advance the scientific study of language. LSA plays a critical role in supporting and disseminating linguistic scholarship both to professional linguists and to the general public.,"Artificial Intelligence (AI), Biotechnology, Data and Analytics, Education, Health Care, Science and Engineering, Software",,,251-500,,,,,,,,,,,,,Private,,,,,,
Numeridex,https://www.crunchbase.com/organization/numeridex,"Computer, Consumer Electronics, Consumer Goods, Hardware, Manufacturing, Software","Chicago, Illinois, United States","Numeridex manufactures and distributes labels- and barcode-related products, including printers, verifiers, scanners, and software.","774,313","Greater Chicago Area, Great Lakes, Midwestern US",$1M to $10M,Active,1967-01-01,year,,,,,For Profit,http://www.numeridex.com,,"Consumer Electronics, Consumer Goods, Hardware, Manufacturing, Software",,,11-50,,,,,,,,,,,,,Private,,,,,,
Carolina Furniture Works,https://www.crunchbase.com/organization/carolina-furniture-works,"Furniture, Manufacturing, Product Design","Sumter, South Carolina, United States",Carolina Furniture Works is a manufacturer of bedroom furniture.,"774,317","East Coast, Southern US",,Active,1946-01-01,year,,,,,For Profit,http://carolinafurnitureworks.com,,"Consumer Goods, Design, Manufacturing",,,1-10,,,,,,,,,,,,,Private,,,,,,
IDkey,https://www.crunchbase.com/organization/idkey,"Biometrics, Internet of Things, Network Security, NFC, Security","Palm Beach Gardens, Florida, United States","IDkey is the most complete solution for securely protecting logical and physical access to online systems, documents, files and facilities.","774,318","Greater Miami Area, East Coast, Southern US",Less than $1M,Active,2010-01-01,year,,,,,For Profit,http://www.idkey.com/,"IDkey is the most complete solution for securely protecting logical and physical access to online systems, documents, files and facilities. IDKEY’s patented biometric technology protects your digital world with the swipe of a finger. - The world’s first FIDO-Ready™ U2F/UAF biometric security key. - Patented 3D surface scan ultrasound technology for most advanced authentication. - Secure your Google accounts and on-line services that support FIDO U2F/UAF authentication. - IDKEY™ M Securely store passwords and files with 10GB of encrypted storage. - IDKEY M can be paired with IDKEY mobile and browser app via USB, Wi-Fi and Bluetooth&reg. - IDKEY is HID&reg SEOS™ M ready to provide secure access to homes and business. - IDKEY utilizes NFC technology for secure payment transactions.","Biotechnology, Data and Analytics, Hardware, Information Technology, Internet Services, Privacy and Security, Science and Engineering",,,1-10,,,,,,,,,,,,,Private,,,,,,
Medical Component Specialists,https://www.crunchbase.com/organization/medical-component-specialists,"Manufacturing, Medical, Medical Device","Bellingham, Massachusetts, United States",Medical Component Specialists is a manufacturer of medical drills and instruments for orthopedics and interventional applications.,"774,322","Greater Boston Area, East Coast, New England",,Active,2002-01-01,year,,,,,For Profit,https://www.medicalcomponentspecialists.com,"Medical Component Specialists is a company that manufactures components for multiple medical markets, such as orthopedics, minimally invasive surgery, and interventional therapies. They manufacture medical components like ortho-pins, mandrels, medical drills, and staples for orthopaedic and interventional applications.","Health Care, Manufacturing",,,51-100,,,,,,,,,,,,,Private,,,,,,
Good Sport,https://www.crunchbase.com/organization/good-sport,"Manufacturing, Sporting Goods","Miami Beach, Florida, United States",Good Sport is the sporting goods manufacturing industry.,"774,324","Greater Miami Area, East Coast, Southern US",,Active,2022-01-01,year,,,,,For Profit,https://playgoodsport.com,,"Commerce and Shopping, Manufacturing, Sports",,,1-10,,,,,,,,,,,,,Private,,,,,,
PKG BIZ.com,https://www.crunchbase.com/organization/pkg-biz-com,"E-Commerce, Manufacturing, Packaging Services, Supply Chain Management, Wholesale","Crystal Lake, Illinois, United States","PKG BIZ.com is a distribution company that supplies corrugated boxes, mailers, cushioning, poly packaging, and tape products.","774,327","Greater Chicago Area, Great Lakes, Midwestern US",$1M to $10M,Active,1992-01-01,year,,,,,For Profit,https://pkgbiz.com,,"Administrative Services, Commerce and Shopping, Manufacturing, Transportation",,,,,,,,,,,,,,,,Private,,,,,,
Kroeschell Inc.,https://www.crunchbase.com/organization/kroeschell-inc,"Computer, Consulting, Electronics, Information Technology, Legal","Arlington Heights, Illinois, United States",Kroeschell Inc. is a provider of mechanical and electrical engineering solutions and industrial support services for Fortune 500 companies.,"774,328","Greater Chicago Area, Great Lakes, Midwestern US",$10M to $50M,Active,1879-01-01,year,,,,,For Profit,http://kroeschell.com,,"Consumer Electronics, Hardware, Information Technology, Professional Services",,,251-500,,,,,,,,,,,,,Private,,,,,,
Blu Trumpet,https://www.crunchbase.com/organization/blu-trumpet,"Accounting, Advertising, iOS, Mobile Apps","New York, New York, United States",Blu Trumpet is a monetization and distribution platform for mobile apps company.,"774,329","Greater New York Area, East Coast, Northeastern US",$1M to $10M,Active,2011-01-01,year,,,,,For Profit,https://www.blutrumpet.com/,"Blu Trumpet helps developers get their apps heard.they are a monetization and distribution platform for mobile apps. they specialize in CPI (cost per install) advertising; publishers earn higher eCPMs and advertisers get the most out of their marketing dollars.Blu Trumpet was incubated in Hatch Labs, and is based in New York City and Toronto.","Advertising, Apps, Financial Services, Mobile, Platforms, Professional Services, Sales and Marketing, Software",2,"Karthik Ramakrishnan, Nina Sodhi",11-50,,,,,,,,,,,,,Private,,,,,,
Document Systems,https://www.crunchbase.com/organization/document-systems-b816,"Consulting, Content, Management Consulting","Washington, District of Columbia, United States",Document Systems provides enterprise content management consulting and system implementation services.,"774,337","Washington DC Metro Area, Southern US",$1M to $10M,Active,1988-01-01,year,,,,,For Profit,https://www.docsysinc.com,Document Systems provides consulting services. They provide enterprise content management consulting and system implementation services. They provide inquiries through online applications and phone calls.,"Media and Entertainment, Professional Services",,,11-50,,,,,,,,,,,,,Private,,,,,,
Raj Technologies,https://www.crunchbase.com/organization/raj-technologies,"Information Technology, Software","Plainview, New York, United States",Raj Technologies provides clients with information technology services and solutions.,"774,338","Greater New York Area, East Coast, Northeastern US",,Active,1986-01-01,year,,,,,For Profit,http://www.rajtechny.com,,"Information Technology, Software",,,,,,,,,,,,,,,,Private,,,,,,
Scopia Technologies,https://www.crunchbase.com/organization/scopia-technologies,"E-Commerce, Location Based Services, Search Engine, Software, Tourism, Travel","Bayside, California, United States",Scopia Technologies LLC specializes in multidimensional search for travel and tourism products and services. Our website is http://goscopia.,"774,339","West Coast, Western US",,Active,2010-06-01,day,,,,,For Profit,http://www.goscopia.com,"Scopia Technologies LLC specializes in multidimensional search for travel and tourism products and services. Our website is http://goscopia.com.  We're looking to raise capital to leverage our existing data structure and unique algorithms for the purpose of creating a multidimensional, cross-platform search experience for use by travel agents (B2B), third parties (B2B2C) and travelers (B2C).  The API and tools will offer the ability to search for travel and tourism products according to one's own logic and in collaboration with others. This process should on one hand considerably reduce search time for travelers and agents while enhancing revenues for third party websites.","Commerce and Shopping, Data and Analytics, Internet Services, Navigation and Mapping, Software, Travel and Tourism",2,"Jim Graziano, Ophir Ben-Yitschak",11-50,,,,,,,,,,,,,Private,,,,,,
Pegasus Maritime,https://www.crunchbase.com/organization/pegasus-maritime,"Consulting, Insurance, Logistics, Marine Transportation, Warehousing","New York, New York, United States","Pegasus Maritime is a logistics company that specializes in cargo, customs brokerage, warehousing, consulting and marine insurance services.","774,340","Greater New York Area, East Coast, Northeastern US",$50M to $100M,Active,2000-01-01,year,,,,,For Profit,https://www.pegasusmaritime.com,,"Financial Services, Professional Services, Transportation",,,101-250,,,,,,,,,,,,,Private,,,,,,
State Bank of Waterloo,https://www.crunchbase.com/organization/state-bank-of-waterloo,"Banking, Finance, Financial Services","Waterloo, Illinois, United States",State Bank of Waterloo is a banking & financial services firm that offers financial services including community banking services.,"774,341","Great Lakes, Midwestern US",,Active,1894-01-01,year,,,,,For Profit,https://www.sbw.bank/Contact-Us.aspx,,"Financial Services, Lending and Investments",,,11-50,,,,,,,,,,,,,Private,,,,,,
BigLever,https://www.crunchbase.com/organization/biglever,"Manufacturing, Software","Austin, Texas, United States",BigLever Software™ provides Feature-based Product Line Engineering (PLE) solutions across the engineering ecosystem.,"774,342",Southern US,$10M to $50M,Active,1999-01-01,year,,,,,For Profit,http://www.biglever.com/,"BigLever Software™ is the long-standing leader in the Product Line Engineering (PLE) field. BigLever's holistic onePLE™ solution delivers the leading-edge technology, proven methodology, business strategy and organizational change expertise needed to efficiently transition to and operate PLE practices. The company's state-of-the-art PLE methods and tools provide one unified, automated approach for feature-based variant management. This approach extends across the full lifecycle including engineering and operations disciplines; software, electrical, and mechanical domains; and tool ecosystem. BigLever's patented Gears™ solution dramatically simplifies the creation, evolution and maintenance of systems and software for a product line portfolio. The Gears Product Line Engineering Tool and Lifecycle Framework™ shifts the development focus from a multitude of products to a single production system capable of automatically producing all of the products in a portfolio. With Gears, engineering organizations can reduce development costs and bring new product line features and products to market faster, enabling the business to more reliably target and hit strategic market windows.","Manufacturing, Software",1,Charles Krueger,11-50,,,,,,,,,,,,,Private,,,,,,
Constantin Precision Instruments,https://www.crunchbase.com/organization/constantin-precision-instruments,"Machinery Manufacturing, Manufacturing, Product Design","Katy, Texas, United States","Constantin Precision Instruments is a manufacturer of machinery parts for the oilfield, semiconductor, and aerospace industries.","774,344","Greater Houston Area, Southern US",$1M to $10M,Active,1998-01-01,year,,,,,For Profit,https://www.cpiprecision.com,"Constantin Precision Instruments is a machine shop that manufactures components and mechanical assemblies to customer specifications. They offer machining operations. They provide machinery parts for oilfield, semiconductor, and aerospace industries.","Design, Manufacturing",,,11-50,,,,,,,,,,,,,Private,,,,,,
Da Vinci Medical,https://www.crunchbase.com/organization/da-vinci-medical,"Health Care, Medical, Therapeutics","Newport Beach, California, United States",Da Vinci Medical is a medical equipment supplier.,"774,349","Greater Los Angeles Area, West Coast, Western US",,Active,2014-01-01,year,,,,,For Profit,https://www.davincimedicalusa.com,"Da Vinci Medical is a biohacking solution and a wellness technology service. They provide a patented method that combines red light therapy, exercise with oxygen therapy, and magnetism (PEMF). Telephone and email contact used for inquiries.",Health Care,,,11-50,,,,,,,,,,,,,Private,,,,,,
