Executive Search Associates,https://www.crunchbase.com/organization/executive-search-associates,"Employment, Human Resources, Recruiting","Colorado Springs, Colorado, United States","Executive Search Associates is a recruitment firm that offers staffing, outsourced recruiting and succession planning services.","572,543",Western US,,Active,2009-01-01,year,,,,,For Profit,https://www.letmeshutmydoor.com/,,"Administrative Services, Professional Services",,,1-10,,,,,,,,,,,,,Private,,,,,,
FedResults,https://www.crunchbase.com/organization/fedresults,Consulting,"Herndon, Virginia, United States","FedResults works with companies entering/expanding in the Federal sector. Whether developing a complete business developlment program,","572,544","Washington DC Metro Area, East Coast, Southern US",$50M to $100M,Active,1997-03-25,day,,,,,For Profit,http://www.fedresults.com,"FedResults works with companies entering/expanding in the Federal sector.  Whether developing a complete business developlment program, obtaining a government contract or providing knowledge of agency opportunities, FedResults has a program to meet a company's federal revenue goals.  FedResults delivers through three business units: sales consulting, contract services and channel/resell.",Professional Services,,,251-500,,,,,,,,,,,,,Private,,,,,,
Ultramatics,https://www.crunchbase.com/organization/ultramatics,"Assistive Technology, Consulting, Health Care, Technical Support","Tampa, Florida, United States","Ultramatics provides and implements technical solutions in the fields of telecom, transportation, finance, and healthcare.","572,547","Tampa Bay Area, East Coast, Southern US",$1M to $10M,Active,2001-01-01,day,,,,,For Profit,http://www.ultramatics.com/,,"Health Care, Information Technology, Other, Professional Services",,,51-100,,,,,,,,,,,,,Private,,,,,,
RemTec International,https://www.crunchbase.com/organization/remtec-international,"Commercial, Environmental Consulting","Bowling Green, Ohio, United States",RemTec International provides products and services to mitigate or eliminate ozone depletion and/or global warming potential worldwide.,"572,547","Great Lakes, Midwestern US",,Active,1986-01-01,year,2012-08-07,day,,,For Profit,http://www.remtec.net/,"RemTec International is provides products and services to mitigate or eliminate ozone depletion and/or global warming potential worldwide. It offers fire protection services, including service to recharge and recertify fire suppression bottles; services to buy and sell halon and alternative agents; tank and valve recertification services; and recertified and painted cylinders. The company also provides services to buy and sell refrigerants; a buyback and recovery program that accepts used refrigerants in any condition; and an inventory consignment program with custom recycling and disposal services. ","Other, Professional Services",,,,,M&A,,,,,,,,,,,Private,,,,,,
ABIS Solutions,https://www.crunchbase.com/organization/abis-solutions,,"Owings Mills, Maryland, United States",ABIS Solutions is a telecommunications service company.,"572,548","Greater Baltimore-Maryland Area, East Coast, Southern US",,Active,2016-01-01,year,,,,,For Profit,https://abis-solutions.com/,,,,,,,,,,,,,,,,,,Private,,,,,,
TC Communications,https://www.crunchbase.com/organization/tc-communications,Telecommunications,"Irvine, California, United States",TC Communications design solutions to make life simpler in a complicated world. Focused on mission-critical communication products.,"572,549","Greater Los Angeles Area, West Coast, Western US",$1M to $10M,Active,1991-01-01,year,,,,,For Profit,http://www.tccomm.com/,,Hardware,,,101-250,,,,,,,,,,,,,Private,,,,,,
Alanis Holdings LLC,https://www.crunchbase.com/organization/demilo-alanis-llc,Cryptocurrency,"Middletown, Delaware, United States",Alanis Holdings is a modern parent company with limitless possibilities.,"572,552","Greater Philadelphia Area, East Coast, Southern US",,Active,2021-04-09,day,,,,,For Profit,https://www.alanis.holdings,"A modern parent company, with limitless possibilities.","Blockchain and Cryptocurrency, Financial Services, Payments, Software",1,Demilo Alanis,1-10,,,,,,,,,,,,,Private,,,,,,
Michigan Masonic Home,https://www.crunchbase.com/organization/michigan-masonic-home,"Assisted Living, Health Care, Non Profit","Alma, Michigan, United States","Michigan Masonic Home specializes in residential and independent living, rehabilitation, health care and assisted living services.","572,553","Great Lakes, Midwestern US",$10M to $50M,Active,1891-01-01,year,,,,,Non-profit,https://www.michiganmasons.org,,"Health Care, Other, Social Impact",,,251-500,,,,,,,,,,,,,Private,,,,,,
Black Knight Security,https://www.crunchbase.com/organization/black-knight-security,"Consulting, Professional Services, Security","Pittsburgh, Pennsylvania, United States","Black Knight Security is a security firm that provides security guards, door staff, action plans and training to individuals and businesses.","572,556","Great Lakes, Northeastern US",$1M to $10M,Active,2003-01-01,year,,,,,For Profit,https://www.blackknightsecurity.com/,,"Other, Privacy and Security, Professional Services",1,Dennis Lejeck,251-500,,,,,,,,,,,,,Private,,,,,,
Wave Central,https://www.crunchbase.com/organization/wave-central,"Electronics, Hardware, Media and Entertainment","Carlisle, Pennsylvania, United States","Wave Central provides RF solutions for sports, entertainment, broadcast, and film.","572,559","Great Lakes, Northeastern US",$1M to $10M,Active,2012-01-01,year,,,,,For Profit,https://www.wavecentralrf.com,,"Consumer Electronics, Hardware, Media and Entertainment",,,11-50,,,,,,,,,,,,,Private,,,,,,
100X.com,https://www.crunchbase.com/organization/100x-com,,"Waltham, Massachusetts, United States",100X.com is an Internet Accelerator.,"572,560","Greater Boston Area, East Coast, New England",,Active,2009-01-01,year,,,,,For Profit,http://100x.com/,"100X.com is a new kind of business known as an Internet Accelerator that is devoted to accelerating the pace, value-creation, and reduction of risk in creating new companies focusing on the consumer market to a whole new standard. 100X.com is part Venture Capitalist, part Incubator, part IT/Management consulting, and part Technology Research Center, and mostly something entirely new. 100X.com's mission is to provide emerging companies with intensive, strategic support in engineering, business design, operations, marketing, and investment partnership development. Although most of its company ideas come from within, 100X.com will also accelerate a select number of new compani",,,,1-10,,,,,,,,,,,,,Private,,,,,,
Harvard Card Systems,https://www.crunchbase.com/organization/harvard-card-systems,"Gift Card, Manufacturing, Printing","City Of Industry, California, United States","Harvard Card Systems, a maker of plastic card products.","572,562","Greater Los Angeles Area, West Coast, Western US",,Active,1996-01-01,year,2018-10-22,day,,,For Profit,https://go.plicards.com/HarvardCardSystems_PLI,"Harvard, a leader in the card printing and gift card manufacturing industry. Harvard produces a broad range of plastic card products for more than 2,500 customers in a variety of sectors, including gifting, hospitality, entertainment, retail and gas, transportation, access control, government, healthcare and more. The company offers an integrated suite of services that includes in-house product design, specialty printing, magnetic striping, cutting, coating, personalization, affixing, packaging and shipping expertise.","Commerce and Shopping, Content and Publishing, Financial Services, Manufacturing, Media and Entertainment",,,251-500,,M&A,,,,,,,,,,,Private,,,,,,
GamesThatGive,https://www.crunchbase.com/organization/gamesthatgive,"Gamification, Gaming, Online Games","San Francisco, California, United States",Charitable Casual Gaming,"572,563","San Francisco Bay Area, West Coast, Western US",,Active,2008-01-01,year,2011-07-20,day,,,For Profit,http://www.gamesthatgive.net,"GamesThatGive was founded in 2008 by Adam Archer and Kris Goss, great friends and self admitted geeks. GamesThatGive was built around the belief that great companies, and their customers, want to make a difference. Even beyond that, they want to help others make a difference.",Gaming,1,Adam Archer,11-50,,M&A,,,,,,,,,,,Private,,,,,,
Bobber Interactive Corporation,https://www.crunchbase.com/organization/bobber-interactive-corporation,"Finance, Information Technology, Software","Seattle, Washington, United States",Bobber Interactive Corporation offers customer engagement solutions for financial institutions.,"572,565","Greater Seattle Area, West Coast, Western US",,Active,2010-01-01,year,,,,,For Profit,http://www.bobberinteractive.com,"Bobber Interactive Corporation provides financial institutions with customer engagement solutions that drive high-value online behavior.  Bobber Interactive Corporation was formed in 2010 and is based in Seattle, Washington.","Financial Services, Information Technology, Software",1,Eric Eastman,11-50,1,Early Stage Venture,1400000,USD,1400000,1400000,USD,1400000,"Peak 6, Dove Capital Partners",1,2,,Private,,,,,,
Dar Al Kitab Al Arabi Usa,https://www.crunchbase.com/organization/dar-al-kitab-al-arabi-usa,"Books, Business Development, E-Commerce, Retail","Garden Grove, California, United States",Alkitab specializes in classical and contemporary books in the Arabic language.,"572,567","Greater Los Angeles Area, West Coast, Western US",,Active,,,,,,,For Profit,http://www.alkitab.com,,"Commerce and Shopping, Content and Publishing, Media and Entertainment, Professional Services",,,11-50,,,,,,,,,,,,,Private,,,,,,
Action Computers,https://www.crunchbase.com/organization/action-computers,"Computer, Electronics, Recycling, Retail, Sales","Denver, Colorado, United States","Action Computers provides computers and electronic equipment purchasing, selling, recycling, repairing, and maintenance services.","572,569","Greater Denver Area, Western US",$10M to $50M,Active,1993-01-01,year,,,,,For Profit,https://www.actionpc.com,"Action Computers was founded in 1993 and specialize in refurbished laptops, desktops, LCD monitors, among other things. The largest buyer, refurbisher, and retailer of used electronic and computer equipment in Colorado are Action Computer. In addition to buying tens of thousands of computers from large multinationals, they also provide services to small local businesses and other organizations, whether public or private. They specialize in buying used computers from individuals or large multinationals, erasing data securely and safely. Their repair department is the best in the business, completing over 500 repairs each month. Their software and techniques are industry-leading, ensuring you are well-informed and comfortable during the repair process.","Commerce and Shopping, Consumer Electronics, Hardware, Sales and Marketing, Sustainability",,,11-50,,,,,,,,,,,,,Private,,,,,,
Appitate LLC,https://www.crunchbase.com/organization/appitate-llc,Advertising,"Huntington, New York, United States",Appitate is an international mobile affiliate network.,"572,570","Greater New York Area, East Coast, Northeastern US",,Active,2016-03-01,month,,,,,For Profit,http://appitate.com/,"Appitate is a fast-growing international mobile CPI Affiliate Network, based in Spain, Madrid. Members of our team are represented by professionals in mobile/web-promotion and traffic monetization.  Appitate works by CPA/CPI model, supplying non-incent campaigns for iOS and Android OS. Our network joins Exclusive and Direct Publishers, Direct App-developers and Leading Advertisers. Our benefits: •	Offers with Highest Payouts from over 50 GEOS •	Helpful Dedicated managers with 24/7 support  •	Net 15 Payments •	TOP performing offers, all possible Verticals •	Day and Night technical Support Trust us, and you will get more than expected!","Advertising, Sales and Marketing",,,11-50,,,,,,,,,,,,,Private,,,,,,
Producers Chemical Company,https://www.crunchbase.com/organization/producers-chemical-company,"Chemical, Industrial, Manufacturing","Sugar Grove, Illinois, United States","Producers Chemical Company offers chemicals, solvents and related products to wide range of industries.","572,572","Greater Chicago Area, Great Lakes, Midwestern US",$10M to $50M,Active,1963-01-01,year,,,,,For Profit,http://www.producerschemical.com,,"Manufacturing, Science and Engineering",,,11-50,,,,,,,,,,,,,Private,,,,,,
Lux de Ville,https://www.crunchbase.com/organization/lux-de-ville,"Consumer Goods, Fashion","Signal Hill, California, United States","Lux de Ville is Making fabulous handbags and various accessories like Backpacks, Lux Hats, Lux Scarves and Sunglasses.","572,573","Greater Los Angeles Area, West Coast, Western US",,Active,2003-04-01,month,,,,,For Profit,https://www.luxdeville.com,,"Clothing and Apparel, Consumer Goods, Design",,,,,,,,,,,,,,,,Private,,,,,,
SMV,https://www.crunchbase.com/organization/smv,"Advertising, Broadcasting, Music, News, Video","Burbank, California, United States",SMV is a broadcast media company that offers post production and audiovisual services.,"572,575","Greater Los Angeles Area, West Coast, Western US",$10M to $50M,Active,1982-01-01,day,,,,,For Profit,http://smvcm.com,,"Advertising, Content and Publishing, Media and Entertainment, Music and Audio, Sales and Marketing, Video",,,101-250,,,,,,,,,,,,,Private,,,,,,
Kraft Sports + Entertainment,https://www.crunchbase.com/organization/kraft-sports-entertainment,"Concerts, Events, Sports","Mansfield, Massachusetts, United States",Kraft Sports + Entertainment delivers concerts and sporting events to the people of New England.,"572,576","East Coast, New England, Northeastern US",,Active,,,,,,,For Profit,https://www.kraftse.com,,"Events, Media and Entertainment, Sports",,,101-250,,,,,,,,,,,,,Private,,,,,,
Whiskey Grade,https://www.crunchbase.com/organization/whiskey-grade,"Apparel, Consumer Goods, E-Commerce, Fashion","Cuyahoga Falls, Ohio, United States",Whiskey Grade is an online site that sells a variety of popular gadgets and apparel.,"572,576","Great Lakes, Midwestern US",Less than $1M,Active,2010-01-01,year,,,,,For Profit,https://whiskeygrade.com,,"Clothing and Apparel, Commerce and Shopping, Consumer Goods, Design",,,11-50,,,,,,,,,,,,,Private,,,,,,
Elliott Group,https://www.crunchbase.com/organization/elliott-group,"Auto Insurance, Commercial Insurance, Financial Services, Insurance, Life Insurance, Property Insurance, Risk Management","Louisburg, Kansas, United States","Elliott Group provides personal, risk management, and commercial insurance services.","572,578",Midwestern US,$1M to $10M,Active,1974-01-01,year,,,,,For Profit,http://www.elliottinsurancegroup.com,"Elliott Group is an insurance firm. They provide contractors, municipalities, schools, religious organizations, homes, auto, manufacturing, benefits, surety bonds, farms, agribusiness, risk management, and commercial insurance services.","Financial Services, Professional Services",,,11-50,,,,,,,,,,,,,Private,,,,,,
Jackson Hospital,https://www.crunchbase.com/organization/jackson-hospital-3ff4,"Fitness, Health Care, Hospital, Medical, Wellness","Marianna, Florida, United States","Jackson Hospital offers fitness, laboratory, and radiology services.","572,580","East Coast, Southern US",,Active,,,,,,,For Profit,https://www.jackson-hospital.com,"Jackson County Hospital Corporation provides traditional medical and surgical care for the residents. The not-for-profit company manages the acute-care, 100-bed Jackson Hospital. Some of the services offered at the hospital include cardiac rehabilitation, intensive care, occupational therapy, radiology, a maternity center, and a sleep laboratory. The medical center also offers physical and speech therapy and laboratory services.","Health Care, Sports",,,501-1000,,,,,,,,,,,,,Private,,,,,,
The Children's Village,https://www.crunchbase.com/organization/the-children-s-village,"Charity, Child Care, Communities, Non Profit, Nursing and Residential Care","Dobbs Ferry, New York, United States","The Children's Village is a charity firm that raise funds to facilitate vulnerable children and families with shelter, food and education.","572,580","Greater New York Area, East Coast, Northeastern US",$50M to $100M,Active,1851-01-01,year,,,,,Non-profit,https://childrensvillage.org/,,"Community and Lifestyle, Health Care, Other, Social Impact",,,501-1000,,,,,,,,,,,,,Private,,,,,,
RSS,https://www.crunchbase.com/organization/rss,"Human Resources, Recruiting, Staffing Agency","Davie, Florida, United States","RSS is a staffing solution company that offers production worker staffing, warehouse worker staffing, and strike replacement services.","572,581","Greater Miami Area, East Coast, Southern US",$1M to $10M,Active,1990-01-01,year,,,,,For Profit,https://www.rssinc.com,,"Administrative Services, Professional Services",,,11-50,,,,,,,,,,,,,Private,,,,,,
Clay Chapman Iwamura Pulice & Nervell,https://www.crunchbase.com/organization/clay-chapman-iwamura-pulice-nervell,"Advice, Legal, Professional Services","Honolulu, Hawaii, United States","Clay Chapman Iwamura Pulice & Nervell is a law firm specializing in civil litigation, personal injury, dispute resolution, and business law.","572,582","Asia-Pacific (APAC), Western US",$1M to $10M,Active,1977-01-01,year,,,,,For Profit,https://www.paclawteam.com/,,"Media and Entertainment, Other, Professional Services",,,11-50,,,,,,,,,,,,,Private,,,,,,
JP Pest Services,https://www.crunchbase.com/organization/jp-pest-services,"Information Services, Renewable Energy","Milford, New Hampshire, United States",JP Pest Services is a pest control company providing services for both residential and commercial properties.,"572,596","East Coast, New England, Northeastern US",$10M to $50M,Active,1925-01-01,year,,,,,For Profit,https://www.jppestservices.com,,"Energy, Information Technology, Sustainability",,,51-100,,,,,,,,,,,,,Private,,,,,,
PEAT,https://www.crunchbase.com/organization/peat-baf8,"Information Services, Technical Support","Washington, District of Columbia, United States",PEAT has vision of technology space that build inclusive workplace for the people with disability,"572,597","Washington DC Metro Area, Southern US",,Active,,,,,,,For Profit,https://www.peatworks.org/,,"Information Technology, Other",,,1-10,,,,,,,,,,,,,Private,,,,,,
Wayne Mills,https://www.crunchbase.com/organization/wayne-mills-28f3,"Manufacturing, Sales, Textiles, Wholesale","Philadelphia, Pennsylvania, United States",Wayne Mills is a textile products manufacturer.,"572,597","Greater Philadelphia Area, Great Lakes, Northeastern US",$10M to $50M,Active,1910-01-01,year,,,,,For Profit,https://www.waynemills.com,"Wayne Mills is a manufacturer of twill tape, binding, and light webbing. They offer narrow fabric custom dyeing, laminating, and adhesive extrusion. They provide services such as textile design services, narrow fabric bleaching, custom dyeing and lab dips, reflective lamination, custom coating, custom cutting, put-ups, and packaging.","Commerce and Shopping, Manufacturing, Sales and Marketing",,,101-250,,,,,,,,,,,,,Private,,,,,,
Marijuana Policy Project,https://www.crunchbase.com/organization/marijuana-policy-project,"Cannabis, Non Profit","Washington, District of Columbia, United States",Marijuana Policy Project is a U.S-based organization focused solely on ending marijuana prohibition.,"572,599","Washington DC Metro Area, Southern US",$1M to $10M,Active,2012-01-01,year,,,,,For Profit,http://mpp.org/,"Marijuana Policy Project is a U.S-based organization focused solely on ending marijuana prohibition. Its aim is to change federal law to allow states to determine their own marijuana policies without federal interference, as well as to regulate marijuana like alcohol in all 50 states, D.C., and the five territories. Marijuana Policy Project has been responsible for changing most of the state marijuana laws that have been reformed since 2000, including the legalization of marijuana in Colorado in November 2012 and in Alaska in 2014. The organization is composed of three separate organizations that include the main branch that deals with lobbying and ballot initiatives, the tax-deductible educational branch, and a branch that donates to congressional candidates. In addition, Marijuana Policy Project has state committees in the states where it is running ballot initiatives; these state committees are formed and closed every few years. For the three aforementioned core organizations, the annual budgets are usually 3,000,000 U.S. dollars, 2,000,000 U.S. dollars, and 100,000 U.S. dollars, respectively. Marijuana Policy Project typically has approximately 30 employees, two-thirds of whom are based in its headquarters in Washington, D.C. and this includes two full-time lobbyists on Capitol Hill. In addition, the organization usually has lobbyists on retainer in six or seven state capitals. It was founded in 2012.","Community and Lifestyle, Food and Beverage, Health Care, Other, Social Impact",,,51-100,,,,,,,,,,,,,Private,,,,,,
Keystone Property Group,https://www.crunchbase.com/organization/keystone-property-group,Real Estate,"Morristown, New Jersey, United States",Keystone Property Group is a commercial property management firm based in Pennsylvania.,"572,601","Greater New York Area, East Coast, Northeastern US",$10M to $50M,Active,1991-01-01,year,,,,,For Profit,http://keystonepropertygroup.com,,Real Estate,1,Bill Glazer,101-250,,,,,,,,,,,,,Private,,,,,,
WTP Advisors,https://www.crunchbase.com/organization/wtp-advisors,"Accounting, Consulting, Financial Services","Minneapolis, Minnesota, United States","WTP Advisors specialize in transfer pricing, international tax, IC-DISC and international valuation solutions through technology.","572,604","Greater Minneapolis-Saint Paul Area, Great Lakes, Midwestern US",Less than $1M,Active,2005-01-01,year,,,,,For Profit,https://wtpadvisors.com/,,"Financial Services, Professional Services",,,11-50,,,,,,,,,,,,,Private,,,,,,
Roman Decorating Products,https://www.crunchbase.com/organization/roman-decorating-products,"Consumer Goods, Food and Beverage, Manufacturing, Retail","Calumet City, Illinois, United States","Roman Decorating Products manufactures wallpaper adhesives, primers, and wallpaper removal products on the market.","572,605","Greater Chicago Area, Great Lakes, Midwestern US",$10M to $50M,Active,2013-01-01,day,,,,,For Profit,http://www.romandecoratingproducts.com,"Roman Decorating Products takes pride in producing quality products with: - The most modern and automated 100,000 square feet “state of the art” facility in the wallpaper sundries industry - Quality standards based on stringent food industry procedures & guidelines - Products formulated and packaged with the environment in mind - ""Tried and True” formulations based on contractor and professional contractor testing and experience -Loyal professional and consumer following in all categories Based in Calumet City, IL, the company's products can be found at most home centers, paint and wallpaper decorating stores, and mass merchants. Roman's brands have been rated number one by a large margin of professional paperhangers. They are rated No. 1 in sales, innovation and quality.  Known as an innovator in the industry, Roman was the first to introduce pre-mixed wallcovering adhesives, wallcovering primers, vinyl over vinyl adhesive and many other innovative products in the wallcovering industry that are a standard on store shelves today.","Commerce and Shopping, Consumer Goods, Food and Beverage, Manufacturing",,,51-100,,,,,,,,,,,,,Private,,,,,,
Cabinets By Design,https://www.crunchbase.com/organization/cabinets-by-design,"Commercial, Construction, Manufacturing","Duluth, Georgia, United States","Cabinets By Design is an industry leader in design, manufacturing and installation of commercial cabinets.","572,605","Greater Atlanta Area, East Coast, Southern US",$10M to $50M,Active,1994-01-01,year,,,,,For Profit,https://www.cbdga.com/,"Cabinets By Design is an industry leader in design, manufacturing and installation of commercial cabinets for education, healthcare and government, Cabinets By Design has consistently met and surpassed our customer’s expectations for more than 20 years. Nationally and internationally known, Cabinets By Design is a full-service provider of high quality plastic laminate casework and wood science laboratory casework. The 120,000 square foot, state-of-the-art facility is the largest in the Southeast. ","Manufacturing, Other, Real Estate",1,Fari Vakili,51-100,1,Private Equity,,USD,,,USD,,Ninth Street Capital,1,1,,Private,,,,,,
"Zeitlin & Co., Realtors",https://www.crunchbase.com/organization/zeitlin-co-realtors,"Consulting, Real Estate","Nashville, Tennessee, United States","Zeitlin & Co., Realtors is a property management firm based in Tennessee.","572,607",Southern US,$10M to $50M,Active,1979-01-01,year,,,,,For Profit,http://zeitlin.com,,"Professional Services, Real Estate",,,101-250,,,,,,,,,,,,,Private,,,,,,
Helen Newberry Joy Hospital,https://www.crunchbase.com/organization/helen-newberry-joy-hospital,"Health Care, Hospital, Medical","Newberry, Michigan, United States","Helen Newberry joy hospital provides laparoscopic, arthroscopic, and ophthalmology surgeries.","572,609","Great Lakes, Midwestern US",$10M to $50M,Active,1965-01-01,year,,,,,For Profit,http://www.hnjh.org,,Health Care,,,251-500,,,,,,,,,,,,,Private,,,,,,
