Labb,https://www.crunchbase.com/organization/labb,"Apps, Information Technology, Mobile Apps","Portsmouth, Virginia, United States","Labb is a mobile app development company in Toronto, Canada.","439,688","East Coast, Southern US",,Active,2017-01-01,year,,,,,For Profit,https://www.labb.com,,"Apps, Information Technology, Mobile, Software",,,,,,,,,,,,,,,,Private,,,,,,
Apple Valley Waste Services,https://www.crunchbase.com/organization/apple-valley-waste-services,Real Estate,"Kearneysville, West Virginia, United States","Apple Valley is a leading solid waste company that offers collection, processing, disposal, and recycling services.","439,690","Washington DC Metro Area, Southern US",,Active,,,2018-12-03,day,,,For Profit,https://www.applevalleywaste.com/,"Apple Valley is a leading solid waste company that offers collection, processing, disposal, and recycling services throughout the Mid-Atlantic region. Apple Valley services residential and commercial customers in West Virginia under certificates of necessity issued by the Public Service Commission of West Virginia and provides residential and commercial waste collection services in large metropolitan areas such as Baltimore, Washington, D.C., and Southern Pennsylvania.",Real Estate,1,Randie Lawson,1-10,,M&A,,,,,,,,,,,Private,,,,,,
Wiki Mastery,https://www.crunchbase.com/organization/wiki-mastery,,"New York, New York, United States","Planning to get more traffic on your website? Perhaps, you should try promoting your brand on Wikipedia.","439,691","Greater New York Area, East Coast, Northeastern US",,Active,2016-06-03,day,,,,,For Profit,https://wikimastery.com/,Agents at Wiki Mastery offer Wikipedia content creation at affordable rates. Our marketing team is available 24/7 to help your business boost sales and maintain a good ranking in the industry. Reach out to us today if you need assistance creating quality content for your Wikipedia page.,,,,101-250,,,,,,,,,,,,,Private,,,,,,
Papa Bear Ventures,https://www.crunchbase.com/organization/papa-bear-ventures,Venture Capital,"New York, New York, United States",Papa Bear Ventures is a venture capital & private equity industry.,"439,691","Greater New York Area, East Coast, Northeastern US",,Active,2017-01-01,year,,,,,For Profit,https://www.papabear.vc/,,"Financial Services, Lending and Investments",1,Josh Futterman,1-10,,,,,,,,,,,,,Private,,,,,,
FLOOD BROTHERS,https://www.crunchbase.com/organization/flood-brothers,"Commercial, Fast-Moving Consumer Goods, Logistics, Warehousing","Atlanta, Georgia, United States","FLOOD BROTHERS provides commercial moving, logistics, warehousing, and furniture installation services.","439,694","Greater Atlanta Area, East Coast, Southern US",$50M to $100M,Active,1996-01-01,year,,,,,For Profit,http://www.floodbrothers.net,,"Consumer Goods, Other, Real Estate, Transportation",,,101-250,,,,,,,,,,,,,Private,,,,,,
Unelko Corporation,https://www.crunchbase.com/organization/unelko-corporation,"Chemical, Cleaning Products, Manufacturing","Phoenix, Arizona, United States","Unelko Corp. manufacturing advanced surface cleaners, coatings & treatments for the preservation & enhancement of a wide range of surfaces.","439,694","Greater Phoenix Area, Western US",,Active,1971-01-01,year,,,,,For Profit,https://unelko.com,,"Consumer Goods, Manufacturing, Science and Engineering",,,11-50,,,,,,,,,,,,,Private,,,,,,
1834,https://www.crunchbase.com/organization/1834,"Advice, Banking, Financial Services, Professional Services, Wealth Management","Evansville, Indiana, United States","1834 is a financial service firm that offers financial planning, private banking, and investment management services.","439,696","Great Lakes, Midwestern US",,Active,1834-01-01,year,,,,,For Profit,https://www.1834.com,,"Financial Services, Lending and Investments, Media and Entertainment, Other",,,51-100,,,,,,,,,,,,,Private,,,,,,
Custom Systems Integration,https://www.crunchbase.com/organization/custom-systems-integration-57af,"Consulting, Electronics, Manufacturing, Software","Endicott, New York, United States",Custom Systems Integration is the employer-owned Custom Engineering and Manufacturing Services and Systems Integration.,"439,697","East Coast, Northeastern US",$1M to $10M,Active,2001-01-01,year,,,,,For Profit,https://www.customsi.com/,"Custom Systems Integration is the employer-owned Custom Engineering and Manufacturing Services and Systems Integration. CSI is your full-service provider for measurement, simulation and test systems. Whether your application is commercial or military, CSI can assist you in your next project, regardless of size.","Consumer Electronics, Hardware, Manufacturing, Professional Services, Software",1,Eric Hulstedt,11-50,,,,,,,,,,,,,Private,,,,,,
American Metal Group,https://www.crunchbase.com/organization/american-metal-group-f424,"B2B, Building Material, Construction, Manufacturing","Sylacauga, Alabama, United States",American Metal Group engages in the steel industry that offers the independent choice for cold-finished bars and threaded rods.,"439,698",Southern US,$1M to $10M,Active,2017-01-01,year,2011-04-01,day,,,For Profit,https://www.amg-steel.com,American Metal Group focuses on recycling scrap metals to reusable materials.,"Manufacturing, Other, Real Estate",,,11-50,,M&A,,,,,,,,,,,Private,,,,,,
DPC Technology,https://www.crunchbase.com/organization/dpc-technology,"Information Services, Information Technology","Jacksonville, Florida, United States","DPC Technology provides computer support, outsourced IT and network implementation solutions to businesses throughout Florida and Georgia.","439,699","East Coast, Southern US",$1M to $10M,Active,1994-01-01,year,,,,,For Profit,https://www.dpctechnology.com/,,Information Technology,,,11-50,,,,,,,,,,,,,Private,,,,,,
D'iyanu,https://www.crunchbase.com/organization/d-iyanu,"Fashion, Retail, Textiles","Norristown, Pennsylvania, United States","D'Iyanu is a ready-to-wear bold print clothing line for men, women, and kids.","439,700","Greater Philadelphia Area, Great Lakes, Northeastern US",$1M to $10M,Active,2014-01-01,year,,,,,For Profit,https://www.diyanu.com/,,"Clothing and Apparel, Commerce and Shopping, Design, Manufacturing",1,Addie Elabor,11-50,,,,,,,,,,,,,Private,,,,,,
Kyron,https://www.crunchbase.com/organization/kyron,"Analytics, Big Data, Health Care","San Jose, California, United States",Kyron analyzes medical records of routine care to generate medical insights.,"439,712","San Francisco Bay Area, Silicon Valley, West Coast",Less than $1M,Closed,2013-05-16,day,,,,none,For Profit,http://kyron.com,"Kyron analyze medical records of routine care to generate medical insights. They identify latent associations between conditions, interventions and outcomes to generate practice-based evidence.","Data and Analytics, Health Care",3,"Louis Monier, Nigam Shah, Noah Zimmerman",1-10,1,Seed,3000000,USD,3000000,3000000,USD,3000000,Khosla Ventures,,1,,Private,,,,,,
Bako Diagnostics,https://www.crunchbase.com/organization/bako-diagnostics,"Health Care, Medical, Therapeutics","Alpharetta, Georgia, United States",Bako Diagnostics is a provider of diagnostic and therapeutic services in the healthcare industry.,"439,713","Greater Atlanta Area, East Coast, Southern US",$10M to $50M,Active,2008-01-01,year,,,,,For Profit,https://bakodx.com,"Bako Diagnostics is a healthcare services company that provides diagnostic and therapeutic services. They specialise in anatomic pathology, nail DNA testing, ENFD, bacteriology, and mycology. They are committed to the advancement of podiatric dermatology through education, research, and financial support that no other national lab or pathology group can match.",Health Care,1,Wayne L. Bakotic,251-500,1,Private Equity,,USD,,,USD,,Consonance Capital Partners,1,1,,Private,,,,,,
CaseMail,https://www.crunchbase.com/organization/casemail,"Information Technology, Online Portals, Software","Lewes, Delaware, United States","CaseMail is an online platform that offers electronic communications and transfers, postal mailings from one application with ease.","439,717","East Coast, Southern US",,Active,2014-01-01,year,,,,,For Profit,https://casemail.us/,,"Information Technology, Internet Services, Software",,,11-50,,,,,,,,,,,,,Private,,,,,,
Dacia,https://www.crunchbase.com/organization/dacia-ef0f,"Automotive, Manufacturing, Recreational Vehicles","Boston, Massachusetts, United States","Dacia is a motor vehicle manufacturing company that makes new cars affordable, spacious, and robust for customers globally.","439,717","Greater Boston Area, East Coast, New England",,Active,1966-01-01,year,,,,,For Profit,https://www.dacia.ro/,,"Manufacturing, Transportation",,,1001-5000,,,,,,,,,,,,,Private,,,,,,
Epic Promotions,https://www.crunchbase.com/organization/epic-promotions-5147,"Apparel, E-Commerce, Fashion, Retail, Shopping","Warwick, Rhode Island, United States","Epic Promotions is a retailer of bags, coolers, jackets, pens, drinkware, and apparel.","439,718","East Coast, New England, Northeastern US",$1M to $10M,Active,2015-01-01,year,,,,,For Profit,https://epicpromos.com,"Epic Promotions sells t-shirts, polos, sweatshirts, hats, water bottles, mugs, travel mugs, tumblers, bar wares, backpacks, tote bags, coolers, drawstring bags, shopping bags, power banks, usb drives, bluetooths, headphones, speakers, metal pens, plastic pens, pencils, and much more.","Clothing and Apparel, Commerce and Shopping, Design",,,11-50,,,,,,,,,,,,,Private,,,,,,
Cig Logistics,https://www.crunchbase.com/organization/cig-logistics,"Logistics, Supply Chain Management","Fort Worth, Texas, United States","CIG Logistics is a safety-focused, technology-driven logistics company.","439,720","Dallas/Fort Worth Metroplex, Southern US",$1M to $10M,Active,2013-01-01,day,,,,,For Profit,http://ciglogistics.com,,Transportation,1,Jonathan Green,1001-5000,,,,,,,,,,,,,Private,,,,,,
GlobeNet Communications,https://www.crunchbase.com/organization/globenet-communications,"Internet, Internet of Things, Telecommunications","Fort Lauderdale, Florida, United States",GlobeNet Communications is a telecommunications company that provides a range of products and services for sustaining internet access.,"439,722","Greater Miami Area, East Coast, Southern US",$10M to $50M,Closed,1997-01-01,year,2022-09-01,month,2022-09-01,day,For Profit,https://globenet.net,,"Hardware, Internet Services",,,51-100,,M&A,,,,,,,,,,,Private,,,,,,
Noah Consulting,https://www.crunchbase.com/organization/noah-consulting,"Business Intelligence, Information Technology, Project Management","Houston, Texas, United States","Specializing in helping companies leverage the value of information, Noah Consulting focuses exclusively","439,723","Greater Houston Area, Southern US",,Active,2008-01-01,year,2015-10-19,day,,,For Profit,http://www.noah-consulting.com/,"Noah Consulting is a consultancy firm that offers analytics and management services to its clients. The firm provides information management services in architecture, data warehouse and big data, data virtualization, data governance, data integration, content management, and master data management. Its strategic services includes strategy and planning, value assessment, architecture, and maturity model assessment. Furthermore, the firm offers industry solutions, analytics, and acquisitions for its clients. Noah Consulting was founded in 2008 and is based in Houston, Texas.","Administrative Services, Data and Analytics, Information Technology, Other",3,"John Ruddy, Shannon Tassin, Stewart Nelson",51-100,,M&A,,,,,,,,,,,Private,,,,,,
RxMile,https://www.crunchbase.com/organization/rxmile,"Pharmaceutical, Software","Longwood, Florida, United States",Prescription delivery platform for independent pharmacies across the United States.,"439,724","East Coast, Southern US",,Active,2021-01-01,month,,,,,For Profit,https://www.rxmile.com/,"RxMile’s prescription delivery platforms encapsulate an all-in-one solution including a delivery portal, real-time tracking, audit and compliance support, medication synchronization, route optimization, refill consent tool, POD, contactless signature capture, co-pay collection and so much more","Health Care, Software",1,Kunal Vyas,1-10,,,,,,,,,,,,,Private,,,,,,
"VistaNational Insurance Group, Inc.",https://www.crunchbase.com/organization/vistanational-insurance-group-inc,"Health Care, Insurance","Oak Brook, Illinois, United States",VistaNational Insurance Group is an insurance company providing health care reform and voluntary benefits solutions.,"439,731","Greater Chicago Area, Great Lakes, Midwestern US",$1M to $10M,Active,1996-01-01,year,,,,,For Profit,http://vistanational.com,,"Financial Services, Health Care",,,11-50,,,,,,,,,,,,,Private,,,,,,
TFE,https://www.crunchbase.com/organization/tfe-129d,"Industrial Automation, Local Business, Manufacturing, Power Grid","Fort Wayne, Indiana, United States",TFE is an industrial automation company that provides fluid power and power transmission products.,"439,743","Great Lakes, Midwestern US",$10M to $50M,Active,1964-01-01,year,,,,,For Profit,https://www.tfedirect.com,,"Energy, Manufacturing, Sales and Marketing, Science and Engineering",,,51-100,,,,,,,,,,,,,Private,,,,,,
Color Brands,https://www.crunchbase.com/organization/color-brands,"E-Commerce, Food and Beverage, Wholesale","Chicago, Illinois, United States","Color Brands is a food and beverage company that delivers eats with an organized, strategic approach to the international marketplace.","439,744","Greater Chicago Area, Great Lakes, Midwestern US",$1M to $10M,Active,2013-01-01,year,,,,,For Profit,https://www.colorbrands.us,"Color Brands color brands are the exclusive international partner to leading food, beverage, and nutrition brands. They focus on healthy snacks, innovative soft drinks, sports nutrition, and global brands, color brands exclusively manages all international businesses on behalf of its brand partners.","Commerce and Shopping, Food and Beverage",,,11-50,,,,,,,,,,,,,Private,,,,,,
Rush Republic,https://www.crunchbase.com/organization/rush-republic,"Digital Marketing, Graphic Design, Web Design","West Hills, California, United States",Rush Republic is a branding and digital marketing agency that offers website design and development services.,"439,747","Greater Los Angeles Area, West Coast, Western US",$1M to $10M,Active,2014-01-01,month,,,,,For Profit,https://therushrepublic.com,"Rush Republic offers website design and development, branding, advertising, graphic designs, video production-animation, content writing services, digital, social media marketing, printing services, packaging design, search engine optimization, marketing, event ideation, and design execution services.","Design, Sales and Marketing",3,"LakshmiGanth Krishnan, Mathuram J., Nishit Rathod",11-50,,,,,,,,,,,,,Private,,,,,,
HVAC Business Solutions,https://www.crunchbase.com/organization/hvac-business-solutions-96c2,"Consulting, Heating, Ventilation, and Air Conditioning (HVAC), Information Technology, Software","Stafford, Texas, United States","HVAC Business Solutions is a software solution that provides HVAC equipment sales, flat-rate pricing, and sale module services.","439,749","Greater Houston Area, Southern US",$1M to $10M,Active,2007-01-01,year,,,,,For Profit,https://hvacbusinesssolutions.com/,,"Information Technology, Professional Services, Real Estate, Software",,,11-50,,,,,,,,,,,,,Private,,,,,,
Peyote Bird Designs,https://www.crunchbase.com/organization/peyote-bird-designs,"E-Commerce, Jewelry, Lifestyle","Santa Fe, New Mexico, United States","Peyote Bird Designs is an online store that sells a wide collection of earrings, necklaces, pins, cuffs, rings, and bracelets.","439,751",Western US,$1M to $10M,Active,1974-01-01,year,,,,,For Profit,https://www.peyotebird.com,,"Commerce and Shopping, Community and Lifestyle, Consumer Goods",,,11-50,,,,,,,,,,,,,Private,,,,,,
National Business Media,https://www.crunchbase.com/organization/national-business-media,"Advertising, Publishing","Broomfield, Colorado, United States",National Business Media is a publishing company offering visual communication and graphics related content.,"439,752","Greater Denver Area, Western US",Less than $1M,Active,1985-01-01,year,,,,,For Profit,http://nbm.com,,"Advertising, Content and Publishing, Media and Entertainment, Sales and Marketing",,,101-250,,,,,,,,,,,,,Private,,,,,,
Quikzer,https://www.crunchbase.com/organization/quikzer,"Information Technology, Software","Orlando, Florida, United States",At the core of our brand lies a commitment to responsiveness and reliability.,"439,755","East Coast, Southern US",,Active,2023-01-01,year,,,,,For Profit,https://www.quikzer.com/,"Our all-in-one marketplace empowers you to choose from hundreds of industry-leading software, cloud-based products, and services.  Automate your software procurement process; quote, invoice, order, and provision your cloud products all in one place. Designed for companies that focus on efficiency, strategic growth, and cost savings.","Information Technology, Software",,,,,,,,,,,,,,,,Private,,,,,,
Wakefield-Vette,https://www.crunchbase.com/organization/wakefield-vette,Electronics,"Pelham, New Hampshire, United States",Wakefield-Vette is one of the complete end-to-end thermal solutions.,"439,757","East Coast, New England, Northeastern US",$10M to $50M,Active,1957-01-01,year,,,,,For Profit,http://www.wakefield-vette.com/,"Wakefield-Vette is one of the complete end-to-end thermal solutions design, engineering and manufacturing companies, with over 50 years experience solving cooling challenges, at the component, system and facility level. Wakefield-Vette has multinational production facilities and is headquartered in Pelham, NH.","Consumer Electronics, Hardware",1,Wayne Frerichs,251-500,,,,,,,,,,,,1,Private,,,,,,
Cuneo Advertising,https://www.crunchbase.com/organization/cuneo-advertising,"Advertising, Marketing","Bloomington, Minnesota, United States","Cuneo Advertising is a marketing and advertising company offering radio production services in Bloomington, Minnesota.","439,759","Greater Minneapolis-Saint Paul Area, Great Lakes, Midwestern US",$10M to $50M,Active,1977-01-01,year,,,,,For Profit,http://cuneoadvertising.com,,"Advertising, Sales and Marketing",,,101-250,,,,,,,,,,,,,Private,,,,,,
Rocky Mountain Bank,https://www.crunchbase.com/organization/rocky-mountain-bank,"Financial Services, FinTech","Billings, Montana, United States",Rocky Mountain Bank is a banking corporation based in Montana.,"439,761",Western US,$10M to $50M,Active,1970-01-01,day,,,,,For Profit,http://rmbank.com,,Financial Services,,,101-250,,,,,,,,,,,,,Private,,,,,,
Shimmy,https://www.crunchbase.com/organization/shimmy-b5ab,"Beauty, Cosmetics, Personal Health, Shopping","Boston, Massachusetts, United States",Shimmy provides everyday essentials as an eco friendly and recyclable products.,"439,763","Greater Boston Area, East Coast, New England",,Active,2020-01-01,year,,,,,For Profit,https://getshimmy.com/?tpcc=nltermsheet,"Shimmy provides glycerin, leaf juice, carbomer, sodium hydroxide, and fragrance. For online inquiries, contact email and phone numbers are available on their websites.","Commerce and Shopping, Consumer Goods, Health Care",,,1-10,,,,,,,,,,,,,Private,,,,,,
Reports and Data,https://www.crunchbase.com/organization/reports-and-data,"Consulting, Market Research","New York, New York, United States",Reports and Data is a market research & consulting company providing market research & consulting solutions and services.,"439,764","Greater New York Area, East Coast, Northeastern US",$10M to $50M,Active,2016-01-01,year,,,,,For Profit,https://www.reportsanddata.com,,"Data and Analytics, Design, Professional Services",,,101-250,,,,,,,,,,,,,Private,,,,,,
HealthPlotter,https://www.crunchbase.com/organization/health-plotter,"Health Care, Medical","Spartanburg, South Carolina, United States",Healthplotter’s platform powers employers & health management programs with actionable data to improve health outcomes & contain cost.,"439,764","East Coast, Southern US",Less than $1M,Active,2013-01-01,year,,,,,For Profit,http://healthplotter.com,"HealthPlotter provides self-insured companies a data-driven cloud based solution that works collaboratively within their existing health benefits ecosystem.  Our single-source platform provides employers and their wellness stakeholders actionable data for improved population health management, risk stratification and cost control.   Today, with health costs continuing to rise, over ½ of self-insured companies utilize a combination of onsite practitioners (work-site clinics) along with a menu of wellness initiatives based on non-actionable data.  With our approach, we power employers, their onsite practitioners and wellness programs through our solution a tactical and strategic plan to address the specific health needs of your population, target modifiable risks and drive tangible high-impact measurable results and outcomes - lower costs.",Health Care,1,Senthil Premraj,1-10,1,Seed,,USD,,,USD,,Iron Yard Ventures,,1,,Private,,,,,,
EGT Solar,https://www.crunchbase.com/organization/egt-solar,"Commercial, Residential, Solar","Meridian, Idaho, United States",EGT Solar is a solar energy services company.,"439,766",Western US,$1M to $10M,Active,2010-01-01,year,,,,,For Profit,https://egtsolar.com,"EGT Solar offers residential and commercial solar installation services. They provide smartsolar evaluation, design, advanced system design, installation, and inspection services.","Energy, Natural Resources, Other, Real Estate, Sustainability",1,Bryan Lawley,11-50,,,,,,,,,,,,,Private,,,,,,
MaxAmps,https://www.crunchbase.com/organization/maxamps,"Consumer Electronics, Manufacturing","Wausau, Wisconsin, United States","MaxAmps provides battery manufacturer, custom LiPo batteries, drone batteries, RC batteries, UAV batteries and Li-Ion batteries.","439,767","Great Lakes, Midwestern US",,Active,2006-01-01,day,,,,,For Profit,https://www.maxamps.com/,,"Consumer Electronics, Hardware, Manufacturing",,,11-50,,,,,,,,,,,,,Private,,,,,,
360 Mortgage Group,https://www.crunchbase.com/organization/360-mortgage-group,"Banking, Financial Services, Insurance, Venture Capital","Austin, Texas, United States",360 Mortgage Group is a privately owned mortgage bank .,"439,769",Southern US,$100M to $500M,Active,2007-01-01,year,,,,,For Profit,https://www.360mtg.com/,,"Financial Services, Lending and Investments",1,Mark Greco,51-100,,,,,,,,,,,,,Private,,,,,,
Collaborative Medical Technology,https://www.crunchbase.com/organization/collaborative-medical-technology,"Health Care, Medical, mHealth","Paramus, New Jersey, United States","Collaborative Medical Technology develops telehealth and mobile health solutions for hospitals, physicians, specialists, and patients.","439,769","Greater New York Area, East Coast, Northeastern US",$1M to $10M,Active,2002-01-01,year,,,,,For Profit,http://cmtcorp.com,"Collaborative Medical Technology Corporation (CMTC) is a health informatics company dedicated to building telehealth and mobile health solutions for hospitals, physicians, specialists, providers, patients/caregivers, and payers. CMTC provides a cloud-based platform with secure “one-click access” for cross-enterprise connectivity among healthcare professionals, hospitals & payers anytime, anyplace and in any format to improve, accelerate and expand healthcare delivery locally, regionally, and globally.","Health Care, Mobile",1,Simon Schurr,11-50,1,Seed,752161,USD,752161,752161,USD,752161,,,,,Private,,,,,,
4Thought Technologies,https://www.crunchbase.com/organization/4thought-technologies,"Financial Services, Trading Platform","New York, New York, United States",4Thought Technologies is an advanced no-code platform that unlocks the benefits of algorithmic trading and automated risk controls.,"439,771","Greater New York Area, East Coast, Northeastern US",,Active,,,,,,,For Profit,https://4thoughtglobal.com,,"Financial Services, Lending and Investments",,,11-50,,,,,,,,,,,,,Private,,,,,,
Techno Consult,https://www.crunchbase.com/organization/techno-consult,"Civil Engineering, Construction, Infrastructure, Project Management","Princeton, New Jersey, United States","Techno Consult provides a wide range of engineering, construction management, and resident engineering inspection services.","439,772","East Coast, Northeastern US",$1M to $10M,Active,2001-01-01,year,,,,,For Profit,https://techno-eng.com/,,"Administrative Services, Other, Real Estate, Science and Engineering",,,101-250,,,,,,,,,,,,,Private,,,,,,
Exteros,https://www.crunchbase.com/organization/exteros,"Artificial Intelligence (AI), Commercial Real Estate, Computer Vision, Machine Learning, Real Estate, Retail, Retail Technology","New York, New York, United States",Human Intelligence for the Real World,"439,773","Greater New York Area, East Coast, Northeastern US",Less than $1M,Active,2018-01-01,day,,,,,For Profit,https://exteros.com,"Exteros uses computer vision and AI to provide real-time person by person traffic, demographics, and interaction data for commercial real estate, shopping centers, and retail.","Artificial Intelligence (AI), Commerce and Shopping, Data and Analytics, Hardware, Real Estate, Science and Engineering, Software",1,Mark Dilsizian,1-10,,,,,,,,,,,,,Private,,,,,,
Environmental Intelligence,https://www.crunchbase.com/organization/environmental-intelligence-llc,"Environmental Consulting, Information Technology, Software","Laguna Beach, California, United States","Environmental Intelligence is a full-service IT company, delivering IT solutions.","439,777","Greater Los Angeles Area, West Coast, Western US",$1M to $10M,Active,2010-01-01,year,2021-08-31,day,,,For Profit,http://enviro-intel.com,"Environmental Intelligence is a full-service IT company, delivering IT solutions.","Information Technology, Professional Services, Software",1,Frank J Rosello,101-250,,M&A,,,,,,,,,,,Private,,,,,,
