Creative Realities,https://www.crunchbase.com/organization/creative-realities,"Advertising, Marketing, Shopping","New York, New York, United States",Creative Realities helps retailers and brands use the latest digital technologies to create better shopping experiences.,"36,505","Greater New York Area, East Coast, Northeastern US",$1M to $10M,Active,1997-01-01,year,2006-12-08,day,,,For Profit,http://www.cri.com/,"Creative Realities helps retailers and brands use the latest digital technologies to create better shopping experiences. They design, deploy, and manage digital in-store merchandising experiences elevating new looks and themes that inspire shoppers to buy more. They enhance the customer experience and transform a basic signage occasion into a special in-store shopping experience - from digital merchandising, virtual shopping assistants, proximity marketing, mobile activation to social in-store. Customers include Macy's, Rite Aid, Calvin Klein, Adidas, Estee Lauder, Sunglass Hut, Nine West. The New York, New York-located company was founded in 1997.","Advertising, Commerce and Shopping, Sales and Marketing",,,101-250,2,IPO,11490000,USD,11490000,11490000,USD,11490000,,,,5,Public,2006-12-08,,,CREX,https://www.crunchbase.com/ipo/creative-realities-ipo--91d1d6a7,NASDAQ
Advocate Technologies,https://www.crunchbase.com/organization/advocate-technologies,"Finance, Financial Services, Insurance","New York, New York, United States",Advocate Technologies provides insurance compliance services and insurance risk management advice.,"36,507","Greater New York Area, East Coast, Northeastern US",,Active,2020-01-01,year,,,,,For Profit,https://tryadvocate.com/,"Advocate Technologies provides tech-enabled insurance compliance services and insurance risk management advice for lenders and asset managers, helping clients to keep loan portfolios safe. Founded in 2020, the firm is based in New York, United States.",Financial Services,2,"Ashwin Agarwal, Dimitris Psaropoulos",11-50,1,,6600000,USD,6600000,6600000,USD,6600000,Vestigo Ventures,,1,,Private,,,,,,
Zentail,https://www.crunchbase.com/organization/zentail,"E-Commerce, Internet, SaaS, Software","Baltimore, Maryland, United States",Zentail is a SaaS platform for multi-channel online retailers.,"36,512","Greater Baltimore-Maryland Area, East Coast, Southern US",Less than $1M,Active,2011-01-01,year,,,,,For Profit,https://www.zentail.com/,"Zentail is a multichannel ecommerce platform. They provide services that include walmart marketplace integration, programmatic google shopping, order management, catalogue management, multichannel retail, and product information management. Their customers' inquiries are addressed through phone, email, and online applications.","Commerce and Shopping, Internet Services, Software",1,Daniel Sperling-Horowitz,1-10,3,Early Stage Venture,5000000,USD,5000000,5000000,USD,5000000,"Y Combinator, Initialized Capital, FundersClub, Ali Partovi, Kevin Moore",1,7,,Private,,,,,,
Tastemakers Africa,https://www.crunchbase.com/organization/tastemakers-africa-2,"Internet, Leisure, Marketplace, Travel","Brooklyn, New York, United States",Experiences marketplace connecting black millennials to culture and heritage worldwide.,"36,514","Greater New York Area, East Coast, Northeastern US",$1M to $10M,Closed,2014-11-01,month,,,,none,For Profit,https://www.tastemakersafrica.com,"Tastemakers Africa is a NYC-based travel experiences marketplace connecting travelers to creative entrepreneurs in African cities. Currently live in Accra, Cape Town, and Johannesburg, we’ve booked 2,000 experiences for 400+ travelers since launching in November 2018.","Commerce and Shopping, Community and Lifestyle, Internet Services, Travel and Tourism",2,"Cherae Robinson, Jeremiah Myers",1-10,3,Seed,2000000,USD,2000000,2000000,USD,2000000,"XFactor Ventures, Precursor Ventures, CRE Venture Capital, Pipeline Angels, Flybridge",1,8,,Private,,,,,,
Apexa iQ,https://www.crunchbase.com/organization/apexa-iq,"Asset Management, Cyber Security, Information Technology, Software","Milford, Massachusetts, United States","ApexaiQ is a SaaS-based platform that delivers your IT risk score, asset compliance, maintenance, and vulnerability in a single dashboard.","36,520","East Coast, New England, Northeastern US",,Active,2021-01-01,year,,,,,For Profit,https://www.apexaiq.com,,"Financial Services, Information Technology, Privacy and Security, Software",1,Lokesh Aggarwal,51-100,2,Seed,950004,USD,950004,950004,USD,950004,,,,,Private,,,,,,
The Gathering Spot,https://www.crunchbase.com/organization/the-gathering-spot,Hospitality,"Atlanta, Georgia, United States","The Gathering Spot is an invite-only private membership club established to connect a network of creators, disruptors, entrepreneurs.","36,521","Greater Atlanta Area, East Coast, Southern US",$1M to $10M,Active,2014-01-01,year,2022-05-10,day,,,For Profit,https://thegatheringspot.club/,"The Gathering Spot is an invitation only, private membership club redefining the traditional club model & experience.",Travel and Tourism,2,"Ryan Wilson, TK Petersen",11-50,1,M&A,5000000,USD,5000000,5000000,USD,5000000,Valor Ventures,1,1,,Private,,,,,,
Blue Sky Specialty Pharmacy,https://www.crunchbase.com/organization/blue-sky-specialty-pharmacy,"Health Care, Hospital, Pharmaceutical","Mount Pleasant, South Carolina, United States","Blue Sky Specialty Pharmacy leverages technology to expedite the prescription process for patients, physicians, payers.","36,522","East Coast, Southern US",,Active,2015-01-01,year,,,,,For Profit,https://blueskyspecialtypharmacy.com/,"Blue Sky Specialty Pharmacy leverages technology to expedite the prescription process for patients, physicians, payers, and pharmaceutical manufacturers by meeting their specific needs and providing transparent access to necessary medications.",Health Care,,,101-250,1,,10000000,USD,10000000,10000000,USD,10000000,CIT Group,1,1,,Private,,,,,,
Lisa Health,https://www.crunchbase.com/organization/lisa-health,"Health Care, Wellness, Women's","Oakland, California, United States",Lisa Health creates advanced technology solutions for menopause and healthy aging.,"36,523","San Francisco Bay Area, West Coast, Western US",,Active,2020-01-01,year,,,,,For Profit,https://midday.health/,"Midday is an app that leverages AI, sensor technology, and digital therapeutics to support women on their menopause journey using personalized insights that illuminate what is happening physically and emotionally during menopause, providing the right intervention at the right time to manage menopause symptoms and promote healthy aging.","Community and Lifestyle, Health Care",1,Ann Garnier,1-10,3,Seed,2500000,USD,2500000,2755742,USD,2755742,"Mayo Clinic, National Science Foundation, Radical Ventures, SRI International, Broadway Angels",2,7,,Private,,,,,,
Talage,https://www.crunchbase.com/organization/talage-insurance,"Insurance, InsurTech, SaaS, Small and Medium Businesses","Reno, Nevada, United States",Talage provides saas solutions for insurance carriers and agencies to enable the digital distribution of insurance.,"36,527",Western US,$1M to $10M,Active,2015-09-13,day,,,,,For Profit,https://talageins.com,"Talage is focused on powering the digital distribution of P&C insurance for the benefit of insurance carriers, agencies, and small business owners.","Financial Services, Other, Software",3,"Adam Kiefer, Matt Donovan, Zachary Draper",11-50,3,,15500000,USD,15500000,15500000,USD,15500000,"Advantage Capital, Western Technology Investment, Forum Ventures, Calibrate Ventures, Merus Capital",2,9,,Private,,,,,,
Nayya,https://www.crunchbase.com/organization/nayya,"Artificial Intelligence (AI), Employee Benefits, Finance, Health Insurance, InsurTech, Software","New York, New York, United States","Nayya is a benefits experience platform that provides decision support and guidance during enrollment, and new employee onboarding.","36,527","Greater New York Area, East Coast, Northeastern US",$10M to $50M,Active,2019-01-01,year,,,,,For Profit,http://www.nayya.com,"At Nayya, we believe there’s a better way to choose and use benefits. A more transparent, less confusing way for employees to control their health and financial potential. Powered by billions of data points and machine learning, our benefits experience platform delivers personalized decision support and guidance during open enrollment, new employee onboarding, qualifying life events, and in the moments that matter all year round. This is one of the most stressful and challenging situations consumers face – and we see that as an opportunity to build an innovative response that can help millions of Americans possess the control and understanding they deserve. Join the consumers and their employers that are now living with more peace and confidence at Nayya.com.","Administrative Services, Artificial Intelligence (AI), Data and Analytics, Financial Services, Health Care, Science and Engineering, Software",2,"Akash Magoon, Sina Chehrazi",101-250,5,Late Stage Venture,105700000,USD,105700000,105700000,USD,105700000,"Felicis, ICONIQ Growth, (ERA) Entrepreneurs Roundtable Accelerator, Social Leverage, New York Angels",4,18,,Private,,,,,,
Danaher,https://www.crunchbase.com/organization/danaher,"Biotechnology, Health Care, Health Diagnostics, Life Science, Medical","Washington, District of Columbia, United States",Danaher is a global science and technology innovator committed to helping their customers solve complex challenges and improve quality.,"36,528","Washington DC Metro Area, Southern US",$1B to $10B,Active,1969-01-01,year,1979-01-05,day,,,For Profit,https://www.danaher.com/,"Danaher Corporation (Danaher) designs, manufactures and markets professional, medical, industrial and commercial products and services. The Company’s research and development, manufacturing, sales, distribution, service and administrative facilities are located in more than 50 countries. It operates in five segments: Test & Measurement; Environmental; Life Sciences & Diagnostics; Dental; and Industrial Technologies. In April 2011, the Company sold its Pacific Scientific Aerospace (PSA) business.  On June 30, 2011, the Company acquired Beckman Coulter, Inc. (Beckman Coulter). In January 2012, the Company sold its Accu-Sort businesses. In February 2012, the Company sold its Kollmorgen Electro-Optical (KEO) business. During the year ended December 31, 2011, the Company acquired EskoArtwork, On February 6, 2012, L-3 Communications Holdings, Inc. acquired Kollmorgen Electro-Optical unit of the Company.","Biotechnology, Health Care, Science and Engineering",2,"Mitchell P. Rales, Steven Rales",10001+,,IPO,,,,,,,,,,59,Public,1979-01-05,,,DHR,https://www.crunchbase.com/ipo/danaher-ipo--a5417cd6,NYSE - New York Stock Exchange
TCHO,https://www.crunchbase.com/organization/tcho-ventures,"Food and Beverage, Food Processing, Hospitality, Manufacturing, Organic Food","Berkeley, California, United States",TCHO is a production company that produces a wide variety of chocolate products and also offers online services.,"36,529","San Francisco Bay Area, West Coast, Western US",$1M to $10M,Active,2005-01-01,year,2018-02-20,day,,,For Profit,https://tcho.com/,"TCHO is a San Francisco Bay Area based craft chocolate manufacturer.  At TCHO, we're obsessive optimists on a quest to bring better chocolate to the world.  Better for the planet.  Better for the growers.  Better for consumers.  We know chocolate makes people smile...TCHO makes them smile just a little wider.   ","Food and Beverage, Manufacturing, Travel and Tourism",2,"Karl Bittong, Timothy Childs",11-50,6,M&A,12327358,USD,12327358,12327358,USD,12327358,"Emil Capital Partners, MVI (MENA Venture Investments)",1,2,,Private,,,,,,
"The Stable, Part of Accenture Song",https://www.crunchbase.com/organization/the-stable,"Brand Marketing, Consulting, Consumer, Consumer Goods, E-Commerce, E-Commerce Platforms","Minneapolis, Minnesota, United States","The Stable, Part of Accenture Song is a commerce agency helping connect brands + consumers across all channels.","36,531","Greater Minneapolis-Saint Paul Area, Great Lakes, Midwestern US",$10M to $50M,Active,2015-06-01,day,2022-07-13,day,,,For Profit,http://www.thestable.com,"The Stable is a fully integrated commerce agency that helps consumer brands activate and sell product across all channels of commerce. The agency creates value for clients leveraging a full suite of omnichannel capabilities including retail representation, eCommerce services, media campaigns & optimization, brand/product development and insights, to generate revenue for clients across brick and mortar, eCommerce and Direct to Consumer (DTC) channels. The diverse client base combined with integrated capabilities and a flexible service model form a market-leading platform that not only amplifies economic potential for clients, but also ensures they are well positioned for where the future of retail is headed.","Commerce and Shopping, Consumer Goods, Internet Services, Other, Professional Services, Sales and Marketing",3,"Chad Hetherington, Kate Hetherington, Nik Larsen",501-1000,2,M&A,4000000,USD,4000000,4000000,USD,4000000,"Growth Catalyst Partners, Gen7 Investments",2,2,6,Private,,,,,,
ChatLingual,https://www.crunchbase.com/organization/chatlingual,"Enterprise Software, Software","Denver, Colorado, United States",ChatLingual delivers enterprise customer service SaaS solutions in over 100 languages.,"36,533","Greater Denver Area, Western US",$10M to $50M,Active,2013-04-01,day,,,,,For Profit,http://www.chatlingual.com,"ChatLingual enables companies to radically simplify their support teams. Our multichannel service platform empowers each Advisor to be your Best Advisor by removing barriers around language, technical skill set and tribal knowledge. With ChatLingual, Global Fortune 500’s are simplifying staffing models, increasing NPS scores, accelerating entry into new markets and driving efficiency across their customer care, sales, IT and HR support teams.",Software,1,Justin Custer,11-50,5,Early Stage Venture,10019896,USD,10019896,10019896,USD,10019896,"Alumni Ventures, Green D Ventures, Startupbootcamp, Royal Street Ventures, Lewis & Clark Ventures",1,10,,Private,,,,,,
Data Dynamics,https://www.crunchbase.com/organization/data-dynamics,Software,"Teaneck, New Jersey, United States",Data Dynamics is a leader in file management solutions.,"36,540","Greater New York Area, East Coast, Northeastern US",$10M to $50M,Active,2012-01-01,year,,,,,For Profit,https://www.datadynamicsinc.com/,"Data Dynamics is a leader in file management solutions that enable enterprises to analyze, move, manage and modernize data assets across hybrid, cloud and object-based storage infrastructures. StorageX eliminates vendor lock-in and provides a policy-based, storage management platform to empower your business with insight, agility and operational efficiency.",Software,1,Piyush Mehta,51-100,1,Private Equity,9000000,USD,9000000,9000000,USD,9000000,DH Capital,1,1,,Private,,,,,,
Avadim Health,https://www.crunchbase.com/organization/avadim-health,"Biotechnology, Consumer Goods, Health Care, Life Science, Medical","Asheville, North Carolina, United States",Avadim Health is a healthcare and wellness company.,"36,544","East Coast, Southern US",$10M to $50M,Active,2007-01-01,year,2021-08-17,day,,,For Profit,https://avadimhealth.com,"Avadim Technologies is a life sciences company that offers a portfolio of solutions and a strong pipeline across health and wellness areas. Their products improve immune health, neuromuscular health, and skin barrier health.","Biotechnology, Consumer Goods, Health Care, Science and Engineering",1,Stephen Woody,101-250,12,M&A,39625494,USD,39625494,99625494,USD,99625494,"Hayfin Capital Management, VentureSouth",1,2,,Private,,,,,,
Energent,https://www.crunchbase.com/organization/energent-l-p,"Energy, Financial Services, Health Care, Manufacturing, Real Estate, Renewable Energy, Transportation","Fort Worth, Texas, United States","Energent, L.P. is a New York and Dallas-based investment manager.","36,545","Dallas/Fort Worth Metroplex, Southern US",,Active,2016-01-01,year,,,,,For Profit,http://www.nrgnt.com,"Energent, L.P. is a multi-billion dollar investment manager focused on climate-aligned investments in renewable generation assets, energy productivity and efficiency businesses that benefit from a high degree of revenue certainty, as well as rail, shipping and transportation assets (through their credit and leasing platforms).","Energy, Financial Services, Health Care, Manufacturing, Real Estate, Sustainability, Transportation",1,Shane Starr,11-50,1,,2900000000,USD,2900000000,2900000000,USD,2900000000,,,,,Private,,,,,,
Genvision,https://www.crunchbase.com/organization/genvision,"Artificial Intelligence (AI), CleanTech, GreenTech, Machine Learning, Natural Resources, Software, Sustainability","New York, New York, United States",Genvision is an AI-enabled solution to measure carbon storage in natural assets.,"36,550","Greater New York Area, East Coast, Northeastern US",,Active,2022-06-01,month,,,,,For Profit,https://www.genvision.com/,"Genvision measures CO2 removal in nature. By analyzing satellite images of nature with AI, we are solving the world's biggest challenge in its transition to carbon neutrality.","Artificial Intelligence (AI), Data and Analytics, Natural Resources, Science and Engineering, Software, Sustainability",2,"Emiel Cockx, Wout Stienaers",1-10,3,Seed,2300000,USD,2300000,2300000,USD,2300000,"(ERA) Entrepreneurs Roundtable Accelerator, Airborn",,2,,Private,,,,,,
Ashby,https://www.crunchbase.com/organization/ashby,"Human Resources, Management Information Systems, Recruiting, Software","San Francisco, California, United States",Ashby develops recruitment software used for high-growth companies.,"36,553","San Francisco Bay Area, West Coast, Western US",,Active,2018-01-01,year,,,,,For Profit,https://www.ashbyhq.com,"Ashby operates as a developer of recruitment software used for high-growth companies. It develops usable, enterprise-grade employment software that enables company leaders, recruiters, and hiring managers to run their hiring process significantly better.","Administrative Services, Information Technology, Professional Services, Software",2,"Abhik Pramanik, Benjamin Encz",51-100,4,Early Stage Venture,39035107,USD,39035107,39035107,USD,39035107,"Gaingels, Y Combinator, F-Prime Capital, DVC, Caffeinated Capital",3,11,,Private,,,,,,
Certent,https://www.crunchbase.com/organization/certent,"Financial Services, Human Resources, Software","Pleasanton, California, United States","Certent develops a web-based technology that streamlines plan management, financial reporting, and analysis.","36,563","San Francisco Bay Area, West Coast, Western US",$10M to $50M,Closed,2002-01-01,year,2021-01-07,day,,none,For Profit,http://www.certent.com,"Certent, Inc. provides stock plan management software solutions to handle the accounting, tax, administration, and employee transaction needs of the companies. The company offers expert financial reporting and reconciliation services. Its products include Stand-Alone FAS123R Reporting and Compliance for financial and SEC reporting; Premium FAS123R Expert Support and Report Delivery, which provides project management, data verification, running reports based on predetermined parameters, notification delivery reports, access to reports between quarters, accountant support for audits, and database access for assessing what-if scenarios; FAS123R Reporting, Administration, and Employee Self-Service that manages and reports on equity compensation; Certent Sandbox, which is a tool for equity compensation management; and CompXchange that enables the clients to synchronize tax and employee demographic information, and to manage the translation and transfer of data between systems. The company serves public and private companies in the high tech, healthcare, retail, finance, energy, and other industries. Certent, Inc. is formerly known as Equity Administration Solutions, Inc. was founded in 2002 and is based in Pleasanton, California.","Administrative Services, Financial Services, Software",1,Grant Rollin,51-100,2,M&A,21390000,USD,21390000,21390000,USD,21390000,K1 Investment Management,1,1,2,Private,,,,,,
GreenSight,https://www.crunchbase.com/organization/greensight-agronomics,"Agriculture, Analytics, Enterprise, Enterprise Software, Golf, Hardware, Machine Learning, Robotics, Software, Water","Boston, Massachusetts, United States","GreenSight is building the scaleable, enterprise platform for low altitude aerial intelligence.","36,565","Greater Boston Area, East Coast, New England",$1M to $10M,Active,2015-02-20,day,,,,,For Profit,http://greensightag.com,"GreenSight is developing the second generation commercial drone platform. The company's full stack product is an enterprise platform that enables flying autonomous robots at scale. Through a mix of custom hardware and software the platform allows businesses in enterprise and government to get daily low altitude aerial intelligence with zero labor. They combine autonomy, advanced sensors, and data analytics to deliver land managers actionable alerts in agriculture, energy, construction and infrastructure. GreenSight has built and tested its technology providing daily agricultural analytics services to the golf course industry. GreenSight has built a complete digital management solution for golf courses which includes labor management, agronomy planning and aerial intelligence. In golf, the technology can save the industry over $1B annually by reducing water consumption allowing them to save on the costs to buy and pump the 752B gallons of water they use each year. They can save them hundreds of millions more on fungicides, pesticides, and fertilizer while improving course quality and improving staff efficiency.","Agriculture and Farming, Artificial Intelligence (AI), Data and Analytics, Hardware, Natural Resources, Other, Science and Engineering, Software, Sports",2,"James Peverill, Joel Pedlikin",11-50,4,Early Stage Venture,3704001,USD,3704001,3959997,USD,3959997,"National Science Foundation, The Toro Company, Emerald Development Managers, Tabard Venture Capital",2,4,1,Private,,,,,,
Sharpen,https://www.crunchbase.com/organization/sharpen,"Children, Education, Primary Education","Concord, Massachusetts, United States",Sharpen assists all youngsters in reaching their full potential.,"36,566","Greater Boston Area, East Coast, New England",,Active,,,,,,,For Profit,https://www.sharpen.com/,Sharpen assists all youngsters in reaching their full potential.,"Community and Lifestyle, Education",,,,1,Early Stage Venture,11000000,USD,11000000,11000000,USD,11000000,Learn Capital,1,1,,Private,,,,,,
SkillCat,https://www.crunchbase.com/organization/skillcat,"Construction, Information Technology, Recruiting, Telecommunications","San Francisco, California, United States",Our simulator matches skilled trade workers with great companies.,"36,567","San Francisco Bay Area, West Coast, Western US",,Active,2021-01-01,year,,,,,For Profit,https://www.skillcatapp.com,"At SkillCat, we're solving the largest social problem of our time: non-college educated workers do not have access to middle class jobs. Through our virtual simulator, we train & place blue collar workers into high demand skilled trade jobs in construction, telecom, and energy. Workers: Train through our free, online simulation bootcamp and get hired at one of our partner companies! Companies: Use our simulator to assess workers before you hire them","Hardware, Information Technology, Professional Services, Real Estate",1,Ruchir Shah,1-10,3,Seed,6700000,USD,6700000,6700000,USD,6700000,Right Side Capital Management,,1,,Private,,,,,,
National Molding,https://www.crunchbase.com/organization/national-molding,"Chemical, Consumer Electronics, Plastics and Rubber Manufacturing","Miami Lakes, Florida, United States",National Molding specializes in the injection molding segment for precision parts.,"36,568","Greater Miami Area, East Coast, Southern US",$50M to $100M,Active,1964-01-01,year,,,,,For Profit,https://nationalmolding.com/,"National Molding specializes in the injection molding segment for precision parts. The company produces over 3.5 billion parts per year all utilizing highly engineered resins. National Molding’s use of cutting-edge technology supported by its proprietary injection molding process is unmatched. Hetero Cavity injection molding was developed here at National Molding and it continues to be the foundation of its manufacturing processes today. Over 80% of all products produced use the proprietary Hetero Cavity Technology. At National Molding, they produce highly engineered plastic parts to demanding tolerances for world-class, multi-national companies. Over 60% of its products serve Tier 1, Tier 2, and direct OEM automotive customers. The remainder of its business is comprised of Duraflex-USA buckles and fasteners for recreational, pet supplies, and sporting goods markets. It also manufactures and assembles a line of highly technical “release systems” products for the military and law enforcement market.  National Molding is headquartered in Miami Lakes, Florida.","Consumer Electronics, Hardware, Manufacturing, Science and Engineering",2,"Bernie Anscher, Marcia Anscher",251-500,9,,19450000,USD,19450000,19450000,USD,19450000,,,,,Private,,,,,,
