Fasturtle,https://www.crunchbase.com/organization/fasturtle,"Marketing, Search Engine, SEM, Web Design","Scottsdale, Arizona, United States","Fasturtle is a Top 10 Ranked AZ based leading provider of website design, search engine ranking, internet marketing strategy and execution.","774,719","Greater Phoenix Area, Western US",Less than $1M,Active,2000-11-11,day,,,,,For Profit,http://www.fasturtle.com,"Since 2000, we have successfully delivered the most innovative and cost effective tools to expand your brand online. Working with clients in many different industries we have the skills to develop revenue generating solutions while keeping your costs down. Fasturtle has been consistently ranked one of Arizona’s Top 10 Website Design and Internet Marketing Companies by Ranking AZ and the Phoenix Business Journal. With over 16 years of experience, an ""A+"" Rating by BBB and numerous other design and marketing awards including the  esteemed AMA Spectrum Award, Top Web Design Firms by the Arizona Business Journal we proudly offer the highest level of customer service and results oriented internet marketing solutions.","Advertising, Design, Internet Services, Sales and Marketing",,,11-50,,,,,,,,,,,,1,Private,,,,,,
American Easle,https://www.crunchbase.com/organization/american-easle,"E-Commerce, Manufacturing, Wood Processing","Salem, Oregon, United States",American Easle is a manufacturer of artist and display easels.,"774,720","West Coast, Western US",Less than $1M,Active,1992-01-01,year,,,,,For Profit,https://www.americaneasel.com,"American Easle manufactures artist and display easels. They concentrated their efforts on a limited product line, allowing us to develop a manufacturing process that provided a superior level of craftsmanship that exceeded industry standards. They also have an online store where you can buy their products.","Commerce and Shopping, Manufacturing",,,1-10,,,,,,,,,,,,,Private,,,,,,
Lutheran Metropolitan Ministry,https://www.crunchbase.com/organization/lutheran-metropolitan-ministry,"Health Care, Homeless Shelter, Non Profit, Wellness","Cleveland, Ohio, United States","Lutheran Metropolitan Ministry provides health, wellness, and workforce development services.","774,720","Great Lakes, Midwestern US",$1M to $10M,Active,1960-01-01,year,,,,,Non-profit,https://www.lutheranmetro.org,"Lutheran metropolitan ministry consistent dedication to treating chronic needs, helping people to self sufficiency, and fighting for system change enables to empower, value, and heal people they are oppressed, forgotten, and wounded. LMM seeks to change the social, political, and religious conversation about justice from one of limitations to one of possibilities by serving as a facilitator and organizer for meaningful dialogue. LMM develops innovative approaches for persons they are homeless, at risk children, disadvantaged older adults, people touched by the criminal justice system, and people with conduct problems, focusing on housing and shelter, workforce development, and health and wellness services.","Health Care, Other, Social Impact",,,51-100,,,,,,,,,,,,,Private,,,,,,
World Wide Gas Turbine Products,https://www.crunchbase.com/organization/world-wide-gas-turbine-products,"Hardware, Industrial, Manufacturing, Supply Chain Management","Clifton Park, New York, United States","Worldwide Gas Turbine Products is a distribution company that supplies hardware, ignitions, bearings, seals, and steam parts products.","774,720","East Coast, Northeastern US",$1M to $10M,Active,2003-01-01,year,,,,,For Profit,https://www.wwgtp.com,,"Hardware, Manufacturing, Transportation",,,1-10,,,,,,,,,,,,,Private,,,,,,
Holy Angels,https://www.crunchbase.com/organization/holy-angels,"Health Care, Hospital","Belmont, California, United States",Holy Angels provides services for children and adults with intellectual developmental disabilities and medical conditions.,"774,723","San Francisco Bay Area, Silicon Valley, West Coast",$10M to $50M,Active,1955-01-01,year,,,,,For Profit,https://www.holyangelsnc.org,,Health Care,,,101-250,,,,,,,,,,,,,Private,,,,,,
Garden Supply Company,https://www.crunchbase.com/organization/garden-supply-company,"E-Commerce, Gift, Home and Garden, Landscaping","Cary, North Carolina, United States",Garden Supply Company is a landscape and design firm that offers products and installation services.,"774,724","Research Triangle, East Coast, Southern US",$1M to $10M,Active,,,,,,,For Profit,https://www.gardensupplyco.com,,"Commerce and Shopping, Real Estate",,,11-50,,,,,,,,,,,,,Private,,,,,,
MCARBO,https://www.crunchbase.com/organization/mcarbo,"Manufacturing, Outdoors, Sporting Goods","Clearwater, Florida, United States",MCARBO is an outdoor and sporting products firm that manufactures parts for rimfires and shotguns.,"774,724","Tampa Bay Area, East Coast, Southern US",,Active,2012-01-01,year,,,,,For Profit,https://www.mcarbo.com/,,"Commerce and Shopping, Manufacturing, Sports",,,1-10,,,,,,,,,,,,,Private,,,,,,
Elizabeth Seton Children’s,https://www.crunchbase.com/organization/elizabeth-seton-children-s,"Health Care, Hospital, Non Profit, Nursing and Residential Care, Rehabilitation","Yonkers, New York, United States","Elizabeth Seton Children’s is a family of non-profit organizations that offers medical services, nursing, and respiratory care.","774,726","Greater New York Area, East Coast, Northeastern US",$10M to $50M,Active,1988-01-01,year,,,,,Non-profit,https://setonchildrens.org/,"Elizabeth Seton Children's provides care, education, and hope for children with some of the most challenging medical conditions. Their residential medical center is the largest of its kind in the United States, changing lives one child at a time.","Health Care, Other, Social Impact",,,501-1000,,,,,,,,,,,,,Private,,,,,,
Omni Connection International,https://www.crunchbase.com/organization/omni-connection-international,Automotive,"Corona, California, United States",Omni Connection International specializes in wire harnesses for automotive and electronic application that has competitive edge.,"774,727","Greater Los Angeles Area, Inland Empire, West Coast",,Active,1992-01-01,year,2021-05-26,day,,,For Profit,https://www.omni-conn.com,Omni Connection International specializes in wire harnesses for automotive and electronic application that has competitive edge.,Transportation,,,1001-5000,,M&A,,,,,,,,,,,Private,,,,,,
Terregena,https://www.crunchbase.com/organization/terregena,"Biotechnology, Chemical, Organic Food","Raleigh, North Carolina, United States","Terregena provides and sells organic seed, soil, fly, and darkling beetle control products.","774,730","Research Triangle, East Coast, Southern US",$1M to $10M,Active,2006-01-01,year,,,,,For Profit,https://terregena.com/insects-pests-and-disease-control/,,"Biotechnology, Food and Beverage, Science and Engineering",,,1-10,,,,,,,,,,,,,Private,,,,,,
Apollo Concrete Coatings,https://www.crunchbase.com/organization/apollo-concrete-coatings,"Civil Engineering, Construction, Professional Services","New York, New York, United States",Apollo Concrete Coatings offers engineering and construction services focusing on floor coatings and installations.,"774,733","Greater New York Area, East Coast, Northeastern US",$1M to $10M,Active,1976-01-01,year,2022-09-28,day,,,For Profit,https://www.apolloconcretecoatings.com/,,"Other, Real Estate, Science and Engineering",,,1-10,,M&A,,,,,,,,,,,Private,,,,,,
Pivot Lab,https://www.crunchbase.com/organization/pivot-lab,"Advertising, Brand Marketing, Digital Marketing, Graphic Design, Marketing","Seattle, Washington, United States","Pivot Lab is an advertising company that provides marketing, brand strategies, and graphics designing services.","774,740","Greater Seattle Area, West Coast, Western US",$1M to $10M,Active,,,,,,,For Profit,http://www.pivotlab.com,,"Advertising, Design, Sales and Marketing",,,1-10,,,,,,,,,,,,,Private,,,,,,
Great Eastern Group,https://www.crunchbase.com/organization/great-eastern-group,"Marine Technology, Marine Transportation, Telecommunications","Virginia Beach, Virginia, United States",Great Eastern Group is a marine engineering company that provides submarine telecommunications and environmental engineering services.,"774,741","East Coast, Southern US",$10M to $50M,Active,,,,,,,For Profit,https://493.01d.myftpupload.com,"Great Eastern Group is a global marine engineering, offshore power, and fiber optic construction firm specializing in program management, environmental compliance, geophysical surveys, ship management and operations, and marine construction management, installation, and oversight. They are program/project management, engineering services including mechanical, electrical, and architectural services, submarine fiber optic cable system terrestrial, shallow water, and main cable lay and shore and installation operations and contracts to the naval surface weapons center for operation, maintenance, and repair. They have handled the development of cost and technical feasibility studies for various special projects.","Hardware, Science and Engineering, Transportation",,,11-50,,,,,,,,,,,,,Private,,,,,,
WinDoor Quote,https://www.crunchbase.com/organization/windoor-quote,Software,"Omaha, Nebraska, United States",Cloud Based Window and Door Quoting Software,"774,741",Midwestern US,,Active,,,,,,,For Profit,https://www.windoorquote.com/,"Taking the complex and making it simple is our mission. Based in Omaha, Nebraska, WDQ provides cloud based software for window, door, screen, and partition manufacturers. WDQ is a fast, reliable, flexible, and intuitive system that will help your company increase sales and process those sales more accurately and efficiently.  With our extensive hands on experience in manufacturing and sales, we are able to have insightful conversations with our customers, leading to optimal solutions that are achieved in a time and cost-efficient manner.  If you have a configurable product and are looking for an ERP and Quoting software to tie your entire business together under one software system, contact us to find out how we can help.",Software,,,11-50,,,,,,,,,,,,,Private,,,,,,
Carolina Comfort,https://www.crunchbase.com/organization/carolina-comfort,"Commercial, Heating, Ventilation, and Air Conditioning (HVAC), Home Services, Residential","Columbia, South Carolina, United States",Carolina Comfort is a HVAC company that offers air conditioning repair and heater repair services for residential and commercial sectors.,"774,742","East Coast, Southern US",$1M to $10M,Active,1992-01-01,year,2023-03-27,day,,,For Profit,https://carolinacomfortsc.com,Carolina Comfort is an HVAC company that offers air conditioning repair and heater repair services for residential and commercial sectors.,"Other, Real Estate",,,11-50,,M&A,,,,,,,,,,,Private,,,,,,
Heritage Management Services,https://www.crunchbase.com/organization/heritage-management-services-7199,"Assisted Living, Health Care, Nursing and Residential Care, Rehabilitation, Therapeutics","Albuquerque, New Mexico, United States","Heritage Management Services provides assisted living, nursing, rehabilitation, and therapy Services.","774,747",Western US,$1M to $10M,Active,1985-01-01,year,,,,,For Profit,https://www.heritagemsi.com,,Health Care,,,11-50,,,,,,,,,,,,,Private,,,,,,
EEE Consulting,https://www.crunchbase.com/organization/eee-consulting,"Environmental Consulting, Environmental Engineering","Mechanicsville, Virginia, United States",EEE Consulting provides environmental and engineering services.,"774,752","East Coast, Southern US",,Active,1998-01-01,year,2020-12-02,day,,,For Profit,https://www.eee-consulting.com/,EEE Consulting provides environmental and engineering services.,"Professional Services, Science and Engineering, Sustainability",,,51-100,,M&A,,,,,,,,,,,Private,,,,,,
Kopka Pinkus Dolin,https://www.crunchbase.com/organization/kopka-pinkus-dolin,"Consulting, Financial Services, Insurance","Chicago, Illinois, United States","Kopka Pinkus Dolin is a law firm that provides legal services in insurance defense, workers' compensation, and litigation matters.","774,754","Greater Chicago Area, Great Lakes, Midwestern US",$1M to $10M,Active,1987-01-01,year,,,,,For Profit,http://kopkalaw.com,,"Financial Services, Professional Services",,,101-250,,,,,,,,,,,,,Private,,,,,,
Emerge Multimedia,https://www.crunchbase.com/organization/emerge-multimedia,"Advertising, Digital Marketing, Social Media Marketing, Web Design","Mill Spring, North Carolina, United States",Emerge Multimedia is a web design and digital marketing agency.,"774,762","East Coast, Southern US",,Active,2018-01-01,year,,,,,For Profit,https://emergemultimedia.com,"Emerge Multimedia is a digital media company that helps businesses determine where their target audience hangs out online and how to build relationships with them through online marketing. Their services include social media marketing, email marketing, website, and blogging. They also provide eCommerce, video creation, logo design, and graphic design.","Advertising, Design, Sales and Marketing",,,1-10,,,,,,,,,,,,,Private,,,,,,
Kafalgedi,https://www.crunchbase.com/organization/kafalgedi,"E-Commerce, Fashion, Retail, Shoes","Bethel Park, Pennsylvania, United States","Kafalgedi is a fashion designer that sells sarees, lehengas, watches, handbags, and accessories.","774,763","Great Lakes, Northeastern US",$1M to $10M,Active,2020-01-01,year,,,,,For Profit,https://kafalgedi.com,,"Clothing and Apparel, Commerce and Shopping, Consumer Goods, Design",,,11-50,,,,,,,,,,,,,Private,,,,,,
Pacific Living Centers,https://www.crunchbase.com/organization/pacific-living-centers,"Elder Care, Elderly, Medical","Wilsonville, Oregon, United States",Pacific Living Centers offers memory care home services for older adults.,"774,764","West Coast, Western US",$10M to $50M,Active,1990-01-01,year,,,,,For Profit,https://pacificlivingcenters.com,,"Community and Lifestyle, Health Care",,,11-50,,,,,,,,,,,,,Private,,,,,,
Safe Express,https://www.crunchbase.com/organization/safe-express,"Fleet Management, Freight Service, Logistics, Transportation","Erie, Pennsylvania, United States",Safe Express is a truck transportation company that provides freight and logistics services.,"774,765","Great Lakes, Northeastern US",$1M to $10M,Active,2015-01-01,year,,,,,For Profit,https://www.safeexpress1.com/,"Safe Express provides freight, fleet management, and logistics services. They specialize in handling aerospace, automotive, electronics, and healthcare products.",Transportation,,,11-50,,,,,,,,,,,,,Private,,,,,,
West Geauga Board of Education,https://www.crunchbase.com/organization/west-geauga-board-of-education,"Education, Higher Education, Primary Education, Secondary Education","Chesterland, Ohio, United States",West Geauga Local Schools provide a continuum of specialized services for their students with disabilities.,"774,768","Great Lakes, Midwestern US",$10M to $50M,Active,,,,,,,For Profit,https://www.westg.org/,,Education,,,101-250,,,,,,,,,,,,,Private,,,,,,
Sandbox Partners,https://www.crunchbase.com/organization/sandbox-partners,"Human Resources, Recruiting, Staffing Agency","San Francisco, California, United States",Sandbox Partners is a global executive search firm that builds executive teams for growth and venture-backed companies.,"774,768","San Francisco Bay Area, West Coast, Western US",$1M to $10M,Active,2015-01-01,year,,,,,For Profit,https://www.sandboxp.com,"Sandbox Partners is a global executive search firm that builds executive teams for growth and venture-backed companies. We specialize in C-Suite, VP, Director, and IC strategic roles. We help our clients hire for full-time, fractional, and advisory boards.","Administrative Services, Professional Services",2,"David Hughes, Marc Kriger",11-50,,,,,,,,,,,,,Private,,,,,,
The Manahan Group,https://www.crunchbase.com/organization/the-manahan-group,"Advertising, Digital Marketing, Information Technology","Charleston, West Virginia, United States",The Manahan Group is an advertising agency specializing in social media and digital marketing.,"774,769",Southern US,$1M to $10M,Active,2004-01-01,day,,,,,For Profit,http://themanahangroup.com/,,"Advertising, Information Technology, Sales and Marketing",1,George Manahan,11-50,,,,,,,,,,,,,Private,,,,,,
After Dark Grafx,https://www.crunchbase.com/organization/after-dark-grafx,"E-Commerce, Graphic Design, Information Services, Information Technology, Printing, Search Engine, Web Design","San Diego, California, United States","After Dark Grafx  has offered Website Design, Graphic Design, SEO (Search Engine Optimization), Hosting, Ecommerce and Printing services.","774,770","Greater San Diego Area, West Coast, Western US",$1M to $10M,Active,1992-01-01,month,,,,,For Profit,https://www.afterdarkgrafx.com/,"After Dark Grafx - Since 1992 has offered Website Design, Graphic Design, SEO (Search Engine Optimization), Hosting, Ecommerce and Printing services for businesses all over the world. They are Shopify Experts, Miva Experts, Magento Experts, WooCommerce Experts and APP Developers for all devices.","Commerce and Shopping, Content and Publishing, Design, Information Technology, Internet Services, Media and Entertainment",,,1-10,,,,,,,,,,,,,Private,,,,,,
PhatNoise,https://www.crunchbase.com/organization/phatnoise,"Advertising, Automotive, Consumer Electronics, Digital Media","Los Angeles, California, United States",PhatNoise provides digital media solutions that enable individuals to introduce digital content into automobiles for better entertainment.,"774,772","Greater Los Angeles Area, West Coast, Western US",,Closed,1999-01-01,year,2005-08-23,day,,none,For Profit,http://www.phatnoise.com/,"PhatNoise provides digital media solutions that enable individuals to introduce digital content into automobiles to enhance the consumer entertainment experience. It was founded in 1999 and is based in Los Angeles, California.","Advertising, Consumer Electronics, Hardware, Media and Entertainment, Sales and Marketing, Transportation",3,"Dan Benyamin, Dannie Lau, Sharon Graves",11-50,3,M&A,4530000,USD,4530000,4530000,USD,4530000,"Tech Coast Angels, Pasadena Angels, Garage Technology Ventures, Ascend Venture Group",,4,,Private,,,,,,
Allied Inventors,https://www.crunchbase.com/organization/allied-inventors,"Financial Services, Intellectual Property, Venture Capital","Redmond, Washington, United States",Allied Inventors is a venture capital firm that specializes in managing start-up equity investments for various sectors.,"774,775","Greater Seattle Area, West Coast, Western US",$1M to $10M,Active,2007-01-01,year,,,,,For Profit,https://www.alliedinventors.com/,,"Financial Services, Lending and Investments, Professional Services",,,1-10,,,,,,,,,,,,,Private,,,,,,
Elite Home Products,https://www.crunchbase.com/organization/elite-home-products,"Building Material, E-Commerce, Home Improvement","Santa Fe Springs, California, United States","Elite Home Products is a home products company that sells products for the bathroom, kitchen, and outdoors.","774,776","Greater Los Angeles Area, West Coast, Western US",$1M to $10M,Active,,,,,,,For Profit,https://elitehomeproducts.com/,,"Commerce and Shopping, Real Estate",,,11-50,,,,,,,,,,,,,Private,,,,,,
UHS Southern California Medical Education Consortium,https://www.crunchbase.com/organization/uhs-southern-california-medical-education-consortium,"Education, Emergency Medicine, Hospital, Medical","Temecula, California, United States",UHS SoCal MEC develops graduate medical education (GME) residency programs in the California network of UHS acute care hospitals.,"774,776","Greater Los Angeles Area, Inland Empire, West Coast",,Active,2018-01-01,year,,,,,For Profit,https://socalresidency.com,"UHS SoCal MEC develops graduate medical education (GME) residency programs in the California network of UHS acute care hospitals. It offers residency programs in various specialties such as cardiology, emergency medicine, family medicine, general surgery, internal medicine, obstetrics and gynecology, and pulmonary medicine. The rotations are held at five UHS acute care hospitals offering a multitude of clinical specialties. UHS Southern California Medical Education Consortium was established in 2018 and is located in Temecula, California.","Education, Health Care",,,,,,,,,,,,,,,,Private,,,,,,
Lexus of Westminster,https://www.crunchbase.com/organization/lexus-of-westminster,"Automotive, Customer Service, Finance, Retail","Westminster, California, United States","Lexus of Westminster is a Lexus car dealership that provides new and used cars sale, tire, and finance services.","774,777","Greater Los Angeles Area, West Coast, Western US",$10M to $50M,Active,,,,,,,For Profit,https://www.lexuswestminster.com,,"Commerce and Shopping, Financial Services, Other, Professional Services, Transportation",,,11-50,,,,,,,,,,,,,Private,,,,,,
Mount Sopris Instrument Company,https://www.crunchbase.com/organization/mount-sopris-instrument-company,"Energy, Industrial, Manufacturing, Oil and Gas","Denver, Colorado, United States","Mount Sopris Instruments manufactures borehole geophysical logging systems for the groundwater, mining, and oil and gas industries.","774,781","Greater Denver Area, Western US",$1M to $10M,Active,1951-01-01,year,,,,,For Profit,https://mountsopris.com/,,"Energy, Manufacturing, Natural Resources",,,101-250,,,,,,,,,,,,,Private,,,,,,
Fragrance Express,https://www.crunchbase.com/organization/fragrance-express,"Beauty, Cosmetics, Delivery, Shopping","Coconut Creek, Florida, United States","Fragrance Express offers fragrances, skincare, hair care, health, and beauty items.","774,782","Greater Miami Area, East Coast, Southern US",$1M to $10M,Active,1995-01-01,year,,,,,For Profit,https://fragranceexpress.com,"Fragrance Express provides fragrance items such as spray, lotion, spray tester, toilette spray, cosmetic bag, and cream. They offer skincare products such as image prevention, daily hydration, facial moisturizer, tinted face moisturizer, cleanser, serum, and face masque. They provide hair care items such as shampoo, conditioner, and hair keepers. They offer health and beauty items. They carry over 8,000 health and beauty products.","Administrative Services, Commerce and Shopping, Consumer Goods",1,Bob Bartlett,11-50,,,,,,,,,,,,,Private,,,,,,
Tag Aloha Co,https://www.crunchbase.com/organization/tag-aloha-co,"Fashion, Retail","Kailua, Hawaii, United States","Tag Aloha Co. is a lifestyle brand offering a growing array of locally inspired products including bags, pareos, hats, and pillows.","774,782","Asia-Pacific (APAC), Western US",,Active,2013-01-01,year,,,,,For Profit,https://tagaloha.com/,"Tag Aloha Co. is a lifestyle brand offering a growing array of locally inspired products including bags, pareos, hats, and pillows.","Clothing and Apparel, Commerce and Shopping, Design",,,1-10,1,,,,,,USD,,Mana Up,1,1,,Private,,,,,,
CED Elevator & Electrical,https://www.crunchbase.com/organization/ced-elevator-electrical,,"Windsor, Connecticut, United States","CED Elevator & Electrical provides elevator parts and supplies for maintenance, repair, and modernization.","774,786","East Coast, New England, Northeastern US",$1M to $10M,Active,1957-01-01,year,,,,,For Profit,http://www.cedelevator.com,,,,,11-50,,,,,,,,,,,,,Private,,,,,,
HillDay,https://www.crunchbase.com/organization/hillday,"Advertising, Marketing, Public Relations","Houston, Texas, United States",HillDay Public Relations is an independent consulting agency aimed at steering decisions for clients.,"774,788","Greater Houston Area, Southern US",,Active,2010-01-01,year,,,,,For Profit,https://hilldaypr.com,,"Advertising, Sales and Marketing",,,1-10,,,,,,,,,,,,,Private,,,,,,
Underground Performance,https://www.crunchbase.com/organization/underground-performance,"Automotive, Customer Service, Transportation","Anchorage, Alaska, United States",Underground Performance is a vehicle repair shop.,"774,790",Western US,$1M to $10M,Active,2006-04-01,month,,,,,For Profit,https://www.undergroundperformance.us,,"Other, Professional Services, Transportation",,,1-10,,,,,,,,,,,,,Private,,,,,,
Squish,https://www.crunchbase.com/organization/squish,"Collaboration, Project Management, SaaS, Software, Web Development","Washington, District of Columbia, United States",Squish is a software company that flexible to customize projects to collect the exact information needed to effectively resolve issues.,"774,791","Washington DC Metro Area, Southern US",$1M to $10M,Active,,,,,,,For Profit,http://www.squishlist.com,"Squish is a cloud-based project management tool that enables companies to collaborate using any web browser, anytime and anywhere in the world.  No special hardware is required and there is no software to install and maintain. The intuitive interface allows project managers to easily customize projects with fields and layouts that use the same language terms that everyone can understand.     Whether you need a tool to track product development or manage client requests, Squish is equipped with features that help keep projects organized and teams informed:  Squish comes with unlimited projects and unlimited users Automatic e-mail notifications keep team members informed of changes Status tracking and milestone features give real time insight as to what is being done Users can save and share search results Search results can be exported into Excel Calendar tracking allows users to manage time for deadlines Role based permissions allow teams to specify access API feature allows issues to be entered programmatically Squish comes with a free 60 day full featured trial","Administrative Services, Other, Software",,,1-10,,,,,,,,,,,,,Private,,,,,,
