Jenson Logistics,https://www.crunchbase.com/organization/jenson-logistics,"Freight Service, Logistics, Transportation","South Pasadena, California, United States",Jenson Logistics is a shipping company that offers freight services.,"1,008,743","Greater Los Angeles Area, West Coast, Western US",$1M to $10M,Active,2006-01-01,year,,,,,For Profit,https://jensonlogistics.com,"Jenson Logistics offers customs brokerage, US retail compliance, and eCommerce fulfillment services. They provide international and domestic freight services that are air, ocean, inland transportation, DHL parcel express, trucking, drayage, and rail.",Transportation,,,11-50,,,,,,,,,,,,,Private,,,,,,
Glasshopper Services Inc.,https://www.crunchbase.com/organization/glasshopper-services-inc,"Financial Services, Human Resources, Management Consulting","Los Angeles, California, United States",Glasshopper Services Inc. is a back office partners company.,"1,008,744","Greater Los Angeles Area, West Coast, Western US",$1M to $10M,Active,2017-01-01,year,,,,,For Profit,https://www.glasshopperinc.com,"Glasshopper Services Inc. partners with growing companies to manage the entire accounting, back office administration, and finance department. We help leaders model and understand their company's financials, budget and forecast for growth, and set up scalable infrastructure.  We work side by side with your team to take the headache away from day to day accounting and finance management, a/p and a/r workflows, and to help your team make well-informed decisions and focus on your core competencies.   Services include: • Fractional CFO / Fractional Controller • Financial modeling and analysis • Annual and quarterly planning • Cash flow forecasting • Budgeting and variance analysis • Accounts receivable and accounts payable management","Administrative Services, Financial Services, Professional Services",,,1-10,,,,,,,,,,,,,Private,,,,,,
Stephen P Beals,https://www.crunchbase.com/organization/stephen-p-beals,"Beauty, Cosmetic Surgery, Cosmetics, Health Care, Wellness","Paradise Valley, Arizona, United States","Stephen P Beals provides cosmetic surgery, laser procedure, and related treatments for the body and skin along with beauty products.","1,008,744","Greater Phoenix Area, Western US",$1M to $10M,Active,1986-01-01,year,,,,,For Profit,https://www.bealsmd.com/,,"Consumer Goods, Health Care",,,11-50,,,,,,,,,,,,,Private,,,,,,
AdoramaPix,https://www.crunchbase.com/organization/adoramapix,"Photo Editing, Photography, Printing","Brooklyn, New York, United States",AdoramaPix is a provides highest-quality printing service company.,"1,008,745","Greater New York Area, East Coast, Northeastern US",,Closed,1997-01-01,day,,,,none,For Profit,http://www.adoramapix.com/,,"Content and Publishing, Media and Entertainment",,,,,,,,,,,,,,,,Private,,,,,,
Columbus Behavioral Center,https://www.crunchbase.com/organization/columbus-behavioral-center,"Health Care, Mental Health, Therapeutics","Columbus, Ohio, United States","Columbus Behavioral Center is a mental healthcare center that treats psychiatric, emotional, and behavioral health problems in children.","1,008,746","Great Lakes, Midwestern US",$1M to $10M,Active,,,,,,,For Profit,https://columbusbehavioral.com,,Health Care,,,101-250,,,,,,,,,,,,,Private,,,,,,
Intertwined Events,https://www.crunchbase.com/organization/intertwined-events,Events,"Irvine, California, United States",Intertwined Events is a 100% volunteer run organization offering an awesome camp experience for hundreds of adults and children .,"1,008,747","Greater Los Angeles Area, West Coast, Western US",$1M to $10M,Active,2015-01-01,day,,,,,Non-profit,https://www.intertwinedevents.com,,"Events, Media and Entertainment",,,11-50,,,,,,,,,,,,,Private,,,,,,
Poling,https://www.crunchbase.com/organization/poling,"Advice, Consulting, Health Care, Law Enforcement, Legal","Columbus, Ohio, United States","Poling is a law firm that provides a wide range of legal advisory services in construction, business, healthcare, employment, and insurance.","1,008,753","Great Lakes, Midwestern US",$1M to $10M,Active,2009-01-01,year,,,,,For Profit,https://poling-law.com,,"Government and Military, Health Care, Media and Entertainment, Privacy and Security, Professional Services",,,11-50,,,,,,,,,,,,,Private,,,,,,
Zergratran,https://www.crunchbase.com/organization/zergratran,Civil Engineering,"Fort Lauderdale, Florida, United States",Zergratran is a high-capacity transportation company that is both innovative and sustainable.,"1,008,754","Greater Miami Area, East Coast, Southern US",,Active,2018-01-01,year,,,,,For Profit,https://www.zergratran.com,"Zergratran is a high-capacity transportation company that is building the world's first tunnel to expedite goods shipping between the North Atlantic and the North Pacific. As a result, it will provide faster, smarter, safer, and less expensive alternatives to existing alternatives.",Science and Engineering,,,1-10,,,,,,,,,,,,,Private,,,,,,
Hudson River Housing,https://www.crunchbase.com/organization/hudson-river-housing,"Elder Care, Health Care, Homeless Shelter, Non Profit","Poughkeepsie, New York, United States",Hudson River Housing is a non-profit organization that provides housing assistance and elder care services.,"1,008,756","Greater New York Area, East Coast, Northeastern US",$1M to $10M,Active,,,,,,,Non-profit,https://www.hudsonriverhousing.org,,"Health Care, Other, Social Impact",,,51-100,,,,,,,,,,,,,Private,,,,,,
"Upchurch, Bailey, and Upchurch",https://www.crunchbase.com/organization/upchurch-bailey-and-upchurch,"Consulting, Law Enforcement, Legal","Saint Augustine, Florida, United States","Upchurch, Bailey, and Upchurch is a law firm that specializes in banking, commercial lending, education, environmental, and business laws.","1,008,759","East Coast, Southern US",$1M to $10M,Active,1925-01-01,month,,,,,For Profit,https://ubulaw.com,,"Government and Military, Privacy and Security, Professional Services",,,11-50,,,,,,,,,,,,,Private,,,,,,
Smart Tools,https://www.crunchbase.com/organization/smart-tools-0da8,"E-Commerce, Medical Device, Sporting Goods","Strongsville, Ohio, United States",Smart Tools is an online store that provides medical equipment and sporting goods online.,"1,008,762","Great Lakes, Midwestern US",,Active,2014-01-01,year,,,,,For Profit,https://smarttoolsplus.com,,"Commerce and Shopping, Health Care, Sports",,,11-50,,,,,,,,,,,,,Private,,,,,,
Yosemite Valley Beef Packing Company,https://www.crunchbase.com/organization/yosemite-valley-beef-packing-company,"Food and Beverage, Food Processing, Packaging Services, Wholesale","Merced, California, United States","Yosemite Valley Beef Packing Company is a meat processing company, specializing in organic Black Angus and Wagyu cows.","1,008,763","West Coast, Western US",$10M to $50M,Active,,,,,,,For Profit,https://yvbeef.com,,"Administrative Services, Commerce and Shopping, Food and Beverage",,,51-100,,,,,,,,,,,,,Private,,,,,,
ProStead Realty,https://www.crunchbase.com/organization/prostead-realty,"Property Management, Real Estate","Charlotte, North Carolina, United States",ProStead Realty is a full-service real estate firm that provides buying & selling of property services.,"1,008,765","East Coast, Southern US",$100M to $500M,Active,2009-01-01,year,,,,,For Profit,https://www.prostead.com,,Real Estate,,,51-100,,,,,,,,,,,,,Private,,,,,,
Suffolk Cold Storage,https://www.crunchbase.com/organization/suffolk-cold-storage,"Facility Management, Industrial, Warehousing","Suffolk, Virginia, United States",Suffolk Cold Storage provides cold storage facilities and warehousing services.,"1,008,765","East Coast, Southern US",$1M to $10M,Active,2001-01-01,year,,,,,For Profit,https://www.suffolkcoldstorage.com,,"Manufacturing, Real Estate, Transportation",,,,,,,,,,,,,,,,Private,,,,,,
Michigan Association of United Ways,https://www.crunchbase.com/organization/michigan-association-of-united-ways,"Social Assistance, Wellness","Lansing, Michigan, United States",Michigan Association of United Ways is a non profit agency that brings about positive change through policy influence and capacity building.,"1,008,766","Great Lakes, Midwestern US",$1M to $10M,Active,1947-01-01,year,,,,,Non-profit,https://www.uwmich.org,,"Government and Military, Health Care",,,1-10,,,,,,,,,,,,,Private,,,,,,
Othús Perfumery,https://www.crunchbase.com/organization/othús-perfumery,"Beauty, Consumer Goods, Fashion, Wholesale","Decatur, Georgia, United States","Othús Perfumery sells perfume, solid perfume, and body oil products.","1,008,768","Greater Atlanta Area, East Coast, Southern US",$1M to $10M,Active,2019-01-01,year,,,,,For Profit,https://othusperfumery.com,,"Clothing and Apparel, Commerce and Shopping, Consumer Goods, Design",,,11-50,,,,,,,,,,,,,Private,,,,,,
Performance Label Company,https://www.crunchbase.com/organization/performance-label-company,"Printing, Wholesale","Lubbock, Texas, United States",Performance Label Company is wholesale label company in USA.,"1,008,769",Southern US,$1M to $10M,Active,1983-01-01,year,,,,,For Profit,https://www.plctx.com,"Performance Label Company Wholesale manufacturers provide you with all kinds of quality custom labels for various needs of your business. We specialize in custom wholesale label printing such as computer labels, shipping labels, product labels, and warning labels. 4-day and 3-day rush services are offered. You can expect delivery of your order within the expected turnaround time, thanks to the high speed and quality of our printing processes. We Offer: Custom label printing, Custom sticker printing, Wholesale computer label printing Die cut label printing, Cut to size business stickers printing, Promotional cut to-size stickers printing, Pressure-sensitive label printing, Wholesale label printing, Wholesale product labels printing, Wholesale bar code label printing, Digital label printing We strive to keep up with the most modern up-to-date technology in the industry so we may continue to sell custom labels at a price that allows our dealers to make a good profit.","Commerce and Shopping, Content and Publishing, Media and Entertainment",,,1-10,,,,,,,,,,,,,Private,,,,,,
Roy Talman & Associates,https://www.crunchbase.com/organization/roy-talman-associates,"Human Resources, Management Consulting, Recruiting, Staffing Agency","Chicago, Illinois, United States",Roy Talman & Associates is devoted to connecting the top financial trading companies with appropriate investment and business opportunities.,"1,008,774","Greater Chicago Area, Great Lakes, Midwestern US",$1M to $10M,Active,1982-01-01,year,,,,,For Profit,https://roytalman.com/,"Roy Talman & Associates offers recruitment services for candidates working for the top financial and technical companies. In addition, they have assisted in advancing their careers by placing them in jobs crucial to their advancement and/or helping them hire people crucial to the success of their teams and organizations. Through many years of collaboration, there is enormous respect and trust between them. In order to prepare candidates they work with for entering the job market, they believe a substantial level of effort must be put into preparing them before they are sent resumes and scheduled for interviews.","Administrative Services, Professional Services",1,Ilya Talman,11-50,,,,,,,,,,,,,Private,,,,,,
Johnson Jones Group,https://www.crunchbase.com/organization/johnson-jones-group,"Advertising, Digital Marketing, SEO, UX Design, Web Design","Minneapolis, Minnesota, United States","Johnson Jones Group is a digital marketing agency offering web design, SEO, and ads management, with a focus on wedding venue marketing.","1,008,777","Greater Minneapolis-Saint Paul Area, Great Lakes, Midwestern US",$1M to $10M,Active,2015-01-01,year,,,,,For Profit,https://johnsonjonesgroup.com,"Johnson Jones Group is a digital marketing agency that offers a range of services including web design, search engine optimization (SEO), and ads management. The company specializes in creating complete marketing systems for businesses, with a particular focus on wedding venue marketing. They provide tailored solutions to help businesses grow their brand, by combining keywords that users are searching for with those that the business already ranks for. In addition, Johnson Jones Group offers custom services to help businesses manage their digital marketing systems more efficiently, freeing up time for them to focus on their core operations.","Advertising, Design, Internet Services, Sales and Marketing",,,1-10,,,,,,,,,,,,,Private,,,,,,
Air Sea Containers,https://www.crunchbase.com/organization/air-sea-containers,"Packaging Services, Service Industry, Transportation","Miami, Florida, United States",Air Sea Containers provides goods transportation and packaging services.,"1,008,777","Greater Miami Area, East Coast, Southern US",$1M to $10M,Active,1991-01-01,year,,,,,For Profit,https://www.airseacontainers.com,,"Administrative Services, Other, Transportation",,,11-50,,,,,,,,,,,,,Private,,,,,,
Sysco New Mexico,https://www.crunchbase.com/organization/sysco-new-mexico,"Food and Beverage, Food Delivery, Food Processing","Albuquerque, New Mexico, United States","Sysco New Mexico is a foodservice distributor firm that sells, markets, and distributes food to restaurants, hospitals, and schools.","1,008,778",Western US,$100M to $500M,Active,2002-01-01,year,,,,,For Profit,https://www.sysco.com/Contact/Contact/Our-Locations/New-Mexico,,"Food and Beverage, Transportation",,,251-500,,,,,,,,,,,,,Private,,,,,,
Barefoot Resort,https://www.crunchbase.com/organization/barefoot-resort,"Events, Packaging Services, Resorts","North Myrtle Beach, South Carolina, United States",Barefoot Resort is a golf resort that offers venue for weddings and events.,"1,008,779","East Coast, Southern US",$10M to $50M,Active,2000-01-01,year,,,,,For Profit,http://barefootgolf.com,"Barefoot Resort is able to create the best all-inclusive golf packages Myrtle Beach has to offer. they provide a variety of golf packages, including Barefoot Golf Packages.","Administrative Services, Events, Media and Entertainment, Travel and Tourism",,,51-100,,,,,,,,,,,,,Private,,,,,,
Collins Brothers,https://www.crunchbase.com/organization/collins-brothers,"Commercial, Self-Storage, Warehousing","Larchmont, New York, United States","Collins Brothers provides warehousing, residential, and commercial moving services.","1,008,784","Greater New York Area, East Coast, Northeastern US",,Active,1910-01-01,year,,,,,For Profit,https://www.collinsbros.com,"Collins Brothers offers small shipment solutions, government, and restoration services. They provide services that include warehousing, storage, local, residential, and commercial moving. An online inquiry form is available on the company's website.","Other, Real Estate, Transportation",1,Frank Webers,251-500,,,,,,,,,,,,,Private,,,,,,
Ameri-Seal,https://www.crunchbase.com/organization/ameri-seal,"Manufacturing, Packaging Services, Printing","Valencia, California, United States",Ameri-Seal provides shrink sleeves and flexible packaging services.,"1,008,786","Greater Los Angeles Area, West Coast, Western US",$10M to $50M,Active,1997-01-01,year,,,,,For Profit,https://www.ameri-seal.com,,"Administrative Services, Content and Publishing, Manufacturing, Media and Entertainment",,,51-100,,,,,,,,,,,,,Private,,,,,,
Heavy Construction Contractors Association,https://www.crunchbase.com/organization/heavy-construction-contractors-association,"Association, Civil Engineering, Construction, Non Profit, Training","Manassas, Virginia, United States",Heavy Construction Contractors Association is a nonprofit organization comprised of infrastructure contractors and related firms.,"1,008,787","Washington DC Metro Area, East Coast, Southern US",$1M to $10M,Active,1957-01-01,year,,,,,Non-profit,https://hcca.net,,"Education, Other, Real Estate, Science and Engineering, Social Impact",,,1-10,,,,,,,,,,,,,Private,,,,,,
Harry P. Leu Gardens,https://www.crunchbase.com/organization/harry-p-leu-gardens,"Events, Government, Recreation, Training","Orlando, Florida, United States","Harry P. Leu Gardens organises scout summer camps, weddings, and private events.","1,008,790","East Coast, Southern US",$1M to $10M,Active,1961-01-01,year,,,,,For Profit,https://www.leugardens.org,,"Education, Events, Government and Military, Media and Entertainment, Sports",,,11-50,,,,,,,,,,,,,Private,,,,,,
Abbeville Press,https://www.crunchbase.com/organization/abbeville-press,Publishing,"New York, New York, United States",Abbeville Press is an independent publisher of timeless fine art and illustrated books.,"1,008,792","Greater New York Area, East Coast, Northeastern US",,Active,1977-01-01,year,,,,,For Profit,https://www.abbeville.com/,,"Content and Publishing, Media and Entertainment",,,11-50,,,,,,,,,,,,,Private,,,,,,
Pacific Food Distributors,https://www.crunchbase.com/organization/pacific-food-distributors,"Food and Beverage, Fruit, Wholesale","Clackamas, Oregon, United States",Pacific Food Distributors is a food service distribution company.,"1,008,793","West Coast, Western US",$1M to $10M,Active,1973-01-01,year,,,,,For Profit,https://pacfoods.com,"Pacific Food Distributors is a seller of fruits and vegetables. They distribute to meat markets, supermarkets, and food distributors. They wholesale food products and non-foods. Their contact is done through phone calls, emails, and online applications.","Commerce and Shopping, Food and Beverage",,,11-50,,,,,,,,,,,,,Private,,,,,,
Ny Casa Group,https://www.crunchbase.com/organization/ny-casa-group,"Communities, Leasing, Property Management, Real Estate, Sales","Brooklyn, New York, United States",Ny Casa Group is a digital resource for buying and selling homes.,"1,008,794","Greater New York Area, East Coast, Northeastern US",Less than $1M,Active,2007-01-01,year,,,,,For Profit,https://www.nycasagroup.com,"NYCG is a specialized real estate brokerage dedicated to providing the best service in the industry. They offer turnkey investment property. They recognize the time and effort required for each transaction, which is why they devote so much time to visiting new properties, researching the market, and forming new relationships.","Community and Lifestyle, Financial Services, Real Estate, Sales and Marketing",,,1-10,,,,,,,,,,,,,Private,,,,,,
True Service Connect,https://www.crunchbase.com/organization/true-service-connect,"Commercial, Home Services, Smart Home, VoIP","San Antonio, Texas, United States","True Service Connect offers video surveillance, automation, VOIP, and home security services for the residential and commercial sectors.","1,008,797",Southern US,$1M to $10M,Active,2017-01-01,year,,,,,For Profit,https://www.trueserviceconnect.com,,"Consumer Electronics, Information Technology, Internet Services, Messaging and Telecommunications, Other, Real Estate",,,11-50,,,,,,,,,,,,,Private,,,,,,
Garrison Family Medical Group,https://www.crunchbase.com/organization/garrison-family-medical-group,"Health Care, Hospital, Primary and Urgent Care, Therapeutics, Wellness","Palmdale, California, United States","Garrison Family Medical Group provides bali med spa, urgent care, and preventative health services.","1,008,800","Greater Los Angeles Area, West Coast, Western US",$1M to $10M,Active,1985-01-01,year,,,,,For Profit,https://garrisonfamilymedicalgroup.com,"Garrison Family Medical Group offers preventative health and illness treatment. They provide pain,  men's health, women health, pediatric care, aging,  cognitive health, injuries, illness, preventative health, cognitive testing, arthritis, bone density, and hearing loss issues. An online inquiry form is available on the company's website.",Health Care,1,Ric Garrison,11-50,,,,,,,,,,,,,Private,,,,,,
Corrotec,https://www.crunchbase.com/organization/corrotec,"Industrial, Industrial Engineering, Manufacturing","Springfield, Ohio, United States","Corrotec specializes in turnkey, sidearm, overhead transporter systems, automation ventilations, tanks, and water treatment products.","1,008,801","Great Lakes, Midwestern US",$10M to $50M,Active,1981-01-01,year,,,,,For Profit,https://www.corrotec.com/,,"Manufacturing, Science and Engineering",,,11-50,,,,,,,,,,,,,Private,,,,,,
Perch,https://www.crunchbase.com/organization/perch-f4a7,"Graphic Design, Information Technology, Internet, Software, UX Design, Web Design, Web Development","Little Rock, Arkansas, United States","Perch works with a strong portfolio of local clients, with a focus on digital product design and development services.","1,008,804",Southern US,,Active,2014-02-05,day,2022-11-17,day,,,For Profit,https://www.workwithperch.com,"Perch works with a strong portfolio of local clients, with a focus on digital product design and development services.","Design, Information Technology, Internet Services, Software",,,1-10,,M&A,,,,,,,,,,,Private,,,,,,
Connecteriors,https://www.crunchbase.com/organization/connecteriors,"Electronics, Lighting, Smart Home, Technical Support","Northbrook, Illinois, United States","Connecteriors is a technology solutions provider concentrating on motorized window treatment, automation, and security integration services.","1,008,805","Greater Chicago Area, Great Lakes, Midwestern US",Less than $1M,Active,2000-01-01,year,,,,,For Profit,https://www.connecteriors.com,,"Consumer Electronics, Hardware, Information Technology, Other, Real Estate",,,11-50,,,,,,,,,,,,,Private,,,,,,
Left Field NYC,https://www.crunchbase.com/organization/left-field-nyc,"E-Commerce, Retail","Ridgewood, New York, United States",Left Field NYC is an online clothing store.,"1,008,805","Greater New York Area, East Coast, Northeastern US",,Active,1998-01-01,day,,,,,For Profit,https://leftfieldnyc.com/,,Commerce and Shopping,,,,,,,,,,,,,,,,Private,,,,,,
PLM Lake & Land Management,https://www.crunchbase.com/organization/plm-lake-land-management,Environmental Consulting,"Brainerd, Minnesota, United States",A woman-owned and operated small business whose goal for over thirty years has been to protect your property from the aesthetic.,"1,008,806","Great Lakes, Midwestern US",$10M to $50M,Active,1979-01-01,year,,,,,For Profit,https://www.plmcorp.net/,"American, woman-owned and operated small business whose goal for over thirty years has been to protect your property from the aesthetic and economic damage caused by invasive plant species. They provide a team of expert biologists, foresters, ecologists and managers to evaluate your environment, prioritize existing problems and develop plans to prevent new infestations. PLM offers a variety of watershed management tools, products and services including lake and pond surveys, vegetation mapping (AVAS), invasive species management plans, herbicide and algaecide applications for aquatic and terrestrial species, bathymetric mapping, water quality testing, aquatic harvesting, aeration / fountains, fish assessments, and right of way (ROW) management. Their company also caters to the invasive plant and algae control needs of power generation companies. Their proven watershed management cycle “Evaluate, Prescribe, Implement” assures constant care and follow-up measures for each customer. PLM Lake & Land Management Corp. (formerly “Professional Lake Management”) has locations in four states: Michigan, Minnesota, North Carolina, and South Carolina.",Professional Services,,,101-250,,,,,,,,,,,,,Private,,,,,,
Transworld Business Advisors,https://www.crunchbase.com/organization/transworld-business-advisors-6a17,"Business Development, Franchise, Fraud Detection","Fort Lauderdale, Florida, United States",Transworld Business Advisors is a franchising service company located in Fort Lauderdale.,"1,008,807","Greater Miami Area, East Coast, Southern US",,Active,1979-01-01,day,,,,,For Profit,https://tworldfranchise.com/,,"Financial Services, Other, Payments, Privacy and Security, Professional Services",1,Andrew Cagnetta,251-500,,,,,,,,,,,,,Private,,,,,,
Best Seller Publishing,https://www.crunchbase.com/organization/best-seller-publishing,Publishing,"Pasadena, California, United States","Best Seller Publishing helps Entrepreneur, Business Owners and Authors become Amazon Best Selling Authors.","1,008,808","Greater Los Angeles Area, West Coast, Western US",Less than $1M,Active,2014-01-01,year,,,,,For Profit,http://bestsellerpublishing.org/,,"Content and Publishing, Media and Entertainment",,,11-50,,,,,,,,,,,,,Private,,,,,,
Citizens Fidelity Insurance,https://www.crunchbase.com/organization/citizens-fidelity-insurance,"Consulting, Financial Services, Insurance","Little Rock, Arkansas, United States","Citizens Fidelity Insurance delivers life insurance, pre-funeral planning and consulting services.","1,008,809",Southern US,$1M to $10M,Active,1969-12-31,day,,,,,For Profit,https://www.citizensfidelityinsurance.com/,,"Financial Services, Professional Services",,,,,,,,,,,,,,,,Private,,,,,,
nQuery Telecom Solutions,https://www.crunchbase.com/organization/nquery-telecom-solutions,Telecommunications,"Miami, Florida, United States",nQuery Telecom Solutions is a telecom consulting firm.,"1,008,810","Greater Miami Area, East Coast, Southern US",$1M to $10M,Active,1999-01-01,day,2023-10-30,day,,,For Profit,https://nquerysolutions.com/,nQuery Telecom Solutions is a telecom consulting  firm.,Hardware,,,1-10,,M&A,,,,,,,,,,,Private,,,,,,
