Greeter,https://www.crunchbase.com/organization/greeter,"Event Management, Online Portals, Software","Los Angeles, California, United States",Greeter is an online platform for digital event management services.,"537,730","Greater Los Angeles Area, West Coast, Western US",,Active,,,,,,,For Profit,https://greeter.co,,"Events, Internet Services, Media and Entertainment, Software",,,1-10,,,,,,,,,,,,,Private,,,,,,
Poly Prep Country Day School,https://www.crunchbase.com/organization/poly-prep-country-day-school,,"Brooklyn, New York, United States","Founded in 1854, Poly Prep Country Day School has a distinguished legacy of educational success.","537,731","Greater New York Area, East Coast, Northeastern US",,Active,1854-01-01,year,,,,,For Profit,http://www.polyprep.org,,,,,,,,,,,,,,,,,,Private,,,,,,
Avalon International Aluminum,https://www.crunchbase.com/organization/avalon-international-aluminum,"Home Improvement, Home Renovation, Innovation Management, Interior Design, Manufacturing","Tualatin, Oregon, United States",Avalon International Aluminum is a manufacturing company that produces and fabricates aluminum interior door frames and glazing components.,"537,731","West Coast, Western US",$1M to $10M,Active,1979-01-01,year,,,,,For Profit,https://avalonint.com/,,"Design, Manufacturing, Professional Services, Real Estate",,,11-50,,,,,,,,,,,,,Private,,,,,,
CannaFundr,https://www.crunchbase.com/organization/cannafundr-2,"Cannabis, Communities, Crowdfunding, Internet","Chicago, Illinois, United States",Premiere online crowdfunding platform dedicated to cannabis,"537,732","Greater Chicago Area, Great Lakes, Midwestern US",Less than $1M,Active,2014-01-01,year,,,,,For Profit,http://www.cannafundr.com,"CannaFundr networks give us access to 1000s of accredited investors, many of whom have already made investments in this sector. Why spend time and money travelling around the country to pitch at conferences and events searching for key strategic investors? Pitch once on CannaFundr - and get heard around the world! CannaFundr is owned and operated by CrowdFund Connect, Inc. (CFC), an industry leader in development and management of crowdfunding sites. CFC is a leader in equity based crowdfunding providing site development, logistics and back office support to new and existing registered broker dealers. CFC is led by industry experts in online capital funding that know and understand the laws both federally and in each state for equity funding and the marijuana industry.","Community and Lifestyle, Financial Services, Food and Beverage, Health Care, Internet Services",,,1-10,,,,,,,,,,,,,Private,,,,,,
Tact Product Development,https://www.crunchbase.com/organization/tact-product-development,"Manufacturing, Mechanical Engineering, Product Design","Palo Alto, California, United States","Tact is a product development, engineering and manufacturing firm.","537,733","San Francisco Bay Area, Silicon Valley, West Coast",$1M to $10M,Active,2003-01-01,year,,,,,For Profit,https://www.tactpd.com/,"Tact is a product development, engineering and manufacturing firm with a devotion to design and the expertise to bring it to fruition. They work with the finest industrial design firms, creative start-ups, and leading corporations to develop a broad range of innovative products from consumer electronics to baby strollers to highly-stylized commercial products. At Tact, when they complete a project it doesn’t just look good—it works and feels great too.","Design, Manufacturing, Science and Engineering",,,11-50,,,,,,,,,,,,,Private,,,,,,
Davis Marketing Company,https://www.crunchbase.com/organization/davis-marketing-company,"Advertising, Brand Marketing, Email Marketing, Graphic Design, Social Media Marketing, Web Design, Web Development","Statesboro, Georgia, United States","Davis Marketing Company is a marketing agency that focuses on web development, social media marketing, branding and graphic design.","537,736","East Coast, Southern US",$1M to $10M,Active,2010-02-01,month,,,,,For Profit,https://davismarketingcompany.com/,,"Advertising, Design, Sales and Marketing, Software",,,1-10,,,,,,,,,,,,,Private,,,,,,
Nonprofit Hub,https://www.crunchbase.com/organization/nonprofit-hub,"Association, Consulting, Non Profit","Grand Rapids, Michigan, United States","Nonprofit Hub is a nonprofit organization that works to educate nonprofits about marketing, fundraising, and social media.","537,738","Great Lakes, Midwestern US",$1M to $10M,Active,2011-01-01,year,,,,,For Profit,https://nonprofithub.org/,,"Other, Professional Services, Social Impact",,,1-10,,,,,,,,,,,,,Private,,,,,,
Irex Corporation,https://www.crunchbase.com/organization/irex-corporation,Manufacturing,"Lancaster, Pennsylvania, United States","Irex Corporation is an industrial, commercial and specialty contracting company.","537,742","Great Lakes, Northeastern US",$100M to $500M,Active,1969-01-01,day,,,,,For Profit,http://irexcontracting.com,,Manufacturing,,,1001-5000,,,,,,,,,,,,,Private,,,,,,
Communications Engineering Company,https://www.crunchbase.com/organization/communications-engineering-company,"Education, Information Technology, Security","Hiawatha, Iowa, United States","Communications Engineering Company is an IT company that offers design, integration, and technical services.","537,743",Midwestern US,$10M to $50M,Active,1946-01-01,day,,,,,For Profit,https://www.cecinfo.com/,"Communications Engineering Company has evolved from a small two-way radio shop into a nationally recognized technology integrator with nine offices across Iowa, Wisconsin, and Minnesota. Its success is driven by its mission: to create world-class technology experiences that improve the lives of our people and partners. It combines alignment with manufacturers that offer the best solutions in the industry along with in-house experts on staff who effectively lead technical and custom integrations.","Education, Information Technology, Privacy and Security",,,101-250,,,,,,,,,,,,,Private,,,,,,
Power Distributing,https://www.crunchbase.com/organization/power-distributing,"Logistics, Professional Services, Supply Chain Management","Elmhurst, Illinois, United States","Power Distributing offers direct store distributor in Illinois, northern Indiana and southwest Michigan for Red Bull.","537,746","Greater Chicago Area, Great Lakes, Midwestern US",,Active,2000-01-01,year,,,,,For Profit,https://powerdist.net/,,"Other, Transportation",,,101-250,,,,,,,,,,,,,Private,,,,,,
Invincible,https://www.crunchbase.com/organization/invincible,Manufacturing,"Opa Locka, Florida, United States",Invincible manufactures and sells high-performance semi-custom saltwater fishing boats.,"537,747","Greater Miami Area, East Coast, Southern US",,Active,2006-01-01,year,2019-07-15,day,,,For Profit,https://invincibleboats.com,Invincible manufactures and sells high-performance semi-custom saltwater fishing boats.,Manufacturing,,,251-500,,M&A,,,,,,,,,,,Private,,,,,,
cigfinancial.com,https://www.crunchbase.com/organization/cigfinancial-com,"Automotive, Finance","Irvine, California, United States","cigfinancial.com was founded in 1985 and headquartered in Irvine, California, is an indirect automobile finance company.","537,749","Greater Los Angeles Area, West Coast, Western US",$10M to $50M,Active,1985-01-01,day,2022-07-22,day,,,For Profit,https://www.cigfinancial.com,"cigfinancial.com was founded in 1985 and headquartered in Irvine, California, is an indirect automobile finance company.","Financial Services, Transportation",,,51-100,,M&A,,,,,,,,,,,Private,,,,,,
Fenix Capital Funding,https://www.crunchbase.com/organization/fenix-capital-funding,"Banking, Finance, Financial Services","Brooklyn, New York, United States",Fenix Capital Funding is a funding company that provides financial solutions for merchants.,"537,750","Greater New York Area, East Coast, Northeastern US",,Active,2021-01-01,year,,,,,For Profit,https://www.fenixcapitalfunding.com,Fenix Capital Funding provides financial services in the banking and finance industry. Their mission is to foster long-lasting relationships with clients by offering alternative funding solutions. They provide a variety of funding programs to help business owners secure the capital they need for their businesses. Their services include merchant cash advances and loans. They also offer a partnership program for ISO partners to provide financial solutions for small and medium businesses nationwide.,"Financial Services, Lending and Investments",,,51-100,,,,,,,,,,,,,Private,,,,,,
Royal Productions,https://www.crunchbase.com/organization/royal-productions,"Audio, Events, Hospitality, Music","Metairie, Louisiana, United States","Royal Productions is a high end audio visual production company specializing in event production, theatrical scenic & art design, & more.","537,753",Southern US,$50M to $100M,Active,1987-01-01,year,,,,,For Profit,https://www.royalproductions.com,,"Events, Media and Entertainment, Music and Audio, Travel and Tourism",,,51-100,,,,,,,,,,,,,Private,,,,,,
Chrome Systems Corporation,https://www.crunchbase.com/organization/chrome-systems-corporation,"Service Industry, Software, Web Browsers","Mountain View, California, United States",Chrome systems corporation is an IT service company that offers a browser for the internet accessibility of the website to the users.,"537,753","San Francisco Bay Area, Silicon Valley, West Coast",,Active,1998-01-01,year,,,,,For Profit,https://www.google.com/chrome/,,"Internet Services, Other, Software",,,10001+,,,,,,,,,,,,,Private,,,,,,
Eldredge,https://www.crunchbase.com/organization/eldredge,"Commercial, Industrial, Recycling, Waste Management","West Chester, Pennsylvania, United States","Eldredge provides waste disposal and recycling, used oil recycling, transportation, and logistics services for the industrial markets.","537,755","Greater Philadelphia Area, Great Lakes, Northeastern US",$10M to $50M,Active,1958-01-01,year,,,,,For Profit,https://www.eldredgeinc.com,,"Manufacturing, Other, Sustainability",,,51-100,,,,,,,,,,,,,Private,,,,,,
Union Adworks,https://www.crunchbase.com/organization/union-adworks,"Advertising, Marketing","Clarkston, Michigan, United States","Union Adworks is a marketing and advertising company that provides writing, programming, and account management services.","537,756","Greater Detroit Area, Great Lakes, Midwestern US",$10M to $50M,Active,2010-01-01,year,,,,,For Profit,http://unionadworks.com,,"Advertising, Sales and Marketing",,,11-50,,,,,,,,,,,,,Private,,,,,,
Sealco Commercial Vehicle,https://www.crunchbase.com/organization/sealco-commercial-vehicle,"Commercial, Manufacturing, Transportation","Phoenix, Arizona, United States","Sealco Commercial Vehicle manufactures and supplies air brake, air electrical, and electrical products for commercial vehicles.","537,757","Greater Phoenix Area, Western US",,Active,1939-01-01,year,,,,,For Profit,https://www.sealcocvp.com,"Sealco Commercial Vehicle manufactures and supplies air brakes, air electrical, anti-lock brake, and electrical products for commercial vehicles. Their products include air product numeric index, air products catalog, air valve quick reference, abs products, wire harness, literature catalog, product reference data, and warranty and policy.","Manufacturing, Other, Transportation",,,11-50,,,,,,,,,,,,,Private,,,,,,
The Meatball Shop,https://www.crunchbase.com/organization/the-meatball-shop,"E-Commerce, Food and Beverage, Retail","New York, New York, United States",The Meatball Shop is a restaurant that offers meatballs and meat dishes.,"537,761","Greater New York Area, East Coast, Northeastern US",$10M to $50M,Active,2010-01-01,year,,,,,For Profit,http://themeatballshop.com,,"Commerce and Shopping, Food and Beverage",3,"Daniel Holzman, Eli Holzman, Michael Chernow",101-250,,,,,,,,,,,,,Private,,,,,,
"Standard Sales Company, LP",https://www.crunchbase.com/organization/standard-sales-company-lp,Food and Beverage,"Odessa, Texas, United States",Standard Sales Company is a food & beverages company specializing in beer and beverages in Texas and Mississippi.,"537,762",Southern US,$100M to $500M,Active,1952-01-01,year,,,,,For Profit,http://standardsalescompanylp.com,,Food and Beverage,1,Ted G. Roden,501-1000,,,,,,,,,,,,,Private,,,,,,
Center For Houston's Future,https://www.crunchbase.com/organization/center-for-houston-s-future,Communities,"Houston, Texas, United States","Center for Houston's Future, The Region's Think Tank, works to solve the region's toughest problems","537,763","Greater Houston Area, Southern US",$1M to $10M,Active,2000-01-01,year,,,,,For Profit,https://www.centerforhoustonsfuture.org,,Community and Lifestyle,,,11-50,,,,,,,,,,,,,Private,,,,,,
VPI,https://www.crunchbase.com/organization/vpi,"Computer, Software","Camarillo, California, United States",VPI is the world's leading provider of call recording,"537,764","Greater Los Angeles Area, West Coast, Western US",,Closed,1994-01-01,year,,,,none,For Profit,http://www.vpi-corp.com/,"VPI is the world's leading provider of call recording, interaction analytics, quality management and contact center workforce optimization software solutions. Become a Fan of VPI and get exclusive offers to new white papers, research, events & more! VPI is the world's leading provider of call recording, interaction analytics, contact center quality management, and workforce optimization software solutions. Over 1,200 customers in 50 countries around the world rely on VPI daily to help them relabily capture, evaluate and analyze interactions to rapidly identify and address opportunities for improvement. ","Consumer Electronics, Hardware, Software",,,51-100,,,,,,,,,,,,,Private,,,,,,
Alvarado,https://www.crunchbase.com/organization/alvarado,Software,"Chino, California, United States",Alvarado is a specializes in providing products and solutions that protect assets and control the flow of people.,"537,765","Greater Los Angeles Area, Inland Empire, West Coast",$10M to $50M,Active,1956-01-01,year,2019-06-27,day,,,For Profit,http://alvaradomfg.com/,"Founded in 1956, Alvarado is a privately held corporation that specializes in providing products and solutions that protect assets and control the flow of people. Thousands of organizations across the globe use Alvarado products and integrated solutions. They’re a uniquely American business that hires the right people, trains them to focus on customer needs and enables them to act in the best interests of their customers. Their Secured Entry Control group manufactures optical turnstiles, full height turnstiles, waist high turnstiles and various types of gates. Their products are sold and installed through a worldwide dealer network that is backed by their knowledgeable and responsive technical support personnel. They are the USA’s leading turnstile manufacturer and their customers include governmental organizations and many of the world’s largest and best known companies. They have thousands of installations and customers worldwide. For over 20 years, leading sports and entertainment venues have relied on Alvarado for intelligent admission control solutions worldwide. Their GateLink10 admission control software and intelligent entry hardware is installed in over 200 locations globally. Representative customers include many of the world’s leading ticketing companies, NASCAR, NBA and MLB teams, 80% of the largest stadiums in Australia and New Zealand, dozens of colleges and North America’s largest regional theme park operator. In addition to front gate entry control software and hardware products, they also provide highly innovative cashless payment and loyalty systems. Alvarado provides products that protect valuable assets in grocery, retail and warehouse environments. Their protection products protect valuable assets such as doors, refrigeration cases and roll-up warehouse doors and warehouse fixtures. Their crowd control group provides products that control pedestrian flow and retail traffic. Their modular railing, turnstile and gate products are highly useful tools to direct pedestrian and shopping cart traffic and reduce shrink in retail environments. Alvarado has provided public entry products since its founding.",Software,,,51-100,,M&A,,,,,,,,,,,Private,,,,,,
Sparktech Software,https://www.crunchbase.com/organization/sparktech-software,"Artificial Intelligence (AI), Enterprise Software, Information Technology, Machine Learning, SaaS, Software, Web Development","Marina Del Rey, California, United States",Sparktech Software is a full service web development and consulting services company.,"537,767","Greater Los Angeles Area, West Coast, Western US",$1M to $10M,Active,2005-01-01,day,,,,,For Profit,http://www.sparktechsoft.com,,"Artificial Intelligence (AI), Data and Analytics, Information Technology, Science and Engineering, Software",1,Cosmin Andriescu,51-100,,,,,,,,,,,,,Private,,,,,,
American Business Machines,https://www.crunchbase.com/organization/american-business-machines-daa8,"Business Development, Consumer Goods, Hardware, Information Technology","Bakersfield, California, United States","American Business Machines provides copiers, managed ITservices, and voice over IP phone systems services.","537,768","West Coast, Western US",$10M to $50M,Active,,,,,,,For Profit,https://www.abm1.com,"American Business Machines specializes in providing custom business solutions. Their core business solutions include multi-functional copiers, voice-over IP phones, security cameras, managed IT, and a professional print shop.","Consumer Goods, Hardware, Information Technology, Professional Services",1,Wallace T. Jones,101-250,,,,,,,,,,,,,Private,,,,,,
NITCO,https://www.crunchbase.com/organization/nitco-e8fd,"Artificial Intelligence (AI), Information Technology, Machine Learning, Natural Language Processing, Robotic Process Automation (RPA), Robotics","Katy, Texas, United States","NITCO accelerates digital automation with AI, machine learning, natural language processing, and robotic process automation.","537,774","Greater Houston Area, Southern US",$1M to $10M,Active,2008-01-01,year,,,,,For Profit,https://www.nitcoinc.com/,,"Artificial Intelligence (AI), Data and Analytics, Hardware, Information Technology, Science and Engineering, Software",,,51-100,,,,,,,,,,,,,Private,,,,,,
Olsen Securities,https://www.crunchbase.com/organization/olsen-securities-corporation,"Architecture, Commercial Real Estate, Construction, Real Estate","Metairie, Louisiana, United States","Olsen Securities Corporation is a real estate company that includes planning, development, architectural, and engineering.","537,774",Southern US,$1M to $10M,Active,,,,,,,For Profit,http://olsensecurities.com,"Olsen Securities Corporation has acquired, developed, and improved more than 150 acres of raw land, involving more than 3,000 apartment units, condominiums, single-family homes, office buildings, and shopping centers.",Real Estate,1,Clifford E. Olsen,11-50,,,,,,,,,,,,,Private,,,,,,
Roundtrip EV Solutions,https://www.crunchbase.com/organization/roundtrip-ev-solutions,"Electric Vehicle, Transportation, Waste Management","Stamford, Connecticut, United States",Roundtrip EV is a solutions provider for the waste industry.,"537,775","East Coast, New England, Northeastern US",,Active,2022-01-01,year,,,,,For Profit,https://roundtripev.com/,"Roundtrip EV is a solutions provider for the waste industry. They provide electric trucks and install the required infrastructure, configuring it to the clients' specific needs. Roundtrip EV is a solutions provider, not a manufacturer. They will select the best equipment and technology at the highest level of service.","Sustainability, Transportation",,,1-10,,,,,,,,,,,,,Private,,,,,,
Intuition Media Group,https://www.crunchbase.com/organization/blissful-media-group,"Advertising, Content Creators, Content Marketing, Marketing, Social Media, Social Media Marketing, Video Advertising","New Canaan, Connecticut, United States","Intuition Media Group, an award-winning influencer marketing agency serving the most iconic brands since 2008.","537,776","East Coast, New England, Northeastern US",$1M to $10M,Active,2008-01-01,year,,,,,For Profit,https://intuitionmediagroup.com/,"We connect trend-setting creators with insight-based strategies. From ideation to implementation, our team of experiential strategists develop campaigns that connect with your target audience and utilize influencers to drive engagement and enhance credibility  Founded in 2008, our experience and industry connections informs our strategy-first mindset.  We work with the most advanced technology platforms to guide and measure our programs.  We are not a talent agency, nor do we have a network of influencers, which allows us to find only the best-suited influencers for your brand.  Our work with Fortune 100 brands has helped them to deepen customer relationships, drive relevance, engagement, awareness and drive sales through creator-led programs.","Advertising, Internet Services, Media and Entertainment, Sales and Marketing",2,"Barbara Jones, Paula Bruno",1-10,,,,,,,,,,,,1,Private,,,,,,
Kleer,https://www.crunchbase.com/organization/kleer-af9d,"Building Material, Construction, Supply Chain Management","Wixom, Michigan, United States","Kleer offers building materials specializing in PVC adhesives, casing, roofing details, beaded boards, PVC post wrap, and trim boards.","537,777","Greater Detroit Area, Great Lakes, Midwestern US",Less than $1M,Active,1970-01-01,year,2012-12-17,day,,,For Profit,https://kleerlumber.com/,"Kleer Lumber has one of the largest PVC trim selections in the industry. It provides a bespoke service to assist the company in obtaining the sizes and profiles it requires, when it is required. They   provides service and support to assist help in growing the company.","Real Estate, Transportation",,,11-50,,M&A,,,,,,,,,,,Private,,,,,,
Watersavers Irrigation,https://www.crunchbase.com/organization/watersavers-irrigation,"Customer Service, Wholesale","San Rafael, California, United States",Watersavers Irrigation is a wholesaler of drip irrigation and landscape lighting supplies.,"537,778","San Francisco Bay Area, West Coast, Western US",$10M to $50M,Active,1988-01-01,year,,,,,For Profit,https://watersaversinc.com,"Watersavers Irrigation is a irrigation, artificial turf, and landscape product supplier. They offer drop irrigation products, outdoor lighting, artificial turf, water conservation, and landscape lighting products.","Commerce and Shopping, Other, Professional Services",,,51-100,,,,,,,,,,,,,Private,,,,,,
Level.Works,https://www.crunchbase.com/organization/level-works,"Home Renovation, Marketplace","Pittsburgh, Pennsylvania, United States",Marketplace for Homeowners and Contractors,"537,778","Great Lakes, Northeastern US",Less than $1M,Active,2015-01-01,year,,,,,For Profit,http://www.level.works/,"Level.Works is a marketplace designed to bring homeowners and contractors together: a safe and trustworthy place where homeowners can list their remodeling and repair jobs, and qualified and rated contractors can bid on those jobs.  Level.Works takes participants from idea through job completion, helping both homeowner and contractor. The home remodeling and repair marketplace is a $141B industry that’s chaotic, inefficient, and roundly distrusted by both buyers and sellers of services. They’ve designed Level.Works to fix this process.","Commerce and Shopping, Real Estate",2,"Chris Connors, Peter Meulbroek",1-10,,,,,,,,,,,,,Private,,,,,,
Defense Engineering Services,https://www.crunchbase.com/organization/defense-engineering-services,"Industrial Design, Machinery Manufacturing, Manufacturing, Mechanical Engineering","Charleston, South Carolina, United States",Defense Engineering Services specializes in providing designing and manufacturing services for the aerospace and defense industry.,"537,779","East Coast, Southern US",$1M to $10M,Active,2013-01-01,year,,,,,For Profit,http://www.defengserv.com/,,"Design, Hardware, Manufacturing, Science and Engineering",,,11-50,,,,,,,,,,,,,Private,,,,,,
The Protocall Group,https://www.crunchbase.com/organization/the-protocall-group,"Delivery, Human Resources, Information Technology, Staffing Agency","Cherry Hill, New Jersey, United States",The Protocall Group is a staffing and recruiting company offering strategic staffing solutions.,"537,785","Greater Philadelphia Area, East Coast, Northeastern US",$10M to $50M,Active,1965-01-01,year,,,,,For Profit,http://protocallgroup.com,,"Administrative Services, Information Technology",,,5001-10000,,,,,,,,,,,,,Private,,,,,,
Savvy Training & Consulting,https://www.crunchbase.com/organization/savvy-training-consulting,"Document Preparation, Legal, Skill Assessment, Software, Training","Denver, Colorado, United States",Savvy Training & Consulting is a Provider of software training services.,"537,786","Greater Denver Area, Western US",$10M to $50M,Active,1985-01-01,year,,,,,For Profit,https://www.savvytraining.com/,"Provider of software training services. The company provides software training services to law firms and corporate legal departments.At Savvy Training & Consulting, they are experts at helping law firms acquire the software platforms they need, training attorneys and staff for maximum efficiency and security,  and assuring ongoing continuity and efficiency of workflow. From weekly opt-in webinars, to on-site trainings to a robust, subscriber-based learning management system that comes fully loaded with content, their work translates directly into higher earning power for law firms throughout the United States, Canada and Europe.","Administrative Services, Education, Professional Services, Software",,,101-250,,,,,,,,,,,,,Private,,,,,,
