Mountaineer Insurance Services,https://www.crunchbase.com/organization/mountaineer-insurance-services,"Auto Insurance, Financial Services, Health Care, Health Insurance, Life Insurance","Beverly, West Virginia, United States","Mountaineer Insurance Services provides life, auto, health, home and business insurance services.","1,034,727",Southern US,Less than $1M,Active,2006-01-01,year,,,,,For Profit,https://mountaineerins.com,,"Financial Services, Health Care",,,1-10,,,,,,,,,,,,,Private,,,,,,
Geoba se,https://www.crunchbase.com/organization/geoba-se,"Information Technology, Internet","Great Falls, Virginia, United States",Geoba.se is your single destination for finding geographic information about any point on Earth.,"1,034,732","Washington DC Metro Area, East Coast, Southern US",,Active,,,,,,,For Profit,http://geoba.se/,"Geoba.se is your single destination for finding geographic information about any point on Earth. Combining multiple sources of data into a single view, Geoba.se provides you with a gazetteer with key geographic information about a location. ","Information Technology, Internet Services",,,,,,,,,,,,,,,,Private,,,,,,
Mi-Tech,https://www.crunchbase.com/organization/mi-tech,"Business Development, Consulting, Industrial Manufacturing, Machinery Manufacturing","North Charleston, South Carolina, United States",Mi-Tech provides machine shop and technical consulting services.,"1,034,734","East Coast, Southern US",$1M to $10M,Active,1985-01-01,year,,,,,For Profit,http://www.mi-tech.net,"Mi-Tech provides on-site consulting and project management services. Offers total project management, technical direction, and manpower. They repair and re-manufacture rotating and reciprocating equipment components. The technical consultants and craft labor personnel offer decades of hands-on experience in the manufacture, repair, and modification of rotating equipment through direct training with OEMs and the military.","Manufacturing, Professional Services",,,11-50,,,,,,,,,,,,,Private,,,,,,
Kodiiac,https://www.crunchbase.com/organization/kodiiac,"E-Commerce, Internet, Outdoors, Retail","Salt Lake City, Utah, United States","Kodiiac advocates for outdoor awareness, stewardship & access as a leading retailer of recreational outdoor equipment & apparel.","1,034,735",Western US,,Active,2015-09-15,day,,,,,For Profit,https://kodiiac.com/,"Kodiiac was established by outdoor enthusiasts to advocate for environmental awareness, stewardship, and access to the outdoors as a leading retailer of recreational outdoor equipment.  Our mission is to educate, inspire, and outfit beginners, enthusiasts, and pros for truly memorable hiking, camping, and climbing adventures.     At Kodiiac, awesome customer experiences are a cornerstone of our brand, so we back every purchase with an unconditional, 100% satisfaction guarantee.  We also offer KodiiacPRO, a membership program that provides two-day free shipping and early access to new promotions.   A portion of the membership fee is also used to fund our conservation efforts with the National Forest Foundation (NFF), the Conservation Alliance, and the National Parks Foundation as well as outdoor access programs with Open Outdoors for Kids and the Outdoor Foundation.     Enjoy the great outdoors, support conservation and help us to improve outdoor access for the next generation of enthusiasts when you shop at Kodiiac.","Commerce and Shopping, Internet Services, Sports",1,James Hwang,1-10,1,Seed,,USD,,,USD,,,,,,Private,,,,,,
Fringe Capital Partners,https://www.crunchbase.com/organization/fringe-capital-partners,Real Estate Investment,"Chicago, Illinois, United States",Boutique Real Estate Investment Firm,"1,034,741","Greater Chicago Area, Great Lakes, Midwestern US",,Active,2018-09-04,day,,,,,For Profit,http://www.fringecp.com,"Fringe Capital Partners and their predecessors were founded in early 2015 with the goal of providing generational multifamily investment vehicles through sponsor commitment, strategic partnerships and multiplatform management. In early 2020, Fringe expanded to the Phoenix/Scottsdale market. Leveraging 20+ years of combined experience in general contracting, property management, and real estate acquisition, Fringe is well situated to acquire, reposition, and maintain multifamily assets through vertically integrated teams in target markets.","Financial Services, Real Estate",1,Josh Meister,1-10,,,,,,,,,,,,,Private,,,,,,
Daansen,https://www.crunchbase.com/organization/daansen,"Manufacturing, Product Design, Wholesale","Nashua, New Hampshire, United States",Daansen is a designer and manufacturer of soap dispensing systems.,"1,034,745","East Coast, New England, Northeastern US",$1M to $10M,Active,1980-01-01,year,,,,,For Profit,https://daansendispensers.com,,"Commerce and Shopping, Design, Manufacturing",,,11-50,,,,,,,,,,,,,Private,,,,,,
AFMWorkshop,https://www.crunchbase.com/organization/afmworkshop,"Nanotechnology, Technical Support","Hilton Head Island, South Carolina, United States","AFMWorkshop specializes in atomic force microscopy, custom engineering, customer support and technical services.","1,034,750","East Coast, Southern US",$1M to $10M,Active,2009-01-01,year,,,,,For Profit,https://afmworkshop.com,,"Information Technology, Other, Science and Engineering",,,11-50,,,,,,,,,,,,,Private,,,,,,
Damen Carbide Tool Co,https://www.crunchbase.com/organization/damen-carbide-tool-co,"Machinery Manufacturing, Manufacturing, Mechanical Engineering","Wood Dale, Illinois, United States","Damen Carbide Tool Co manufactures precision machine tool parts made of carbide, steel, titanium, and ceramic.","1,034,753","Greater Chicago Area, Great Lakes, Midwestern US",$1M to $10M,Active,1948-01-01,year,,,,,For Profit,http://damencarbide.com/,,"Manufacturing, Science and Engineering",,,11-50,,,,,,,,,,,,,Private,,,,,,
Marberry Cleaners & Launderers,https://www.crunchbase.com/organization/marberry-cleaners-launderers,"Commercial, Facilities Support Services, Laundry and Dry-cleaning, Residential","Saint Charles, Illinois, United States",Marberry Cleaners & Launderers is a cleaning company that offers laundry and dry cleaning services to residents and businesses.,"1,034,754","Greater Chicago Area, Great Lakes, Midwestern US",,Active,1911-01-01,year,,,,,For Profit,http://www.marberrycleaners.com,,"Administrative Services, Clothing and Apparel, Other, Real Estate",4,"David Marberry, Jr. John Marberry, Peter Marberry, Sr. John Marberry",51-100,,,,,,,,,,,,,Private,,,,,,
CT Traina,https://www.crunchbase.com/organization/ct-traina,"Facilities Support Services, Facility Management, Heating, Ventilation, and Air Conditioning (HVAC), Industrial, Quality Assurance, Vending and Concessions","Metairie, Louisiana, United States","CT Traina is an industrial firm offering plumbing, air conditioning, welding, and fabrication aids for residential/commercial properties.","1,034,755",Southern US,Less than $1M,Active,1964-01-01,year,,,,,For Profit,https://www.cttraina.com/,,"Administrative Services, Commerce and Shopping, Manufacturing, Professional Services, Real Estate",,,51-100,,,,,,,,,,,,,Private,,,,,,
Hazardous Software,https://www.crunchbase.com/organization/hazardous-software,"Gaming, Information Technology, Software","Raleigh, North Carolina, United States",Hazardous Software is a consulting firm that offers game and simulation development solutions.,"1,034,758","Research Triangle, East Coast, Southern US",Less than $1M,Active,2007-01-01,year,,,,,For Profit,http://www.hazardoussoftware.com,,"Gaming, Information Technology, Software",,,1-10,,,,,,,,,,,,,Private,,,,,,
Nexgen Tooling,https://www.crunchbase.com/organization/nexgen-tooling,"Delivery, Industrial Engineering, Manufacturing, Product Design","Springvale, Maine, United States","NEXGEN Tooling is a manufacturer and designer of cutting tools for the aviation, automotive, and medical industries.","1,034,761","East Coast, New England, Northeastern US",$1M to $10M,Active,2016-01-01,year,,,,,For Profit,https://www.nexgentooling.com,,"Administrative Services, Design, Manufacturing, Science and Engineering",1,Kevin Sevigny,11-50,,,,,,,,,,,,,Private,,,,,,
Ingersoll Place Assisted Living,https://www.crunchbase.com/organization/ingersoll-place-assisted-living,"Assisted Living, Elder Care, Health Care","Schenectady, New York, United States",Ingersoll Place Assisted Living is a not-for-profit assisted living and memory care center.,"1,034,761","East Coast, Northeastern US",,Active,1924-01-01,year,,,,,For Profit,https://ingersollplace.org,,Health Care,,,11-50,,,,,,,,,,,,,Private,,,,,,
sipVine,https://www.crunchbase.com/organization/sipvine,"Information Services, Information Technology, Telecommunications, VoIP","North Kansas City, Missouri, United States","sipVine specializes in VoIP business phone, SIP trunk, and business development services.","1,034,766",Midwestern US,Less than $1M,Active,2005-01-01,year,,,,,For Profit,https://www.sipvine.com,,"Hardware, Information Technology, Internet Services, Messaging and Telecommunications",,,11-50,,,,,,,,,,,,,Private,,,,,,
MIT Bootcamps,https://www.crunchbase.com/organization/mit-bootcamps,"E-Learning, Higher Education, Innovation Management","Cambridge, Massachusetts, United States","MIT Bootcamps provides educational opportunities via online courses and programs to individuals, teams, universities, and companies.","1,034,770","Greater Boston Area, East Coast, New England",,Active,2014-01-01,year,,,,,For Profit,http://bootcamps.mit.edu/,"MIT Bootcamps provides educational opportunities via online courses and programs to individuals, teams, universities, and companies across the world. The goal is to help accelerate the pace of innovation by providing a global community with access to the highest quality education. MIT Bootcamps is headquartered in Cambridge, Massachusetts and founded on 2014.","Education, Professional Services, Software",,,1-10,,,,,,,,,,,,,Private,,,,,,
Homeland Title,https://www.crunchbase.com/organization/homeland-title,Real Estate,"Franklin, Tennessee, United States","Homeland Title protects property rights of buyers, the funds of the seller, and the lien rights of creditors.","1,034,772",Southern US,,Active,,,2022-01-07,day,,,For Profit,https://homelandtitletn.com/,"Homeland Title protects property rights of buyers, the funds of the seller, and the lien rights of creditors.",Real Estate,,,11-50,,M&A,,,,,,,,,,,Private,,,,,,
Greenlogic Lighting & Electric,https://www.crunchbase.com/organization/greenlogic-lighting-electric,"Commercial, Electronics, Lighting, Manufacturing, Security","Houston, Texas, United States","Greenlogic Lighting & Electric is a manufacturing firm that designs and installs lighting and security tools, cameras, and access control.","1,034,773","Greater Houston Area, Southern US",$1M to $10M,Active,2015-01-01,year,,,,,For Profit,https://gogreenlogic.com/,,"Consumer Electronics, Hardware, Manufacturing, Other, Privacy and Security",,,11-50,,,,,,,,,,,,,Private,,,,,,
Phaeacian Partners,https://www.crunchbase.com/organization/phaeacian-partners,Financial Services,"El Segundo, California, United States",Phaeacian Partners is a financial advisor firm.,"1,034,774","Greater Los Angeles Area, West Coast, Western US",,Active,2020-01-01,year,,,,,For Profit,https://www.phaeacianpartners.com,,Financial Services,2,"Greg Herr, Pierre O. Py",,,,,,,,,,,,,,Private,,,,,,
PIAA Corporation,https://www.crunchbase.com/organization/piaa-corporation,"Automotive, Lighting, Manufacturing","Hampton, Virginia, United States",PIAA Corporation specializes in the design and manufacture of LED and halogen lighting systems and silicone wiper blades.,"1,034,782","East Coast, Southern US",,Active,1963-01-01,year,,,,,For Profit,https://www.piaa.com/,,"Hardware, Manufacturing, Transportation",,,,,,,,,,,,,,,,Private,,,,,,
Agganis Arena,https://www.crunchbase.com/organization/agganis-arena,"eSports, Fantasy Sports, Sports","Boston, Massachusetts, United States",Agganis Arena Premium Club offers the finest sight lines with outstanding views of the action as well as a wide range of amenities.,"1,034,785","Greater Boston Area, East Coast, New England",$1M to $10M,Active,2005-01-03,day,,,,,For Profit,http://www.agganisarena.com/,,"Gaming, Sports",,,51-100,,,,,,,,,,,,,Private,,,,,,
MGL Engineering,https://www.crunchbase.com/organization/mgl-engineering,"Industrial, Manufacturing, Mechanical Engineering","Lakeland, Florida, United States",MGL Engineering is a manufacturer of material processing and handling systems for the material handling industry.,"1,034,787","East Coast, Southern US",$10M to $50M,Active,1998-01-01,year,,,,,For Profit,https://mglengineering.com,,"Manufacturing, Science and Engineering",,,51-100,,,,,,,,,,,,,Private,,,,,,
Gary Monetta Brokerage Company Real Estate,https://www.crunchbase.com/organization/gary-monetta-brokerage-company-real-estate,"Accounting, Consulting, Leasing, Property Management, Real Estate, Real Estate Brokerage","Ramona, California, United States","Gary Monetta Brokerage Company Real Estate is a commercial property management, project management, and real estate brokerage firm.","1,034,791","Greater San Diego Area, West Coast, Western US",$1M to $10M,Active,,,,,,,For Profit,https://gmbcrealestate.com,"Gary Monetta Brokerage Company  Real Estate provides property leasing and management services. They offer real estate brokerage services. They offer services including property marketing, tenant screening, secure handling of deposits, secure rent collections, eviction management, maintenance coordination, property inspection, lease negotiations, lease addendums, and lease terminations.","Financial Services, Professional Services, Real Estate",,,11-50,,,,,,,,,,,,,Private,,,,,,
Hougen,https://www.crunchbase.com/organization/hougen,"Industrial, Machinery Manufacturing, Manufacturing","Swartz Creek, Michigan, United States",Hougen is a portable magnetic drill and annular cutters manufacturer.,"1,034,794","Great Lakes, Midwestern US",$50M to $100M,Active,1959-01-01,year,,,,,For Profit,https://www.hougen.com,,Manufacturing,,,11-50,,,,,,,,,,,,,Private,,,,,,
ArcusScale,https://www.crunchbase.com/organization/arcusscale,"Consulting, Database, Software","Ohio City, Ohio, United States","ArcusScale is a software company that provides strategic consulting, software implementation, and maintenance services.","1,034,796","Great Lakes, Midwestern US",,Active,,,,,,,For Profit,https://www.arcusscale.com,,"Data and Analytics, Professional Services, Software",,,11-50,,,,,,,,,,,,,Private,,,,,,
C&M Door Controls,https://www.crunchbase.com/organization/c-m-door-controls,"Architecture, Manufacturing, Sales","Port Reading, New Jersey, United States","C&M Door Controls provides wood doors, architectural aluminum products, metal doors, and frames.","1,034,796","Greater New York Area, East Coast, Northeastern US",,Active,,,,,,,For Profit,https://www.cmdoorcontrols.com,,"Manufacturing, Real Estate, Sales and Marketing",,,,,,,,,,,,,,,,Private,,,,,,
Prana Consulting,https://www.crunchbase.com/organization/prana-consulting,Information Technology,"Santa Clara, California, United States",Prana Consulting,"1,034,799","San Francisco Bay Area, Silicon Valley, West Coast",Less than $1M,Closed,2003-01-01,year,2020-02-26,day,,none,For Profit,http://www.pranaglobal.com/,,Information Technology,1,Gary Peters,11-50,,M&A,,,,,,,,,,,Private,,,,,,
Project Inspiration,https://www.crunchbase.com/organization/project-inspiration,"Art, Education, Non Profit, STEM Education","Vineland, New Jersey, United States","Project Inspiration engages children in STEAM education, aiming to inspire positive lives through activities and merchandise.","1,034,801","East Coast, Northeastern US",$1M to $10M,Active,2007-01-01,year,,,,,Non-profit,https://projectinspir8tion.org,,"Education, Media and Entertainment, Other, Science and Engineering, Social Impact",,,11-50,,,,,,,,,,,,,Private,,,,,,
ConditionHer,https://www.crunchbase.com/organization/conditionher,"Beauty, Wellness, Women's","Los Angeles, California, United States",ConditionHer is a personal care product manufacturing company that offers a daily-use moisturizing cream for intimate areas.,"1,034,802","Greater Los Angeles Area, West Coast, Western US",$1M to $10M,Active,2019-01-01,year,,,,,For Profit,https://conditionher.com/,,"Community and Lifestyle, Consumer Goods, Health Care",1,Wendy Rose Berry,1-10,,,,,,,,,,,,,Private,,,,,,
AllMedia Inc,https://www.crunchbase.com/organization/adl-media-inc,Advertising,"Plano, Iowa, United States","AllMedia provides media recommendation, data acquisition, and ancillary services to marketers.","1,034,804",Midwestern US,,Active,1981-01-01,year,2014-05-08,day,,,For Profit,http://www.allmediainc.com,"AllMedia Inc. specializes in providing targeted media for measurable results.  Our Account Teams provide expert advice to marketers around the world regarding the purchase and use of email, postal and telemarketing prospect lists and related services. In addition to facilitating data acquisition, we help our clients utilize insert programs and online media to meet their marketing goals. AllMedia also provides ancillary services such as merge/purge coordination, telephone and email appending, and data hygiene such as NCOA processing.  Our mission is to provide strategic and thoughtful media recommendations and skillful services to all our clients, large and small. Specialties Direct Marketing, Targeted marketing, Email lists, Postal lists, Medical Lists, Physician Lists, Consumer Lists, Business Lists, Email Marketing","Advertising, Sales and Marketing",,,11-50,,M&A,,,,,,,,,,,Private,,,,,,
The Simple Dollar,https://www.crunchbase.com/organization/the-simple-dollar,"Banking, Financial Services, Internet","Fort Mill, South Carolina, United States",The Simple Dollar is a provider of financial services.,"1,034,805","East Coast, Southern US",,Active,2006-01-01,day,,,,,For Profit,https://www.thesimpledollar.com/,,"Financial Services, Internet Services, Lending and Investments",,,1-10,,,,,,,,,,,,,Private,,,,,,
Advancing Inspiration,https://www.crunchbase.com/organization/advancing-inspiration,"Consulting, Management Consulting, Professional Services","Alexandria, Virginia, United States",Advancing Inspiration is a firm that specializes in management consulting.,"1,034,805","Washington DC Metro Area, East Coast, Southern US",,Active,2007-01-01,year,,,,,For Profit,https://www.advancinginspiration.com,"Advancing Inspiration offers their experience, optimism, and strategic insights. They dare to say the things that will ground in sacred relationships and uplift in possibilities beyond their wildest dreams. They are a small group of dedicated individuals who bring a grounded, expansive perspective to real-world challenges.","Other, Professional Services",,,1-10,,,,,,,,,,,,,Private,,,,,,
Laugh Out Loud,https://www.crunchbase.com/organization/laugh-out-loud,Media and Entertainment,"Encino, California, United States",Laugh Out Loud is a comedy brand and multi-platform network.,"1,034,806","Greater Los Angeles Area, West Coast, Western US",,Active,2017-01-01,year,2022-04-26,day,,,For Profit,https://laughoutloud.com,,Media and Entertainment,,,11-50,,M&A,,,,,,,,,,,Private,,,,,,
Trilogy Management Group,https://www.crunchbase.com/organization/trilogy-management-group,"Consulting, Management Consulting, Professional Services","National, Maryland, United States",Trilogy Management Group is a professional services firm that provides management consulting and executive development.,"1,034,807","East Coast, Southern US",$1M to $10M,Active,2014-01-01,year,,,,,For Profit,http://thetrilogygrp.com,"Trilogy Management Group is a management consulting company. They offer professional services, management consulting, administrative support services, and executive development. They provide services for the industries of small businesses, non-profit organizations, the faith-based community, and state and local government entities.","Other, Professional Services",,,11-50,,,,,,,,,,,,,Private,,,,,,
Tagawa Greenhouse,https://www.crunchbase.com/organization/tagawa-greenhouse,"Agriculture, Farming, Home and Garden","Brighton, Colorado, United States",Tagawa Greenhouse provides greenhouses and garden center services.,"1,034,808","Greater Denver Area, Western US",$10M to $50M,Active,1967-01-01,year,,,,,For Profit,https://www.tagawagreenhouse.com,,"Agriculture and Farming, Real Estate",,,501-1000,,,,,,,,,,,,,Private,,,,,,
iPyxel Creations,https://www.crunchbase.com/organization/ipyxel-creations,"Advertising, Automotive, Digital Media, Marketing Automation","Chicago, Illinois, United States",Performance Ad Optimization & Automation,"1,034,810","Greater Chicago Area, Great Lakes, Midwestern US",Less than $1M,Active,2012-01-15,day,,,,,For Profit,http://www.ipyxel.com,"iPyxel Creations’ mission is to create innovative demand-side technology to allow businesses and brands of all sizes access to efficient management, automation, and optimization of digital ad campaigns. We promote do-it-yourself digital advertising and performance based customer acquisition. Our products aim to make campaign creation, ad management, and performance optimization more efficient through automation and cross-platform data aggregation. We focus on performance, customer acquisitions, and the bottom line. Since its founding in early 2012, iPyxel Creations has taken no outside funding. We actively purchase digital media and have successfully run display, social, search, and mobile campaigns, which not only allows us to reinvest into technology, it gives us the necessary expertise to build it.","Advertising, Media and Entertainment, Sales and Marketing, Software, Transportation",1,Tom Fang,1-10,,,,,,,,,,,,,Private,,,,,,
Virtue Salon,https://www.crunchbase.com/organization/virtue-salon,"Beauty, Fashion, Online Portals","Columbus, Ohio, United States",Virtue Salon is an online store that sells hair care products.,"1,034,813","Great Lakes, Midwestern US",$1M to $10M,Active,2010-01-01,year,,,,,For Profit,https://www.virtuevegansalon.com,"Virtue Salon offers hair cutting, coloring, and waxing services. They allow consumers to directly buy goods or services from a seller over the Internet using a web browser or a mobile app. Their products serve consumers.","Clothing and Apparel, Consumer Goods, Design, Internet Services",,,11-50,,,,,,,,,,,,,Private,,,,,,
The Advocate,https://www.crunchbase.com/organization/the-advocate-99f0,"Media and Entertainment, News, Publishing","Los Angeles, California, United States","The Advocate is a broadcast media production and distribution company that focuses on publishing news, politics, and entertainment.","1,034,814","Greater Los Angeles Area, West Coast, Western US",$10M to $50M,Active,1967-01-01,year,,,,,For Profit,https://www.advocate.com,"Advocate is a media production industry. They also distribute magazines, which are printed bimonthly and available by subscription or packaged with magazines on newsstands nationwide. They are a leading source of LGBT news and entertainment with their highly-visited website.","Content and Publishing, Media and Entertainment",,,11-50,,,,,,,,,,,,,Private,,,,,,
My Own Power,https://www.crunchbase.com/organization/my-own-power,"Energy, Renewable Energy, Solar","Fort Worth, Texas, United States","My Own Power is an energy company that supplies solar power panels, insulation devices, and equipment.","1,034,816","Dallas/Fort Worth Metroplex, Southern US",,Active,2006-01-01,year,,,,,For Profit,https://www.myogroup.co/,,"Energy, Natural Resources, Sustainability",1,Keri Blalock,,,,,,,,,,,,,,Private,,,,,,
ALT TAB Consulting,https://www.crunchbase.com/organization/alt-tab-consulting,"Graphic Design, Human Resources, Information Technology, Outsourcing","Princeton, New Jersey, United States",ALT TAB Consulting is a sales outsourcing company that provides BPO and IT-enabled services.,"1,034,821","East Coast, Northeastern US",,Active,2015-01-01,month,,,,,For Profit,https://alttabcs.com,"ALT TAB provides solutions to enhance the performance of their clients’. Their services include legal discovery, graphics, medical records, transcription and translation, outsourced sales management, B2B inside sales, IT services, and HR services. They respond to customer inquiries by phone, contact form, and email.","Administrative Services, Design, Information Technology, Professional Services",1,Bharat Pavan,51-100,,,,,,,,,,,,,Private,,,,,,
High Performance Technologies (HPTi),https://www.crunchbase.com/organization/high-performance-technologies-hpti,Software,"Reston, Virginia, United States",High Performance Technologies is a technology service company.,"1,034,822","Washington DC Metro Area, East Coast, Southern US",,Closed,1991-01-01,year,2011-06-06,day,,none,For Profit,http://www.hpti.com,"High Performance Technologies, Inc. (HPTi) is a technology services company. Founded in 1991 by Don Fitzpatrick and Tim Keenan, the firm is headquartered in Reston, VA. The privately owned firm enjoyed revenues of nearly $91 million in 2010. HPTi employs over 400 professionals. The mid-sized firm is responsible for several high-profile solutions for the federal government and focuses primarily on federal clients. Most of the company's work involves computational science, program management, software development, and systems engineering.",Software,,,251-500,,M&A,,,,,,,,,,,Private,,,,,,
Home State Bank,https://www.crunchbase.com/organization/home-state-bank-n-a,"Banking, Communities, Venture Capital","Crystal Lake, Illinois, United States",Home State Bank is a community bank based out of Illinois.,"1,034,827","Greater Chicago Area, Great Lakes, Midwestern US",$10M to $50M,Active,1915-01-01,year,,,,,For Profit,http://homestateonline.com,,"Community and Lifestyle, Financial Services, Lending and Investments",,,101-250,,,,,,,,,,,,,Private,,,,,,
