Organization Name,Organization Name URL,Industries,Headquarters Location,Description,CB Rank (Company),Headquarters Regions,Estimated Revenue Range,Operating Status,Founded Date,Founded Date Precision,Exit Date,Exit Date Precision,Closed Date,Closed Date Precision,Company Type,Website,Full Description,Industry Groups,Number of Founders,Founders,Number of Employees,Number of Funding Rounds,Funding Status,Total Equity Funding Amount,Total Equity Funding Amount Currency,Total Equity Funding Amount Currency (in USD),Total Funding Amount,Total Funding Amount Currency,Total Funding Amount Currency (in USD),Top 5 Investors,Number of Lead Investors,Number of Investors,Number of Acquisitions,IPO Status,IPO Date,Delisted Date,Delisted Date Precision,Stock Symbol,Stock Symbol URL,Stock Exchange
Preferred Powder Coating,https://www.crunchbase.com/organization/preferred-powder-coating,"Chemical, Industrial Automation, Manufacturing","Elk River, Minnesota, United States",Preferred Powder Coating is an industrial automation company that offers powder coating services.,"1,034,002","Greater Minneapolis-Saint Paul Area, Great Lakes, Midwestern US",$1M to $10M,Active,,,,,,,For Profit,https://www.preferredpowder.com,"Preferred Powder Coating uses nanotechnology in their titration cycle, which enables them to receive the label phosphate free. The procedure improved performance pretreatment. It was made to go beyond phosphate limitations, reduce water waste, lower chemical and natural gas consumption, and produce a treatment that ensures a chemical link with the substrate. A coating that is applied as a dry, free-flowing powder is known as a powder coating.","Manufacturing, Science and Engineering",,,11-50,,,,,,,,,,,,,Private,,,,,,
Paycloud.io,https://www.crunchbase.com/organization/paycloud-io,"Financial Services, Mobile Apps, Payments","Warner Robins, Georgia, United States","Paycloud.io is a financial service company that offers online, IVR payments, messenger, claim payment suite, and e-sign services.","1,034,003","East Coast, Southern US",$1M to $10M,Active,,,,,,,For Profit,https://www.paycloud.io/,,"Apps, Financial Services, Mobile, Payments, Software",,,51-100,,,,,,,,,,,,,Private,,,,,,
Bliss Drive,https://www.crunchbase.com/organization/bliss-drive,"Advertising, Reputation, SEM","Irvine, California, United States",Bliss Drive is a digital marketing agency that drives businesses growth by creating and implementing an overall online marketing strategy.,"1,034,005","Greater Los Angeles Area, West Coast, Western US",$1M to $10M,Active,2007-04-01,month,,,,,For Profit,http://www.blissdrive.com,"Bliss Drive is a digital marketing agency that drives businesses growth by creating and implementing an overall online marketing strategy. Through search engine marketing and online reputation management tools, we connect businesses with their target audience, increase business loyalty, and expand brand awareness. We are Los Angeles SEO Company with worldwide recognition for marketing excellence and innovation","Advertising, Information Technology, Internet Services, Sales and Marketing",1,Richard Fong,11-50,,,,,,,,,,,,,Private,,,,,,
Tactical FLEX,https://www.crunchbase.com/organization/tactical-flex,"Security, Software","Chicago, Illinois, United States","Tactical FLEX, Inc., a privately owned software development firm.","1,034,009","Greater Chicago Area, Great Lakes, Midwestern US",$1M to $10M,Active,2003-01-01,year,,,,,For Profit,http://www.tacticalflex.com,"Tactical FLEX, Inc., is a privately owned information security firm, specializing in software development, information security research, engineering and technology design and production.","Privacy and Security, Software",,,1-10,,,,,,,,,,,,,Private,,,,,,
Arisone Home Care,https://www.crunchbase.com/organization/arisone-home-health-care,"Health Care, Home Health Care","Denver, Colorado, United States","The core of Arisone HC is to create services and a workplace with high-quality and safety for clients, family members and staff.","1,034,013","Greater Denver Area, Western US",Less than $1M,Active,2014-01-02,day,,,,,For Profit,http://www.arisone.com/,"HOME CARE SOLUTIONS Quality Home Care You Can Trust At Arisone Home Care, nothing matters more than your wellbeing. Since 2014, we've been there for our clients as a comprehensive, friendly and professional Home Care Agency. We shape our caregiving services based on what our clients, want and need. Get in touch and see what we can do for you or your family members today.",Health Care,1,Anna Nadmyr,11-50,1,,,,,,USD,,,,,,Private,,,,,,
Raleigh Tire Service,https://www.crunchbase.com/organization/raleigh-tire-service,"Automotive, Local Business, Mechanical Engineering","Cordova, Tennessee, United States","Raleigh Tire Service is a full-service automotive repair, tire, and wheel center.","1,034,013",Southern US,$10M to $50M,Active,1963-01-01,year,,,,,For Profit,https://www.raleightire.com,,"Sales and Marketing, Science and Engineering, Transportation",,,51-100,,,,,,,,,,,,,Private,,,,,,
Allied Elevator,https://www.crunchbase.com/organization/allied-elevator,"Commercial, Facilities Support Services, Service Industry","Pennsauken, New Jersey, United States","Allied Elevator offers commercial elevator maintenance, repair, modernization, and value-added services.","1,034,014","Greater Philadelphia Area, East Coast, Northeastern US",,Active,2009-01-01,year,,,,,For Profit,https://www.alliedelevator.com/,,"Administrative Services, Other",,,11-50,,,,,,,,,,,,,Private,,,,,,
Caring Hands Healthcare Centers,https://www.crunchbase.com/organization/caring-hands-healthcare-centers,"Cosmetic Surgery, Dental, Health Care, Pharmaceutical, Therapeutics","Mcalester, Oklahoma, United States",Caring Hands Healthcare Centers is a health and wellness service provider.,"1,034,018",Southern US,,Active,2005-01-01,year,,,,,For Profit,https://chhcok.com,"Caring Hands Healthcare Centers provide health care services. Their services include primary care, women’s health, prenatal, pediatrics, hospital follow-up, immunizations, laboratory, referral services, sports physicals, and chronic diseases. They also provide dental services that include fillings, root canals, extractions, and cosmetic dentistry. Additionally, they provide behavioral health services, including anxiety, depression, couples counseling, and much more. In addition, they offer pharmacy and consulting services.",Health Care,,,11-50,,,,,,,,,,,,,Private,,,,,,
"Frascona, Joiner, Goodman and Greenstein",https://www.crunchbase.com/organization/frascona-joiner-goodman-and-greenstein,"Environmental Consulting, Family, Law Enforcement, Legal, Professional Services, Service Industry","Boulder, Colorado, United States","Frascona, Joiner, Goodman and Greenstein provides legal services.","1,034,019","Greater Denver Area, Western US",,Active,1974-01-01,year,,,,,For Profit,https://frascona.com,"Frascona, Joiner, Goodman and Greenstein their firm handles aspects of business law, real estate law, civil litigation, mediation, estate planning, divorce and family law, trust and estate administration, employment law, taxation, foreclosure, association law, construction law, water law, oil, and gas law.","Community and Lifestyle, Government and Military, Other, Privacy and Security, Professional Services",,,11-50,,,,,,,,,,,,,Private,,,,,,
Alfa Dental Management,https://www.crunchbase.com/organization/alfa-dental-management,"Business Development, Dental, Health Care, Marketing","Jacksonville, Florida, United States",Alfa Dental Management provides business development strategies to promote revenue growth for dental sectors.,"1,034,022","East Coast, Southern US",$1M to $10M,Active,2009-01-01,year,,,,,For Profit,https://www.alfadentalmanagement.com/,,"Health Care, Professional Services, Sales and Marketing",1,Tim Tursonoff,101-250,,,,,,,,,,,,,Private,,,,,,
Erie Plating Company,https://www.crunchbase.com/organization/erie-plating-company,"Chemical, Industrial, Manufacturing","Erie, Pennsylvania, United States","Erie Plating Company manufactures fabricated metal specializes in plating, polishing and industrial metal finishing services.","1,034,025","Great Lakes, Northeastern US",$1M to $10M,Active,1925-01-01,year,,,,,For Profit,https://erieplating.com,,"Manufacturing, Science and Engineering",,,11-50,,,,,,,,,,,,,Private,,,,,,
InvestAmerica,https://www.crunchbase.com/organization/investamerica,"Advice, Banking, Finance, Financial Services","Tampa, Florida, United States","InvestAmerica provides securities, debt & equity placements, financial analysis, underwriting and advisory services to businesses.","1,034,026","Tampa Bay Area, East Coast, Southern US",Less than $1M,Active,2010-01-01,year,,,,,For Profit,https://investamericap.com,,"Financial Services, Lending and Investments, Media and Entertainment",,,11-50,,,,,,,,,,,,,Private,,,,,,
Merse,https://www.crunchbase.com/organization/merse,"Information Technology, Internet, Software","Mountain View, California, United States",Merse compares fresh builds to production to automatically test your APIs.,"1,034,035","San Francisco Bay Area, Silicon Valley, West Coast",,Active,2022-01-01,year,,,,,For Profit,https://merse.ai,Merse compares fresh builds to production to automatically test your APIs. Instantaneously produces thorough reports for all problems. Run tests concurrently in a matter of minutes to provide the team with more time for other crucial work.,"Information Technology, Internet Services, Software",,,1-10,,,,,,,,,,,,,Private,,,,,,
Juneva Health,https://www.crunchbase.com/organization/juneva-health,"Alternative Medicine, Health Care, Medical","Antioch, California, United States",Juneva Health provides alternative and holistic health services.,"1,034,035","San Francisco Bay Area, West Coast, Western US",$1M to $10M,Active,2017-01-01,year,,,,,For Profit,https://www.juneva.com/,,Health Care,1,Wolfgang Scheinhart,1-10,,,,,,,,,,,,,Private,,,,,,
Windy City Motorcycle Company,https://www.crunchbase.com/organization/windy-city-motorcycle-company,"Automotive, Commercial, Manufacturing","Rosamond, Illinois, United States","Windy City Motorcycle Company is a motorcycle distributor that provides premium OEM brands, motorcycle service, parts, and accessories.","1,034,036","Great Lakes, Midwestern US",$1M to $10M,Active,2000-01-01,year,,,,,For Profit,https://www.windycitymc.com/,,"Manufacturing, Other, Transportation",,,251-500,,,,,,,,,,,,,Private,,,,,,
Camman Lighting,https://www.crunchbase.com/organization/camman-lighting,"Electronics, Lighting, Manufacturing","Derry, Pennsylvania, United States",Camman Lighting is a manufacturing company that manufactures architectural lighting products.,"1,034,037","Great Lakes, Northeastern US",$1M to $10M,Active,,,,,,,For Profit,https://www.cammanlighting.com,,"Consumer Electronics, Hardware, Manufacturing",,,11-50,,,,,,,,,,,,,Private,,,,,,
Multimedia Lists,https://www.crunchbase.com/organization/multimedia-lists,Database,"Alpharetta, Georgia, United States","Multimedia Lists compile data and lists, clean them up, merge/purge them, manage them for other companies.","1,034,040","Greater Atlanta Area, East Coast, Southern US",,Active,2007-01-01,year,2022-09-27,day,,,For Profit,https://multimedialists.com,"Multimedia Lists compile data and lists, clean them up, merge/purge them, manage them for other companies.","Data and Analytics, Software",,,1-10,,M&A,,,,,,,,,,,Private,,,,,,
Reading Housing Authority,https://www.crunchbase.com/organization/reading-housing-authority,"Construction, Property Management, Real Estate","Reading, Pennsylvania, United States",Reading Housing Authority offers affordable housing facilities to individuals and deals in real estate and property management services.,"1,034,042","Great Lakes, Northeastern US",,Active,1939-01-01,year,,,,,For Profit,https://www.readingha.org/,,Real Estate,,,,,,,,,,,,,,,,Private,,,,,,
The Foundation Schools,https://www.crunchbase.com/organization/the-foundation-schools,"E-Learning, Education, Higher Education, Secondary Education","Upper Marlboro, Maryland, United States","Foundation Schools is a school for academic, behavioral and social education.","1,034,043","Washington DC Metro Area, East Coast, Southern US",,Active,1975-01-01,year,,,,,For Profit,https://www.foundationschools.org,"Foundation Schools help students with emotional disabilities and autism realize their full potential. It is a nonpublic day school that offers special education programs. In addition to providing individualized educational and therapeutic support, basic needs, and parent support, they connect their families to community resources.","Education, Software",,,101-250,,,,,,,,,,,,,Private,,,,,,
Section86,https://www.crunchbase.com/organization/section86,"Audio, Digital Media, Internet Radio, Media and Entertainment, Music, Podcast, Video, Web Design","Kewanee, Illinois, United States","Section86 is a media production platform that creates websites, radio spots, radio lines, podcasts, music, and videos.","1,034,044","Great Lakes, Midwestern US",,Active,2003-01-01,year,,,,,For Profit,https://section86.com,,"Design, Media and Entertainment, Music and Audio, Video",,,1-10,,,,,,,,,,,,,Private,,,,,,
LaBrilliante,https://www.crunchbase.com/organization/labrilliante,"Jewelry, Manufacturing, Retail","Hoboken, New Jersey, United States",LaBrilliante is a manufacturer of natural diamonds.,"1,034,046","Greater New York Area, East Coast, Northeastern US",,Active,2017-01-01,year,,,,,For Profit,https://labrilliante.com,"LaBrilliante offers diamond rings, earrings, necklaces, and bracelets. They provide diamonds in round, princess, cushion, emerald, pear, oval, radiant, asscher, marquise, and heart shapes. They also provide diamonds in yellow, pink, purple, blue, green, orange, brown, and black.","Commerce and Shopping, Consumer Goods, Manufacturing",,,11-50,,,,,,,,,,,,,Private,,,,,,
Duncan Day Advertising,https://www.crunchbase.com/organization/duncan-day-advertising,"Advertising, Marketing, Social Media","Texas, South Carolina, United States","Duncan Day Advertising develops content and strategy for brand development, improve marketing activities and packaging.","1,034,054","East Coast, Southern US",$1M to $10M,Active,1986-01-01,day,,,,,For Profit,http://www.duncanday.com,,"Advertising, Internet Services, Media and Entertainment, Sales and Marketing",,,1-10,,,,,,,,,,,,,Private,,,,,,
New York Vocal Coaching,https://www.crunchbase.com/organization/new-york-vocal-coaching,"E-Learning, Education, Music Education, Training","New York, New York, United States","New York Vocal Coaching provides voice lessons, vocal coaching, and voice teacher training.","1,034,059","Greater New York Area, East Coast, Northeastern US",$1M to $10M,Active,2005-01-01,year,,,,,For Profit,https://newyorkvocalcoaching.com,"New York Vocal Coaching is an online vocal coaching studio offering speech coaching, acting and monologue coaching, audition prep, guitar and bass lessons, piano lessons, recording, and videography services.","Education, Media and Entertainment, Music and Audio, Software",1,Justin Stoney,11-50,,,,,,,,,,,,,Private,,,,,,
Corporate Housing Systems,https://www.crunchbase.com/organization/corporate-housing-systems,"Hospitality, Real Estate, Reservations, Residential, Travel Accommodations","Dublin, Ohio, United States","Corporate Housing Systems offers premium temporary housing, relocation, and accommodation services for traveling business professionals.","1,034,064","Great Lakes, Midwestern US",$1M to $10M,Active,1983-01-01,year,,,,,For Profit,https://www.corporatehousingsystems.com/,,"Events, Media and Entertainment, Real Estate, Travel and Tourism",,,11-50,,,,,,,,,,,,,Private,,,,,,
Kite Family,https://www.crunchbase.com/organization/kite-family,"Commercial Real Estate, Real Estate, Real Estate Investment","Orange, California, United States",Kite Family is an investment company that specializes in commercial real estate.,"1,034,067","Greater Los Angeles Area, West Coast, Western US",$1M to $10M,Active,2000-01-01,year,,,,,For Profit,https://kitefamilylp.com,,"Financial Services, Real Estate",,,1-10,,,,,,,,,,,,,Private,,,,,,
Autotruck Financial Credit Union,https://www.crunchbase.com/organization/autotruck-financial-credit-union,"Banking, Financial Services, Lending","Louisville, Kentucky, United States","Autotruck Financial Credit Union is a financial service company that provides online banking, loans, and insurance services.","1,034,070",Southern US,$1M to $10M,Active,1961-06-13,day,,,,,For Profit,https://www.autotruckfcu.org/,,"Financial Services, Lending and Investments",,,11-50,,,,,,,,,,,,,Private,,,,,,
Our Lady of Good Counsel High School,https://www.crunchbase.com/organization/our-lady-of-good-counsel-high-school,"Education, Primary Education, Secondary Education","Olney, Maryland, United States",Our Lady of Good Counsel High School is committed to preparing students with diverse learning abilities for the challenges of life.,"1,034,071","Washington DC Metro Area, East Coast, Southern US",,Active,1958-01-01,year,,,,,Non-profit,https://www.olgchs.org/,,Education,,,101-250,,,,,,,,,,,,,Private,,,,,,
Hanover Supply,https://www.crunchbase.com/organization/hanover-supply,"Commercial, Heating, Ventilation, and Air Conditioning (HVAC), Industrial, Manufacturing, Residential","East Hanover, New Jersey, United States","Hanover Supply is an HVAC company that provides residential, commercial, and industrial plumbing, heating, cooling, and remodeling products.","1,034,075","Greater New York Area, East Coast, Northeastern US",$1M to $10M,Active,1923-01-01,year,,,,,For Profit,https://www.hanoversupply.com,,"Manufacturing, Other, Real Estate",,,11-50,,,,,,,,,,,,,Private,,,,,,
Shining Stars Learning Center,https://www.crunchbase.com/organization/shining-stars-learning-center,"E-Learning, EdTech, Education","Queen Creek, Arizona, United States",Shining Stars Learning Center is to develop confident learners by promoting the natural learning process.,"1,034,076","Greater Phoenix Area, Western US",,Active,,,,,,,For Profit,http://www.sslcaz.com,,"Education, Software",,,51-100,,,,,,,,,,,,,Private,,,,,,
Small Data Group,https://www.crunchbase.com/organization/small-data-group,"Analytics, Communities, Information Technology, Internet, Internet of Things","Boston, Massachusetts, United States","Small Data Group is a blog and community for organizations looking to understand, invest in or deploy data-driven ‘smart’ applications.","1,034,079","Greater Boston Area, East Coast, New England",$1M to $10M,Active,2012-01-01,year,,,,,For Profit,https://smalldatagroup.com,,"Community and Lifestyle, Data and Analytics, Information Technology, Internet Services",1,Allen Bonde,11-50,,,,,,,,,,,,,Private,,,,,,
DRHA,https://www.crunchbase.com/organization/drha,"Construction, Government","Danville, Virginia, United States","DRHA is a government firm that offers services such as construction, remodeling, leasing, improving and operating housing projects.","1,034,081","East Coast, Southern US",$1M to $10M,Active,1941-01-01,year,,,,,For Profit,https://www.drhava.com,,"Government and Military, Real Estate",,,11-50,,,,,,,,,,,,,Private,,,,,,
Trill,https://www.crunchbase.com/organization/trill,"Events, Internet","Pasadena, California, United States",Everything that happens on a stage— curated by Boston locals in the know.,"1,034,083","Greater Los Angeles Area, West Coast, Western US",Less than $1M,Active,2014-01-01,day,,,,,For Profit,http://trill.me,"Trill was a social media platform centered around arts and culture events, sparking daily dialogue and event attendance in Boston, NYC, Asbury Park, and LA.","Events, Internet Services, Media and Entertainment",,,1-10,1,,,,,,USD,,MassChallenge,,1,,Private,,,,,,
UNT Division of Student Affairs,https://www.crunchbase.com/organization/university-of-north-texas,"Education, Higher Education, Training","Denton, Texas, United States","UNT Division of Student Affairs creates an inclusive student that supports academic success, social engagement, and personal.","1,034,085","Dallas/Fort Worth Metroplex, Southern US",,Active,1890-01-01,year,,,,,For Profit,https://studentaffairs.unt.edu/,,Education,,,1001-5000,,,,,,,,,,,,,Private,,,,,,
Monkai,https://www.crunchbase.com/organization/monkai,"Artificial Intelligence (AI), Machine Learning, Software","San Francisco, California, United States",Monkai is the world's first deep focus conversational AI assistant.,"1,034,087","San Francisco Bay Area, West Coast, Western US",,Active,2022-01-01,year,,,,,For Profit,https://monkai.io,"Focus management has now become the most undervalued, unsolved, and ever-growing pain of the current digital era, and it's Monkai's mission to cure it in the next 20 years. Monkai is the world's first deep focus conversational AI assistant. Powered by localized NLP ML models, Monkai will coach and guide you away from distracting websites with a friendly peer-like approach that reduces judgment and inspires action. Monkai removes irrelevant social media content, streamlines notifications, and surfaces your top priorities to ensure you stay mindful and focused.","Artificial Intelligence (AI), Data and Analytics, Science and Engineering, Software",,,1-10,,,,,,,,,,,,,Private,,,,,,
Turner Property Services Group,https://www.crunchbase.com/organization/turner-property-services-group,Real Estate,"Dayton, Ohio, United States",Turner Property Services Group is a real estate company that offers property services group.,"1,034,087","Great Lakes, Midwestern US",$1M to $10M,Active,2005-01-01,year,,,,,For Profit,https://www.turnerpsg.com,,Real Estate,,,11-50,,,,,,,,,,,,,Private,,,,,,
ERW,https://www.crunchbase.com/organization/erw-inc,Manufacturing,"Putnam, Connecticut, United States","ERW Inc is a Precision Sheet Metal and Machined Products Manufacturer, Specializing in Thermal Spray Hard Tooling and Fixturing.","1,034,088","East Coast, New England, Northeastern US",,Active,1985-01-01,year,,,,,For Profit,https://www.erwinc.com,,Manufacturing,,,1-10,,,,,,,,,,,,,Private,,,,,,
MCO Transport,https://www.crunchbase.com/organization/mco-transport,"Transportation, Warehousing","Wilmington, North Carolina, United States",MCO Transport provides transportation and warehousing services.,"1,034,090","East Coast, Southern US",$10M to $50M,Active,1976-01-01,day,,,,,For Profit,http://www.mcotransport.com/,,Transportation,1,Danny McComas,11-50,,,,,,,,,,,,,Private,,,,,,
Optimation,https://www.crunchbase.com/organization/optimation,"Computer, Internet, Software","Blue Springs, Missouri, United States",Optimation is a computer Software company that provides the standard for nesting software automation.,"1,034,092",Midwestern US,,Active,1978-01-01,day,,,,,For Profit,http://www.optinest.com/,,"Consumer Electronics, Hardware, Internet Services, Software",,,11-50,,,,,,,,,,,,,Private,,,,,,
Ooltewah Manufacturing,https://www.crunchbase.com/organization/ooltewah-manufacturing,"Industrial, Industrial Engineering, Industrial Manufacturing, Manufacturing, Mechanical Engineering","Ooltewah, Tennessee, United States","Ooltewah Manufacturing specializes in dielectric welding, die-cutting, sewing, and contract manufacturing of specialty parts for industries.","1,034,094",Southern US,$1M to $10M,Active,1972-01-01,year,,,,,For Profit,https://www.ooltewah.com/,,"Manufacturing, Science and Engineering",,,11-50,,,,,,,,,,,,,Private,,,,,,
Everflow,https://www.crunchbase.com/organization/everflow-df1d,"Blockchain, Real Estate","New York, New York, United States",Real Estate Digitalized on Blockchain,"1,034,095","Greater New York Area, East Coast, Northeastern US",Less than $1M,Active,2018-01-01,year,,,,,For Profit,https://everflow.global/,Everflow is a blockchain technology company disrupting the $255T illiquid real estate market with a network of exchanges.,"Blockchain and Cryptocurrency, Other, Real Estate",1,Sharon Greenberg,1-10,1,Seed,,USD,,,USD,,BuiltUp Ventures,,1,,Private,,,,,,
Wheelcare Express,https://www.crunchbase.com/organization/wheelcare-express,"Addiction Treatment, Medical, Transportation, Wellness","San Francisco, California, United States",Wheelcare Express is a non-emergency transportation company.,"1,034,096","San Francisco Bay Area, West Coast, Western US",,Active,,,,,,,For Profit,https://wheelcareexpress.com,"Wheelcare Express provides medical transportation services. Their services include dialysis treatments, oncology clinics, medical appointments and exams, physical therapy, drug and alcohol rehabilitation, psychology and social services sessions, hospital discharges, labs and prescription needs, and more.","Health Care, Transportation",,,51-100,,,,,,,,,,,,,Private,,,,,,
Precision Injection Molding,https://www.crunchbase.com/organization/precision-injection-molding,"Manufacturing, Plastics and Rubber Manufacturing","Corona, California, United States",Precision Injection Molding is a manufacturer of injection molded plastic parts.,"1,034,098","Greater Los Angeles Area, Inland Empire, West Coast",,Active,,,2019-02-22,day,,,For Profit,http://www.pimcoplastics.com/,,Manufacturing,,,,,M&A,,,,,,,,,,,Private,,,,,,
AlphaBrace.com,https://www.crunchbase.com/organization/alphabrace-com,"E-Commerce, Medical Device, Retail","Rock Hill, South Carolina, United States",AlphaBrace.com is an online seller of medical products.,"1,034,104","East Coast, Southern US",,Active,1988-01-01,year,,,,,For Profit,https://www.alphabrace.com,"AlphaBrace.com is a medical, dental, hospital equipment, and supplies merchant wholesaler. Their retail braces and support independent pharmacies, and durable medical equipment dealers. By selling to doctors and medical equipment distributors they methodically expanded their product line to a broad assortment of products used and recommended by health care professionals.","Commerce and Shopping, Health Care",,,1-10,,,,,,,,,,,,,Private,,,,,,
