St. Anthony's Memorial Hospital,https://www.crunchbase.com/organization/st-anthonys-memorial-hospital,"Fitness, Health Care, Wellness","Effingham, Illinois, United States",To reveal and embody Christ's healing love for all people through our high quality Franciscan health care ministry,"572,304","Great Lakes, Midwestern US",$100M to $500M,Active,1875-01-01,year,,,,,For Profit,http://www.stanthonyshospital.org/,,"Health Care, Sports",,,501-1000,,,,,,,,,,,,,Private,,,,,,
AMZAlert,https://www.crunchbase.com/organization/amzalert,"E-Commerce, Product Management, Software","Ada, Michigan, United States","AMZAlert is a product monitoring software tool that alerts about listing, purchase, and sales activities on products.","572,305","Great Lakes, Midwestern US",,Active,2013-01-01,year,,,,,For Profit,https://amzalert.com/,,"Commerce and Shopping, Other, Software",1,Steve Eilers,1-10,,,,,,,,,,,,,Private,,,,,,
Makari,https://www.crunchbase.com/organization/makari,"Chemical, Cosmetics","New York, New York, United States","Makari offers collections of targeted, problem solving products addressing the skincare needs of diverse.","572,306","Greater New York Area, East Coast, Northeastern US",$1M to $10M,Active,2011-01-01,year,,,,,For Profit,https://www.makari.com/,,"Consumer Goods, Science and Engineering",,,11-50,,,,,,,,,,,,,Private,,,,,,
TPE Boulder,https://www.crunchbase.com/organization/tpe-boulder,"Finance, Financial Services, Health Care, Software","Boulder, Colorado, United States","TPE Boulder is a private equity investor in the buyouts of software, healthcare services, and business services companies.","572,311","Greater Denver Area, Western US",,Active,2010-01-01,year,,,,,For Profit,http://tpeboulder.com/,"TPE Boulder is a private equity investor in the buyouts of software, healthcare services, and business services companies. It typically invests as part of a syndicate  in majority purchases of companies with $4.0 to $40.0 million in revenue and at least $1.5 million in EBITDA.  The firm seeks to provide liquidity to founders and early investors and to help in the transition of management.","Financial Services, Health Care, Software",2,"James E. Vandervelden, Robert M. Hannon",,,,,,,,,,,,,,Private,,,,,,
Satya Nutrition,https://www.crunchbase.com/organization/satya-nutrition,"Children, Food and Beverage, Food Delivery, Health Care, Non Profit, Nutrition","Baltimore, Maryland, United States",Satya Nutrition is a nonprofit organization that aims to help fight against childhood malnutrition and nutritious treatment.,"572,323","Greater Baltimore-Maryland Area, East Coast, Southern US",$1M to $10M,Active,2018-01-01,year,,,,,Non-profit,https://satyanutrition.org/,,"Community and Lifestyle, Food and Beverage, Health Care, Other, Social Impact, Transportation",,,11-50,,,,,,,,,,,,,Private,,,,,,
Compression Components & Service,https://www.crunchbase.com/organization/compression-components-service,"Industrial Manufacturing, Machinery Manufacturing, Manufacturing","Huntingdon Valley, Pennsylvania, United States",Compression Components & Service is a machinery manufacturing company provides support services to tablet press end users.,"572,325","Greater Philadelphia Area, Great Lakes, Northeastern US",$1M to $10M,Active,2002-01-01,year,2023-04-05,day,,,For Profit,https://ccsindexstokes.com,"Compression Components & Service provides support services to tablet press end users. The Stokes Tablet Press and Index Capsule Filler brands were acquired in two separate transactions and began to manufacture new machines and control systems. Their services include the design and manufacturing of tablet presses, capsule fillers, and control systems to support the needs of their customers with new equipment, remanufactured equipment, control systems, spare parts, training, and field services. For inquiries, telephone and email contact are used.",Manufacturing,,,11-50,,M&A,,,,,,,,,,,Private,,,,,,
Transcend,https://www.crunchbase.com/organization/transcend-f7a2,"Health Care, mHealth, Personal Health, Telehealth, Wellness","Auburn Hills, Michigan, United States","Transcend is a telemedicine company that provides age management, sexual wellness, hormone therapy, and weight loss services.","572,326","Greater Detroit Area, Great Lakes, Midwestern US",$1M to $10M,Active,2020-01-01,year,,,,,For Profit,https://transcendcompany.com,,"Health Care, Mobile",,,51-100,,,,,,,,,,,,,Private,,,,,,
Forty Nine Degrees,https://www.crunchbase.com/organization/forty-nine-degrees,"Digital Signage, Graphic Design, Interior Design, Manufacturing","Coldwater, Ohio, United States","Forty Nine Degrees focuses on the design, consulting, and manufacturing of environmental graphics and signage for various sectors.","572,327","Great Lakes, Midwestern US",$1M to $10M,Active,2002-01-01,year,,,,,For Profit,https://www.fortyninedegrees.com,"Forty Nine Degrees focuses on the design, consulting, and manufacturing of environmental graphics and signage for various sectors.","Design, Manufacturing, Real Estate, Sales and Marketing",,,11-50,,,,,,,,,,,,,Private,,,,,,
Chicago Steak Company,https://www.crunchbase.com/organization/chicago-steak-company,"E-Commerce, Food and Beverage, Food Processing","Chicago, Illinois, United States",Chicago Steak Company is an online shop and wholesaler that supplies gourmet dry-aged meat.,"572,329","Greater Chicago Area, Great Lakes, Midwestern US",$1M to $10M,Active,1865-01-01,year,,,,,For Profit,https://www.mychicagosteak.com/,,"Commerce and Shopping, Food and Beverage",,,11-50,,,,,,,,,,,,,Private,,,,,,
SweetWARE,https://www.crunchbase.com/organization/sweetware,"Information Technology, Software","Oakland, California, United States",SweetWARE is a developer software for the food industry.,"572,332","San Francisco Bay Area, West Coast, Western US",$1M to $10M,Active,1989-01-01,day,,,,,For Profit,http://www.sweetware.com,,"Information Technology, Software",,,1-10,,,,,,,,,,,,,Private,,,,,,
Pathfinder Regional Vocational Technical High School,https://www.crunchbase.com/organization/pathfinder-regional-vocational-technical-high-school,"Education, Tutoring, Vocational Education","Palmer, Alaska, United States",Pathfinder Regional Vocational Technical High School is a education management company.,"572,335",Western US,,Active,,,,,,,For Profit,https://www.pathfindertech.org,Pathfinder Regional Vocational Technical High Schoolare a regional vocational technical high school bringing quality vocational technical programs and innovative academics to students from over 25+ communities.,Education,,,11-50,,,,,,,,,,,,,Private,,,,,,
NextStep Technology,https://www.crunchbase.com/organization/nextstep-technology-4766,"Cyber Security, Information Technology, Logistics","Springfield, Virginia, United States","NextStep Technology provides ERP & IT, mobile app development, cybersecurity, logistics management, and audit services.","572,335","Washington DC Metro Area, East Coast, Southern US",Less than $1M,Active,1997-01-01,year,,,,,For Profit,https://www.nextsteptech.us,,"Information Technology, Privacy and Security, Transportation",1,Brett Le Veille,11-50,,,,,,,,,,,,,Private,,,,,,
Lanica,https://www.crunchbase.com/organization/lanica,"Android, iOS, Mobile, Software, Web Development","San Francisco, California, United States",Lanica enables JavaScript developers to create cross platform games for mobile devices.,"572,337","San Francisco Bay Area, West Coast, Western US",Less than $1M,Active,2012-06-01,day,,,,,For Profit,http://lanica.co,"Lanica was founded in June 2012 by Carlos Icaza (former co-founder/CEO of Ansca Mobile, makers of the Corona SDK), Kota Iguchi (former CEO of Infosia, makers of the successful Emo-Framework game engine) and Bruno Fonzi (founder of CODAME and former Adobe Sr. Engineering Manager). Lanica's platform allows JavaScript developers to create new and engaging cross platform games for mobile devices.","Mobile, Platforms, Software",1,Bruno Fonzi,11-50,1,,,USD,,,USD,,Appcelerator Innovation Fund,,1,1,Private,,,,,,
Periwinkle Trading,https://www.crunchbase.com/organization/periwinkle-trading,,"Arlington, Virginia, United States","Periwinkle Trading is a statistical arbitrage, systematic trading firm that generates exceptional returns for investors.","572,337","Washington DC Metro Area, East Coast, Southern US",,Active,2017-01-01,year,,,,,For Profit,http://periwinkletrading.com/,"Periwinkle Trading is a statistical arbitrage, systematic trading firm that generates exceptional returns for investors through the scientific analysis of commercial data.  Founded by Scott Smallwood, former Managing Director at Morgan Stanley’s Process Driven Trading and Partner at PDT Partners, Periwinkle Trading has developed a powerful system to generate tradable signals and seamless execution.  A complimentary team of mathematicians, engineers and technologists collaborate in a symbiotic culture of signal discovery, trading operations and unabashed fun.",,,,,,,,,,,,,,,,,Private,,,,,,
U S Laboratories,https://www.crunchbase.com/organization/u-s-laboratories,"Health Care, Medical, Medical Device","San Diego, California, United States",U.S. Laboratories (USL) is a diagnostic testing company that specializes in laboratory services.,"572,340","Greater San Diego Area, West Coast, Western US",,Active,1996-01-01,year,1999-02-23,day,,,For Profit,http://www.us-labs.com/,"U.S. Laboratories (USL) is a diagnostic testing company that specializes in laboratory services. We also provide x-ray and ultrasound services through our affiliate Mobilex USA. US Labs delivers accurate and timely results, 24 hours a day, through a delivery model that rapidly responds to the needs of our clients and their patients.",Health Care,,,101-250,,IPO,,,,,,,,,,2,Public,1999-02-23,,,USLB,https://www.crunchbase.com/ipo/u-s-laboratories-ipo--47d2a29a,NASDAQ
National Association of Black Accountants (NABA),https://www.crunchbase.com/organization/national-association-of-black-accountants-naba,,"Greenbelt, Maryland, United States",NABA serves as a resource for greater participation by African Americans and other minorities in the accounting profession.,"572,343","Washington DC Metro Area, East Coast, Southern US",Less than $1M,Active,1969-01-01,day,,,,,For Profit,http://www.nabainc.org/,,,,,11-50,,,,,,,,,,,,,Private,,,,,,
The Stemmler Group,https://www.crunchbase.com/organization/the-stemmler-group,"Commercial, Consulting, Management Consulting","New York, New York, United States",The Stemmler Group is a consulting company that offers end-to-end analysis and assessment services.,"572,344","Greater New York Area, East Coast, Northeastern US",$1M to $10M,Active,2011-01-01,year,,,,,For Profit,https://www.thestemmlergroup.com,"The Stemmler Group provides adaptive strategies and blueprints, program delivery and activation, technology transformation and digital engineering, okr-based outcome management, competitive analysis, and outcome-management office services.","Other, Professional Services",,,11-50,,,,,,,,,,,,,Private,,,,,,
Gardner,https://www.crunchbase.com/organization/gardner-c34b,"Commercial, Property Management, Real Estate","Salt Lake City, Utah, United States","Gardner is a commercial real estate development firm that offers property management, financial planning, and initial planning.","572,344",Western US,$10M to $50M,Active,,,,,,,For Profit,https://gardnergroup.com,,"Other, Real Estate",1,Kem Gardner,11-50,,,,,,,,,,,,,Private,,,,,,
Solubit,https://www.crunchbase.com/organization/solubit,"Data Management, Hardware, Industrial Automation, Software, Test and Measurement","Manitou Springs, Colorado, United States","Solubit is an engineering company that provides test ,measurement, hardware, software, data management and automation services.","572,345",Western US,Less than $1M,Active,2003-01-01,year,,,,,For Profit,http://solubit.com/,,"Data and Analytics, Hardware, Manufacturing, Science and Engineering, Software",1,Bill Raskob,1-10,,,,,,,,,,,,,Private,,,,,,
SPSD,https://www.crunchbase.com/organization/spsd,"Building Material, Construction, Facilities Support Services, Landscaping, Recreation, Water","Arlington, Texas, United States","SPSD is a construction company that offers landscape management, masonry installation, irrigation installation, and management services.","572,350","Dallas/Fort Worth Metroplex, Southern US",$10M to $50M,Active,1982-01-01,year,,,,,For Profit,https://www.spsd.com,"SPSD has continually developed spectacular landscapes for its clients. The company's commitment to high-quality specialty landscape construction has proven invaluable to landscape architects, general contractors, land developers, public agencies, and high-end residential clients. They provide a turnkey option for their clients to be the total outdoor solution.","Administrative Services, Natural Resources, Real Estate, Sports",,,101-250,,,,,,,,,,,,,Private,,,,,,
BeachEdge,https://www.crunchbase.com/organization/beachedge,"Property Development, Property Management, Real Estate, Real Estate Investment, Residential","San Francisco, California, United States",BeachEdge is a ConTech startup that is making beach homes a reality for the modern-day professional.,"572,352","San Francisco Bay Area, West Coast, Western US",,Active,2021-01-01,year,,,,,For Profit,https://beachedge.com,"BeachEdge is a ConTech startup that is making beach homes a reality for the modern day professional. These are hassle free, affordable and cash flow generating beach houses. Ownership of a second home is not nearly as accessible as it used to be 30 years ago, when it was very common for middle-class and upper middle class professionals to have a second property. As inflation outpaced wage growth over the years, it is now generally a luxury reserved for the very wealthy. We are giving an overlooked group of the current generation a reasonable opportunity to experience what has been taken away from them by time: ownership of a vacation home and ownership of hard cash flow asset. Through the use of our ai driven technology and our experience, we are able to make this a reality.","Financial Services, Real Estate",1,Nikhil Choudhary,11-50,,,,,,,,,,,,,Private,,,,,,
Reycor,https://www.crunchbase.com/organization/reycor,"Business Development, Compliance, Legal, Project Management","Phoenix, Arizona, United States","Reycor is a dynamic firm that offers benchmarking, process development, project management, legal compliance, and new business development.","572,353","Greater Phoenix Area, Western US",$1M to $10M,Active,2004-01-01,year,,,,,For Profit,https://reycor.net/,,"Administrative Services, Other, Professional Services",1,Michael Reynoso,1-10,,,,,,,,,,,,,Private,,,,,,
"Alsip, Hazelgreen and Oaklawn Elementary School District 126",https://www.crunchbase.com/organization/alsip-hazelgreen-and-oaklawn-elementary-school-district-126,"Education, Primary Education, Secondary Education","Alsip, Illinois, United States","Alsip, Hazelgreen, and Oaklawn Elementary School District 126 is a school district that serves both primary and secondary students.","572,354","Greater Chicago Area, Great Lakes, Midwestern US",,Active,1890-01-01,year,,,,,For Profit,https://www.dist126.org/,,Education,,,11-50,,,,,,,,,,,,,Private,,,,,,
The Cornerstone Clubs,https://www.crunchbase.com/organization/the-cornerstone-clubs,"Fitness, Health Care, Scheduling, Wellness","Furlong, Pennsylvania, United States",The Cornerstone Clubs is a fitness center that provides group classes and medical fitness programs.,"572,356","Greater Philadelphia Area, Great Lakes, Northeastern US",$10M to $50M,Active,1995-01-01,year,,,,,For Profit,https://www.cornerstoneclubs.com,,"Health Care, Information Technology, Software, Sports",1,Jim Bishop,101-250,,,,,,,,,,,,,Private,,,,,,
NY Tent,https://www.crunchbase.com/organization/ny-tent,"Event Management, Events, Interior Design, Local Business, Rental","Bohemia, New York, United States","NY Tent is an event company that provides tents, flooring, interior decor, event planning, and design services for various occasions.","572,362","Greater New York Area, East Coast, Northeastern US",$1M to $10M,Active,1994-01-01,year,,,,,For Profit,https://www.nytent.com/,,"Commerce and Shopping, Design, Events, Media and Entertainment, Real Estate, Sales and Marketing",1,David Tannenbaum,51-100,,,,,,,,,,,,,Private,,,,,,
A & P Consulting Transportation Engineers,https://www.crunchbase.com/organization/a-p-consulting-transportation-engineers,"Civil Engineering, Consulting","Doral, Florida, United States","A&P Consulting Transportation Engineers is an engineering firm that offers roadway design, utility design, construction management, etc.","572,362","Greater Miami Area, East Coast, Southern US",$10M to $50M,Active,1995-01-01,year,2022-02-23,day,,,For Profit,https://www.apcte.com,"A & P Consulting Transportation Engineers is an engineering consulting firm that provides technical excellence in design and construction. The firm's areas of expertise include civil engineering, transportation, water resources, environmental, structural, lighting, electrical, traffic studies, construction management, and CEI.","Professional Services, Science and Engineering",,,51-100,,M&A,,,,,,,,,,,Private,,,,,,
Austin Rare Coins & Bullion,https://www.crunchbase.com/organization/austin-rare-coins-bullion,"E-Commerce, Precious Metals, Retail","Austin, Texas, United States","Austin Rare Coins & Bullion Specializes in buying and selling rare coins, ancient coins, gold, silver, and precious metals.","572,363",Southern US,$1M to $10M,Active,1989-01-01,year,,,,,For Profit,https://www.austincoins.com,,"Commerce and Shopping, Natural Resources",,,11-50,,,,,,,,,,,,,Private,,,,,,
Inspire Recovery,https://www.crunchbase.com/organization/inspire-recovery,"Health Care, LGBT, Rehabilitation, Therapeutics","West Palm Beach, Florida, United States",Inspire Recovery is a drug and alcohol recovery center for LGBT community.,"572,368","Greater Miami Area, East Coast, Southern US",$1M to $10M,Active,2014-01-01,year,,,,,For Profit,https://inspirerecovery.com,"Inspire Recovery assists the LGBTQIA+ community to recover from drugs and alcohol. Their radically trauma-informed approach includes prescribing hormones with informed consent upon arrival to clients, de-stigmatizing sex work, and not hospitalizing people during mental health crises.","Community and Lifestyle, Health Care, Other",,,11-50,,,,,,,,,,,,,Private,,,,,,
Agency Off Record,https://www.crunchbase.com/organization/agency-off-record,"Advertising, Marketing","Denver, Colorado, United States","Agency Off Record is a marketing and advertising company providing advertising, marketing, and interactive services.","572,368","Greater Denver Area, Western US",$1M to $10M,Active,1992-01-01,year,2015-09-01,month,,,For Profit,http://thinkaor.com,,"Advertising, Sales and Marketing",,,11-50,,M&A,,,,,,,,,,,Private,,,,,,
iFIBER Communications,https://www.crunchbase.com/organization/ifiber-communications,"Internet, Telecommunications","Ephrata, Washington, United States","iFIBER Communications is an Open Access Internet, Television and Telephone service provider.","572,374","West Coast, Western US",$1M to $10M,Active,2005-01-01,year,2022-12-12,day,,,For Profit,http://www.ifiber.tv/,"iFIBER Communications is an Open Access Internet, Television and Telephone service provider that utilizes PUD owned fiber optic networks in open access environments.","Hardware, Internet Services",,,1-10,,M&A,,,,,,,,,,,Private,,,,,,
Fresh Start Produce Sales,https://www.crunchbase.com/organization/fresh-start-produce-sales,"Food and Beverage, Sales","Delray Beach, Florida, United States","Fresh Start Produce Sales is a produce, shipping, and sales company specializing in cabbage, cucumbers, and sweet corn.","572,378","Greater Miami Area, East Coast, Southern US",$1M to $10M,Active,1996-01-01,year,,,,,For Profit,https://www.freshstartproducesales.com,,"Food and Beverage, Sales and Marketing",,,11-50,,,,,,,,,,,,,Private,,,,,,
Barefoot Coders,https://www.crunchbase.com/organization/barefoot-coders,"Internet, Mobile","Brooklyn, New York, United States",We love helping business thrive in uncharted territories.,"572,379","Greater New York Area, East Coast, Northeastern US",,Active,2011-01-01,year,,,,,For Profit,http://www.barefootcoders.com/,,"Internet Services, Mobile",1,Jason Berlinsky,1-10,,,,,,,,,,,,,Private,,,,,,
Intelliquick Delivery,https://www.crunchbase.com/organization/intelliquick-delivery,"Delivery Service, Freight Service","Las Vegas, Nevada, United States",Intelliquick Delivery is a delivery and courier service company.,"572,380",Western US,$10M to $50M,Active,1997-01-01,year,,,,,For Profit,https://www.iqcando.com/,"Intelliquick Delivery is a technology, uncommon customer service, and guaranteed on-time, same-day delivery service. It is a delivery and courier service company. It is pioneering advanced delivery solutions to deliver faster, better, and smarter. It is to automate the delivery process with real-time communications technology.",Transportation,,,101-250,,,,,,,,,,,,,Private,,,,,,
World Panel Products,https://www.crunchbase.com/organization/world-panel-products,"Consumer Goods, Manufacturing, Wood Processing","Miami Beach, Florida, United States",World Panel Products is a producer and distributor company of marine wood products.,"572,381","Greater Miami Area, East Coast, Southern US",$1M to $10M,Active,1993-01-01,year,,,,,For Profit,https://www.worldpanel.com,,"Consumer Goods, Manufacturing",,,11-50,,,,,,,,,,,,,Private,,,,,,
English + Associates Architects,https://www.crunchbase.com/organization/english-associates-architects,"Architecture, Green Building, Interior Design, Project Management","Houston, Texas, United States",English + Associates Architects is an architectural and interior design firm.,"572,382","Greater Houston Area, Southern US",$1M to $10M,Active,1989-01-01,year,,,,,For Profit,https://www.english-architects.com,,"Administrative Services, Design, Other, Real Estate, Sustainability",,,11-50,,,,,,,,,,,,,Private,,,,,,
C2C Schools,https://www.crunchbase.com/organization/c2c,"Education, Sports","Punta Gorda, Florida, United States",C2C Schools is a company that provides a Premier High School Sports Network for Schools.,"572,382","East Coast, Southern US",$10M to $50M,Active,2008-01-01,year,,,,,For Profit,https://www.c2cschools.com,,"Education, Sports",,,11-50,,,,,,,,,,,,,Private,,,,,,
Applied Marketing Science,https://www.crunchbase.com/organization/applied-marketing-science,"Advertising, CRM, Marketing","Waltham, Massachusetts, United States",Applied Marketing Science offers insights and consulting for innovation and litigation support through market research.,"572,383","Greater Boston Area, East Coast, New England",$1M to $10M,Active,1989-01-01,year,,,,,For Profit,https://www.ams-inc.com/,"Applied Marketing Science offers insights and consulting for innovation and litigation support through market research. AMS, founded in 1989 by Professor John Hauser, is a renowned market research and consulting firm specializing in innovation and litigation support, offering research and training to help clients create unique products and experiences.","Advertising, Information Technology, Sales and Marketing, Software",,,11-50,,,,,,,,,,,,,Private,,,,,,
Interwest,https://www.crunchbase.com/organization/interwest-07ce,"3D Technology, Film, Film Distribution","Riverside, California, United States","Interwest is a distributor for 3M-branded films, providing automotive and building films throughout the Western United States.","572,385","Greater Los Angeles Area, Inland Empire, West Coast",,Active,1985-01-01,year,2021-12-08,day,,,For Profit,https://www.interwestdc.com/,"Interwest is a distributor for 3M-branded films, providing automotive and building films throughout the Western United States. It has been a supplier of 3M-brand films to the western United States. Interwest distributes paint-protection film, car wraps, and window tint to its automotive customers and sun control, security, and decorative films to its building window installer customer base.","Hardware, Media and Entertainment, Software, Video",,,1-10,,M&A,,,,,,,,,,,Private,,,,,,
Veritract,https://www.crunchbase.com/organization/veritract,"Hardware, Manufacturing","Salt Lake City, Utah, United States",Veritract develops and manufactures healthcare equipment such as feeding tubes with integrated optics and steering.,"572,387",Western US,Less than $1M,Active,2010-01-01,year,,,,,For Profit,http://veritract.com,"Each year approximately 3,000 people in the US die because of incorrectly placed feeding tubes.  Veritract is developing  feeding tubes with integrated optics and steering allowing precision tube placement and confirmation in the GI tract through direct vision. Their technology can be utilized to prevent unnecessary deaths or serious complications.","Hardware, Manufacturing",1,John Fang,1-10,1,Early Stage Venture,819500,USD,819500,819500,USD,819500,"Kickstart, University Growth Fund, Salt Lake Life Science Angels, Knox",2,4,,Private,,,,,,
Indiana Seal,https://www.crunchbase.com/organization/indiana-seal,"Building Material, Manufacturing, Plastics and Rubber Manufacturing","Fargo, North Dakota, United States",Indiana Seal is a PVC pipe couplings manufacturing company.,"572,389",Midwestern US,$1M to $10M,Active,1981-01-01,year,,,,,For Profit,https://www.indiana-seal.com,"Indiana Seal is a manufacturer of PVC pipe couplings in the United States. Their coupling is made of tough and pliable PVC. This gives them the capability to withstand hazards such as sewer gases, chemicals, fungus growth, various soil conditions, roots, and other in-ground dangers that can lead to leaks and breakdowns in the system.","Manufacturing, Real Estate",,,11-50,,,,,,,,,,,,,Private,,,,,,
