N.S. Giles Foundations,https://www.crunchbase.com/organization/n-s-giles-foundations,"Commercial, Construction, Residential","Bangor, Maine, United States",N.S. Giles Foundations is a construction company. It provides a superior experience and end product that is unparalleled in the industry.,"572,742","East Coast, New England, Northeastern US",$10M to $50M,Active,1998-01-01,year,,,,,For Profit,https://www.nsgiles.com,"N.S. Giles Foundations is a construction company. It provides a superior experience and end product that is unparalleled in the industry. It is focused on delivering world-class customer service and satisfaction, as well as the way it relates to the most advanced technologies in the commercial, industrial and residential concrete market. It is specialized in commercial concrete, industrial concrete, concrete paving, and residential concrete, and more.","Other, Real Estate",,,11-50,,,,,,,,,,,,,Private,,,,,,
Milestone Entertainment,https://www.crunchbase.com/organization/milestone-entertainment,"Consulting, Gaming, Marketing","Manhattan Beach, California, United States",Milestone Entertainment provides solutions for the gaming industry.,"572,744","Greater Los Angeles Area, West Coast, Western US",$1M to $10M,Active,2000-01-01,year,,,,,For Profit,https://milestoneentertainment.com,"Milestone Entertainment offers services, including product development and integrated marketing, that are supported by the catalog of patented games and game mechanics. If you want any information please contact them through email or phone call.","Gaming, Professional Services, Sales and Marketing",1,Randall Katz,11-50,,,,,,,,,,,,,Private,,,,,,
Elite Medical Laboratory,https://www.crunchbase.com/organization/elite-medical-laboratory,"Health Care, Hospital, Medical","Tomball, Texas, United States",Elite Medical Laboratory Solutions is a toxicology facility,"572,744","Greater Houston Area, Southern US",,Active,2015-01-01,year,,,,,For Profit,http://www.elitemedicallab.com/,Elite Medical Laboratory Solutions is a toxicology facility. It was located in,Health Care,1,Saad Alsaab,,,,,,,,,,,,,,Private,,,,,,
Lloyd Industries,https://www.crunchbase.com/organization/lloyd-industries,"Heating, Ventilation, and Air Conditioning (HVAC), Manufacturing","Montgomeryville, Pennsylvania, United States",Lloyd Industries manufactures and supplies fire dampers and HVAC products.,"572,745","Greater Philadelphia Area, Great Lakes, Northeastern US",$10M to $50M,Active,1981-01-01,year,,,,,For Profit,http://firedamper.com,"Lloyd Industries, Inc. has been a renown US manufacturer and supplier of fire dampers and HVAC products since 1981, when it was founded by William P. Lloyd.  Lloyd Industries products are distributed through sales partners in many areas throughout the United States and Canada.","Manufacturing, Real Estate",,,11-50,,,,,,,,,,,,,Private,,,,,,
Care IT Services,https://www.crunchbase.com/organization/care-it-services,"Consulting, Information Technology, Software","Princeton, New Jersey, United States","Care IT Services provides software products, contingent IT staffing, custom software development, and IT solutions services.","572,745","East Coast, Northeastern US",$1M to $10M,Active,2010-01-01,year,,,,,For Profit,http://www.careits.com/,,"Information Technology, Professional Services, Software",,,11-50,,,,,,,,,,,,,Private,,,,,,
MedCo Data,https://www.crunchbase.com/organization/medco-data,"Digital Marketing, Information Services, Information Technology, Management Consulting","Clearwater, Florida, United States","MedCo Data offers IT support, cloud hosting, cloud phone communication, and digital marketing services.","572,751","Tampa Bay Area, East Coast, Southern US",$1M to $10M,Active,2006-01-01,day,2017-06-13,day,,,For Profit,https://www.medcodata.com/,"Revenue cycle management (RCM) is the process that manages claims processing, payment and revenue generation. The process of medical billing is growing increasingly complex and there is no reprieve in sight for the independent practice. Most practices simply lack the knowledge, bandwidth, and expertise required to adapt or effectively navigate these complexities. Consequently, the results can be devastating in terms of revenue capture.","Information Technology, Professional Services, Sales and Marketing",,,11-50,,M&A,,,,,,,,,,,Private,,,,,,
Artifact,https://www.crunchbase.com/organization/artifact-9c9f,"Animation, Graphic Design, Information Technology","Atlanta, Georgia, United States",Artifact is a design-driven production and post-production studio in Atlanta.,"572,753","Greater Atlanta Area, East Coast, Southern US",,Active,1998-01-01,year,,,,,For Profit,https://www.artifactdesign.com,,"Design, Information Technology, Media and Entertainment, Video",,,11-50,,,,,,,,,,,,,Private,,,,,,
Blue Planet Foundation,https://www.crunchbase.com/organization/blue-planet-foundation,"Clean Energy, CleanTech, Energy, Fuel","Honolulu, Hawaii, United States",Blue Planet Foundation is a model of clean energy progress that can inspire and catalyze climate solutions globally.,"572,755","Asia-Pacific (APAC), Western US",,Active,2007-01-01,year,,,,,For Profit,https://blueplanetfoundation.org/,They’re a local nonprofit powering the transition to 100% clean energy in Hawaii and leading the way for global change. They find creative ways to remove the obstacles that stand between us and a future free from fossil fuels.,"Energy, Sustainability",,,,,,,,,,,,,,,,Private,,,,,,
NC Pediatric Dentistry,https://www.crunchbase.com/organization/nc-pediatric-dentistry,"Dental, Health Care, Medical","Salisbury, North Carolina, United States",NC Pediatric Dentistry provides dental care to children and families.,"572,755","East Coast, Southern US",$10M to $50M,Active,,,,,,,For Profit,https://ncpediatricdentistry.com,,Health Care,,,11-50,,,,,,,,,,,,,Private,,,,,,
University Center Imaging,https://www.crunchbase.com/organization/university-center-imaging,"Health Care, Hospitality, Universities","Melbourne, Florida, United States",University Center Imaging is owned and operated by medical technology transfer corporation.,"572,758","East Coast, Southern US",$1B to $10B,Active,1995-01-01,day,,,,,For Profit,http://universitycenterimaging.com/,,"Health Care, Other, Travel and Tourism",,,51-100,,,,,,,,,,,,,Private,,,,,,
UniLink Inc.,https://www.crunchbase.com/organization/unilink-inc,"Financial Services, Hardware, Manufacturing","Rochester, New York, United States","UniLink Inc. is a company that sells check scanners, signature pads and many other types of table top financial hardware and supplies.","572,763","Great Lakes, East Coast, Northeastern US",$10M to $50M,Active,1988-01-01,year,,,,,For Profit,http://www.unilinkinc.com,"UniLink Inc. is One-Stop Shop for all your Business Financial Solutions needs like Financial Printing Equipment & Currency Counters, Scanners etc. Give us a call at 800.666.2980","Financial Services, Hardware, Manufacturing",,,11-50,,,,,,,,,,,,,Private,,,,,,
SAILS Group,https://www.crunchbase.com/organization/sails-group,"Education, Family, Training","Costa Mesa, California, United States","Committed to the quality of care, supervision and training of adults and children with intellectual and developmental disabilities.","572,764","Greater Los Angeles Area, West Coast, Western US",$1M to $10M,Closed,1996-02-01,day,,,,none,For Profit,http://sailsgroup.org,"The SAILS Group, Inc. (Supported And Independent Living Services) is an international agency committed to the quality of care, supervision and training of adults and children with intellectual and developmental disabilities. We specialize in the most behaviorally challenged individuals and are known for our holistic, non-aversive training methods. When possible, we help these individuals develop skills, earn income, and live an integrated life in their communities. The SAILS Group, Inc. operates three separate for-profit corporations: SAILS Bakersfield, SAILS Los Angeles and SAILS San Diego. The SAILS Group also provides management and administrative services for two nonprofit corporations: Kids First Foundation (U.S.A.) and Kids First Foundation – Colombia. SAILS Group is committed to providing the most collaborative and multi-dimensional array of services in order to meet the needs of the individuals served. We realize these needs change on an on-going basis, with the ultimate goal of placing an individual in the least restrictive environment. Therefore, SAILS offers a wide range of placement and intervention services. SAILS holds a long-standing history of expertise and success in this field. The group currently operates 37 licensed and/or vendored services among all the companies, 17 of which are Adult Residential Facilities, fifteen are Children’s Group Homes, two are in-home behavioral support programs, and three are adult behavioral day programs. With an additional three programs under development, the SAILS Group will reach 40 facilities by 1st Quarter 2016, indicating a steady growth rate of two per year. With almost two decades of practicing knowledge, over 400 current employees and a proven record of success in working with and molding some of the most behaviorally challenging individuals in the state of California, SAILS’ success is ultimately related to its philosophy, values, structure and consistency that is relayed to both the persons served and staff alike.","Community and Lifestyle, Education",1,Ihab Shahawi,11-50,,,,,,,,,,,,,Private,,,,,,
PayCargo Finance,https://www.crunchbase.com/organization/paycargo-finance,"Finance, Financial Services, Payments","Coral Gables, Florida, United States","PayCargo Finance is a logistics payment platform that offers cash management, digital transactions, and financial services.","572,764","Greater Miami Area, East Coast, Southern US",$1M to $10M,Active,2017-01-01,year,,,,,For Profit,https://paycargocap.com,,"Financial Services, Payments",,,101-250,,,,,,,,,,,,,Private,,,,,,
Herrero Builders,https://www.crunchbase.com/organization/herrero-construction,"Building Maintenance, Building Material, Construction, Real Estate","San Francisco, California, United States",Herrero Builders is a commercial general contractor in the San Francisco and greater Bay Area.,"572,765","San Francisco Bay Area, West Coast, Western US",$10M to $50M,Active,1955-01-01,year,,,,,For Profit,http://www.herrero.com,,Real Estate,,,51-100,,,,,,,,,,,,,Private,,,,,,
Path 2 Potential,https://www.crunchbase.com/organization/path-2-potential,"Child Care, Education, Health Care, Therapeutics, Training","Queens, New York, United States","Path 2 Potential provides teletherapy, in-home autism, and ABA programs.","572,768","Greater New York Area, East Coast, Northeastern US",$1M to $10M,Active,2016-01-01,year,,,,,For Profit,https://www.path2potential.org,"Path 2 Potential provides ABA therapy for individuals with autism and other developmental disabilities. Their services include ABA therapy, BCBA supervision, continuing education, transitional services, parent training, and vocational training. Their therapist will come home each week and provide ABA therapy for their child using techniques including discrete trial instruction, verbal behavior, fluency-based instruction, and incidental teaching. They also develop functional behavioral assessments, functional communication training, and positive behavior support plans.","Education, Health Care",2,"Angelina Acevedo, Jason Lantier",11-50,,,,,,,,,,,,,Private,,,,,,
Bleecker & Jones,https://www.crunchbase.com/organization/bleecker-jones,"Brewing, Consumer Software, Enterprise Software","New York, New York, United States",Early-stage finance and accounting consultancy for venture-backed companies.,"572,769","Greater New York Area, East Coast, Northeastern US",,Active,2018-03-01,month,,,,,For Profit,https://www.bleeckerandjones.com/,,"Food and Beverage, Software",1,Brian Saplicki,1-10,,,,,,,,,,,,,Private,,,,,,
CarAudioNow,https://www.crunchbase.com/organization/caraudionow,"Audio, Automotive, Boating, Consumer Electronics, Content, Digital Media, Media and Entertainment, Recreational Vehicles, Video","Rancho Santa Margarita, California, United States","CarAudioNow helps you find the best automotive products and shows you how to fix, decide what to buy, and solve common automotive problems.","572,770","Greater Los Angeles Area, West Coast, Western US",,Active,2009-08-01,month,,,,,For Profit,https://www.caraudionow.com,"In 2010, CarAudioNow was founded by Kameron Scott to help consumers find the right products for the right application. The goal was simplify the search for people. While working in the field installing products and testing items first hand, Kameron decided to start to write about his experiences with products online. Combined with his itch for everything digital and websites, CarAudioNow was created and has been chugging along ever since. Roaming through the web and in the stores to find the equipment that's best for your car, truck or boat can be time consuming at the least. Hundreds of options, diluted by thousands of opinions. Where as many of our competitor review sites write meaningless articles, or hire cheap writers to assemble lists for the sole purpose of money (yes we do have to make money too via affiliate links), the experts that write for CarAudioNow.com have been hand picked. They have first-hand experience installing and reviewing Car Audio equipment, or are just gear heads that love everything automotive. At CarAudioNow.com, it is our mission to provide meaningful, unbiased reviews and reliable information about car audio and video equipment in order to simplify your search for the best products. The content you read here is our honest opinion based on our own experiences and expertise. If you don't think that we're doing this effectively, or have general questions or feedback please reach out to us via our Contact Us page! We want to create content and experiences that users love and if we aren't doing that, we want to know.","Consumer Electronics, Hardware, Media and Entertainment, Music and Audio, Sports, Transportation, Video",1,Kameron Scott,1-10,,,,,,,,,,,,,Private,,,,,,
Tury Health,https://www.crunchbase.com/organization/tury-health,"Health Care, Medical","Manning, South Carolina, United States",Equitable Decentralized Clinical Research,"572,770","East Coast, Southern US",,Active,2022-03-24,day,,,,,For Profit,https://turyhealth.com/,Chronic disease prevention focused virtual healthcare,Health Care,,,1-10,,,,,,,,,,,,,Private,,,,,,
Sarkar Tactical,https://www.crunchbase.com/organization/sarkar-tactical,"E-Commerce, Manufacturing, Sales, Textiles, Wearables","El Paso, Texas, United States",Sarkar Tactical is a manufacturer of ballistic armor products.,"572,771",Southern US,$1M to $10M,Active,2008-01-01,year,,,,,For Profit,https://sarkartactical.com,"Sarkar Tactical  design, manufacture and supply of ballistic helmets, body armor, tactical products, soft armor, hard armor, tactical gear, and more. They are a complete armor manufacturer, from molding their helmets to stitching the vests. They also sell their armor products and accessories through online.","Commerce and Shopping, Consumer Electronics, Hardware, Manufacturing, Sales and Marketing",,,11-50,,,,,,,,,,,,,Private,,,,,,
Monarch Communities,https://www.crunchbase.com/organization/monarch-communities,"Elder Care, Health Care, Home Services, Property Development, Property Management, Real Estate, Residential","White Marsh, Maryland, United States",Monarch Communities develops senior living communities .,"572,775","Greater Baltimore-Maryland Area, East Coast, Southern US",,Active,2019-01-01,year,,,,,For Profit,https://monarchcommunities.com,"Monarch Communities provides assisted living services that includes medication management services, move-in coordination services, and residence maintenance services. They provides on-site medical consultations with healthcare providers.","Health Care, Real Estate",,,251-500,,,,,,,,,,,,,Private,,,,,,
Kestrel Venture Management,https://www.crunchbase.com/organization/kestrel-venture-management,,"Boston, Massachusetts, United States","Kestrel Venture Management, a venture capital firm, finances companies based in the New England area and Eastern Massachusetts.","572,775","Greater Boston Area, East Coast, New England",,Active,,,,,,,For Profit,http://www.kestrelvm.com,"Kestrel Management, LLC invests in and offers guidance to small companies in Eastern Massachusetts. It also serves as the management company to two small venture funds. Representative services include project consulting, outside board positions, and the non-executive Chairman role.",,,,,,,,,,,,,,,,,Private,,,,,,
NetDirector,https://www.crunchbase.com/organization/netdirector,"Information Services, Information Technology, SaaS, Software","Tampa, Florida, United States",NetDirector provides a Cloud-based data exchange service to improve business process efficiency and standards compliance. ,"572,777","Tampa Bay Area, East Coast, Southern US",$1M to $10M,Active,2003-01-01,year,,,,,For Profit,http://web.netdirector.biz/,"NetDirector provides a Cloud-based data exchange service to improve business process efficiency and standards compliance.  NetDirector creates value for organizations by providing speed in transaction processing, reducing partner collaboration costs and enabling greater responsiveness in serving customers.","Information Technology, Software",,,11-50,,,,,,,,,,,,,Private,,,,,,
Agricultural Consulting Services,https://www.crunchbase.com/organization/agricultural-consulting-services,"Agriculture, Consulting, Farming","Ithaca, New York, United States",Agricultural Consulting Services provides crop consulting service to farmers.,"572,777","East Coast, Northeastern US",$1M to $10M,Active,1983-01-01,year,,,,,For Profit,https://www.acscrops.com,Agricultural Consulting Services helps farmers to identify and manage the land to minimize erosion and nutrient losses. They collects data and consults with farmers.,"Agriculture and Farming, Professional Services",,,11-50,,,,,,,,,,,,,Private,,,,,,
Translucence Biosystems,https://www.crunchbase.com/organization/translucence-biosystems,"3D Technology, Biotechnology, Life Science, Machine Learning","Irvine, California, United States",Translucence Biosystems is the developer of the device for 3D imaging of biological samples.,"572,783","Greater Los Angeles Area, West Coast, Western US",$1M to $10M,Active,2018-01-01,year,,,,,For Profit,https://www.translucencebio.com,"Translucence Biosystems is enabling a revolution in tissue histology, developing new tools, reagents, assays, and know-how for 3D next-generation imaging of intact tissues. They provide researchers and clinicians with fast, reliable, and complete 3D analysis of their biological samples. Their powerful workflow combines their unique expertise in tissue clearing, light sheet imaging, computational 3D reconstruction, and machine learning-based image analysis, to dramatically increase access to the intricate three dimensional structure of the brain and other complex organs.","Artificial Intelligence (AI), Biotechnology, Data and Analytics, Hardware, Science and Engineering, Software",,,11-50,,,,,,,,,,,,,Private,,,,,,
360 Customer,https://www.crunchbase.com/organization/360-customer-inc,"Education, Human Resources, Staffing Agency","San Jose, California, United States",360 Customer is a staffing and recruiting company offering education recruiting services.,"572,787","San Francisco Bay Area, Silicon Valley, West Coast",$10M to $50M,Closed,,,,,,none,For Profit,http://360customer.com,,"Administrative Services, Education",,,101-250,,,,,,,,,,,,,Private,,,,,,
Anesthesia Consultants of Inadianapolis,https://www.crunchbase.com/organization/anesthesia-consultants-of-inadianapolis,"Health Care, Medical, Wellness","Indianapolis, Indiana, United States","Anesthesia Consultants of Indianapolis is a health agency that provides anesthesia, acute pain procedures, and or management services.","572,788","Great Lakes, Midwestern US",$1M to $10M,Active,2000-01-01,year,,,,,For Profit,https://www.aci-llc.net,,Health Care,,,101-250,,,,,,,,,,,,,Private,,,,,,
Enertron,https://www.crunchbase.com/organization/enertron,"Infrastructure, Logistics, Technical Support","Clinton Township, Michigan, United States","Enertron is an IT firm that provides technical services, logistics, infrastructure and IT support.","572,788","Greater Detroit Area, Great Lakes, Midwestern US",$1M to $10M,Active,1988-01-01,year,,,,,For Profit,https://www.enertronllc.com/,,"Information Technology, Other, Transportation",,,11-50,,,,,,,,,,,,,Private,,,,,,
Doctors Choice Medical Services,https://www.crunchbase.com/organization/doctors-choice-medical-services,"Health Care, Information Technology, Medical","Rockville, Maryland, United States","Doctors Choice Medical Services offers medical billing, IT integration, hosting, data analytics, revenue cycle & denial management services.","572,789","Washington DC Metro Area, East Coast, Southern US",,Active,1995-01-01,year,,,,,For Profit,https://doctorschoicemd.com,,"Health Care, Information Technology",,,11-50,,,,,,,,,,,,,Private,,,,,,
International Minute Press Gastonia NC,https://www.crunchbase.com/organization/international-minute-press-gastonia-nc,Manufacturing,"Gastonia, North Carolina, United States",International Minute Press is a printing company specializing in design and printing services.,"572,789","East Coast, Southern US",$1M to $10M,Active,1991-01-01,year,,,,,For Profit,http://impressnc.com,,Manufacturing,,,1-10,,,,,,,,,,,,,Private,,,,,,
CPS Payment Services,https://www.crunchbase.com/organization/cps-payment-services,"Financial Services, Insurance, Software","Atlanta, Georgia, United States",A market leader providing a full suite of electronic payment solutions. ,"572,792","Greater Atlanta Area, East Coast, Southern US",,Active,2014-03-01,month,2020-10-27,day,,,For Profit,http://cpspaymentservices.com/,Their proprietary software automates your accounts payable process from payment disbursement to payment reconciliation by enabling you to pay your vendors electronically. Installation is free and the solution generates a significant monthly cash rebate.,"Financial Services, Software",,,1-10,,M&A,,,,,,,,,,,Private,,,,,,
