Organization Name,Organization Name URL,Industries,Headquarters Location,Description,CB Rank (Company),Headquarters Regions,Estimated Revenue Range,Operating Status,Founded Date,Founded Date Precision,Exit Date,Exit Date Precision,Closed Date,Closed Date Precision,Company Type,Website,Full Description,Industry Groups,Number of Founders,Founders,Number of Employees,Number of Funding Rounds,Funding Status,Total Equity Funding Amount,Total Equity Funding Amount Currency,Total Equity Funding Amount Currency (in USD),Total Funding Amount,Total Funding Amount Currency,Total Funding Amount Currency (in USD),Top 5 Investors,Number of Lead Investors,Number of Investors,Number of Acquisitions,IPO Status,IPO Date,Delisted Date,Delisted Date Precision,Stock Symbol,Stock Symbol URL,Stock Exchange
Biocept,https://www.crunchbase.com/organization/biocept,"Biotechnology, Health Care, Health Diagnostics","San Diego, California, United States",Biocept employs cell separation technology to develop a class of diagnostic assays for the early detection and diagnosis of cancer.,"36,001","Greater San Diego Area, West Coast, Western US",$1M to $10M,Active,1993-01-01,year,2013-02-05,day,,,For Profit,http://www.biocept.com,"Biocept, an emerging biotechnology leader in cell separation technology, is developing a new, powerful class of diagnostic assays for personalized medicine in early detection, diagnosis and monitoring of cancer. The CEEâ„¢ Cell Enrichment and Extraction platform combines sophisticated attachment chemistry with mathematically modeled fluid dynamics to enable earlier, accurate, less invasive diagnoses. Isolation, purification and analysis of rare cells are managed within their state-of-the-art CLIA-accredited laboratory. The clinical laboratory is accredited by the College of American Pathologists (CAP) and holds licenses in California and several other states.","Biotechnology, Health Care, Science and Engineering",1,Soon Kap Hahn,51-100,8,IPO,46999999,USD,46999999,48199999,USD,48199999,"ROTH Capital Partners, Needham Capital Partners, Chardan Capital",,3,,Public,2013-02-05,,,BIOC,https://www.crunchbase.com/ipo/biocept-ipo--380bec62,NASDAQ
Terumo,https://www.crunchbase.com/organization/terumo-medical-corporation,"Health Care, Manufacturing, Medical, Medical Device, Training","Somerset, New Jersey, United States","Terumo develops technology and medical devices for hollow fiber technology, blood management systems, and endovascular therapy.","36,006","Greater New York Area, East Coast, Northeastern US",$1B to $10B,Active,1972-01-01,year,,,,,For Profit,https://www.terumo.com,"Terumo is a global leader in medical technology and has been committed to ""Contributing to Society through Healthcare"" for nearly 100 years. Based in Tokyo and operating globally, Terumo employs more than 25,000 associates worldwide to provide innovative medical solutions in more than 160 countries and regions. The company started as a Japanese thermometer manufacturer, and has been supporting healthcare ever since. Now, its extensive business portfolio ranges from vascular intervention and cardio-surgical solutions, blood transfusion and cell therapy technology, to medical products essential for daily clinical practice. Terumo will further strive to be of value to patients, medical professionals, and society at large.","Education, Health Care, Manufacturing",2,"Dr. Shibasaburo Kitasato, Shibasaburo Kitasato",11-50,3,,5546715,USD,5546715,22946715,USD,22946715,Biomedical Advanced Research and Development Authority (BARDA),,1,2,Private,,,,,,
Kondukto,https://www.crunchbase.com/organization/kondukto,"Computer, Cyber Security, DevOps, Network Security, Security","Wilmington, Delaware, United States",A modern AppSec Orchestration & Posture management platform,"36,007","Greater Philadelphia Area, East Coast, Southern US",,Active,2019-07-01,month,,,,,For Profit,https://kondukto.io/,Kondukto improves your organisation's security posture by integrating all your security data into one crystal clear view.  It is a comprehensive AppSec Orchestration and Posture Management platform that enables you to make insights actionable and automate workflows to increase the productivity for AppSec teams.,"Consumer Electronics, Hardware, Information Technology, Privacy and Security, Software",2,"Can Taylan Bilgin, Cenk Kalpakoğlu",11-50,3,Seed,1220000,USD,1220000,1220000,USD,1220000,"500 Global, ScaleX Ventures, 500 Istanbul",2,3,,Private,,,,,,
Kingfield,https://www.crunchbase.com/organization/kingfield-corporation,"Financial Services, FinTech","Naples, Florida, United States",Kingfield  provides transparency in financial services operations that improve the client and service provider experience.,"36,009","East Coast, Southern US",,Active,2015-01-01,year,,,,,For Profit,http://www.kingfieldcorp.com/,"Kingfield provides transparency in financial services operations. It is building the next-generation financial markets technology to improve the client and service provider experience. It was founded in 2015 and is headquartered in Naples, Florida.",Financial Services,1,Craig Welch,11-50,2,Seed,7079100,USD,7079100,7079100,USD,7079100,"Contour Venture Partners, Vestigo Ventures",1,2,,Private,,,,,,
Ten-X,https://www.crunchbase.com/organization/ten-x,"Commercial Real Estate, E-Commerce, Information Technology, Marketplace, Online Portals, PropTech, Real Estate","Irvine, California, United States",Ten-X provides online real estate services.,"36,013","Greater Los Angeles Area, West Coast, Western US",$100M to $500M,Active,1990-01-01,year,2020-05-13,day,,,For Profit,http://ten-x.com/,"Ten-X provides an online real estate marketplace allows people to buy and sell commercial and residential real estate properties online using desktop and mobile technology. It buys and sells residential and commercial properties.  Ten-X lets buyers, sellers, and real estate professionals search, list, and transact properties completely online. Jeffrey Frieden, Monte Koch, and Robert Friedman founded Auction in 1990 that became Ten-X in January 2016, with its headquarters is in Irvine in California.","Commerce and Shopping, Information Technology, Internet Services, Real Estate",3,"Jeffrey Frieden, Monte Koch, Robert Friedman",501-1000,3,M&A,141750000,USD,141750000,141750000,USD,141750000,"CapitalG, Stone Point Capital, Starwood Capital Group",2,3,1,Private,,,,,,
Vig It,https://www.crunchbase.com/organization/vigit-technologies,"Gaming, Information Technology, Mobile, Sports","Philadelphia, Pennsylvania, United States",Vig It is a gamified social sports network changing the way people bet on sports.,"36,014","Greater Philadelphia Area, Great Lakes, Northeastern US",,Active,2018-01-01,year,,,,,For Profit,https://www.vigitapp.com/,"Vig It is a gamified social sports network changing the way people bet on sports. Vig It's mobile platform allows fans to compete head to head with their friends while following their favorite teams and industry insiders with access to real-time odds, scores, and statistics in one central location.","Gaming, Information Technology, Mobile, Sports",3,"Andrew Wolfington, Joseph Barba, Shawn Lindsey",11-50,1,Seed,385000,USD,385000,385000,USD,385000,,,,,Private,,,,,,
"MycoMedica Life Sciences, PBC",https://www.crunchbase.com/organization/mycomedica-life-sciences,"Biotechnology, Health Care, Life Science","Shelton, Washington, United States",Psychedelic Medicines,"36,015","West Coast, Western US",,Active,2021-01-01,year,,,,,For Profit,http://www.mycomedica.bio,"Founded by world-renowned mycologist Paul Stamets, MycoMedica, PBC is a lifesciences company developing therapeutic drugs derived from fungi to help people live healthier, better lives.   Our breakthrough innovation, the Stamets Stack, uses a novel combination of ingredients – not found together in nature – to unlock the potential effectiveness of psilocybin in the prevention and treatment of psychiatric and neurological disorders. More information is available at www.mycomedica.bio.","Biotechnology, Health Care, Science and Engineering",3,"Pamela Kryskow M.D., Paul Stamets, Tad Buchanan",11-50,3,Early Stage Venture,68000000,USD,68000000,68000000,USD,68000000,"Obvious Ventures, Artis Ventures (AV), KittyHawk Ventures, True Ventures, Zen Chu",2,6,,Private,,,,,,
BoxLock,https://www.crunchbase.com/organization/boxlock-inc,"Construction, Hardware, Health Care, Logistics, Security, Software","Atlanta, Georgia, United States",The Supply Chain Access Control Platform,"36,016","Greater Atlanta Area, East Coast, Southern US",$1M to $10M,Active,2017-07-03,day,,,,,For Profit,http://www.boxlock.io,"BoxLock’s innovative supply chain access control platform helps businesses protect, track, and transfer assets. The company’s inventory, access, and security solutions make supply chains more efficient, accountable, and reliable wherever assets are stored or transferred. BoxLock’s smart devices and pioneering software platform seamlessly integrate into existing business systems, enabling companies unparalleled control over all facets of their supply chain, from pickup to delivery, and all points in between.  The company’s transformative solutions are used by customers in healthcare, aviation, operations, logistics, and distribution. BoxLock is headquartered in Atlanta, GA.","Hardware, Health Care, Privacy and Security, Real Estate, Software, Transportation",2,"Brad Ruffkess, Mike Glass",11-50,2,Seed,5250000,USD,5250000,5250000,USD,5250000,,,,,Private,,,,,,
Jet Edge International,https://www.crunchbase.com/organization/jet-edge-international,Aerospace,"Van Nuys, California, United States",Jet Edge specializes in jet charter and aircraft management and provides flex based one way jet charter.,"36,018","Greater Los Angeles Area, West Coast, Western US",$10M to $50M,Active,2007-01-01,year,,,,,For Profit,https://www.flyjetedge.com/,"Jet Edge International, a Bard Capital Company, is a leader in full-service global private aviation.  As an integrated large-cabin management operator and maintenance provider, Jet Edge services aircraft owners with a world-class operational platform and extends  individual clients and corporations 365-day-a-year access to one of the most diverse and luxurious aircraft fleets in the world.",Science and Engineering,4,"Allen Ramsay, Gary Waldman, Steve Malvesta, William Papariella",251-500,3,Private Equity,60000000,USD,60000000,285000000,USD,285000000,"Kohlberg Kravis Roberts, Solace Capital Partners",2,2,,Private,,,,,,
DripDrop,https://www.crunchbase.com/organization/drip-drop,"Fitness, Health Care, Medical","San Francisco, California, United States","Drip Drop is an oral rehydration solution that helps prevent dehydration, maintain electrolyte balance, and replenish lost fluids.","36,019","San Francisco Bay Area, West Coast, Western US",$1M to $10M,Active,2008-01-01,year,,,,,For Profit,http://dripdrop.com,"Drip Drop is an oral rehydration solution that helps prevent dehydration, maintain electrolyte balance, and replenish lost fluids. Developed by a Mayo trained physician and Stanford professor, Drip Drop's patent-pending formula helps prevent dehydration, maintain electrolyte balance, and replenish fluids lost through illness or activity.  Having proven effective on humanitarian relief missions across the globe, Drip Drop has been adopted early on by a diverse group of users that include UCSF Medical Center, Stanford University Medical Center, The Mayo Clinic, U.S. Special Forces, pharmacies, and patients with chronic illness.  With 2-3 times the electrolytes and half the calories of sports drinks, Drip Drop is a safe and effective choice for children, adults, and seniors. It was founded in 2008 and is headquartered in San Francisco, California.","Health Care, Sports",1,Dr. Eduardo Dolhun M.D.,11-50,3,Early Stage Venture,9142000,USD,9142000,9142000,USD,9142000,"Aurum Partners, Seth Taube, Pacific Advantage Capital, Ronnie Lott, Sam Nazarian",1,9,,Private,,,,,,
Arc Technologies,https://www.crunchbase.com/organization/arc-technologies-245d,"Financial Services, FinTech, Funding Platform, SaaS","San Francisco, California, United States",Arc is a full-service finance platform that provides software startups with customized financial products.,"36,024","San Francisco Bay Area, West Coast, Western US",,Active,2021-01-01,year,,,,,For Profit,https://www.arc.tech/,"Arc is the full-service finance platform for SaaS, that provides software startups with customized financial products. In partnership with Stripe, Arc is building a first-of-its-kind fintech solution where software founders can borrow, save, and spend on one comprehensive digital platform.","Financial Services, Lending and Investments, Software",3,"Don Muir, Nick Lombardo, Raven Jiang",11-50,3,Early Stage Venture,31000000,USD,31000000,181000000,USD,181000000,"Soma Capital, Alumni Ventures, Bain Capital Ventures, Y Combinator, Clocktower Technology Ventures",3,12,,Private,,,,,,
RedZone Robotics,https://www.crunchbase.com/organization/redzone-robotics,"Information Technology, Robotics, Waste Management","Pittsburgh, Pennsylvania, United States",RedZone Robotics is a provider of wastewater asset management solutions.,"36,028","Great Lakes, Northeastern US",$10M to $50M,Active,1987-01-01,year,2018-06-07,day,,,For Profit,https://redzone.com/,"RedZone Robotics simplifies wastewater management by providing municipal clients with the information and tools necessary to address their most valuable wastewater assets â€“ their sewer pipes. At RedZone we deliver high performance pipeline inspection products and services for municipalities, contractors and engineering firms across North America.","Hardware, Information Technology, Science and Engineering, Software, Sustainability",1,Red Whittaker,51-100,8,M&A,45740387,USD,45740387,46490387,USD,46490387,"Innovation Works, ABS Capital Partners, William Guttman",1,3,1,Private,,,,,,
Ivenix,https://www.crunchbase.com/organization/ivenix,"Health Care, Medical, Medical Device","Amesbury, Massachusetts, United States",Ivenix is a medical technology company that has developed an infusion pump.,"36,029","Greater Boston Area, East Coast, New England",$1M to $10M,Active,2007-01-01,year,2022-03-31,day,,,For Profit,http://www.ivenix.com/,"Ivenix is a medical technology company that develops a next-generation infusion management system. It is a venture-backed medical device company with a vision to transform infusion delivery in every care setting, globally. The company is focused on bringing its first product to market, a new and innovative infusion management system for hospitals. The system combines integrated state-of-the-art information technology and simplicity with an adaptive fluid delivery platform that continuously measures flow.  The company was founded in 2007 and is headquartered in Amesbury, Massachusetts.",Health Care,1,Jesse E. Ambrosina,51-100,4,M&A,92000000,USD,92000000,92000000,USD,92000000,"F-Prime Capital, Eight Roads Ventures, Smiths Medical, Cardinal Partners, WuXi Healthcare Ventures",3,8,,Private,,,,,,
Qpex Biopharma,https://www.crunchbase.com/organization/qpex-biopharma-inc,"Biotechnology, Health Care","San Diego, California, United States",Qpex Biopharma develops a pipeline of agents addressing critical needs for the treatment of infectious diseases.,"36,029","Greater San Diego Area, West Coast, Western US",,Active,2018-10-01,month,2023-06-25,day,,,For Profit,https://www.qpexbio.com/,"Qpex Biopharma develops a pipeline of agents addressing critical needs for the treatment of infectious diseases. It develops multiple antibiotic drugs intended to combat antimicrobial resistance. The company's technology is focused on targeting the treatment of infectious diseases for both inpatient and outpatient cases, deep expertise in the discovery, development and regulatory approval of anti-infective medicines, including an extensive record of working with public/private partnerships focused on new antibiotics to combat antimicrobial resistance, enabling medical businesses optimal use of products and critical needs for the treatment of infectious diseases in the inpatient and outpatient settings. It was founded in 2018 and is headquartered in San Diego, California.","Biotechnology, Health Care, Science and Engineering",1,Michael Dudley,11-50,2,M&A,33000000,USD,33000000,53000000,USD,53000000,"Stanford University, New Enterprise Associates, Adams Street Partners, Biomedical Advanced Research and Development Authority (BARDA), Hatteras Venture Partners",2,6,,Private,,,,,,
Aquifer Motion,https://www.crunchbase.com/organization/aquifer-motion,"3D Technology, Media and Entertainment, SaaS","Austin, Texas, United States",Aquifer Motion is a SaaS platform that enables creators and teams create studio-level animated video without studios.,"36,033",Southern US,$1M to $10M,Active,2018-01-01,year,,,,,For Profit,https://www.aquifermotion.com/,"With Aquifer, anyone can create cinematic, animated content. Our mobile technology transfers your voice and facial expressions to an animated character, capturing all the nuances of human emotion. The resulting video is a cinematically rendered character in a 3d scene. By using machine learning and automation, we remove the frustrating, technical aspects of animation so the focus is on storytelling. The platform combines augmented reality and machine learning to make professional 3D animation accessible for all creators. Aquifer Motion was founded in 2018 and is based in Austin, Texas, USA.","Hardware, Media and Entertainment, Software",2,"Chen Zhang, Matt Udvari",1-10,3,Seed,5334464,USD,5334464,5334464,USD,5334464,"Techstars, Boost VC, LDV Capital, Wedbush Ventures, Geekdom Fund",2,9,,Private,,,,,,
Tignis,https://www.crunchbase.com/organization/tignis,"Information Services, Information Technology, Machine Learning, Software","Seattle, Washington, United States",Tignis develops predictive and proactive support solutions that capitalize on the profound advantages of real-time edge computing.,"36,034","Greater Seattle Area, West Coast, Western US",$1M to $10M,Active,2017-01-01,year,,,,,For Profit,https://tignis.com,"Tignis is an information technology company that enables hardware and software vendors to continually monitor performance data while their products are in use. Using real-time edge computing, machine learning, and customer-specific controls, vendors can quickly identify and proactively remedy performance issues and predict problems before they occur. The company was founded in 2017 and headquartered in Washington, United States.","Artificial Intelligence (AI), Data and Analytics, Information Technology, Software",3,"Jon Herlocker, Mark Huang, Matt McLaughlin",11-50,4,Early Stage Venture,15655922,USD,15655922,15655922,USD,15655922,"DN Capital, Clear Ventures, BMNT, Ashmeet Sidana, Christopher Rust",3,7,,Private,,,,,,
NexHealth,https://www.crunchbase.com/organization/nexhealth,"Electronic Health Record (EHR), Health Care, Scheduling","San Francisco, California, United States","NexHealth is a real-time patient booking platform for people, their doctors, and healthcare developers.","36,038","San Francisco Bay Area, West Coast, Western US",$1M to $10M,Active,2016-01-01,year,,,,,For Profit,https://nexhealth.com,"NexHealth is an operating system for people, their doctors, and healthcare developers. It is the open data layer sitting on top of EHRs connecting patients, doctors, and healthcare developers through features like real-time online booking, messaging, payments, and a standardized API. It is situated in San Francisco, California, and is founded in 2017 by Alamin Uddin.","Health Care, Information Technology, Software",2,"Alamin Uddin, Waleed Asif",101-250,9,Late Stage Venture,177151998,USD,177151998,177151998,USD,177151998,"Point Nine, Scott Belsky, Buckley Ventures, Jack Altman, DeNA",6,31,1,Private,,,,,,
tapouts,https://www.crunchbase.com/organization/tapouts,"Apps, Health Care, Mental Health, mHealth, Mobile, Mobile Apps, Personal Health","Venice, California, United States",Mobile Mental Health Care,"36,038","Greater Los Angeles Area, West Coast, Western US",,Active,2021-01-12,day,,,,,For Profit,https://www.tapouts.com,"tapouts is a mental health edutainment platform for children. Founded in 2020, the company develops proprietary, science backed programs that teach children how to be better at stress. The tapouts method utilizes a preventive intervention strategy which makes sure that children develop the skills they need to excel in life making them healthier, happier and able to reach their full potential.","Apps, Health Care, Mobile, Software",2,"George Moringer, Wolfgang Baier",1-10,1,Seed,1600000,USD,1600000,1600000,USD,1600000,"M Venture Partners (MVP), Royce Hong",1,2,,Private,,,,,,
Finite Carbon,https://www.crunchbase.com/organization/finite-carbon,,"Wayne, Pennsylvania, United States",Finite Carbon provides landowners with an all in one carbon offset monitoring system.,"36,039","Greater Philadelphia Area, Great Lakes, Northeastern US",$1M to $10M,Active,2009-02-09,day,2020-12-16,day,,,For Profit,http://www.finitecarbon.com,Finite Carbon provides landowners with an all-in-one carbon offset monitoring system. Finite Carbon assumes all risks and expenses associated with project issuance and manages all development phases in-house. Finite Carbon works with clients and trains them to ensure that their carbon project is fully integrated with their forest ownership goals and timber operations.,,2,"Scott Nissenbaum, Sean Carney",11-50,2,M&A,7000000,USD,7000000,7000000,USD,7000000,"BP Ventures, TL Ventures",2,2,,Private,,,,,,
Enview,https://www.crunchbase.com/organization/enview,"3D Technology, Big Data, Cloud Computing, Geospatial, InsurTech, Machine Learning","San Francisco, California, United States",Enview is a 3D geospatial analytics company providing automated data analytics to the energy industry and government agencies.,"36,040","San Francisco Bay Area, West Coast, Western US",$1M to $10M,Active,2015-02-02,day,2022-01-06,day,,,For Profit,https://www.enview.com,"Enview is a 3D Geospatial Analytics company protecting people and critical infrastructure, and enhancing national security by mapping the world in 3D. The company’s solutions combine expertise in remote sensing, computer vision, and geospatial big data to enable energy and government customers to predict future threats, and prevent those threats from becoming incidents.","Artificial Intelligence (AI), Data and Analytics, Financial Services, Hardware, Internet Services, Navigation and Mapping, Software",2,"Krassimir Piperkov, San Gunawardana",11-50,3,M&A,20500000,USD,20500000,20500000,USD,20500000,"Crosslink Capital, Statkraft Ventures, Promus Ventures, BrightCap Ventures, Lemnos VC",3,7,,Private,,,,,,
AllClear ID,https://www.crunchbase.com/organization/allclear-id,"Enterprise Software, Identity Management, Security","Austin, Texas, United States",See AllClearID Health for new company. AllClear ID sold its breach business to Experian and is now offers identity protection services.,"36,041",Southern US,$10M to $50M,Active,2004-01-01,year,2019-04-01,month,,,For Profit,http://www.allclearid.com,"AllClear ID was founded in 2004 by CEO Bo Holland.  In March 2019, AllClear sold its breach response business to Experian and is now an employee owned small business.  The proceeds of the sale were used to buy out all institutional investors including Merus, Trellis and Runway.    The award winning AllClear ID team is recognized for its identity protection products, high quality service and successful deployment of large-scale managed services. AllClear helped organizations like Anthem Blue Cross, Home Depot and Sony to respond successfully to data breaches affecting 200 million customers. The company currently offers identity protection products direct to consumer and manages employee and customer benefit plans for large enterprises.","Information Technology, Privacy and Security, Software",1,Bo Holland,11-50,3,M&A,9300000,USD,9300000,21300000,USD,21300000,"Experian, Runway Growth Capital, Merus Capital, Level39, Trellis Partners",3,5,1,Private,,,,,,
Pulley,https://www.crunchbase.com/organization/pulley,"Financial Services, FinTech, Information Services, Software","San Francisco, California, United States","Pulley offers a cap table management platform designed to help startup founders, employees, and investors monitor their equity information.","36,045","San Francisco Bay Area, West Coast, Western US",,Active,2019-01-01,year,,,,,For Profit,https://pulley.com/,"Pulley is a San Francisco-based company that provides a platform to help startup founders and employees figure out their equity. It also offers a cap table management product for startups to provide employee and investor equity information and maintain accurate ownership records. The platform is used to issue employee and investor equity and maintain accurate ownership records as the company scales. Pulley manages the cap table and runs the client's business with a clear understanding of the ownership of the business. Founded in 2019 and is headquartered in San Francisco, CA, USA.","Financial Services, Information Technology, Software",1,Yin Yin Wu,11-50,3,Early Stage Venture,50150000,USD,50150000,50150000,USD,50150000,"8VC, General Catalyst, Stripe, Y Combinator, La Famiglia",2,16,,Private,,,,,,
