Series C - Aldagen,https://www.crunchbase.com/funding_round/aldagen-series-c--2386aab5,"Biotechnology, Health Care, Therapeutics","Durham, North Carolina, United States, North America",Series C,14300000,USD,14300000,2006-12-19,Aldagen,https://www.crunchbase.com/organization/aldagen,http://www.aldagen.com,,,,"Harbert Growth Partners, Intersouth Partners, Piedmont Angel Network, Tall Oaks Capital Partners, The Aurora Funds, The Trelys Funds, Village Ventures","Aldagen develops regenerative cell therapies for inherited metabolic diseases, leukemia, critical limb ischemia and ischemic heart failure.",Late Stage Venture,Yes,,64528283,USD,64528283,M&A,9,"Harbert Growth Partners, Intersouth Partners",7,3,"495,864"
Non Equity Assistance - Carbon Orca,https://www.crunchbase.com/funding_round/carbon-orca-non-equity-assistance--00e22484,"Electric Vehicle, Marine Technology","Seattle, Washington, United States, North America",Non-equity Assistance,,,,2022-01-05,Carbon Orca,https://www.crunchbase.com/organization/carbon-orca,https://carbon-orca.myshopify.com,,,,Maritime Blue Innovation Accelerator,Carbon Orca is developing electric hydrofoil boards.,,No,$1M to $10M,,USD,,,1,Maritime Blue Innovation Accelerator,1,1,"495,865"
Post-IPO Equity - Roxgold Inc.,https://www.crunchbase.com/funding_round/roxgold-inc-post-ipo-equity--2dfb3cce,"Mining, Precious Metals, Real Estate","Toronto, Ontario, Canada, North America",Post-IPO Equity,2250000,CAD,2185047,2010-10-27,Roxgold Inc.,https://www.crunchbase.com/organization/roxgold-inc,http://www.roxgold.com/s/Home.asp,,,,,"Roxgold is a gold exploration and development company with its key asset, the high grade,",,Yes,$10M to $50M,170915255,USD,170915255,M&A,10,,,,"495,867"
Venture Round - LifeWave,https://www.crunchbase.com/funding_round/lifewave-series-unknown--39b99083,"Biotechnology, Health Care, Information Technology, Medical","Los Altos, California, United States, North America",Venture - Series Unknown,618178,USD,618178,2013-12-31,LifeWave,https://www.crunchbase.com/organization/lifewave,http://lifewavebiomed.com,,,,,LifeWave focuses on developing non-invasive and sensing technology for prenatal and neonatal monitoring in clinical and remote settings.,,Yes,$10M to $50M,618178,USD,618178,,4,,,,"495,868"
Venture Round - Forward Edge AI,https://www.crunchbase.com/funding_round/forward-edge-ai-series-unknown--103d2b75,"Artificial Intelligence (AI), National Security, Network Security","San Antonio, Texas, United States, North America",Venture - Series Unknown,,,,2023-01-18,Forward Edge AI,https://www.crunchbase.com/organization/forward-edge-ai,https://www.forwardedge.ai/,,,,Deal Box Ventures,Forward Edge AI develops artificial intelligence for public safety and national security.,,Yes,,1222567,USD,1222567,,3,Deal Box Ventures,1,1,"495,869"
Series B - TearClear,https://www.crunchbase.com/funding_round/tearclear-series-b--de4ae2c6,"Chemical Engineering, Medical Device, Pharmaceutical","Boston, Massachusetts, United States, North America",Series B,22000000,USD,22000000,2020-08-11,TearClear,https://www.crunchbase.com/organization/tearclear,https://www.tearclear.com/,,,,"Bluestem Capital, Flying L Partners, Visionary Venture Fund",TearClear is a pharmaceutical company that specializes in providing a disruptive eye health technology.,Early Stage Venture,Yes,,51954261,USD,51954261,,6,,3,,"495,871"
Seed Round - BoxMySpace,https://www.crunchbase.com/funding_round/boxmyspace-seed--ba94d00c,"E-Commerce, Internet, Self-Storage","Mumbai, Maharashtra, India, Asia",Seed,,,,2017-08-04,BoxMySpace,https://www.crunchbase.com/organization/boxmyspace,http://boxmyspace.com/,,,,"Aditya Vazirani, AVN Business Solutions, Business Solutions, Dreamweaver Investments, Jayakumar Ramamoorthy, Rhea Vazirani, Satveer Singh Thakral, Vaibhav Vohra","BoxMySpace Whichever box you need, we'll bring it to you within 24 hours.",Seed,Yes,$1M to $10M,3200000,USD,3200000,Seed,2,Jayakumar Ramamoorthy,8,,"495,873"
Post-IPO Equity - Newron Pharmaceuticals,https://www.crunchbase.com/funding_round/newron-pharmaceuticals-post-ipo-equity--5e187e82,"Biopharma, Biotechnology, Health Care, Medical","Bresso, Lombardia, Italy, Europe",Post-IPO Equity,26100000,CHF,26704318,2016-10-07,Newron Pharmaceuticals,https://www.crunchbase.com/organization/newron-pharmaceuticals,http://www.newron.com,,,,,Newron Pharmaceuticals S.p.A. is a biopharmaceutical company,,Yes,$1M to $10M,129431024,USD,129431024,IPO,10,,,,"495,874"
Debt Financing - Jain Housing & Constructions,https://www.crunchbase.com/funding_round/jain-housing-constructions-debt-financing--7242232b,"Architecture, Construction, Real Estate","Chennai, Tamil Nadu, India, Asia",Debt Financing,2200000000,INR,35607797,2015-02-04,Jain Housing & Constructions,https://www.crunchbase.com/organization/jain-housing-constructions,http://www.jainhousing.com/,,,,GIC,Jain Housing Group entered the escalated market of real estate in the year 1988 with a presence in five states of Southern India.,,No,,3950000000,INR,59551860,Private Equity,3,GIC,1,,"495,875"
Venture Round - Genea,https://www.crunchbase.com/funding_round/genea-energy-series-unknown--ac94d8a5,"Cloud Data Services, Commercial Real Estate, Real Estate, Service Industry, Software","Irvine, California, United States, North America",Venture - Series Unknown,1625000,USD,1625000,2007-07-05,Genea,https://www.crunchbase.com/organization/genea-energy,https://www.getgenea.com/,,,,,Genea provides cloud-based software platform services.,,Yes,$10M to $50M,7625000,USD,7625000,Late Stage Venture,4,,,,"495,876"
Post-IPO Equity - Bay Bank,https://www.crunchbase.com/funding_round/bay-bank-post-ipo-equity--977bf635,"Banking, Financial Services","Columbia, Maryland, United States, North America",Post-IPO Equity,6999999,USD,6999999,2014-05-16,Bay Bank,https://www.crunchbase.com/organization/bay-bank,https://www.baybankmd.com/,,,,,Bay Bank serves the needs of the local community with exceptional personal attention and the most convenient financial solutions.,,Yes,,6999999,USD,6999999,M&A,1,,,,"495,877"
Seed Round - Dynamic Optics,https://www.crunchbase.com/funding_round/dynamic-optics-seed--9cb9a55d,"Eyewear, Information Services, Information Technology, Manufacturing","Padova, Veneto, Italy, Europe",Seed,200000,EUR,231913,2021-10-05,Dynamic Optics,https://www.crunchbase.com/organization/dynamic-optics,https://www.dynamic-optics.it/,,,,Progress Tech Transfer Fund,"Dynamic Optics manufactures adaptive lenses, deformable mirrors, lenses and optics and wavefront sensors.",Seed,Yes,$1M to $10M,200000,EUR,231914,Seed,1,Progress Tech Transfer Fund,1,,"495,878"
Pre Seed Round - ROBOjuice,https://www.crunchbase.com/funding_round/robojuice-pre-seed--5b2bf095,"Food and Beverage, Robotics","San Francisco, California, United States, North America",Pre-Seed,500000,USD,500000,2020-01-01,ROBOjuice,https://www.crunchbase.com/organization/robojuice,https://robojuice.ai,,,,,"Food tech, Robotics, Food & beverage",Seed,Yes,,500000,USD,500000,Seed,2,,,,"495,879"
Venture Round - Greycork,https://www.crunchbase.com/funding_round/greycork-series-unknown--ec3daca0,"E-Commerce, Fashion, Interior Design","Providence, Rhode Island, United States, North America",Venture - Series Unknown,,,,2015-07-13,Greycork,https://www.crunchbase.com/organization/greycork,http://greycork.com,,,,Nick Ducoff,"Greycork offers a range of interior design, home and garden design, and accessories for homes.",,Yes,,1972500,USD,1972500,Seed,5,,1,,"495,880"
Seed Round - XnTree,https://www.crunchbase.com/funding_round/xntree-seed--892eabe9,Venture Capital,"London, England, United Kingdom, Europe",Seed,,,,2016-01-01,XnTree,https://www.crunchbase.com/organization/xntree,http://xntree.com/,,,,Level39,XnTree is an innovation and entrepreneurial bridge between Seoul and London.,Seed,Yes,Less than $1M,,USD,,Seed,1,,1,,"495,882"
Seed Round - Arkis BioSciences,https://www.crunchbase.com/funding_round/arkis-biosciences-seed--27bb4630,"Biotechnology, Health Care, Medical Device","Knoxville, Tennessee, United States, North America",Seed,400000,USD,400000,2013-03-28,Arkis BioSciences,https://www.crunchbase.com/organization/arkis-biosciences,https://www.arkisbiosciences.com,,,,,Arkis BioSciences® is a medical device company providing advanced implantable technology and minimally invasive surgical instrumentation.,Seed,Yes,$1M to $10M,9631000,USD,9631000,M&A,7,,,,"495,883"
Pre Seed Round - Backr,https://www.crunchbase.com/funding_round/backr-pre-seed--0f53f100,Software,"Kingston, Ontario, Canada, North America",Pre-Seed,,,,2022-11-01,Backr,https://www.crunchbase.com/organization/backr,https://www.backr.space,,,,Techstars,Backr develops software and solutions for content creators interested in building businesses.,Seed,Yes,,,USD,,Seed,3,Techstars,1,,"495,884"
Corporate Round - Reliance Jio,https://www.crunchbase.com/funding_round/reliance-jio-infocomm-ltd-234-corporate-round--e6d55472,"Apps, Consumer Electronics, Electronics, Information Services, Information Technology, Internet, Telecommunications","Mumbai, Maharashtra, India, Asia",Corporate Round,337370000000,INR,4489237314,2020-07-15,Reliance Jio,https://www.crunchbase.com/organization/reliance-jio-infocomm-ltd-234,https://www.jio.com,4044058571429,INR,53812545984,Google,Reliance Jio is a telecommunications company that offers mobile internet access to customers and businesses.,,Yes,$1B to $10B,28361990389,USD,28361990389,,16,Google,1,1,"495,886"
Series A - Easybook,https://www.crunchbase.com/funding_round/easybook-series-a--6cf1aa66,"E-Commerce, Internet, Ticketing, Travel","Singapore, Central Region, Singapore, Asia",Series A,3000000,USD,3000000,2015-10-08,Easybook,https://www.crunchbase.com/organization/easybook,http://www.easybook.com/,,,,,"LARGEST Bus, Train, Car, Tour & Ferry Ticket Booking.",Early Stage Venture,Yes,,8000000,USD,8000000,Late Stage Venture,2,,,,"495,887"
Venture Round - FreshKet,https://www.crunchbase.com/funding_round/freshket-series-unknown--62dbf336,"Agriculture, E-Commerce, Food and Beverage, Restaurants","Makkasan, Krung Thep, Thailand, Asia",Venture - Series Unknown,,,,2021-11-30,FreshKet,https://www.crunchbase.com/organization/freshket,https://www.freshket.co,,,,500 Global,FreshKet is an integrated workflow marketplace for fresh food suppliers and restaurants.,,Yes,$1M to $10M,26229003,USD,26229003,Early Stage Venture,4,,1,,"495,888"
Series A - Alltrue,https://www.crunchbase.com/funding_round/alltrue-series-a--6e131d32,"Digital Media, Media and Entertainment, Social Media","New York, New York, United States, North America",Series A,8000000,USD,8000000,2000-07-26,Alltrue,https://www.crunchbase.com/organization/alltrue,http://www.alltrue.com/,,,,Atlas Venture,Alltrue provides socially conscious prouducts and lifestyle product.,Early Stage Venture,Yes,$1M to $10M,8000000,USD,8000000,Early Stage Venture,1,Atlas Venture,1,,"495,889"
Seed Round - Warmup Your Email,https://www.crunchbase.com/funding_round/product-ninja-seed--29220e55,"Email, Software, Subscription Service","Wilmington, Delaware, United States, North America",Seed,,,,2014-11-09,Warmup Your Email,https://www.crunchbase.com/organization/product-ninja,https://warmupyour.email,,,,,Warmup Your Email is an email reputation software company.,Seed,Yes,Less than $1M,,USD,,Seed,1,,,,"495,890"
Angel Round - Nail Your Mortgage,https://www.crunchbase.com/funding_round/nail-your-mortgage-angel--89cab6e9,"Banking, Finance, FinTech, Internet","Chicago, Illinois, United States, North America",Angel,3100000,USD,3100000,2009-10-01,Nail Your Mortgage,https://www.crunchbase.com/organization/nail-your-mortgage,http://www.nailyourmortgage.com,,,,,Nail Your Mortgage offers solutions for borrowers and lenders to interact in an open electronic marketplace.,Seed,Yes,,3100000,USD,3100000,Seed,1,,,,"495,891"
Seed Round - Hardywood Park Craft Brewery,https://www.crunchbase.com/funding_round/hardywood-park-craft-brewery-seed--ac2f515b,"Consumer Goods, Food and Beverage, Wine And Spirits","Richmond, Virginia, United States, North America",Seed,449923,USD,449923,2017-03-15,Hardywood Park Craft Brewery,https://www.crunchbase.com/organization/hardywood-park-craft-brewery,https://hardywood.com/,,,,,"Hardywood Park Craft Brewery specializes in producing craft beer, canned beer and similar alcoholic beverages.",Seed,Yes,$1M to $10M,1751156,USD,1751156,,2,,,,"495,892"
Series E - Zomato,https://www.crunchbase.com/funding_round/zomato-series-e--b01098be,"Food Delivery, Mobile Apps, Reservations, Restaurants","Gurgaon, Haryana, India, Asia",Series E,60000000,USD,60000000,2014-11-18,Zomato,https://www.crunchbase.com/organization/zomato,https://www.zomato.com,,,,"Apple, Info Edge, Sequoia Capital, Vy Capital","Zomato is a restaurant discovery platform that allows users to search for restaurants, browse menus, and place orders for food delivery.",Late Stage Venture,Yes,$500M to $1B,3018099967,USD,3018099967,IPO,23,"Info Edge, Vy Capital",4,1,"495,893"
Seed Round - Spider Labs,https://www.crunchbase.com/funding_round/spider-labs-seed--cd7355e2,"Cyber Security, Internet, Security","Tokyo, Tokyo, Japan, Asia",Seed,65000000,JPY,607340,2018-04-17,Spider Labs,https://www.crunchbase.com/organization/spider-labs,https://spideraf.com/,,,,"Daiwa Corporate Investment, Freebit Investment, Shogo Kawada, Yoshinobu Saeki",Spider Labs offers solutions to help fight ad fraud and ensure data security.,Seed,Yes,Less than $1M,935000000,JPY,8467888,Early Stage Venture,4,,4,,"495,894"
Seed Round - Zeplin,https://www.crunchbase.com/funding_round/zeplin-seed--70750e13,"Collaboration, Developer Tools, Mobile, Mobile Apps, Product Design, SaaS, Software","San Francisco, California, United States, North America",Seed,19000,USD,19000,2014-10-01,Zeplin,https://www.crunchbase.com/organization/zeplin,http://zeplin.io,,,,Startupbootcamp Istanbul,Zeplin is a collaboration tool between designers and developers to publish finalized designs,Seed,Yes,$10M to $50M,1359541,USD,1359541,Seed,4,,1,,"495,895"
Venture Round - Realtime Immersion (RTI),https://www.crunchbase.com/funding_round/realtime-immersion--rti--series-unknown--566b4716,"Media and Entertainment, Social Media, Sports","Westborough, Massachusetts, United States, North America",Venture - Series Unknown,9297736,USD,9297736,2016-04-18,Realtime Immersion (RTI),https://www.crunchbase.com/organization/realtime-immersion--rti-,http://www.rtistudios.com/,,,,,"RTI provides end-to-end solutions for delivering the world’s highest-quality, live 360º video for news reporting, entertainment, and sports.",,Yes,$10M to $50M,11247736,USD,11247736,,4,,,,"495,896"
Venture Round - White Raven,https://www.crunchbase.com/funding_round/fringefy-series-unknown--c5654381,"Artificial Intelligence (AI), Image Recognition, Location Based Services, Machine Learning, Software, Visual Search","Ramat Gan, Tel Aviv, Israel, Asia",Venture - Series Unknown,,,,2015-03-15,White Raven,https://www.crunchbase.com/organization/fringefy,http://www.whiteraven.ai,,,,"Andrew Gault, Greg Castle, Microsoft Accelerator, Presence Capital, Rothenberg Ventures, Super Ventures",White Raven is an AI-based visual positioning software company for autonomous robots and cars that navigate in areas where GPS connectivity.,,Yes,Less than $1M,,USD,,,4,,6,,"495,898"
Seed Round - MORFO,https://www.crunchbase.com/funding_round/morfo-seed--29628cfa,"Artificial Intelligence (AI), Computer Vision, Drones, Forestry, GreenTech","Paris, Ile-de-France, France, Europe",Seed,4000000,EUR,4222299,2022-12-08,MORFO,https://www.crunchbase.com/organization/morfo,https://www.morfo.rest,,,,"AFI Ventures, Caroline Lair, Demeter, Graffi Rathamohan, Jean-Gabriel Levon, Nicolas Béraud, Raise Ventures, Teampact ventures","MORFO incorporates biological symbioses, drones, and AI technologies to sustainably reforest and fight against global warming.",Seed,Yes,,4000000,EUR,4222300,Seed,2,"Demeter, Raise Ventures",8,5,"495,899"
Product Crowdfunding - Purism,https://www.crunchbase.com/funding_round/purism-product-crowdfunding--73511fe8,"Cyber Security, Hardware, Linux, Mobile Devices, Open Source, Operating Systems, Privacy, Software","San Francisco, California, United States, North America",Product Crowdfunding,278745,USD,278745,2015-06-21,Purism,https://www.crunchbase.com/organization/purism,https://puri.sm/,,,,,"Purism beautiful computers designed to respect and protect your privacy, security and freedom.",,No,$1M to $10M,5588678,USD,5588678,Seed,8,,,,"495,900"
Series B - Alpine Data Labs,https://www.crunchbase.com/funding_round/alpine-data-labs-series-b--687b91e7,"Analytics, Big Data, Collaborative Consumption","San Francisco, California, United States, North America",Series B,16000000,USD,16000000,2013-11-22,Alpine Data Labs,https://www.crunchbase.com/organization/alpine-data-labs,http://www.alpinenow.com,50000000,USD,50000000,"Bosch Ventures, Dell Technologies Capital, Mission Ventures, Sierra Ventures, UMC Capital",Alpine Data Labs develops big data predictive solutions that simplify the process of building predictive models for data sets.,Early Stage Venture,Yes,$1M to $10M,25000000,USD,25000000,M&A,3,,5,4,"495,901"
Debt Financing - Happy Tax,https://www.crunchbase.com/funding_round/happy-tax-debt-financing--62ec9123,"Accounting, Customer Service, Financial Services, FinTech","Miami Beach, Florida, United States, North America",Debt Financing,240000,USD,240000,2017-01-12,Happy Tax,https://www.crunchbase.com/organization/happy-tax,http://www.gethappytax.com,,,,Brian Anderson,"Happy Tax is a national tax preparation firm that makes the stressful, time consuming and inefficient tax preparation process easy and fun.",,No,Less than $1M,3240000,USD,3240000,,6,,1,,"495,902"
Private Equity Round - Parkplatzking,https://www.crunchbase.com/funding_round/parkplatzking-private-equity--875510d0,Public Transportation,"Hamburg, Hamburg, Germany, Europe",Private Equity,,,,2012-10-15,Parkplatzking,https://www.crunchbase.com/organization/parkplatzking,http://www.parkplatzking.de,,,,,Parkplatzking offers an online platform that enables its users to find and book parking spaces in Germany.,Private Equity,Yes,$1M to $10M,,USD,,Private Equity,1,,,,"495,903"
Venture Round - 263 Cloud Communications,https://www.crunchbase.com/funding_round/net-263-series-unknown--b1edb639,Messaging,"Beijing, Beijing, China, Asia",Venture - Series Unknown,10000000,USD,10000000,2005-01-01,263 Cloud Communications,https://www.crunchbase.com/organization/net-263,https://www.263.net,,,,SAIF Partners,263 Cloud Communications is a comprehensive communication service provider that focuses on small and medium enterprises and business people.,,Yes,Less than $1M,10000000,USD,10000000,,1,,1,,"495,904"
Venture Round - Silicon Jelly,https://www.crunchbase.com/funding_round/silicon-jelly-2-series-unknown--ce32cb8e,"Gaming, Mobile, Video Games","Praha, Hlavni mesto Praha, Czech Republic, Europe",Venture - Series Unknown,,,,2014-01-01,Silicon Jelly,https://www.crunchbase.com/organization/silicon-jelly-2,http://siliconjelly.com,,,,Rockaway Capital,Silicon Jelly is an independent gaming studio.,,Yes,$1M to $10M,,USD,,,1,,1,,"495,905"
Angel Round - Fengniaowu,https://www.crunchbase.com/funding_round/fengniaowu-angel--9753b15f,"Real Estate, Rental","Shanghai, Shanghai, China, Asia",Angel,,,,2018-06-28,Fengniaowu,https://www.crunchbase.com/organization/fengniaowu,http://www.fengniaowu.com/pc/index.html,,,,,Fengniaowu (蜂鸟屋) is a financial technology platform for apartments rental. Company.,Seed,Yes,,,USD,,Seed,1,,,,"495,906"
Seed Round - Hojoki,https://www.crunchbase.com/funding_round/hojoki-seed--b97416c6,"Cloud Computing, Collaboration, Enterprise Software, Software, Web Development","Chemnitz, Sachsen, Germany, Europe",Seed,620000,USD,620000,2011-11-22,Hojoki,https://www.crunchbase.com/organization/hojoki,http://getcatchapp.com/hojoki,,,,KIZOO Technology Capital,Hojoki provides team messaging and task management services with real-time integration for apps used by cloud workers.,Seed,Yes,$1M to $10M,620000,USD,620000,Early Stage Venture,2,,1,,"495,907"
Seed Round - Relmada Therapeutics,https://www.crunchbase.com/funding_round/relmada-therapeutics-seed--a20c4e92,"Biotechnology, Clinical Trials, Pharmaceutical","New York, New York, United States, North America",Seed,,,,2004-02-25,Relmada Therapeutics,https://www.crunchbase.com/organization/relmada-therapeutics,http://www.relmada.com,,,,BioAdvance,"Relmada Therapeutics is a biotech company addressing diseases of the central nervous system, with a focus on major depressive disorder.",Seed,Yes,$1M to $10M,191131110,USD,191131110,IPO,9,,1,,"495,908"
Grant - Enviromaster International,https://www.crunchbase.com/funding_round/enviromaster-international-corp-grant--10e5e0f0,"Heating, Ventilation, and Air Conditioning (HVAC)","Rome, Lazio, Italy, Europe",Grant,996004,USD,996004,1999-07-12,Enviromaster International,https://www.crunchbase.com/organization/enviromaster-international-corp,http://www.emiretroaire.com,,,,NYSERDA,Enviromaster International Corp.,,No,,1477978,USD,1477978,,2,,1,,"495,909"
Series A - Tellius,https://www.crunchbase.com/funding_round/tellius-series-a--71d89ced,"Analytics, Artificial Intelligence (AI), Intelligent Systems, Machine Learning, Predictive Analytics","Reston, Virginia, United States, North America",Series A,8000000,USD,8000000,2021-04-27,Tellius,https://www.crunchbase.com/organization/tellius,http://www.tellius.com,,,,"Grotech Ventures, Sands Capital Ventures",Tellius is an AI-powered business analytics platform designed to help enterprises accelerate data-driven insight and decision-making.,Early Stage Venture,Yes,$1M to $10M,33000000,USD,33000000,Early Stage Venture,4,Sands Capital Ventures,2,1,"495,910"
Angel Round - Hamac,https://www.crunchbase.com/funding_round/hamac-angel--b7404554,"Fashion, Lifestyle, Swimming","Paris, Ile-de-France, France, Europe",Angel,,,,2016-04-13,Hamac,https://www.crunchbase.com/organization/hamac,http://www.hamac-paris.com,,,,GoBeyond,Hamac is a young and innovative company created in 2009 by Florence Hallouin.,Seed,Yes,Less than $1M,,USD,,Seed,5,,1,1,"495,911"
Seed Round - Talixo,https://www.crunchbase.com/funding_round/talixo-seed--1076b23b,"B2B, Transportation, Travel","Berlin, Berlin, Germany, Europe",Seed,,,,2014-02-01,Talixo,https://www.crunchbase.com/organization/talixo,https://talixo.com/,,,,Matthew Witt,Talixo is a B2B ground transportation solution.,Seed,Yes,$10M to $50M,6600000,EUR,7651132,Early Stage Venture,4,,1,,"495,913"
Equity Crowdfunding - Lowry Academy of Visual and Performing Arts,https://www.crunchbase.com/funding_round/lowry-academy-of-visual-and-performing-arts-equity-crowdfunding--4f117afc,"Art, Education, Training","Portsmouth, Virginia, United States, North America",Equity Crowdfunding,,,,2012-04-23,Lowry Academy of Visual and Performing Arts,https://www.crunchbase.com/organization/lowry-academy-of-visual-and-performing-arts,https://www.lowryacademy.org/,,,,,"Lowry Academy of Visual and Performing Arts, (Lowry Academy) is a not-for-profit 501 (c) (3) organization.",,Yes,Less than $1M,,USD,,,1,,,,"495,914"
Grant - Canadian Medical Association,https://www.crunchbase.com/funding_round/canadian-medical-association-grant--21503eff,"Association, Health Care","Ottawa, Ontario, Canada, North America",Grant,500000,USD,500000,2020-02-02,Canadian Medical Association,https://www.crunchbase.com/organization/canadian-medical-association,https://www.cma.ca/,,,,,"The Canadian Medical Association (CMA) is a national, voluntary association of physicians that advocates on behalf of its members.",,No,$10M to $50M,500000,USD,500000,,1,,,,"495,915"
Venture Round - Algorithm,https://www.crunchbase.com/funding_round/algorithm-2-series-unknown--088ed261,"Information Technology, Management Information Systems, Software","Columbus, Ohio, United States, North America",Venture - Series Unknown,,,,2017-12-04,Algorithm,https://www.crunchbase.com/organization/algorithm-2,http://www.algorithminc.com/,,,,Tendercapital,Algorithm provides business management software consulting services.,,Yes,$10M to $50M,292000,USD,292000,,2,Tendercapital,1,,"495,916"
Venture Round - Tissue Regeneration Systems,https://www.crunchbase.com/funding_round/tissue-regeneration-systems-series-unknown--0a65dbd8,"Biotechnology, Medical Device, Pharmaceutical","Kirkland, Washington, United States, North America",Venture - Series Unknown,4093181,USD,4093181,2015-05-19,Tissue Regeneration Systems,https://www.crunchbase.com/organization/tissue-regeneration-systems,http://tissuesys.com,,,,,Tissue Regeneration Systems is a medical device company commercializing a skeletal reconstruction and bone regeneration technology platform.,,Yes,$1M to $10M,18332002,USD,18332002,,5,,,,"495,917"
Angel Round - Infinit,https://www.crunchbase.com/funding_round/infinit-angel--eed7c8e8,"Data Storage, Infrastructure","Paris, Ile-de-France, France, Europe",Angel,340000,USD,340000,2013-03-19,Infinit,https://www.crunchbase.com/organization/infinit,https://infinit.sh/,,,,Alive Ideas,Infinit International is a venture backed company specializing in storage technologies.,Seed,Yes,$1M to $10M,2360000,USD,2360000,M&A,6,,1,,"495,919"
Series A - BrowseLabs,https://www.crunchbase.com/funding_round/browselabs-series-a--3e1db76a,"Advertising, B2C, SaaS","Kraków, Malopolskie, Poland, Europe",Series A,3000000,USD,3000000,2013-09-01,BrowseLabs,https://www.crunchbase.com/organization/browselabs,http://www.browselabs.com,,,,,"BrowseLabs is a technology incubator, with a focus on disruptive business to consumer products and SaaS platforms.",Early Stage Venture,Yes,$1M to $10M,3000000,USD,3000000,Early Stage Venture,1,,,,"495,920"
