Series A - ZWSOFT,https://www.crunchbase.com/funding_round/zwsoft-series-a--fe87b123,"CAD, Manufacturing, Software","Guangzhou, Guangdong, China, Asia",Series A,80000000,CNY,11623345,2018-12-06,ZWSOFT,https://www.crunchbase.com/organization/zwsoft,https://www.zwsoft.com,,,,"CASIC, Fortune Venture Capital",ZWSOFT is a world renowned CAD/CAM solutions provider.,Early Stage Venture,Yes,$1M to $10M,220000000,CNY,31392609,IPO,2,Fortune Venture Capital,2,,"257,075"
Non Equity Assistance - Mortgage Peer Network,https://www.crunchbase.com/funding_round/mortgage-peer-network-non-equity-assistance--0637b04b,Financial Services,"North Little Rock, Arkansas, United States, North America",Non-equity Assistance,,,,2016-07-28,Mortgage Peer Network,https://www.crunchbase.com/organization/mortgage-peer-network,http://www.mtgpeer.com/,,,,The FIS FinTech Accelerator in Partnership with The Venture Center,Mortgage Peer Network is a hosted service comprised of member institutions.,,No,,,USD,,,1,The FIS FinTech Accelerator in Partnership with The Venture Center,1,,"257,076"
Venture Round - MapLight Therapeutics,https://www.crunchbase.com/funding_round/alvarado-therapeutics-series-unknown--c1fde663,"Biopharma, Biotechnology, Life Science, Medical","Palo Alto, California, United States, North America",Venture - Series Unknown,29999999,USD,29999999,2021-03-10,MapLight Therapeutics,https://www.crunchbase.com/organization/alvarado-therapeutics,https://maplightrx.com,,,,,MapLight Therapeutics is a biopharma company that offers a platform designed to discover and develop therapeutics for brain disorders.,,Yes,$10M to $50M,268099999,USD,268099999,Late Stage Venture,4,,,,"257,077"
Grant - NVIDIA,https://www.crunchbase.com/funding_round/nvidia-grant--d309aaef,"Artificial Intelligence (AI), GPU, Hardware, Software, Virtual Reality","Santa Clara, California, United States, North America",Grant,25000000,USD,25000000,2010-08-09,NVIDIA,https://www.crunchbase.com/organization/nvidia,https://www.nvidia.com,,,,DARPA,"NVIDIA is a computing platform company operating at the intersection of graphics, HPC, and AI.",,No,$10B+,4095000000,USD,4095000000,IPO,8,DARPA,1,,"257,079"
Seed Round - HomeSolution.net,https://www.crunchbase.com/funding_round/home-solution-seed--52e0f686,"Home Improvement, Home Services, Lead Generation, Marketplace","Buenos Aires, Distrito Federal, Argentina, South America",Seed,67500,USD,67500,2015-09-15,HomeSolution.net,https://www.crunchbase.com/organization/home-solution,http://www.homesolution.net,750000,USD,750000,,"Lead Generation marketplace who matches homeowners with more than 15,000 handymen across Latin America",Seed,Yes,$50M to $100M,174500,USD,174500,Seed,2,,,,"257,080"
Venture Round - Real Time Translation,https://www.crunchbase.com/funding_round/real-time-translation-series-unknown--1b09bc18,"Information Technology, Mobile, Translation Service","Chaska, Minnesota, United States, North America",Venture - Series Unknown,100000,USD,100000,2015-09-04,Real Time Translation,https://www.crunchbase.com/organization/real-time-translation,http://www.rttmobile.com,,,,,Real Time Translation provides on-demand mobile language interpretation services with an end-to-end service delivery platform.,,Yes,$1M to $10M,2701830,USD,2701830,,4,,,,"257,082"
Venture Round - M3 Technology Group,https://www.crunchbase.com/funding_round/m3-technology-group-series-unknown--4f152248,"Consulting, Enterprise Software, Information Technology, Infrastructure, Messaging, Software","Charlotte, North Carolina, United States, North America",Venture - Series Unknown,6500000,USD,6500000,2007-10-12,M3 Technology Group,https://www.crunchbase.com/organization/m3-technology-group,http://www.m3tg.com,,,,Frontier Growth,"M3 Technology Group provides customized professional and enterprise services such as e-messaging, and infrastructure systems development.",,Yes,,6500000,USD,6500000,M&A,1,Frontier Growth,1,,"257,085"
Pre Seed Round - MenuBubble,https://www.crunchbase.com/funding_round/menububble-pre-seed--6efb07b3,"Delivery, E-Commerce, Food and Beverage, Food Delivery, Internet, Social Entrepreneurship, Wellness","Lansing, Michigan, United States, North America",Pre-Seed,,,,2020-09-04,MenuBubble,https://www.crunchbase.com/organization/menububble,https://www.MenuBubble.com,,,,Red Cedar Ventures,Healthy meal delivery service focuses on accessibility and convenience offering ready to warm-up meals palatable to everyone.,Seed,Yes,,20000,USD,20000,Seed,3,,1,,"257,086"
Grant - Pulvinar Neuro,https://www.crunchbase.com/funding_round/pulvinar-neuro-grant--8c43a588,"Biotechnology, Health Care, Neuroscience","Durham, North Carolina, United States, North America",Grant,13716,USD,13716,2021-02-02,Pulvinar Neuro,https://www.crunchbase.com/organization/pulvinar-neuro,https://www.pulvinarneuro.com/,,,,One North Carolina Small Business Program,Pulvinar Neuro is to enable and support outstanding basic and translational neuroscience research.,,No,,3073716,USD,3073716,M&A,2,One North Carolina Small Business Program,1,,"257,087"
Seed Round - Toters,https://www.crunchbase.com/funding_round/toters-seed--f7eb3df4,"Courier Service, Delivery Service, E-Commerce, Food Delivery, Grocery, Marketplace","Beirut, Beyrouth, Lebanon, Asia",Seed,550000,USD,550000,2018-01-01,Toters,https://www.crunchbase.com/organization/toters,https://www.totersapp.com,,,,,"Toters is a tech company that operates a range of products including Marketplace, eGrocery, Courier Services, and Payments",Seed,Yes,,23000000,USD,23000000,Early Stage Venture,3,,,,"257,088"
Pre Seed Round - One2Ones.com,https://www.crunchbase.com/funding_round/one2ones-com-pre-seed--ff2068dd,"Education, Information Technology","London, England, United Kingdom, Europe",Pre-Seed,200000,USD,200000,2021-01-01,One2Ones.com,https://www.crunchbase.com/organization/one2ones-com,https://one2ones.com,,,,,"One2Ones.com is an Educational Technology Platform that provides live Online Zoom Classes ( Academic, Music, Art, Sport, Creative, Fun).",Seed,Yes,,200000,USD,200000,Seed,1,,,,"257,089"
Grant - Packetized Energy,https://www.crunchbase.com/funding_round/packetized-energy-grant--fa08f1df,"Energy, Information Technology","Burlington, Vermont, United States, North America",Grant,225000,USD,225000,2017-07-10,Packetized Energy,https://www.crunchbase.com/organization/packetized-energy,http://www.packetizedenergy.com,,,,National Science Foundation,Packetized Energy’s mission is to enable the future of clean energy by simplifying grid edge flexibility.,,No,Less than $1M,225000,USD,225000,M&A,1,National Science Foundation,1,,"257,090"
Seed Round - Qunjielong,https://www.crunchbase.com/funding_round/qunjielong-seed--62512586,"Communities, Food and Beverage","Nanning, Guangxi, China, Asia",Seed,,,,2018-09-12,Qunjielong,https://www.crunchbase.com/organization/qunjielong,https://pro.qunjielong.com/,,,,"GSR Ventures, Zero2IPO Ventures","Qunjielong is a WeChat mini program that engages people in community activities such as group registration, group purchase and so on.",Seed,Yes,$10M to $50M,5000000,USD,5000000,Early Stage Venture,2,"GSR Ventures, Zero2IPO Ventures",2,,"257,092"
Seed Round - The Language Express,https://www.crunchbase.com/funding_round/the-language-express-seed--b633e231,"Children, Education, Software, Young Adults","Encinitas, California, United States, North America",Seed,750000,USD,750000,2012-05-03,The Language Express,https://www.crunchbase.com/organization/the-language-express,https://socialexpress.com/,,,,,"The Language Express offers The Social Express™, software designed to teach children and young adults how to manage social situations.",Seed,Yes,$1M to $10M,1627964,USD,1627964,Seed,3,,,,"257,093"
Venture Round - Dermala,https://www.crunchbase.com/funding_round/dermala-inc-series-unknown--0d83d75a,"Biotechnology, Health Care","San Diego, California, United States, North America",Venture - Series Unknown,1000000,USD,1000000,2018-05-02,Dermala,https://www.crunchbase.com/organization/dermala-inc,https://www.dermala.com/,,,,True Wealth Ventures,"DERMALA develops personalized, clinically validated, patented treatments for chronic skin conditions including acne & eczema.",,Yes,Less than $1M,7650000,USD,7650000,Early Stage Venture,3,True Wealth Ventures,1,1,"257,094"
Angel Round - Xiaxiaoshi,https://www.crunchbase.com/funding_round/xiaxiaoshi-angel--ad54ee05,"Catering, Marketing, Service Industry","Beijing, Beijing, China, Asia",Angel,1600000,USD,1600000,2021-05-01,Xiaxiaoshi,https://www.crunchbase.com/organization/xiaxiaoshi,https://www.bjxiaxiaoshi.com/,,,,,Xiaxiaoshi catering management company that provides light food brand.,Seed,Yes,,3082602,USD,3082602,Seed,2,,,,"257,095"
Debt Financing - iScreen Vision,https://www.crunchbase.com/funding_round/iscreen-vision-debt-financing--0fc5efda,"Biotechnology, Health Care, Health Diagnostics, Medical Device","Cordova, Tennessee, United States, North America",Debt Financing,100000,USD,100000,2013-04-16,iScreen Vision,https://www.crunchbase.com/organization/iscreen-vision,http://www.iscreenvision.com,,,,Innova Memphis,iScreen Vision is a medical device company that offers photoscreening devices and analysis for pediatric vision problems.,,No,$1M to $10M,10979668,USD,10979668,,17,,1,1,"257,098"
Series A - Subaio,https://www.crunchbase.com/funding_round/subaio-series-a--c364ff97,"Big Data, Financial Services, FinTech, Information Technology, Insurance, Payments, Robotics","Aalborg, Nordjylland, Denmark, Europe",Series A,4000000,EUR,4863174,2021-02-25,Subaio,https://www.crunchbase.com/organization/subaio,https://www.subaio.com/,,,,Global PayTech Ventures,Subaio is a software company that creates products and services that simplifies people's lives.,Early Stage Venture,Yes,$1M to $10M,4000000,EUR,4863175,Early Stage Venture,3,Global PayTech Ventures,1,1,"257,099"
Non Equity Assistance - POWZL,https://www.crunchbase.com/funding_round/powzl-non-equity-assistance--06e06af7,"Energy, Energy Storage, Renewable Energy, Semiconductor",,Non-equity Assistance,,,,2021-12-11,POWZL,https://www.crunchbase.com/organization/powzl,http://powzl.fr,,,,AGORANOV,POWZL develops innovative batteries to reduce the impact of energy storage.,,No,,,USD,,,1,AGORANOV,1,,"257,101"
Series B - Cellink,https://www.crunchbase.com/funding_round/cellink-series-b--ee871fc2,"Electronics, Energy, Hardware, Solar","San Carlos, California, United States, North America",Series B,22500000,USD,22500000,2019-10-29,Cellink,https://www.crunchbase.com/organization/cellink,https://cellinktechnologies.com,,,,"BMW i Ventures, Fontinalis Partners, Ford Motor","CelLink develops a flexible conductive backplane for solar, LED, and battery industries.",Early Stage Venture,Yes,$10M to $50M,659224975,USD,659224975,Late Stage Venture,6,,3,2,"257,103"
Seed Round - gymCentral,https://www.crunchbase.com/funding_round/gymcentral-seed--3c1250b7,Health Care,"Palo Alto, California, United States, North America",Seed,,,,2015-01-01,gymCentral,https://www.crunchbase.com/organization/gymcentral,http://gymcentral.net/,,,,EIT Digital Accelerator,"gymCentral provides useful information about exercises, especially indoor exercises, and gym equipment choices.",Seed,Yes,Less than $1M,,USD,,Seed,1,,1,,"257,104"
Seed Round - Swantide,https://www.crunchbase.com/funding_round/swantide-seed--78cf01a7,"CRM, Management Information Systems, Software","San Francisco, California, United States, North America",Seed,7000000,USD,7000000,2022-10-27,Swantide,https://www.crunchbase.com/organization/swantide,https://www.swantide.com/,,,,"Burst Capital, Menlo Ventures, Neo, Scribble Ventures, Village Global",Automate the configuration and management of your GTM tech stack with Swantide.,Seed,Yes,,7000000,USD,7000000,Seed,3,Menlo Ventures,5,2,"257,105"
Venture Round - Nevis Networks,https://www.crunchbase.com/funding_round/nevis-networks-series-unknown--b26078c8,"Internet, Network Security, Security","Mountain View, California, United States, North America",Venture - Series Unknown,,,,2012-07-03,Nevis Networks,https://www.crunchbase.com/organization/nevis-networks,http://www.nevisnetworks.com,,,,Ncubate Capital Partners,Nevis Networks offers local area network (LAN) security systems to ensure data integrity and network availability in corporate LANs.,,Yes,$10M to $50M,34124800,USD,34124800,,6,Ncubate Capital Partners,1,,"257,106"
Venture Round - Barghest Building Performance,https://www.crunchbase.com/funding_round/barghest-building-performance-series-unknown--83d10694,"Energy, Renewable Energy","Singapore, Central Region, Singapore, Asia",Venture - Series Unknown,1750000,USD,1750000,2022-09-13,Barghest Building Performance,https://www.crunchbase.com/organization/barghest-building-performance,https://bbp.sg/,,,,Kohlberg Kravis Roberts,Barghest Building Performance is an energy efficiency company that provides advanced data analytics for predictive maintenance.,,Yes,,34561509,USD,34561509,,7,Kohlberg Kravis Roberts,1,1,"257,107"
Angel Round - Entropy Innovations,https://www.crunchbase.com/funding_round/entropy-innovations-angel--3624e53e,Innovation Management,"Mumbai, Maharashtra, India, Asia",Angel,,,,2015-06-02,Entropy Innovations,https://www.crunchbase.com/organization/entropy-innovations,http://entropy.co.in,,,,"AdvantEdge Founders, ah! Ventures, Mark Mobius",Entropy Innovations is an engineering innovations company that has disrupted the two wheeler service industry.,Seed,Yes,$1M to $10M,,USD,,M&A,1,ah! Ventures,3,,"257,108"
Secondary Market - Unity,https://www.crunchbase.com/funding_round/unity-technologies-secondary-market--904c5c9e,"Augmented Reality, Developer Platform, Metaverse, Mobile Apps, Virtual Reality","San Francisco, California, United States, North America",Secondary Market,,,,2021-02-03,Unity,https://www.crunchbase.com/organization/unity-technologies,https://unity.com,,,,FinSight Ventures,Unity provides multiplatform tools and services to developers of interactive content.,,No,$100M to $500M,2301800000,USD,2301800000,IPO,15,,1,,"257,110"
Angel Round - Mercately,https://www.crunchbase.com/funding_round/mercately-angel--605dacb6,"Communications Infrastructure, Internet, Marketing, Marketing Automation, Software","Miami, Florida, United States, North America",Angel,100000,USD,100000,2022-05-27,Mercately,https://www.crunchbase.com/organization/mercately,http://www.mercately.com,1328571,USD,1328571,Platanus Ventures,"Mercately increases a company's sales through an ecommerce ecosystem, built for messaging applications.",Seed,Yes,,100000,USD,100000,Seed,2,Platanus Ventures,1,,"257,111"
Seed Round - Rovity,https://www.crunchbase.com/funding_round/rovity-seed--44562738,"Artificial Intelligence (AI), Cloud Infrastructure, Cloud Storage, Machine Learning, Web Hosting","Bangalore, Karnataka, India, Asia",Seed,2100000,USD,2100000,2021-04-01,Rovity,https://www.crunchbase.com/organization/rovity,https://rovity.io,,,,,Rovity is builidng a host of AI and automation solutions that cater to your business's specific needs.,Seed,Yes,,2100000,USD,2100000,Seed,1,,,,"257,113"
Seed Round - Washé,https://www.crunchbase.com/funding_round/washe-seed--b13bdf35,"Apps, Internet, Mobile Apps, Service Industry","New York, New York, United States, North America",Seed,3500000,USD,3500000,2018-05-02,Washé,https://www.crunchbase.com/organization/washe,https://washe.io/,,,,Ron Zuckerman,On Demand Car Wash and Mobile Detailing App,Seed,Yes,$1M to $10M,3500000,USD,3500000,Seed,1,Ron Zuckerman,1,,"257,114"
Seed Round - Qmod,https://www.crunchbase.com/funding_round/qmod-seed--f6968e70,"Casual Games, Education, Energy","Rotterdam, Zuid-Holland, The Netherlands, Europe",Seed,,,,2015-09-01,Qmod,https://www.crunchbase.com/organization/qmod,https://myqmod.com,,,,Agile Accelerator,Qmod is an energy game designed for kids (10-15) to learn the fundamentals of harvesting and experimenting with clean energy.,Seed,Yes,,,USD,,Seed,2,Agile Accelerator,1,,"257,115"
Seed Round - Glassy Pro,https://www.crunchbase.com/funding_round/glassy-pro-seed--2c54dddc,"Sporting Goods, Sports","Godella, Comunidad Valenciana, Spain, Europe",Seed,,,,2015-05-24,Glassy Pro,https://www.crunchbase.com/organization/glassy-pro,http://glassy.pro,,,,Brinc,Glassy Pro is the union of technology and action sports under the structure of a start-up company.,Seed,Yes,Less than $1M,835000,USD,835000,Seed,7,,1,,"257,116"
Grant - HI-TEC Profiles,https://www.crunchbase.com/funding_round/hi-tec-profiles-grant--be8c47e3,"Machinery Manufacturing, Manufacturing, Mechanical Design","Regina, Saskatchewan, Canada, North America",Grant,1000000,USD,1000000,2019-08-26,HI-TEC Profiles,https://www.crunchbase.com/organization/hi-tec-profiles,https://hitecprofiles.com/,,,,Government of Canada,"HI-TEC Profiles are one of Western Canada’s leading providers of steel processing services, including profile cutting and bending technology",,No,,7513000,USD,7513000,,2,,1,,"257,117"
Angel Round - Feedgen,https://www.crunchbase.com/funding_round/feedgen-angel--880d2d63,"CRM, Information Technology, Social CRM, Software","San Francisco, California, United States, North America",Angel,,,,2011-01-01,Feedgen,https://www.crunchbase.com/organization/feedgen,http://www.feedgen.com,,,,"Jim Payne, John Pelly",Feedgen is a SaaS-based platform for inside sales and lead generation teams.,Seed,Yes,,,USD,,Seed,1,,2,,"257,119"
Funding Round - Good Day Farm,https://www.crunchbase.com/funding_round/good-day-farm-undisclosed--1895bf34,"Agriculture, Alternative Medicine, Cannabis, Farming","Little Rock, Arkansas, United States, North America",Funding Round,29752000,USD,29752000,2020-11-18,Good Day Farm,https://www.crunchbase.com/organization/good-day-farm,http://www.gooddayfarm.com/,,,,,Good Day Farm is a health-focused hemp grower that also offers venue spaces and barns intended to protect and preserve the environment.,,Yes,$1M to $10M,66494555,USD,66494555,,6,,,,"257,120"
Series A - Lev,https://www.crunchbase.com/funding_round/lev-series-a--1f187eff,"Commercial Real Estate, FinTech, Marketplace, Real Estate, Real Estate Investment","New York, New York, United States, North America",Series A,30000000,USD,30000000,2021-06-20,Lev,https://www.crunchbase.com/organization/lev,https://www.levcapital.com,100000000,USD,100000000,"ANIMO Ventures, Greenspring Associates, JLL Spark, Ludlow Ventures, NFX, Parker89",Lev is a commercial mortgage marketplace for capital market advisors.,Early Stage Venture,Yes,$1M to $10M,214782994,USD,214782994,Early Stage Venture,8,Greenspring Associates,6,1,"257,122"
Non Equity Assistance - Barkyn,https://www.crunchbase.com/funding_round/barkyn-non-equity-assistance--ba82cfef,"E-Commerce, Internet","Porto, Lisboa, Portugal, Europe",Non-equity Assistance,,,,2018-01-01,Barkyn,https://www.crunchbase.com/organization/barkyn,https://www.barkyn.com,,,,Google for Startups,All-included subscription for dogs.,,No,$1M to $10M,12376357,USD,12376357,Early Stage Venture,6,Google for Startups,1,,"257,123"
Grant - Safi Africa,https://www.crunchbase.com/funding_round/safi-africa-grant--5b371c78,"Energy, Oil and Gas","Abuja, Federal Capital Territory, Nigeria, Africa",Grant,,,,2022-05-05,Safi Africa,https://www.crunchbase.com/organization/safi-africa,https://safiafricaenergy.com/,,,,Clean Cooking Alliance,"Safi Africa is a technology-driven, integrated global energy company.",,No,$1M to $10M,,USD,,,1,Clean Cooking Alliance,1,1,"257,125"
Venture Round - TidalScale,https://www.crunchbase.com/funding_round/tidalscale-series-unknown--ddecd150,"Analytics, Cloud Infrastructure, Data Mining, Information Technology, Infrastructure, Software, Virtualization","Los Gatos, California, United States, North America",Venture - Series Unknown,1500000,USD,1500000,2016-11-11,TidalScale,https://www.crunchbase.com/organization/tidalscale,http://www.tidalscale.com/,,,,Infosys,"TidalScale Result faster, simpler, cheaper development. Scale your compute to match the problem, rather than the problem to the compute.",,Yes,Less than $1M,43036612,USD,43036612,,7,Infosys,1,1,"257,127"
Series A - Kooltra,https://www.crunchbase.com/funding_round/kooltra-series-a--06d88ffa,"Computer, Digital Marketing, Information Technology, Software","Toronto, Ontario, Canada, North America",Series A,6500000,CAD,5046062,2018-10-03,Kooltra,https://www.crunchbase.com/organization/kooltra,http://kooltra.com,,,,"Hyde Park Venture Partners, Real Ventures, Round13 Capital, Salesforce Ventures",Kooltra Increase efficiency and reduce human error while empowering your team.,Early Stage Venture,Yes,$1M to $10M,8091261,CAD,6265578,Early Stage Venture,2,Hyde Park Venture Partners,4,,"257,128"
Seed Round - Ailvgo.com,https://www.crunchbase.com/funding_round/ailvgo-com-seed--c4af914b,"Information Services, Internet, Travel","Changping, Beijing, China, Asia",Seed,10000000,CNY,1618495,2014-08-01,Ailvgo.com,https://www.crunchbase.com/organization/ailvgo-com,http://www.ailvgo.com/,,,,Qinglin Huacheng,Ailvgo.com is a smart travel information service cloud platform.,Seed,Yes,,20000000,CNY,3187972,Seed,2,Qinglin Huacheng,1,,"257,129"
Non Equity Assistance - White,https://www.crunchbase.com/funding_round/white-non-equity-assistance--41db0b42,"B2B, Financial Services, Information Technology, Small and Medium Businesses","Paris, Ile-de-France, France, Europe",Non-equity Assistance,,,,2014-03-28,White,https://www.crunchbase.com/organization/white,https://www.white.eu.com,,,,Microsoft Accelerator Paris,an accounting solution to manage all your business incomes and spendings.,,No,$1M to $10M,,USD,,,1,,1,,"257,131"
Seed Round - Deliciou,https://www.crunchbase.com/funding_round/deliciou-seed--05caa9a0,"Consumer Goods, Food and Beverage, Grocery","Melbourne, Victoria, Australia, Oceania",Seed,,,,2021-03-30,Deliciou,https://www.crunchbase.com/organization/deliciou,https://www.deliciou.com,,,,Stray Dog Capital,Deliciou offers healthy snacks and premium seasonings that are fun and easy to use.,Seed,Yes,,300000,USD,300000,Seed,4,Stray Dog Capital,1,1,"257,133"
Series B - Rainier Therapeutics,https://www.crunchbase.com/funding_round/rainier-therapeutics-series-b--4f84bb38,"Biopharma, Biotechnology, Developer Platform, Medical, Therapeutics","San Leandro, California, United States, North America",Series B,20000000,USD,20000000,2018-05-09,Rainier Therapeutics,https://www.crunchbase.com/organization/rainier-therapeutics,https://www.rainierrx.com/,,,,"EQT life science, HealthCap, Inkef, Sectoral Asset Management, Sofinnova Investments, Tekla Capital Management, Ysios Capital",Rainier Therapeutics is a developer of cancer therapeutics technology intended to offer advanced targeted therapy for bladder cancer.,Early Stage Venture,Yes,$1M to $10M,89000000,USD,89000000,Early Stage Venture,5,,7,,"257,136"
Corporate Round - Link-U,https://www.crunchbase.com/funding_round/link-u-corporate-round--7941b4df,"Content, Education, Information Technology, Internet","Tokyo, Tokyo, Japan, Asia",Corporate Round,24000000,JPY,198197,2015-12-11,Link-U,https://www.crunchbase.com/organization/link-u,http://www.link-u.co.jp/,,,,"MEDIASEEK, Yuki Maeda","Link-U is a server platform business company that offers a low-cost, secure platform built around high-performance original servers.",,Yes,$10M to $50M,84000000,JPY,734712,IPO,2,,2,,"257,138"
Grant - Conductr,https://www.crunchbase.com/funding_round/conductr-grant--34e877e3,"iOS, Music","Barcelona, Catalonia, Spain, Europe",Grant,100000,EUR,113359,2015-02-23,Conductr,https://www.crunchbase.com/organization/conductr,http://www.conductr.net,,,,IMPACT Accelerator,Conductr is a company that manufactures Ableton Live & Traktor controller for iPad.,,No,Less than $1M,200000,EUR,247319,,3,IMPACT Accelerator,1,,"257,139"
Pre Seed Round - QUEST Corp Solutions,https://www.crunchbase.com/funding_round/quest-corp-solutions-pre-seed--dfac876b,"Consumer Goods, Retail, Retail Technology","Whitby, Ontario, Canada, North America",Pre-Seed,250000,EUR,283187,2019-02-08,QUEST Corp Solutions,https://www.crunchbase.com/organization/quest-corp-solutions,https://www.questcorpsolutions.com/,,,,,Quest Corp Solutions aims to transform the retail space for vaping products.,Seed,Yes,$1M to $10M,250000,EUR,283188,Seed,1,,,,"257,140"
Debt Financing - Sparkasse Bank Makedonija,https://www.crunchbase.com/funding_round/erste-bank-sparkasse-debt-financing--ee7f9092,"Banking, Financial Services","Skopje, Karpos, Macedonia, Europe",Debt Financing,2000000,EUR,2175970,2020-02-25,Sparkasse Bank Makedonija,https://www.crunchbase.com/organization/erste-bank-sparkasse,https://sparkasse.mk,,,,European Bank for Reconstruction and Development,Sparkasse Bank Makedonija offers a full range of banking services for companies and private individuals.,,No,,25000000,EUR,24793219,,2,European Bank for Reconstruction and Development,1,,"257,143"
Series A - ImmuneOnco Biopharma,https://www.crunchbase.com/funding_round/immuneonco-biopharma-series-a--57a3438d,"Biopharma, Biotechnology, Health Care","Shanghai, Shanghai, China, Asia",Series A,15800000,USD,15800000,2018-04-11,ImmuneOnco Biopharma,https://www.crunchbase.com/organization/immuneonco-biopharma,http://immuneonco.com/,,,,"Chongde Hongxin, Lang Sheng Investment, Lapam Capital, Milestone, Z&H Investment",ImmuneOnco is a tumor immunotherapy product developer engaged in the development and research of tumor immunotherapy products.,Early Stage Venture,Yes,$1M to $10M,147207153,USD,147207153,,7,Lapam Capital,5,,"257,146"
Venture Round - Umajin,https://www.crunchbase.com/funding_round/umajin-series-unknown--4babbd1c,"Brand Marketing, Mobile, Software","Palmerston North, Wellington, New Zealand, Oceania",Venture - Series Unknown,4135320,USD,4135320,2015-12-09,Umajin,https://www.crunchbase.com/organization/umajin,http://www.umajin.com,,,,,"Umajin is an information technology company that specializes in rapid native app development platform, and private enterprise app portal.",,Yes,Less than $1M,7336620,USD,7336620,,5,,,,"257,147"
