Grant - FXFowle Architects,https://www.crunchbase.com/funding_round/fxfowle-architects-grant--fa846e90,"Architecture, Interior Design","New York, New York, United States, North America",Grant,100000,USD,100000,2015-04-24,FXFowle Architects,https://www.crunchbase.com/organization/fxfowle-architects,http://www.fxfowle.com/,,,,NYSERDA,"FXFowle Architects provides architectural, interior design, planning, and urban design services.",,No,$10M to $50M,100000,USD,100000,,1,,1,,"427,369"
Pre Seed Round - Avansa,https://www.crunchbase.com/funding_round/avansa-pre-seed--311a0efc,"Blockchain, Cryptocurrency, Software","Evanston, Illinois, United States, North America",Pre-Seed,175000,USD,175000,2018-12-02,Avansa,https://www.crunchbase.com/organization/avansa,https://www.avansa.io/,,,,,"Avansa is a computer software company that specializes in blockchain, cryptocurrency, and software.",Seed,Yes,,175000,USD,175000,Seed,1,,,,"427,371"
Corporate Round - Millpond,https://www.crunchbase.com/funding_round/millpond-corporate-round--ce6b72a6,"Consulting, Information Services, Project Management","Christchurch, Canterbury, New Zealand, Oceania",Corporate Round,,,,2021-10-04,Millpond,https://www.crunchbase.com/organization/millpond,https://millpond.co.nz/,,,,Qual IT,"Millpond provides the complete suite of professional Project Management, from consulting and delivery to training and assessments.",,Yes,,,USD,,,1,Qual IT,1,,"427,372"
Venture Round - 3D Biotek,https://www.crunchbase.com/funding_round/3d-biotek-series-unknown--b42fb02d,"Biotechnology, Manufacturing","Bridgewater, New Jersey, United States, North America",Venture - Series Unknown,,,,2010-04-29,3D Biotek,https://www.crunchbase.com/organization/3d-biotek,http://www.3dbiotek.com,,,,NJEDA,3D Biotek LLC is a biotechnology company.,,Yes,$1M to $10M,225000,USD,225000,,2,NJEDA,1,,"427,373"
Seed Round - TRELYS,https://www.crunchbase.com/funding_round/trelys-seed--09d74fd3,"Biotechnology, Life Science, Pharmaceutical","San Francisco, California, United States, North America",Seed,80000,USD,80000,2017-04-12,TRELYS,https://www.crunchbase.com/organization/trelys,http://www.trelystech.com,,,,,"TRELYS is a biotechnology company based in San Francisco, California.",Seed,Yes,Less than $1M,2580000,USD,2580000,Seed,2,,,,"427,378"
Non Equity Assistance - NewBlue,https://www.crunchbase.com/funding_round/newblue-non-equity-assistance--395d81ed,"Broadcasting, Digital Media, Information Technology, Software, Video Streaming","San Diego, California, United States, North America",Non-equity Assistance,,,,2011-04-01,NewBlue,https://www.crunchbase.com/organization/newblue,https://newbluefx.com/,,,,EvoNexus,graphics software for post and live video production,,No,$10M to $50M,,USD,,,1,,1,,"427,379"
Series C - TurnKey Vacation Rentals,https://www.crunchbase.com/funding_round/turnkey-vacation-rentals-series-c--05ce0d23,"Leisure, Tourism, Travel, Vacation Rental","Austin, Texas, United States, North America",Series C,21000000,USD,21000000,2017-03-09,TurnKey Vacation Rentals,https://www.crunchbase.com/organization/turnkey-vacation-rentals,http://turnkeyvr.com,,,,"Adams Street Partners, Altos Ventures, Silverton Partners",TurnKey Vacation Rentals markets and manages premier vacation rental homes in top U.S. destinations.,Late Stage Venture,Yes,$100M to $500M,120000000,USD,120000000,M&A,8,Adams Street Partners,3,1,"427,381"
Seed Round - Tyre Express,https://www.crunchbase.com/funding_round/tyre-express-seed--c55c19be,"Enterprise Software, Internet of Things, Real Time","Mumbai, Maharashtra, India, Asia",Seed,,,,2017-01-20,Tyre Express,https://www.crunchbase.com/organization/tyre-express,http://www.tyreexpress.co.in/,,,,IvyCamp,India’s first IoT platform for Tyre performance management and tracking.,Seed,Yes,,,USD,,Seed,1,IvyCamp,1,,"427,382"
Venture Round - Colville Capital,https://www.crunchbase.com/funding_round/colville-capital-series-unknown--71e7cf8b,"Business Development, Finance, Financial Services","Charlotte, North Carolina, United States, North America",Venture - Series Unknown,2753640,USD,2753640,2015-01-13,Colville Capital,https://www.crunchbase.com/organization/colville-capital,http://www.colvillecapital.com,,,,,Colville capital is a private investment partnership dedicated to building private companies in the lower middle market.,,Yes,,2753640,USD,2753640,,1,,,,"427,383"
Debt Financing - EastPoint Sports,https://www.crunchbase.com/funding_round/eastpoint-sports-debt-financing--c140b6fd,Sporting Goods,"Succasunna, New Jersey, United States, North America",Debt Financing,,,,2018-09-04,EastPoint Sports,https://www.crunchbase.com/organization/eastpoint-sports,https://www.eastpointsports.com/,,,,Patriot Capital,EastPoint is a sporting goods company.,,No,,,USD,,M&A,1,,1,,"427,384"
Seed Round - Calixa,https://www.crunchbase.com/funding_round/calixa-8307-seed--4ae9c530,"Analytics, B2B, SaaS, Software","San Francisco, California, United States, North America",Seed,4250000,USD,4250000,2021-03-09,Calixa,https://www.crunchbase.com/organization/calixa-8307,https://calixa.io,,,,"Kleiner Perkins, Liquid 2 Ventures, Operator Collective",Calixa is the Product-Led Sales platform that turns product data into closed won.,Seed,Yes,$1M to $10M,16250000,USD,16250000,Early Stage Venture,2,Kleiner Perkins,3,1,"427,385"
Seed Round - Pastel Innovation,https://www.crunchbase.com/funding_round/pastel-innovation-seed--31348cc2,"Health Care, Personal Health, Wellness","Los Angeles, California, United States, North America",Seed,20000,USD,20000,2017-05-01,Pastel Innovation,https://www.crunchbase.com/organization/pastel-innovation,http://pastelinnovation.com/,,,,StartersHub XO,Pastel Innovation searches for innovative solutions that may help personal health and comfort.,Seed,Yes,Less than $1M,20000,USD,20000,Seed,1,,1,,"427,386"
Initial Coin Offering - SpankChain,https://www.crunchbase.com/funding_round/spankchain-initial-coin-offering--8f849db1,,,Initial Coin Offering,6000000,USD,6000000,2017-10-01,SpankChain,https://www.crunchbase.com/organization/spankchain,https://spankchain.com/,,,,,SpankChain is an adult entertainment ecosystem powered by blockchain technology.,,Yes,,6000000,USD,6000000,,1,,,,"427,387"
Non Equity Assistance - Imverse,https://www.crunchbase.com/funding_round/imverse-non-equity-assistance--fef9e2d1,"3D Technology, Simulation, Software, Virtual Reality, Virtual World, Virtualization","Plan-les-ouates, Geneve, Switzerland, Europe",Non-equity Assistance,,,,2017-10-04,Imverse,https://www.crunchbase.com/organization/imverse,https://www.imverse.com,,,,MassChallenge,"Imverse is a 3D graphics software company that offers real-time simulation and modeling tools for live streaming, gaming, and remote work.",,No,,6822884,USD,6822884,Seed,6,,1,1,"427,391"
Seed Round - Bookpad,https://www.crunchbase.com/funding_round/bookpad-tech-seed--c2401ec4,"Cloud Data Services, Hardware, Software","Mountain View, California, United States, North America",Seed,,,,2013-03-16,Bookpad,https://www.crunchbase.com/organization/bookpad-tech,http://www.docspad.com,,,,Somdutta Singh,Bookpad designs and invents technologies to solve problems surrounding digital content.,Seed,Yes,,,USD,,M&A,2,,1,,"427,393"
Venture Round - Segment,https://www.crunchbase.com/funding_round/segment-io-series-unknown--2fc55fda,"Analytics, Big Data, Cloud Computing, Infrastructure, SaaS","San Francisco, California, United States, North America",Venture - Series Unknown,,,,2016-03-25,Segment,https://www.crunchbase.com/organization/segment-io,http://segment.com,,,,Founders Circle Capital,Segment provides customer data infrastructure that helps businesses put their customers first.,,Yes,$50M to $100M,283720000,USD,283720000,M&A,9,,1,1,"427,395"
Series C - Ingrian Networks,https://www.crunchbase.com/funding_round/ingrian-networks-series-c--f5a4082a,"Enterprise Software, Privacy, Security","Redwood City, California, United States, North America",Series C,14000000,USD,14000000,2004-01-05,Ingrian Networks,https://www.crunchbase.com/organization/ingrian-networks,http://www.ingrian.com,,,,"Globespan Capital Partners, HighBar Partners, Partech, Prism Venture Management","Ingrian Networks offers enterprise data protection and privacy solutions to companies such as Dell, Microsoft, Oracle, IBM and VeriSign.",Late Stage Venture,Yes,,51400000,USD,51400000,M&A,3,Prism Venture Management,4,3,"427,396"
Grant - Launch NY,https://www.crunchbase.com/funding_round/launch-ny-grant--d8d708e0,"Non Profit, Social Entrepreneurship","Buffalo, New York, United States, North America",Grant,168000,USD,168000,2017-09-19,Launch NY,https://www.crunchbase.com/organization/launch-ny,http://www.launchny.org/,,,,Community Development Financial Institutions Fund,Launch NY is a U.S. Treasury-designated Community Financial Institution (CDFI) and a 501(c)(3) nonprofit venture development organization.,,No,$1M to $10M,9243000,USD,9243000,,8,Community Development Financial Institutions Fund,1,,"427,400"
Series C - Nomad Health,https://www.crunchbase.com/funding_round/nomad-health-series-c--cf702fcd,"Health Care, Human Resources, Marketplace, Recruiting","New York, New York, United States, North America",Series C,34000000,USD,34000000,2019-08-15,Nomad Health,https://www.crunchbase.com/organization/nomad-health,https://nomadhealth.com,,,,".406 Ventures, Icon Ventures, Polaris Partners, RRE Ventures, Silicon Valley Bank",Nomad Health is an online staffing marketplace that connects clinicians to healthcare jobs.,Late Stage Venture,Yes,$1M to $10M,218000000,USD,218000000,,9,Icon Ventures,5,3,"427,402"
Seed Round - MUOV,https://www.crunchbase.com/funding_round/muoverti-seed--ae52887f,"Consumer Goods, Cycling, Fitness, Sporting Goods","London, England, United Kingdom, Europe",Seed,1640000,GBP,2010927,2022-05-13,MUOV,https://www.crunchbase.com/organization/muoverti,https://www.muov.bike/,12400000,USD,12400000,,The world's leading indoor bike system.,Seed,Yes,,3108811,GBP,3901178,,4,,,,"427,405"
Seed Round - Mashvisor,https://www.crunchbase.com/funding_round/mashvisor-seed--1f2da5cc,"Analytics, Big Data, PropTech, Real Estate, Real Estate Investment","Campbell, California, United States, North America",Seed,310000,USD,310000,2017-07-30,Mashvisor,https://www.crunchbase.com/organization/mashvisor,https://www.mashvisor.com,,,,"Arab Palestinian Investment Company (APIC), Ibtikar Fund",Real Estate Investment Analytics,Seed,Yes,$1M to $10M,1050000,USD,1050000,Seed,7,Ibtikar Fund,2,,"427,407"
Venture Round - CollectiveCrunch,https://www.crunchbase.com/funding_round/collectivecrunch-series-unknown--b98c4ed0,"Analytics, Artificial Intelligence (AI), Carbon Capture, Energy Efficiency, Environmental Consulting, Forestry, Paper Manufacturing, Renewable Energy, SaaS, Software","Espoo, Southern Finland, Finland, Europe",Venture - Series Unknown,600000,EUR,682290,2019-06-27,CollectiveCrunch,https://www.crunchbase.com/organization/collectivecrunch,http://www.collectivecrunch.com/,,,,Thominvest,CollectiveCrunch is a leader in AI for the forestry industry. We bring a step-change to prediction of forest inventories and carbon capture.,,Yes,Less than $1M,5050000,EUR,5820533,,5,Thominvest,1,,"427,408"
Series B - SkyRecon Systems,https://www.crunchbase.com/funding_round/skyrecon-systems-series-b--b9fd7b48,"Business Information Systems, Database, Security","Paris, Ile-de-France, France, Europe",Series B,6500000,USD,6500000,2007-03-12,SkyRecon Systems,https://www.crunchbase.com/organization/skyrecon-systems,http://www.skyrecon.com,,,,"Ace Capital Partners, Ventech","SkyRecon Systems offers StormShield, an endpoint protection platform for organizations to ensure the security of business data.",Early Stage Venture,Yes,,10230000,USD,10230000,M&A,2,"Ace Capital Partners, Ventech",2,1,"427,409"
Venture Round - Shanghai Dajun Technologies,https://www.crunchbase.com/funding_round/shanghai-dajun-technologies-series-unknown--5f863535,"Automotive, Electric Vehicle, Manufacturing","Shanghai, Shanghai, China, Asia",Venture - Series Unknown,20000000,USD,20000000,2012-01-06,Shanghai Dajun Technologies,https://www.crunchbase.com/organization/shanghai-dajun-technologies,http://www.dajuntech.com,,,,,Shanghai Dajun Technologies specializes in the R&D and production of motors and control systems for hybrid-electric and electric vehicles.,,Yes,$10M to $50M,20000000,USD,20000000,,1,,,,"427,413"
Grant - Wip Proyectos Industriales,https://www.crunchbase.com/funding_round/wip-proyectos-industriales-grant--9f04c131,"Machinery Manufacturing, Manufacturing, Product Design","Valladolid, Castilla y Leon, Spain, Europe",Grant,50000,EUR,54330,2016-01-03,Wip Proyectos Industriales,https://www.crunchbase.com/organization/wip-proyectos-industriales,http://www.wip.es/,,,,EASME - EU Executive Agency for SMEs,Wip offers a solution to new problems or unresolved problems that is difficult to reach by the company's competitors.,,No,$1M to $10M,50000,EUR,54331,,1,,1,,"427,415"
Seed Round - Yast,https://www.crunchbase.com/funding_round/yast-seed--966f5af9,"Project Management, SaaS, Software","Sogndal, Rogaland, Norway, Europe",Seed,150000,USD,150000,2008-05-14,Yast,https://www.crunchbase.com/organization/yast,http://www.yast.com,,,,"Innovation Norway, Sparebanken Vest",Yast is a SaaS-based company offering an online time-tracking application.,Seed,Yes,$1M to $10M,690000,USD,690000,Early Stage Venture,3,,2,,"427,416"
Series A - Typecast,https://www.crunchbase.com/funding_round/neosapience-inc-series-a--f55bc9a8,"Apps, Artificial Intelligence (AI), Software","Seoul, Seoul-t'ukpyolsi, South Korea, Asia",Series A,5000000000,KRW,4241061,2020-02-12,Typecast,https://www.crunchbase.com/organization/neosapience-inc,https://typecast.ai,,,,"Company K Partners, Daekyo Investment, Hyundai Venture Investment Corporation, Woori Technology Investment","Neosapience develops Typecast.ai, a virtual voice and video actor casting service.",Early Stage Venture,Yes,Less than $1M,26801609,USD,26801609,Early Stage Venture,5,Company K Partners,4,,"427,417"
Private Equity Round - Chaitanya Rural Intermediation and Development Services,https://www.crunchbase.com/funding_round/chaitanya-rural-intermediation-and-development-services-private-equity--db902c1a,"Consumer, Financial Services","Bengaluru, Karnataka, India, Asia",Private Equity,,,,2016-07-01,Chaitanya Rural Intermediation and Development Services,https://www.crunchbase.com/organization/chaitanya-rural-intermediation-and-development-services,https://www.chaitanyarural.in/,,,,Equator Capital Partners,Chaitanya Rural Intermediation and Development Services to provide access to financial services.,Private Equity,Yes,,,USD,,Private Equity,1,Equator Capital Partners,1,,"427,418"
Angel Round - Codelucida,https://www.crunchbase.com/funding_round/codelucida-angel--d14ad79d,Semiconductor,"Tucson, Arizona, United States, North America",Angel,,,,2021-12-31,Codelucida,https://www.crunchbase.com/organization/codelucida,http://www.codelucida.com/,,,,Arizona Tech Investors,Codelucida develops error-correction technology for applications in non-volatile memories.,Seed,Yes,Less than $1M,4258200,USD,4258200,Seed,5,,1,,"427,419"
Series B - LLamasoft,https://www.crunchbase.com/funding_round/llamasoft-series-b--ef7e085a,"Logistics, Predictive Analytics, Software, Supply Chain Management","Ann Arbor, Michigan, United States, North America",Series B,50000000,USD,50000000,2015-09-29,LLamasoft,https://www.crunchbase.com/organization/llamasoft,http://www.llamasoft.com,,,,Goldman Sachs,LLamasoft is a supply-chain planning company that elevates lives and organizations through the science of smarter decision-making.,Early Stage Venture,Yes,$100M to $500M,56100000,USD,56100000,M&A,3,Goldman Sachs,1,1,"427,420"
Seed Round - Tykn,https://www.crunchbase.com/funding_round/tykn-seed--591bc85d,"Blockchain, Cyber Security, Identity Management, Social Entrepreneurship, Social Impact","The Hague, Zuid-Holland, The Netherlands, Europe",Seed,1200000,EUR,1340105,2019-05-20,Tykn,https://www.crunchbase.com/organization/tykn,http://tykn.tech,,,,Netsam Participaties BV,Tykn is an award-winning startup developing Self-Sovereign Identity solutions. Creating a future of opportunity through digital identity.,Seed,Yes,$1M to $10M,1683900,EUR,1920033,Seed,5,,1,,"427,421"
Equity Crowdfunding - Pingify International,https://www.crunchbase.com/funding_round/pingify-international-equity-crowdfunding--1e542e54,"Innovation Management, Marketplace, Software","Vancouver, British Columbia, Canada, North America",Equity Crowdfunding,125000,USD,125000,2014-07-22,Pingify International,https://www.crunchbase.com/organization/pingify-international,http://www.pingify.com/,,,,,"Pingify International Inc. is an innovative, Vancouver based software development company trading on the OTCQB market place.",,Yes,,125000,USD,125000,IPO,1,,,,"427,422"
Venture Round - Aponia Laboratories,https://www.crunchbase.com/funding_round/aponia-laboratories-series-unknown--189e8427,"Biotechnology, Pharmaceutical, Therapeutics","Greenwich, Connecticut, United States, North America",Venture - Series Unknown,460000,USD,460000,2012-03-06,Aponia Laboratories,https://www.crunchbase.com/organization/aponia-laboratories,http://aponialaboratories.com,,,,,Aponia Laboratories is a pharmaceutical company producing a series of clinically proven prescription pain relief products.,,Yes,$1M to $10M,5682737,USD,5682737,,4,,,,"427,425"
Venture Round - Aprecia Pharmaceuticals,https://www.crunchbase.com/funding_round/aprecia-pharmaceuticals-series-unknown--00f0c815,"Biopharma, Biotechnology, Pharmaceutical","Langhorne, Pennsylvania, United States, North America",Venture - Series Unknown,500000,USD,500000,2009-05-29,Aprecia Pharmaceuticals,https://www.crunchbase.com/organization/aprecia-pharmaceuticals,http://www.aprecia.com,,,,,Aprecia Pharmaceuticals develops precision drug delivery systems and products.,,Yes,$1M to $10M,158423231,USD,158423231,,10,,,,"427,426"
Pre Seed Round - Nutrigene Inc.,https://www.crunchbase.com/funding_round/nutrigene-ltd-pre-seed--c8c320f1,"Fitness, Health Care, Wellness","San Francisco, California, United States, North America",Pre-Seed,120000,USD,120000,2018-03-22,Nutrigene Inc.,https://www.crunchbase.com/organization/nutrigene-ltd,http://www.mynutrigene.com/,,,,Y Combinator,"Nutrigene delivers tailor-made, freshly formulated liquid supplements based on health data.",Seed,Yes,Less than $1M,120000,USD,120000,Seed,2,Y Combinator,1,,"427,427"
Seed Round - BloomJoy,https://www.crunchbase.com/funding_round/bloomjoy-seed--cafbd3da,"Ad Network, Advertising, Blogging Platforms, Content Creators, Content Discovery, Content Syndication, Digital Media, Internet, Publishing","Austin, Texas, United States, North America",Seed,120000,USD,120000,2018-01-04,BloomJoy,https://www.crunchbase.com/organization/bloomjoy,https://bloomjoy.com/,,,,"Pi Campus, Y Combinator","BloomJoy is a safe and curated platform for content syndication between publishers, bloggers, and brands.",Seed,Yes,$1M to $10M,1310000,USD,1310000,Seed,2,Y Combinator,2,,"427,429"
Series A - DT One,https://www.crunchbase.com/funding_round/dtone-series-a--bab1fc4c,"Mobile, Mobile Payments","Singapore, Central Region, Singapore, Asia",Series A,3000000,USD,3000000,2009-10-14,DT One,https://www.crunchbase.com/organization/dtone,http://www.dtone.com,,,,Ingenico Group,DT One operates a global network for mobile top-up solutions and innovative mobile rewards for emerging economies.,Early Stage Venture,Yes,$50M to $100M,6500000,USD,6500000,Private Equity,3,Ingenico Group,1,,"427,431"
Pre Seed Round - Eat Offbeat,https://www.crunchbase.com/funding_round/eat-offbeat-pre-seed--e88b8882,"Catering, Food and Beverage, Food Delivery, Social Entrepreneurship, Social Impact","New York, New York, United States, North America",Pre-Seed,25000,USD,25000,2015-12-15,Eat Offbeat,https://www.crunchbase.com/organization/eat-offbeat,http://www.eatoffbeat.com,,,,Tamer Fund for Social Ventures,Eat Offbeat serves authentic meals from around the world conceived and prepared by refugees who now call NYC home.,Seed,Yes,$1M to $10M,205000,USD,205000,Seed,2,Tamer Fund for Social Ventures,1,,"427,432"
Seed Round - Gotuit,https://www.crunchbase.com/funding_round/gotuitmedia-seed--2eec3ab3,"Data Integration, Publishing","Woburn, Massachusetts, United States, North America",Seed,2100000,USD,2100000,2000-08-15,Gotuit,https://www.crunchbase.com/organization/gotuitmedia,http://gotuit.com,,,,"100X, Joel Harrison, Stan Marder, The Topol Group",Gotuit is a provider of metadata technology that optimizes the value of stored video libraries for professional content publishers.,Seed,Yes,,19240000,USD,19240000,M&A,4,The Topol Group,4,,"427,433"
Debt Financing - LiteSheet,https://www.crunchbase.com/funding_round/litesheet-debt-financing--038752ec,"Consumer Electronics, Electronics, Manufacturing, Product Design","Forest, Virginia, United States, North America",Debt Financing,200000,USD,200000,2020-11-09,LiteSheet,https://www.crunchbase.com/organization/litesheet,https://www.litesheet.com,,,,,LiteSheet is an AC Direct LED lighting innovation company that develops and commercializes products.,,No,$10M to $50M,4215000,USD,4215000,,8,,,,"427,436"
Post-IPO Equity - i-Cube,https://www.crunchbase.com/funding_round/i-cube-post-ipo-equity--8b450d11,"Customer Service, Information Technology, Mobile, Software, Telecommunications","Cambridge, Massachusetts, United States, North America",Post-IPO Equity,40250000,USD,40250000,1998-02-01,i-Cube,https://www.crunchbase.com/organization/i-cube,,,,,,Application migration and custom software development services.,,Yes,,40250000,USD,40250000,IPO,1,,,,"427,437"
Venture Round - Tugboat Yards,https://www.crunchbase.com/funding_round/tugboat-yards-series-unknown--5529a642,"Advertising, Digital Media, Online Portals, Publishing, Social Media, Software","Half Moon Bay, California, United States, North America",Venture - Series Unknown,,,,2012-12-01,Tugboat Yards,https://www.crunchbase.com/organization/tugboat-yards,https://tugboatyards.com/,,,,"Andreessen Horowitz, Greylock","Tools to help grow, manage, monetize and retain audiences",,Yes,,,USD,,M&A,2,,2,,"427,438"
Post-IPO Equity - Local Bounti,https://www.crunchbase.com/funding_round/local-bounti-post-ipo-equity--02d87876,"Agriculture, Farming, Green Consumer Goods, Organic Food","Hamilton, Montana, United States, North America",Post-IPO Equity,23300000,USD,23300000,2022-10-24,Local Bounti,https://www.crunchbase.com/organization/local-bounti,https://localbounti.com,,,,"BNP Paribas Asset Management, Fidelity","Local Bounti is an agriculture company delivering herbs, vegetables, and other products to service wholesale restaurant and grocer accounts.",,Yes,$500M to $1B,493300000,USD,493300000,IPO,4,,2,,"427,440"
Debt Financing - Bankai Group,https://www.crunchbase.com/funding_round/bankai-group-debt-financing--e12875f2,"Information Technology, Messaging, Service Industry, SMS, Telecommunications, Unified Communications, VoIP","New York, New York, United States, North America",Debt Financing,60000000,USD,60000000,2015-11-15,Bankai Group,https://www.crunchbase.com/organization/bankai-group,https://www.bankaigroup.com/,,,,,"Bankai Group is a telecommunications company specializing in billing, routing, and VoIP Solutions.",,No,$50M to $100M,560000000,USD,560000000,,2,,,,"427,442"
Series A - FOTA-Fight Of The Ages,https://www.crunchbase.com/funding_round/fota-fight-of-the-ages-series-a--ec7de67f,"Blockchain, Gaming","Singapore, Central Region, Singapore, Asia",Series A,5000000,USD,5000000,2022-03-02,FOTA-Fight Of The Ages,https://www.crunchbase.com/organization/fota-fight-of-the-ages,https://fota.io/,,,,Kenzo Ventures,FOTA-Fight Of The Ages is the play-2-earn blockchain-based project of Meta DJINN.,Early Stage Venture,Yes,$1M to $10M,13350000,USD,13350000,Seed,4,Kenzo Ventures,1,,"427,444"
Convertible Note - Briefcase Biotec,https://www.crunchbase.com/funding_round/briefcase-biotec-convertible-note--012a6413,"Biotechnology, Machinery Manufacturing, Manufacturing","Graz, Steiermark, Austria, Europe",Convertible Note,,,,2018-10-16,Briefcase Biotec,https://www.crunchbase.com/organization/briefcase-biotec,http://www.kilobaser.com,,,,"RebelBio, SOSV","Briefcase Biotec develops KiloBaser, a Nespresso machine of DNA synthesis - enabling cutting edge research without detours.",,No,Less than $1M,,USD,,Seed,7,,2,1,"427,445"
Angel Round - Yibai Wangluo,https://www.crunchbase.com/funding_round/yibai-wangluo-angel--0705c1fc,"Gaming, Media and Entertainment, Mobile","Guangzhou, Guangdong, China, Asia",Angel,3000000,CNY,474886,2018-04-23,Yibai Wangluo,https://www.crunchbase.com/organization/yibai-wangluo,https://www.yibaiip.com/,,,,Hiway Capital,Yibai Wangluo is a professional game development company.,Seed,Yes,,3000000,CNY,474886,Seed,1,,1,,"427,449"
Seed Round - Particle,https://www.crunchbase.com/funding_round/particle-3-seed--b492b2f0,"Consumer Electronics, Hardware, Information Services, Infrastructure, Internet of Things, Software","San Francisco, California, United States, North America",Seed,,,,2013-09-30,Particle,https://www.crunchbase.com/organization/particle-3,https://www.particle.io,,,,SOSV,"Particle is an integrated IoT platform that helps businesses connect, manage, and deploy software applications.",Seed,Yes,$10M to $50M,105770000,USD,105770000,Late Stage Venture,15,,1,1,"427,451"
