Series A - Mirametrix,https://www.crunchbase.com/funding_round/mirametrix-gaming-series-a--a7d2e923,"Artificial Intelligence (AI), Computer, Computer Vision, Consumer Electronics, Human Computer Interaction, Software","Montréal, Quebec, Canada, North America",Series A,4000000,CAD,3617974,2014-03-31,Mirametrix,https://www.crunchbase.com/organization/mirametrix-gaming,http://www.mirametrix.com,,,,Ferst Capital Partners - FCP,"Natural human-computer interaction on all consumer electronics, powered by breakthrough Attention Sensing technology.",Early Stage Venture,Yes,$1M to $10M,13450000,CAD,11512511,M&A,6,,1,,"257,216"
Pre Seed Round - Valt,https://www.crunchbase.com/funding_round/valt-pre-seed--644880d0,,"North Adams, Massachusetts, United States, North America",Pre-Seed,,,,2019-01-03,Valt,https://www.crunchbase.com/organization/valt,https://valt.io,,,,,Valt protects the digital identity of every individual and avoids the pain of forgotten passwords.,Seed,Yes,,,USD,,M&A,4,,,,"257,217"
Non Equity Assistance - Logmind,https://www.crunchbase.com/funding_round/logmind-non-equity-assistance--8424adfd,"Analytics, Apps, Artificial Intelligence (AI), Big Data, DevOps, Information Technology, Machine Learning, Productivity Tools, Software","Lausanne, Vaud, Switzerland, Europe",Non-equity Assistance,,,,2019-05-15,Logmind,https://www.crunchbase.com/organization/logmind,https://www.logmind.com,,,,MassChallenge,Logmind is an AI-accelerated log data analytics platform for the visibility and automated insights into unstructured log data.,,No,,280000,CHF,297726,Seed,8,,1,1,"257,218"
Convertible Note - Work & Mother,https://www.crunchbase.com/funding_round/work-mother-convertible-note--8174d6ed,"Apps, Coworking, Women's","Houston, Texas, United States, North America",Convertible Note,,,,2021-07-22,Work & Mother,https://www.crunchbase.com/organization/work-mother,https://www.workandmother.com/,,,,Texas HALO Fund,Work & Mother is a network of fully-equipped lactation suites and an associated working motherhood support app.,,No,,,USD,,,4,,1,,"257,219"
Private Equity Round - UST,https://www.crunchbase.com/funding_round/ust-private-equity--94bbe6db,"Consulting, Information Services, Information Technology","Aliso Viejo, California, United States, North America",Private Equity,250000000,USD,250000000,2018-06-27,UST,https://www.crunchbase.com/organization/ust,https://www.ust.com,750000000,USD,750000000,Temasek Holdings,UST is a Digital Transformations Solutions Provider.,Private Equity,Yes,$500M to $1B,250000000,USD,250000000,Private Equity,1,Temasek Holdings,1,,"257,220"
Grant - Pmf system,https://www.crunchbase.com/funding_round/pmf-system-grant--1e698690,"Industrial Engineering, Industrial Manufacturing, Intelligent Systems","Marly, Lorraine, France, Europe",Grant,10000,CHF,10156,2022-11-08,Pmf system,https://www.crunchbase.com/organization/pmf-system,https://pmf-system.ch/en,,,,Fribourg Innovation,PMF-System has patented a rapid assembly system which enables the production of all types of custom-made furniture.,,No,,10000,CHF,10156,,1,Fribourg Innovation,1,,"257,221"
Corporate Round - Mesentech,https://www.crunchbase.com/funding_round/mesentech-corporate-round--f21b395a,"Biotechnology, Health Care, Medical, Therapeutics","Vancouver, British Columbia, Canada, North America",Corporate Round,,,,2018-11-01,Mesentech,https://www.crunchbase.com/organization/mesentech,http://www.mesentech.com,,,,"CCRM, FedDev, Networks of Centres of Excellence, Ontario",Mesentech is a company focused on treating diseases and medical conditions that relate to bone.,,Yes,,1500000,CAD,1110737,,10,CCRM,4,,"257,222"
Seed Round - IDEE GmbH,https://www.crunchbase.com/funding_round/idee-gmbh-seed--3bce6c23,"Cloud Security, Cyber Security, Identity Management, Privacy","Munich, Bayern, Germany, Europe",Seed,,,,2017-02-28,IDEE GmbH,https://www.crunchbase.com/organization/idee-gmbh,https://getidee.com,,,,QuarterMoore,IDEE GmbH is the German technology company behind AuthN. AuthN is phish-proof multi-factor authentication.,Seed,Yes,$1M to $10M,,USD,,Early Stage Venture,2,QuarterMoore,1,,"257,223"
Debt Financing - MedNews,https://www.crunchbase.com/funding_round/mednews-debt-financing--b521766a,"Biotechnology, Health Care, Medical Device, Pharmaceutical, Wellness","Saint Paul, Minnesota, United States, North America",Debt Financing,478476,USD,478476,2010-06-09,MedNews,https://www.crunchbase.com/organization/mednews,http://acorncv.com/,,,,,MedNews is a medical device company developing treatments for patients with heart failure.,,No,$10M to $50M,478476,USD,478476,,1,,,,"257,224"
Series A - FTX Games,https://www.crunchbase.com/funding_round/funtactix-series-a--a1aec3b3,"Computer, Gaming, Mobile","New York, New York, United States, North America",Series A,6000000,USD,6000000,2007-01-01,FTX Games,https://www.crunchbase.com/organization/funtactix,http://funtactix.com,,,,"Benchmark, Jerusalem Venture Partners (JVP)",FTX Games formerly Funtactix is an online game development studio specializing in social and mobile games based on major motion pictures.,Early Stage Venture,Yes,,6000000,USD,6000000,M&A,1,,2,1,"257,225"
Venture Round - TemperPack,https://www.crunchbase.com/funding_round/temperpack-series-unknown--58bf9eb0,"Environmental Consulting, GreenTech, Manufacturing, Packaging Services","Richmond, Virginia, United States, North America",Venture - Series Unknown,140000000,USD,140000000,2022-03-22,TemperPack,https://www.crunchbase.com/organization/temperpack,https://www.temperpack.com/,,,,"Arborview Capital, Goldman Sachs Asset Management, Grosvenor Food & AgTech, Harbert Growth Partners, Revolution Growth, SJF Ventures, Tao Capital Partners",TemperPack manufactures insulated packaging solutions that meet the needs of all industries that ship perishable items.,,Yes,$1M to $10M,208851000,USD,208851000,,7,Goldman Sachs Asset Management,7,5,"257,226"
Series B - FriendlyWorks,https://www.crunchbase.com/funding_round/friendlyworks-series-b--49c1f7f5,"Children, Software","Lenexa, Kansas, United States, North America",Series B,1820000,USD,1820000,2000-04-25,FriendlyWorks,https://www.crunchbase.com/organization/friendlyworks,,,,,Crescent Capital Partners,FriendlyWorks offers a custom Internet system created especially for seniors.,Early Stage Venture,Yes,,1820000,USD,1820000,Early Stage Venture,1,Crescent Capital Partners,1,,"257,227"
Seed Round - Gameto,https://www.crunchbase.com/funding_round/gameto-seed--2b6bccc0,"Biopharma, Biotechnology, Genetics","New York, New York, United States, North America",Seed,,,,2021-04-02,Gameto,https://www.crunchbase.com/organization/gameto,https://gametogen.com,,,,"FJ Labs, Yes VC",Gameto is a biotechnology using cell engineering to develop therapeutics of the female reproductive system.,Seed,Yes,$1M to $10M,40000000,USD,40000000,,4,,2,,"257,228"
Grant - Valorka,https://www.crunchbase.com/funding_round/valorka-grant--c76f7502,"Electronics, Energy, Information Technology","Reykjavík, Gullbringusysla, Iceland, Europe",Grant,21000000,ISK,157612,2015-03-01,Valorka,https://www.crunchbase.com/organization/valorka,http://www.valorka.is,,,,Technology Development Fund,Valorka Ltd. is developing turbines for tidal energy power plant.,,No,,615113,USD,615113,,4,Technology Development Fund,1,,"257,229"
Seed Round - maufait,https://www.crunchbase.com/funding_round/maufait-seed--b18e90aa,"Apps, Mobile","Omaha, Nebraska, United States, North America",Seed,25000,USD,25000,2008-07-03,maufait,https://www.crunchbase.com/organization/maufait,http://www.mosnaps.com,,,,,"Mosnaps is a Blackberry photo upload application designed for individual users, bloggers, and mobile journalists.",Seed,Yes,,25000,USD,25000,Seed,1,,,,"257,230"
Pre Seed Round - Phytoform Labs,https://www.crunchbase.com/funding_round/phytoform-labs-pre-seed--6c9a8a80,"Agriculture, AgTech, Biotechnology, Genetics, Life Science","Salisbury, Wiltshire, United Kingdom, Europe",Pre-Seed,50000,USD,50000,2019-01-01,Phytoform Labs,https://www.crunchbase.com/organization/phytoform-labs,https://www.phytoformlabs.com,,,,,Phytoform Labs is a biotechnology company that focuses on resilient and sustainable crops.,Seed,Yes,$1M to $10M,11201498,USD,11201498,Seed,4,,,,"257,232"
Pre Seed Round - Spatio Labs,https://www.crunchbase.com/funding_round/spatio-0d1a-pre-seed--a7edaa86,"Augmented Reality, Software, Virtual Reality",,Pre-Seed,20000,USD,20000,2022-10-14,Spatio Labs,https://www.crunchbase.com/organization/spatio-0d1a,https://spatiolabs.org,,,,,"The Multiverse Gateway, Protocol, and Ecosystem",Seed,Yes,,20000,USD,20000,Seed,1,,,,"257,233"
Pre Seed Round - ESDECS,https://www.crunchbase.com/funding_round/esdecs-pre-seed--c39f562d,"Education, Skill Assessment, Vocational Education","Kolkata, West Bengal, India, Asia",Pre-Seed,3200000,INR,48957,2015-08-17,ESDECS,https://www.crunchbase.com/organization/esdecs,http://esdecsindia.com,,,,"Artha Impact, Villgro","ESDECS provides education, skills development, and elder care services.",Seed,Yes,,3200000,INR,48958,Seed,1,,2,,"257,234"
Equity Crowdfunding - Wyre,https://www.crunchbase.com/funding_round/wyre-equity-crowdfunding--059988a4,"Cryptocurrency, Financial Services, FinTech, Payments","San Francisco, California, United States, North America",Equity Crowdfunding,2886000,USD,2886000,2015-12-24,Wyre,https://www.crunchbase.com/organization/wyre,https://www.sendwyre.com,,,,SeedInvest,Wyre is a crypto and payment infrastructure company that develops a variety of payment APIs.,,Yes,Less than $1M,29146000,USD,29146000,M&A,9,,1,,"257,235"
Series A - Levels Beyond,https://www.crunchbase.com/funding_round/levels-beyond-series-a--c35b80be,"Digital Media, Software, Video","Denver, Colorado, United States, North America",Series A,2499991,USD,2499991,2014-04-03,Levels Beyond,https://www.crunchbase.com/organization/levels-beyond,http://www.levelsbeyond.com,,,,TVC Capital,"Levels Beyond specializes in the fields of media management, media workflow, video library management, and video delivery.",Early Stage Venture,Yes,$1M to $10M,10499992,USD,10499992,M&A,4,TVC Capital,1,1,"257,236"
Venture Round - Infrafone,https://www.crunchbase.com/funding_round/infrafone-series-unknown--b329e5b7,"Industrial, Industrial Engineering, Mechanical Engineering","Stockholm, Stockholms Lan, Sweden, Europe",Venture - Series Unknown,,,,2012-05-28,Infrafone,https://www.crunchbase.com/organization/infrafone,http://www.infrafone.se,,,,"Almi Invest, Coach & Capital","Infrafones, a Stockholm, Sweden-based maker of soot cleaning technology.",,Yes,$1M to $10M,,USD,,,1,,2,,"257,237"
Series A - Revulytics,https://www.crunchbase.com/funding_round/v-i-laboratories-series-a--195f29d1,"Analytics, Business Intelligence, Security, Software","Waltham, Massachusetts, United States, North America",Series A,,,,2006-06-27,Revulytics,https://www.crunchbase.com/organization/v-i-laboratories,https://www.revulytics.com,,,,Rockford Capital,Insight into who’s using your software and how they’re using it.,Early Stage Venture,Yes,$1M to $10M,14500000,USD,14500000,M&A,5,Rockford Capital,1,,"257,238"
Seed Round - eKomoditi Solutions Indonesia,https://www.crunchbase.com/funding_round/ekomoditi-solutions-indonesia-seed--53bec8ae,"Consulting, Forestry","Jakarta, Jakarta Raya, Indonesia, Asia",Seed,,,,2019-10-30,eKomoditi Solutions Indonesia,https://www.crunchbase.com/organization/ekomoditi-solutions-indonesia,http://www.ekomoditi.id/,,,,500 Global,eKomoditi is a consulting company that provides technology solutions for plantations and agriculture.,Seed,Yes,,,USD,,Seed,2,,1,,"257,239"
Series C - Legion Technologies,https://www.crunchbase.com/funding_round/legion-series-c--f3ad5ae5,"Human Resources, SaaS","Palo Alto, California, United States, North America",Series C,50000000,USD,50000000,2021-05-11,Legion Technologies,https://www.crunchbase.com/organization/legion,https://legion.co,,,,"Dollar General, First Round Capital, Norwest Venture Partners, Stripes, Webb Investment Network, XYZ Venture Capital",Legion Technologies’ workforce management platform enables businesses to maximize labor efficiency and employee engagement simultaneously.,Late Stage Venture,Yes,$100M to $500M,85500000,USD,85500000,Late Stage Venture,4,Stripes,6,5,"257,243"
Venture Round - Kamp'n,https://www.crunchbase.com/funding_round/kamp-n-series-unknown--3fe66af8,"Advertising, Internet, SaaS, Software","Paris, Ile-de-France, France, Europe",Venture - Series Unknown,2000000,EUR,2192701,2019-09-02,Kamp'n,https://www.crunchbase.com/organization/kamp-n,https://kampn.fr,,,,"ACG Management, Provence Business Angels",Kamp'n is a management and optimization tool for agencies and advertisers interested in implementing data-driven marketing.,,Yes,Less than $1M,3000000,EUR,3317750,M&A,2,"ACG Management, Provence Business Angels",2,,"257,244"
Convertible Note - EMMAC Life Sciences,https://www.crunchbase.com/funding_round/emmac-life-sciences-convertible-note--2821ce0c,"Biotechnology, Cannabis, Market Research","London, England, United Kingdom, Europe",Convertible Note,,,,2019-06-01,EMMAC Life Sciences,https://www.crunchbase.com/organization/emmac-life-sciences,https://www.emmac.com/,,,,Material V,EMMAC is a medical cannabis company that works to join together the latest science and research with cutting-edge cultivation.,,No,$1M to $10M,25581296,USD,25581296,M&A,3,,1,,"257,246"
Seed Round - Tiipz.com,https://www.crunchbase.com/funding_round/tiipz-com-seed--0bcf2302,"Mobile, Social CRM, Social Media","Squamish, British Columbia, Canada, North America",Seed,300000,CAD,297375,2010-12-10,Tiipz.com,https://www.crunchbase.com/organization/tiipz-com,http://www.tiipz.com,,,,,Tiipz.com is a social CRM tool that transforms social communities into a source for measurable consumer insight and information.,Seed,Yes,$1M to $10M,300000,CAD,297375,Seed,1,,,,"257,247"
Seed Round - Ed Partners,https://www.crunchbase.com/funding_round/ed-partners-seed--719d7db7,"Education, Financial Services","Westlands, Nairobi Area, Kenya, Africa",Seed,205000000,KES,1901781,2021-06-22,Ed Partners,https://www.crunchbase.com/organization/ed-partners,https://edpartnersafrica.com/,,,,"Acumen, Investisseurs & Partenaires, Zephyr Management",Ed Partners Africa is a non-banking financial institution that transforms the education sector by providing financial solutions.,Seed,Yes,,13401782,USD,13401782,Seed,3,Acumen,3,3,"257,248"
"Seed Round - Boxbee, Inc.",https://www.crunchbase.com/funding_round/boxbee-seed--edfbb324,"Information Technology, Internet, Logistics, Self-Storage, Service Industry, Software, Transportation","New York, New York, United States, North America",Seed,2300000,USD,2300000,2014-04-16,"Boxbee, Inc.",https://www.crunchbase.com/organization/boxbee,https://www.boxbee.com/,,,,"500 Global, Floodgate, Google Ventures, LAUNCH, Ludlow Ventures, Techstars",Our Software Powers Full-Service Storage.,Seed,Yes,Less than $1M,7300000,USD,7300000,M&A,4,Floodgate,6,1,"257,249"
Series A - Kajeet,https://www.crunchbase.com/funding_round/kajeet-series-a--b86965e0,"Children, EdTech, Education, Mobile, Telecommunications","Mclean, Virginia, United States, North America",Series A,27000000,USD,27000000,2006-01-01,Kajeet,https://www.crunchbase.com/organization/kajeet,https://www.kajeet.net/,,,,"Bessemer Venture Partners, Fidelity Ventures, Gabriel Venture Partners, InterWest Partners","Kajeet, the industry leader for safe, mobile student Internet connectivity outside the classroom, helps students succeed in school.",Early Stage Venture,Yes,$10M to $50M,92931050,USD,92931050,,6,,4,1,"257,250"
Convertible Note - CFP Composites,https://www.crunchbase.com/funding_round/carbon-fibre-preforms-convertible-note--8e8ba9fb,Plastics and Rubber Manufacturing,"Hampton In Arden, Solihull, United Kingdom, Europe",Convertible Note,,,,2021-01-28,CFP Composites,https://www.crunchbase.com/organization/carbon-fibre-preforms,http://carbonfibrepreforms.com/,,,,Future Planet Capital,CFP Composites is a manufacturer of revolutionary ultra-lightweight.,,No,,2578000,GBP,3318058,Early Stage Venture,4,,1,,"257,252"
Grant - Pepgen,https://www.crunchbase.com/funding_round/pepgen-corporation-grant--4ee83994,"Biotechnology, Clinical Trials, Medical","Oxford, Oxfordshire, United Kingdom, Europe",Grant,1600000,GBP,2075523,2018-11-02,Pepgen,https://www.crunchbase.com/organization/pepgen-corporation,https://pepgen.com/,,,,Innovate UK,PepGen is empowering nucleic acid therapeutics to go the distance.,,No,$1M to $10M,239675523,USD,239675523,IPO,5,,1,,"257,254"
Pre Seed Round - PEMRS,https://www.crunchbase.com/funding_round/pemrs-pre-seed--7f0d58ec,"Electronic Health Record (EHR), Health Care, Information Technology, Medical, mHealth","East Brunswick, New Jersey, United States, North America",Pre-Seed,100000,USD,100000,2018-05-05,PEMRS,https://www.crunchbase.com/organization/pemrs,https://fiithealth.com,,,,"Harald Kiamzon, Hesham Mohamed, Jeremy Baron, Mahmood Mosaddeghi, Ravi Gangavali, Thangamani Seenivassen",PEMRS is a healthcare digital technology company that provides a mobile app for individuals to aggregate their electronic medical records.,Seed,Yes,,170000,USD,170000,Seed,2,,6,,"257,258"
Grant - EPRI,https://www.crunchbase.com/funding_round/epri-grant--b45b0fd9,"Electrical Distribution, Electronics, Non Profit","Palo Alto, California, United States, North America",Grant,6000000,USD,6000000,2019-01-09,EPRI,https://www.crunchbase.com/organization/epri,http://www.epri.com,,,,U.S. Department of Energy Solar Energy Technologies Office,"Electric Power Research Institute, or EPRI, conducts research on issues related to the electric power industry.",,No,$10M to $50M,14699667,USD,14699667,,6,U.S. Department of Energy Solar Energy Technologies Office,1,,"257,260"
Series B - Royole Corporation,https://www.crunchbase.com/funding_round/royole-corporation-series-b--f8574132,"Electronics, Manufacturing, Mobile Devices","Shenzhen, Guangdong, China, Asia",Series B,,,,2013-04-01,Royole Corporation,https://www.crunchbase.com/organization/royole-corporation,https://global.royole.com,,,,"Green Pine Capital Partners, IDG Capital","Royole Corporation is a global manufacturer of advanced flexible displays, flexible sensors, and smart devices.",Early Stage Venture,Yes,$10M to $50M,1052000000,USD,1052000000,Late Stage Venture,7,IDG Capital,2,,"257,262"
Seed Round - Sifter SP,https://www.crunchbase.com/funding_round/sifter-sp-seed--9e36574d,E-Commerce,"Evanston, Illinois, United States, North America",Seed,5000000,USD,5000000,2022-05-25,Sifter SP,https://www.crunchbase.com/organization/sifter-sp,https://sifter.shop/,,,,"Hyde Park Angels, Valor Siren Ventures, Wintrust Ventures",Sifter is a new app and website that empowers people to discover products that fit their personal wellness preferences.,Seed,Yes,,5000000,USD,5000000,Seed,2,Valor Siren Ventures,3,1,"257,263"
Series B - Che300,https://www.crunchbase.com/funding_round/che300-com-车300-series-b--63d6a85a,"Automotive, Car Sharing, E-Commerce","Nanjing, Jiangsu, China, Asia",Series B,100000000,CNY,15341767,2016-02-16,Che300,https://www.crunchbase.com/organization/che300-com-车300,http://www.che300.com,,,,"Sequoia Capital, Source Code Capital",Che300 is a secondhand car appraisal and transaction platform.,Early Stage Venture,Yes,$1M to $10M,119654449,USD,119654449,Late Stage Venture,5,,2,,"257,264"
Venture Round - Nabati Foods,https://www.crunchbase.com/funding_round/nabati-foods-series-unknown--9cd58de6,"Food and Beverage, Food Processing, Organic, Plant-Based Foods","Edmonton, Alberta, Canada, North America",Venture - Series Unknown,7700000,CAD,6170118,2021-03-15,Nabati Foods,https://www.crunchbase.com/organization/nabati-foods,https://www.nabati.ca/,,,,,"Nabati Foods is a plant-based food and dessert producer that uses unrefined fruits, nuts, and vegetables.",,Yes,Less than $1M,7700000,CAD,6170119,,2,,,,"257,265"
Seed Round - Taking Point,https://www.crunchbase.com/funding_round/taking-point-seed--1b36b46e,"EdTech, Education, Employment, Internet, National Security, Online Portals, Public Relations, Social Media, Social Network","Scottsdale, Arizona, United States, North America",Seed,100000,USD,100000,2009-10-16,Taking Point,https://www.crunchbase.com/organization/taking-point,http://www.takingpoint.com,,,,Inventing Room Productions,Taking Point is a support community that connects America's veterans and service members.,Seed,Yes,$1M to $10M,3367593,USD,3367593,,4,,1,,"257,266"
Seed Round - Hybrent,https://www.crunchbase.com/funding_round/hybrent-seed--40889042,"Business Intelligence, Health Care, Information Technology, Supply Chain Management","Arlington, Virginia, United States, North America",Seed,,,,2015-03-09,Hybrent,https://www.crunchbase.com/organization/hybrent,http://hybrent.com,,,,Village Capital,Hybrent is committed to improving the current state of healthcare by providing groundbreaking technology,Seed,Yes,$1M to $10M,1250000,USD,1250000,M&A,3,,1,,"257,267"
Grant - Redwood Bioscience,https://www.crunchbase.com/funding_round/redwood-bioscience-grant--80ff3133,"Biotechnology, Chemical, Health Care","Emeryville, California, United States, North America",Grant,961368,USD,961368,2012-03-30,Redwood Bioscience,https://www.crunchbase.com/organization/redwood-bioscience,http://www.redwoodbioscience.com,,,,National Science Foundation,Redwood Bioscience uses precision protein-chemical engineering to develop optimized and novel biotherapeutics.,,No,,12859667,USD,12859667,M&A,7,National Science Foundation,1,,"257,268"
Grant - ROVENSO,https://www.crunchbase.com/funding_round/rovenso-grant--3bf88da4,"Machinery Manufacturing, Robotics, Security","Villaz-saint-pierre, Fribourg, Switzerland, Europe",Grant,20000,CHF,20909,2016-04-06,ROVENSO,https://www.crunchbase.com/organization/rovenso,https://rovenso.com,,,,Venture Kick,ROVENSO is a provider of agile robots for security and safety monitoring of industrial sites.,,No,,2844010,USD,2844010,Seed,11,Venture Kick,1,,"257,269"
Grant - HealthyRoad,https://www.crunchbase.com/funding_round/healthyroad-grant--3427d1d6,"Artificial Intelligence (AI), Automotive, Biometrics, Fleet Management, Machine Learning, Risk Management, Software","Porto, Lisboa, Portugal, Europe",Grant,33600,EUR,45120,2014-08-01,HealthyRoad,https://www.crunchbase.com/organization/healthyroad,http://www.healthyroad.pt,,,,Portuguese Public Funding,HealthyRoad is a technology company that develops AI facial biometric software for the automotive industry.,,No,Less than $1M,488600,EUR,607291,Seed,6,,1,,"257,274"
Pre Seed Round - Smart Soft Solutions,https://www.crunchbase.com/funding_round/smart-soft-solutions-pre-seed--9819d0bf,"Internet of Things, Software","Rozprza, Lodzkie, Poland, Europe",Pre-Seed,900000,PLN,251906,2018-05-11,Smart Soft Solutions,https://www.crunchbase.com/organization/smart-soft-solutions,http://www.smartsoftsolutions.pl/,,,,"AgriTech Hub, Simpact Ventures",Smart Soft Solutions develops ThermoEye proprietary product and the implementation of programming services.,Seed,Yes,,333775,USD,333775,Seed,2,AgriTech Hub,2,,"257,275"
Seed Round - Theres,https://www.crunchbase.com/funding_round/theres-seed--98fa33a6,"Communities, Outdoors, Recreation","Seocho, Seoul-t'ukpyolsi, South Korea, Asia",Seed,,,,2022-07-26,Theres,https://www.crunchbase.com/organization/theres,https://www.theres.co,,,,500 Global,Theres design outdoor communities and commerce experiences.,Seed,Yes,,,USD,,Seed,1,,1,,"257,277"
Grant - Pharmarctica,https://www.crunchbase.com/funding_round/pharmarctica-grant--2ba6ee94,"Cosmetics, Health Care, Manufacturing, Pharmaceutical","Grenivík, Sudur-Tingeyjarsysla, Iceland, Europe",Grant,30000000,ISK,225160,2015-03-01,Pharmarctica,https://www.crunchbase.com/organization/pharmarctica,http://www.pharmarctica.is,,,,Technology Development Fund,Pharmarctica is a pharmaceutical company.,,No,,30000000,ISK,225161,,1,Technology Development Fund,1,,"257,278"
Series A - CitySourced,https://www.crunchbase.com/funding_round/citysourced-series-a--f28827a9,"Government, GovTech, Mobile, Software","Los Angeles, California, United States, North America",Series A,1330000,USD,1330000,2011-12-19,CitySourced,https://www.crunchbase.com/organization/citysourced,https://www.citysourced.com,,,,"Dale Okuno, Jack Dangermond, Ron Sheridan","CitySourced is an enterprise civic engagement platform in the world, connecting citizens with their local government.",Early Stage Venture,Yes,,1395000,USD,1395000,M&A,2,,3,,"257,279"
Venture Round - ddmap.com,https://www.crunchbase.com/funding_round/ddmap-com-series-unknown--6cbc6ef3,"Information Services, Location Based Services","Shanghai, Shanghai, China, Asia",Venture - Series Unknown,9000000,USD,9000000,2010-01-01,ddmap.com,https://www.crunchbase.com/organization/ddmap-com,http://www.ddmap.com,,,,HTC,Ddmap.com is a location-based search engine platform that provides information for urban lives.,,Yes,$10M to $50M,49000000,USD,49000000,,6,,1,,"257,280"
Angel Round - TT Shengxian,https://www.crunchbase.com/funding_round/tt-shengxian-angel--4ca37b8f,"E-Commerce, Food Delivery, Mobile Apps, Same Day Delivery","Suzhou, Jiangsu, China, Asia",Angel,10000000,CNY,1462693,2017-06-23,TT Shengxian,https://www.crunchbase.com/organization/tt-shengxian,http://www.iptt.cn,,,,,TT Shengxian is a mobile ordering application for food delivery services.,Seed,Yes,,10000000,CNY,1462694,Seed,1,,,,"257,281"
