"Seed Round - HyperSpace Propulsion, Inc.",https://www.crunchbase.com/funding_round/hyperspace-propulsion-inc-seed--622fdee7,"Aerospace, Manufacturing","Portland, Maine, United States, North America",Seed,,,,2020-09-01,"HyperSpace Propulsion, Inc.",https://www.crunchbase.com/organization/hyperspace-propulsion-inc,http://hspi.space,10000000,USD,10000000,,"Aerospace company developing revolutionary air breathing plasma rocket and vehicle for space access, earth to orbit in a single bound.",Seed,Yes,,,USD,,Seed,2,,,,"572,637"
Series A - Podimo,https://www.crunchbase.com/funding_round/podimo-series-a--37c100df,"Audio, Content, Digital Entertainment, Podcast","Copenhagen, Hovedstaden, Denmark, Europe",Series A,15000000,EUR,16618123,2020-05-28,Podimo,https://www.crunchbase.com/organization/podimo,https://podimo.com,,,,"83North, Headline, Heartcore Capital, Possible Ventures",Podimo is an open podcast platform that offers a subscription service for creators.,Early Stage Venture,Yes,$1M to $10M,204170000,EUR,221352491,,7,83North,4,3,"572,638"
Pre Seed Round - Zeal Robotics,https://www.crunchbase.com/funding_round/zeal-robotics-pre-seed--faf92d6a,"Robotics, Warehouse Automation","Herent, Vlaams-Brabant, Belgium, Europe",Pre-Seed,,,,2022-08-02,Zeal Robotics,https://www.crunchbase.com/organization/zeal-robotics,https://www.zealrobotics.com/,,,,Comate Ventures,Zeal Robotics is creating the next generation of autonomous mobile robots for warehouses.,Seed,Yes,,,USD,,Seed,1,Comate Ventures,1,1,"572,639"
Debt Financing - SingularCover,https://www.crunchbase.com/funding_round/singularcover-debt-financing--69632500,"Finance, Insurance, InsurTech","Barcelona, Catalonia, Spain, Europe",Debt Financing,200000,EUR,221839,2019-12-23,SingularCover,https://www.crunchbase.com/organization/singularcover,http://www.singularcover.com,,,,ICF Capital,Singular Cover is an online insurance company that provides liability insurance and trade insurance.,,No,$1M to $10M,6625000,EUR,7435655,,5,,1,,"572,640"
Seed Round - RedDoor,https://www.crunchbase.com/funding_round/reddoor-seed--935c360e,"Information Technology, Lending, Real Estate","San Francisco, California, United States, North America",Seed,,,,2019-07-18,RedDoor,https://www.crunchbase.com/organization/reddoor,https://reddoor.com,,,,"Chang Corporation, Jeff Seibert, Streamlined Ventures, Wayne Chang","RedDoor provides the best online mortgage experience backed by superior customer support, low rates, down payments, and quick close.",Seed,Yes,,,USD,,M&A,1,,4,2,"572,641"
Angel Round - Resolar Energy,https://www.crunchbase.com/funding_round/resolar-energy-angel--52a322e6,Energy,"Noida, Uttar Pradesh, India, Asia",Angel,30000,USD,30000,2018-07-15,Resolar Energy,https://www.crunchbase.com/organization/resolar-energy,http://www.resolars.in,,,,,Resolar Energy provides turnkey rooftop solar energy solutions for customers in India.,Seed,Yes,,30000,USD,30000,Seed,1,,,,"572,643"
Seed Round - Ohoshop mCommerce,https://www.crunchbase.com/funding_round/ohoshop-mcommerce-seed--ffe68bb2,"E-Commerce, Mobile Apps, SaaS, Software","Ahmedabad, Gujarat, India, Asia",Seed,1000000,USD,1000000,2017-03-02,Ohoshop mCommerce,https://www.crunchbase.com/organization/ohoshop-mcommerce,https://www.ohoshop.in/,,,,Brand Capital,Personalized mCommerce Platform to create retail mobile app,Seed,Yes,Less than $1M,1000000,USD,1000000,Seed,1,Brand Capital,1,,"572,644"
Seed Round - Eureka Robotics,https://www.crunchbase.com/funding_round/eureka-robotics-seed--f06ee40b,"Robotics, Software","Singapore, Central Region, Singapore, Asia",Seed,4250000,USD,4250000,2022-05-10,Eureka Robotics,https://www.crunchbase.com/organization/eureka-robotics,https://eurekarobotics.com,,,,"ATEQ, Touchstone Partners, UTEC - The University of Tokyo Edge Capital Partners",Eureka Robotics delivers software and systems to automate tasks requiring High Accuracy and High Agility for precision manufacturing.,Seed,Yes,$1M to $10M,5250000,USD,5250000,Seed,2,UTEC - The University of Tokyo Edge Capital Partners,3,1,"572,645"
Series C - NinePoint Medical,https://www.crunchbase.com/funding_round/ninepoint-medical-series-c--d935434d,"Health Care, Medical, Medical Device","Cambridge, Massachusetts, United States, North America",Series C,30667046,USD,30667046,2015-11-25,NinePoint Medical,https://www.crunchbase.com/organization/ninepoint-medical,http://www.ninepointmedical.com,,,,,"NinePoint Medical is a transformational medical device company developing innovative, real-time, in vivo pathology devices.",Late Stage Venture,Yes,$50M to $100M,112667046,USD,112667046,Late Stage Venture,4,,,,"572,646"
Pre Seed Round - WENDGO,https://www.crunchbase.com/funding_round/wendgo-pre-seed--5a11a79c,"Advertising, E-Commerce, Information Technology, Software","Phnom Penh, Phnum Penh, Cambodia, Asia",Pre-Seed,150000,USD,150000,2017-01-01,WENDGO,https://www.crunchbase.com/organization/wendgo,https://www.wendgo.com,,,,,Cloud Digital Service Aggregator,Seed,Yes,,150000,USD,150000,Seed,1,,,,"572,647"
Seed Round - Opora,https://www.crunchbase.com/funding_round/opora-technologies-seed--9986d33b,"Big Data, Cloud Computing, Cyber Security, Information Technology, Machine Learning, Software","San Francisco, California, United States, North America",Seed,7000000,USD,7000000,2020-06-11,Opora,https://www.crunchbase.com/organization/opora-technologies,https://www.opora.io/,,,,Jerusalem Venture Partners (JVP),Opora develops cyber threat intelligence technologies.,Seed,Yes,,7000000,USD,7000000,Seed,1,Jerusalem Venture Partners (JVP),1,2,"572,649"
Debt Financing - Fridela,https://www.crunchbase.com/funding_round/fridela-debt-financing--bc7b1f50,"Food and Beverage, Food Processing, Manufacturing","Tudela, Navarra, Spain, Europe",Debt Financing,650000,EUR,736005,2021-12-23,Fridela,https://www.crunchbase.com/organization/fridela,https://fridela.com/,,,,SODENA,Fridela is a producer and seller of bakery products.,,No,$1M to $10M,650000,EUR,736005,,1,SODENA,1,,"572,650"
Seed Round - Tassl,https://www.crunchbase.com/funding_round/tassl-seed--35ff155a,"Analytics, Business Intelligence, EdTech, Enterprise Software, Event Management, SaaS, Software","Philadelphia, Pennsylvania, United States, North America",Seed,507000,USD,507000,2015-11-22,Tassl,https://www.crunchbase.com/organization/tassl,https://www.tassl.com,,,,"Ben Franklin Technology Partners of Southeastern Pennsylvania, Keiretsu Forum Mid Atlantic, Keiretsu Forum Northwest, Rowan University",Tassl is a SaaS and mobile platform helping Universities to better understand and build network engagement,Seed,Yes,$1M to $10M,507000,USD,507000,Early Stage Venture,3,,4,,"572,651"
Seed Round - Equal-Smart Spending,https://www.crunchbase.com/funding_round/equal-smart-spending-seed--23c67fb0,"Prepaid Cards, Software","Waterloo, Ontario, Canada, North America",Seed,30000,USD,30000,2020-01-09,Equal-Smart Spending,https://www.crunchbase.com/organization/equal-smart-spending,https://www.spendwithequal.com/,,,,,"Equal-Smart Spending receipt tracking, prepaid cards, expensive software company.",Seed,Yes,,30000,USD,30000,Seed,1,,,,"572,652"
Pre Seed Round - TARSENS,https://www.crunchbase.com/funding_round/tarsens-pre-seed--7f821b80,"Agriculture, Computer Vision, Image Recognition, Wireless","Bandirma, Balikesir, Turkey, Europe",Pre-Seed,,,,2017-08-21,TARSENS,https://www.crunchbase.com/organization/tarsens,http://tarsens.com,,,,TÜBİTAK,Creating the Next Agricultural Revolution,Seed,Yes,,,USD,,Seed,1,TÜBİTAK,1,,"572,653"
Seed Round - Outleads,https://www.crunchbase.com/funding_round/outleads-seed--1ee94ef9,"Advertising, Analytics, Lead Generation, Lead Management, SaaS, Social CRM","New York, New York, United States, North America",Seed,,,,2013-07-01,Outleads,https://www.crunchbase.com/organization/outleads,http://www.outleads.com/,,,,Microsoft Accelerator Seattle,Linking offline data with online profiles for targeted online advertising and web content,Seed,Yes,,55000,USD,55000,Seed,3,,1,,"572,654"
Venture Round - Craft Health,https://www.crunchbase.com/funding_round/craft-health-series-unknown--f0ec8729,"3D Printing, Dietary Supplements, Health Care, Nutraceutical, Pharmaceutical","Singapore, Central Region, Singapore, Asia",Venture - Series Unknown,1420000,SGD,1029981,2022-08-16,Craft Health,https://www.crunchbase.com/organization/craft-health,http://www.crafthealth.me,,,,Mistletoe,Craft Health is a pharmaceutical drug delivery company.,,Yes,,2370000,SGD,1731858,,2,,1,,"572,655"
Debt Financing - Relay Commerce,https://www.crunchbase.com/funding_round/relay-commerce-debt-financing--ff1e96db,"E-Commerce, E-Commerce Platforms, Software","New York, New York, United States, North America",Debt Financing,20000000,USD,20000000,2022-05-01,Relay Commerce,https://www.crunchbase.com/organization/relay-commerce,https://www.relaycommerce.io,,,,TriplePoint Capital,Relay Commerce is an e-commerce software holding company that operates and acquires SaaS companies.,,No,,27000000,USD,27000000,Seed,3,TriplePoint Capital,1,,"572,656"
Venture Round - PlayPass Ltd,https://www.crunchbase.com/funding_round/playpass-ltd-series-unknown--bfc2852c,"Event Management, Events, Music, NFC, RFID, Social Media","Antwerp, Antwerpen, Belgium, Europe",Venture - Series Unknown,1900000,EUR,2199438,2018-08-21,PlayPass Ltd,https://www.crunchbase.com/organization/playpass-ltd,http://www.playpass.be/,,,,Newion,"PlayPass offers a wristband that enables event organizers to manage crew, artists, and crowds.",,Yes,,6324579,USD,6324579,,6,Newion,1,,"572,657"
Seed Round - Magnitt,https://www.crunchbase.com/funding_round/magnitt-seed--65f3ec51,"Communities, Content Discovery, FinTech, Funding Platform","Dubai, Dubai, United Arab Emirates, Asia",Seed,1000000,USD,1000000,2018-03-26,Magnitt,https://www.crunchbase.com/organization/magnitt,https://www.magnitt.com/,,,,"500 Global, Financial Horizon Group, HALA Ventures, Integrated Networks, KISP Ventures, Middle East Venture Partners (MEVP)","Magnitt is a startup directory that connects investors, mentors, and emerging companies in the Middle East.",Seed,Yes,Less than $1M,1000000,USD,1000000,Seed,1,500 Global,6,2,"572,658"
Seed Round - NubeliU,https://www.crunchbase.com/funding_round/nubeliu-seed--0d0bbb2b,"Cloud Computing, Cloud Management, Enterprise Software, Management Information Systems, Private Cloud, Virtualization","São Paulo, Sao Paulo, Brazil, South America",Seed,,,,2014-11-01,NubeliU,https://www.crunchbase.com/organization/nubeliu,http://nubeliu.com,,,,"Kaszek, Storm Ventures","We help businesses architect, migrate, manage, and optimize their Cloud environments.",Seed,Yes,,,USD,,M&A,1,,2,,"572,659"
Seed Round - Forefront RF,https://www.crunchbase.com/funding_round/forefront-rf-seed--18b78c17,Semiconductor,"Cambridge, Cambridgeshire, United Kingdom, Europe",Seed,1500000,GBP,2079898,2021-08-11,Forefront RF,https://www.crunchbase.com/organization/forefront-rf,https://www.forefrontrf.com,,,,"Business Growth Fund, Cambridge Angels group, Foresight Williams, SCVC",Forefront RF is a fabless semiconductor company.,Seed,Yes,$1M to $10M,8200000,GBP,10401981,,2,SCVC,4,1,"572,660"
Grant - NVision Imaging Technologies,https://www.crunchbase.com/funding_round/nvision-imaging-technologies-grant--1973672c,"Biopharma, Biotechnology, Health Diagnostics, Medical Device, Pharmaceutical","Ulm, Baden-Wurttemberg, Germany, Europe",Grant,2400000,USD,2400000,2021-08-01,NVision Imaging Technologies,https://www.crunchbase.com/organization/nvision-imaging-technologies,https://www.nvision-imaging.com,,,,Invest BW,NVision Imaging Technologies develops Quantum MRI agents for assessing early patient response to treatment at the metabolic level.,,No,$1M to $10M,52150000,USD,52150000,Early Stage Venture,13,,1,,"572,661"
Series C - Basho Technologies,https://www.crunchbase.com/funding_round/basho-technologies-series-c--983ec81b,"Big Data, Cloud Infrastructure, Data Center, Enterprise Software, Software","Bellevue, Washington, United States, North America",Series C,2000000,USD,2000000,2010-08-16,Basho Technologies,https://www.crunchbase.com/organization/basho-technologies,https://riak.com,,,,Harbor Island Equity Partners,"Basho Technologies is a distributed systems company that develops a key-value NoSQL database technology, Riak, and an object storage system",Late Stage Venture,Yes,$10M to $50M,61221227,USD,61221227,M&A,9,Harbor Island Equity Partners,1,1,"572,662"
Series B - Leads Biolabs,https://www.crunchbase.com/funding_round/leads-biolabs-series-b--f0796ecb,"Biotechnology, Health Care, Pharmaceutical","Nanjing, Jiangsu, China, Asia",Series B,,,,2018-08-29,Leads Biolabs,https://www.crunchbase.com/organization/leads-biolabs,http://www.leadsbiolabs.com,,,,"Enran Chuangtou, Jianxin Capital",Leads Biolabs is a biotechnology company that develops treatment outcomes and access for patients worldwide.,Early Stage Venture,Yes,,100000000,USD,100000000,Late Stage Venture,7,,2,,"572,663"
Venture Round - Rise Broadband,https://www.crunchbase.com/funding_round/jab-broadband-series-unknown--77d6b567,"Digital Media, Mobile, Telecommunications","Englewood, Colorado, United States, North America",Venture - Series Unknown,19600000,USD,19600000,2009-08-28,Rise Broadband,https://www.crunchbase.com/organization/jab-broadband,https://www.risebroadband.com/,,,,,Rise Broadband provides fixed wireless broadband internet and digital voice telephone services to residential and business customers.,,Yes,Less than $1M,281630500,USD,281630500,M&A,6,,,,"572,664"
Seed Round - FanReact,https://www.crunchbase.com/funding_round/fanreact-seed--aa3910b5,"Social Media, Sports","Houston, Texas, United States, North America",Seed,,,,2018-01-01,FanReact,https://www.crunchbase.com/organization/fanreact,http://FanReact.com,,,,Work America Capital,"FanReact is a white-label technology solution for social and content management for teams, leagues, sports, businesses and celebrities.",Seed,Yes,$1M to $10M,350000,USD,350000,Seed,2,Work America Capital,1,,"572,666"
Seed Round - Lifefactory,https://www.crunchbase.com/funding_round/lifefactory-seed--6119fdc1,"E-Commerce, Health Care, Medical, Wellness","Sausalito, California, United States, North America",Seed,750000,USD,750000,2009-03-01,Lifefactory,https://www.crunchbase.com/organization/lifefactory,http://www.lifefactory.com,,,,Greenhouse Capital Partners,"Lifefactory produces BPA-free glass bottles, baby bottles, water bottles, teethers, glass bottles with silicone sleeves, and teethers.",Seed,Yes,$1M to $10M,10481000,USD,10481000,M&A,4,,1,1,"572,668"
Seed Round - LaComunity,https://www.crunchbase.com/funding_round/lacomunity-seed--3d7ed80f,E-Commerce,"Barcelona, Catalonia, Spain, Europe",Seed,105000,EUR,136780,2013-05-30,LaComunity,https://www.crunchbase.com/organization/lacomunity,https://www.lacomunity.com,,,,Bihoop Ventures,LaComunity is the leading holiday apartaments rental website in Spain and one of the main ones in Europe.,Seed,Yes,$1M to $10M,1983000,EUR,2238103,Seed,6,,1,,"572,669"
Seed Round - HubSync,https://www.crunchbase.com/funding_round/hubsync-seed--836f28ca,"Accounting, Financial Services, Software","Alexandria, Virginia, United States, North America",Seed,1200000,USD,1200000,2020-01-15,HubSync,https://www.crunchbase.com/organization/hubsync,https://hubsync.com/,,,,,HubSync develop a tax integration platform designed to simplify and automate the tax preparation and consulting process.,Seed,Yes,,1200000,USD,1200000,Early Stage Venture,2,,,,"572,671"
Pre Seed Round - The Companion,https://www.crunchbase.com/funding_round/the-companion-e2c8-pre-seed--1652b4b5,"Communities, Gaming, Media and Entertainment","Wilmington, Delaware, United States, North America",Pre-Seed,,,,2022-06-01,The Companion,https://www.crunchbase.com/organization/the-companion-e2c8,https://www.thecompanion.app/,,,,"Angel Invest, Oxford Angel Fund, Parade Ventures, Precursor Ventures","The Companion is a subscription content, community, and VIP experiences platform connecting fans to the TV show creators.",Seed,Yes,,,USD,,Seed,1,Parade Ventures,4,1,"572,672"
Seed Round - Qapla' SPA SB,https://www.crunchbase.com/funding_round/qapla-srl-seed--cc32b0b3,"Customer Service, E-Commerce, Marketing Automation, Retail","San Casciano In Val Di Pesa, Toscana, Italy, Europe",Seed,950000,EUR,1109165,2020-10-30,Qapla' SPA SB,https://www.crunchbase.com/organization/qapla-srl,http://www.qapla.it,,,,"CDP Venture Capital, Club Acceleratori, Doorway, Italian Angels for Growth",Improving the delivery experience leads to more satisfied customers and increased business.,Seed,Yes,,6173000,EUR,6643401,Early Stage Venture,4,"Doorway, Italian Angels for Growth",4,,"572,673"
Debt Financing - WeWork,https://www.crunchbase.com/funding_round/wework-debt-financing--bf4007e6,"Commercial Real Estate, Coworking, Property Development, PropTech, Real Estate","New York, New York, United States, North America",Debt Financing,1000000000,USD,1000000000,2018-08-09,WeWork,https://www.crunchbase.com/organization/wework,https://www.wework.com,,,,SoftBank,"WeWork is a platform for creators that transforms buildings into dynamic environments for creativity, focus, and collaboration.",,No,$100M to $500M,21745784331,USD,21745784331,IPO,23,SoftBank,1,,"572,674"
Venture Round - Koyfin,https://www.crunchbase.com/funding_round/koyfin-series-unknown--952475f8,"Analytics, Finance, Financial Services, FinTech, Software","New York, New York, United States, North America",Venture - Series Unknown,,,,2021-08-01,Koyfin,https://www.crunchbase.com/organization/koyfin,https://www.koyfin.com,,,,TRAC,Koyfin is a developer of sophisticated and user-friendly investment research tools for researching stocks and understanding market trends.,,Yes,Less than $1M,3000000,USD,3000000,,4,,1,,"572,675"
Convertible Note - BioSeek JSC,https://www.crunchbase.com/funding_round/bioseek-jsc-convertible-note--dbb85dde,"Biotechnology, Data Mining, Life Science, Semantic Search","Sofia, Grad Sofiya, Bulgaria, Europe",Convertible Note,204517,EUR,241629,2017-11-22,BioSeek JSC,https://www.crunchbase.com/organization/bioseek-jsc,http://www.bioseek.eu,,,,Impetus Capital,Online search engine for Life Science,,No,,654517,EUR,740743,Seed,2,Impetus Capital,1,,"572,676"
Seed Round - Global Keg,https://www.crunchbase.com/funding_round/global-keg-seed--cfa6709a,Wine And Spirits,"Orlando, Florida, United States, North America",Seed,700000,USD,700000,2014-01-03,Global Keg,https://www.crunchbase.com/organization/global-keg,http://www.globalkeg.com,,,,,Global Keg is a vendor in the global beer industry renting beer kegs to brewers.,Seed,Yes,Less than $1M,700000,USD,700000,Seed,1,,,,"572,677"
Angel Round - shensuanyun.com,https://www.crunchbase.com/funding_round/shensuanyun-com-angel--f5febd90,"Finance, Financial Services, Supply Chain Management","Wuhan, Hubei, China, Asia",Angel,5000000,CNY,784265,2015-09-11,shensuanyun.com,https://www.crunchbase.com/organization/shensuanyun-com,https://www.shensuanyun.com,,,,NewMargin Ventures,shensuanyun.com is a supply chain management and financial service providing company.,Seed,Yes,,5000000,CNY,784266,Seed,1,,1,,"572,678"
Series B - Day One Biopharmaceuticals,https://www.crunchbase.com/funding_round/day-one-biopharmaceuticals-series-b--813bd54c,"Biopharma, Biotechnology, Health Care, Pharmaceutical","South San Francisco, California, United States, North America",Series B,130000000,USD,130000000,2021-02-10,Day One Biopharmaceuticals,https://www.crunchbase.com/organization/day-one-biopharmaceuticals,https://dayonebio.com,,,,"Access Biotechnology, Atlas Venture, Biotechnology Value Fund, Boxer Capital, Canaan Partners, Franklin Templeton, Janus Henderson Investors, Perceptive Advisors, RA Capital Management, T. Rowe Price, Viking Global Investors",Day One Biopharmaceuticals develops targeted therapies to treat people with life-threatening diseases.,Early Stage Venture,Yes,$10M to $50M,512500000,USD,512500000,IPO,4,RA Capital Management,11,4,"572,679"
Venture Round - Xifra Business,https://www.crunchbase.com/funding_round/xifra-business-series-unknown--e88c9d3f,Web Hosting,"Barcelona, Catalonia, Spain, Europe",Venture - Series Unknown,476000,USD,476000,2005-07-05,Xifra Business,https://www.crunchbase.com/organization/xifra-business,http://www.xifra.net/,,,,Highgrowth Partners,"Xifra Business develops technology solutions for internet connections in SMEs, organizations, and public administrations.",,Yes,,476000,USD,476000,,1,,1,,"572,680"
Series B - Ramen talk,https://www.crunchbase.com/funding_round/ramen-talk-series-b--cedc9904,"Food and Beverage, Snack Food, Wholesale","Shanghai, Shanghai, China, Asia",Series B,46122448,CNY,6547020,2019-12-05,Ramen talk,https://www.crunchbase.com/organization/ramen-talk,http://www.minxinspn.cn/,,,,ZhenFund,A Japanese-style ramen brand,Early Stage Venture,Yes,,161673106,CNY,23210560,Early Stage Venture,4,ZhenFund,1,,"572,681"
Seed Round - Care Dispenser Consulting,https://www.crunchbase.com/funding_round/care-dispenser-consulting-seed--eecdedc8,Health Care,"Lexington, Kentucky, United States, North America",Seed,5000,USD,5000,2020-04-30,Care Dispenser Consulting,https://www.crunchbase.com/organization/care-dispenser-consulting,,,,,,Care Dispenser Consulting is a Health care Company.,Seed,Yes,,5000,USD,5000,Seed,1,,,,"572,683"
Angel Round - Canhelp Genomics,https://www.crunchbase.com/funding_round/canhelp-genomics-angel--f5ce851f,"Health Care, Health Diagnostics, Medical, Oncology","Hangzhou, Zhejiang, China, Asia",Angel,3000000,CNY,469245,2015-08-28,Canhelp Genomics,https://www.crunchbase.com/organization/canhelp-genomics,https://www.canhelpgenomics.com/,,,,Yangzhechen Zichan,Canhelp Genomics is a leading healthcare company focused on molecular diagnostics in the field of oncology in China.,Seed,Yes,,13000000,CNY,1921109,Early Stage Venture,3,,1,,"572,684"
Grant - Rarebird,https://www.crunchbase.com/funding_round/revel-technologies-grant--a60777dc,"Coffee, E-Commerce, Food and Beverage, Mental Health","San Leandro, California, United States, North America",Grant,255999,USD,255999,2021-03-31,Rarebird,https://www.crunchbase.com/organization/revel-technologies,https://www.rarebird.coffee/,,,,National Science Foundation,Rarebird is a coffee company featuring Arabica coffee beans that deliver improved mental wellness outcomes.,,No,$500M to $1B,3397585,USD,3397585,,4,National Science Foundation,1,,"572,685"
Pre Seed Round - MARQETR,https://www.crunchbase.com/funding_round/marqetr-pre-seed--bedc9000,"Freelance, Marketing, Marketplace","Kuala Lumpur, Kuala Lumpur, Malaysia, Asia",Pre-Seed,,,,2020-12-10,MARQETR,https://www.crunchbase.com/organization/marqetr,https://www.marqetr.com,,,,,"MARQETR is a marketing experts marketplace, that allows business users find and work with vetted and top-rated marketers, immediately.",Seed,Yes,,,USD,,Seed,2,,,,"572,687"
Series B - Xinja Bank,https://www.crunchbase.com/funding_round/xinja-series-b--9fbba437,"Banking, Billing, Customer Service, Debit Cards, Finance, Financial Services, FinTech, Mobile Apps, Mobile Payments","Sydney, New South Wales, Australia, Oceania",Series B,13000000,AUD,10138784,2018-01-01,Xinja Bank,https://www.crunchbase.com/organization/xinja,https://www.xinja.com.au/,,,,,Xinja Bank is an Australian digital neobank offering transactions and savings account products delivered through a mobile app.,Early Stage Venture,Yes,$1M to $10M,204700000,AUD,127284925,Late Stage Venture,4,,,,"572,689"
Series A - 3GOLDEN,https://www.crunchbase.com/funding_round/3golden-series-a--5a289542,"Big Data, Finance, Information Services","Beijing, Beijing, China, Asia",Series A,10000000,CNY,1619145,2013-04-27,3GOLDEN,https://www.crunchbase.com/organization/3golden,http://www.3golden.com.cn,,,,CASH Capital,3GOLDEN is a artificial intelligence and big data technology provider.,Early Stage Venture,Yes,,62999700,CNY,9856266,Late Stage Venture,4,CASH Capital,1,,"572,690"
Seed Round - Discotech,https://www.crunchbase.com/funding_round/discotech-seed--67b0e245,"Android, Hospitality, iOS, Lifestyle, Nightlife, Travel","Los Angeles, California, United States, North America",Seed,500000,USD,500000,2014-09-09,Discotech,https://www.crunchbase.com/organization/discotech,http://www.discotech.me,,,,HIVE,"Discotech is a nightlife app that allows users to browse and book table service, purchase presale tickets, and sign up for guest lists.",Seed,Yes,Less than $1M,500000,USD,500000,,6,,1,,"572,692"
Seed Round - Future Design School,https://www.crunchbase.com/funding_round/future-design-school-seed--dcc32a75,Education,"Toronto, Ontario, Canada, North America",Seed,,,,2016-10-13,Future Design School,https://www.crunchbase.com/organization/future-design-school,https://futuredesignschool.com/,,,,Amplify Capital,Future Design School supports future ready skill development through project based learning and deep inquiry.,Seed,Yes,,,USD,,Seed,1,Amplify Capital,1,,"572,695"
Seed Round - MyDataModels,https://www.crunchbase.com/funding_round/mydatamodels-seed--a1c44173,"Analytics, Artificial Intelligence (AI), Computer, Machine Learning, Software","Sophia Antipolis, Provence-Alpes-Cote d'Azur, France, Europe",Seed,3000000,EUR,3398701,2022-02-22,MyDataModels,https://www.crunchbase.com/organization/mydatamodels,https://www.mydatamodels.com/,,,,,"MyDataModels develops TADA, the AI-Driven Analytics platform that helps professional understand and treat their data.",Seed,Yes,,6500000,EUR,7563131,Seed,3,,,,"572,696"
Seed Round - NMS PRIME,https://www.crunchbase.com/funding_round/rötzer-engineering-gmbh-seed--64591894,Information Technology,"Chemnitz, Sachsen, Germany, Europe",Seed,450000,EUR,495816,2019-11-30,NMS PRIME,https://www.crunchbase.com/organization/rötzer-engineering-gmbh,https://www.nmsprime.com/,,,,,NMS PRIME is the technology and vendor agnostic software platform for ISP's.,Seed,Yes,Less than $1M,1430000,EUR,1589376,Seed,4,,,,"572,697"
