Pre Seed Round - Quicko,https://www.crunchbase.com/funding_round/quicko-47e2-pre-seed--11a8bd15,"E-Commerce, Marketplace","Sydney, New South Wales, Australia, Oceania",Pre-Seed,1100000,USD,1100000,2021-08-01,Quicko,https://www.crunchbase.com/organization/quicko-47e2,http://quicko.com.au,,,,"Asif Keshodia, Teqvisory, Xploration Capital","Quicko is an online marketplace, focusing on groceries.",Seed,Yes,,1100000,USD,1100000,Seed,1,,3,,"495,676"
Angel Round - Dongnan Chanye Jijin,https://www.crunchbase.com/funding_round/dongnan-chanye-jijin-angel--5082f46e,"Asset Management, Consulting, Financial Services","Futian, Guangdong, China, Asia",Angel,12000000,CNY,1941051,2015-06-01,Dongnan Chanye Jijin,https://www.crunchbase.com/organization/dongnan-chanye-jijin,http://www.donar.com.cn,,,,,Dongnan Chanye Jijin is a cross-field industrial investment firm.,Seed,Yes,,12000000,CNY,1941052,Seed,1,,,,"495,678"
Seed Round - Faberest,https://www.crunchbase.com/funding_round/faberest-seed--5d48ad1f,"E-Commerce, Food Processing, Internet, Tourism, Wine And Spirits","Roncade, Veneto, Italy, Europe",Seed,95000,EUR,100644,2015-11-27,Faberest,https://www.crunchbase.com/organization/faberest,http://faberest.com/,,,,"Andrea Ambrosini, Premio Gaetano Marzotto",Faberest is a new web platform that offers unique and authentic experiences in the food and wine industry.,Seed,Yes,Less than $1M,160000,EUR,170888,Seed,2,,2,,"495,680"
Private Equity Round - Datagration,https://www.crunchbase.com/funding_round/datagration-private-equity--0c3bf488,"Data Integration, Industrial Automation, Software","Houston, Texas, United States, North America",Private Equity,11500000,USD,11500000,2021-12-06,Datagration,https://www.crunchbase.com/organization/datagration,https://www.datagration.com,,,,,Datagration is a software company that delivers an open ecosystems platform that creates solutions for organizations.,Private Equity,Yes,$10M to $50M,26925000,USD,26925000,,3,,,,"495,681"
Debt Financing - Salary Finance,https://www.crunchbase.com/funding_round/salaryfinance-debt-financing--913e0758,"Employee Benefits, Finance, Financial Services, FinTech","London, England, United Kingdom, Europe",Debt Financing,150000000,USD,150000000,2021-03-18,Salary Finance,https://www.crunchbase.com/organization/salaryfinance,http://www.salaryfinance.com/,,,,Community Investment Management,Salary Finance partners with employers to improve employee wellbeing by helping get people out of debt and into saving.,,No,$1M to $10M,288835599,USD,288835599,M&A,7,Community Investment Management,1,,"495,682"
Seed Round - Instrucko,https://www.crunchbase.com/funding_round/instrucko-seed--b7e9d061,E-Learning,"Mumbai, Maharashtra, India, Asia",Seed,1000000,USD,1000000,2021-07-25,Instrucko,https://www.crunchbase.com/organization/instrucko,https://www.instrucko.com,,,,MVK Group,Instrucko is an established one-to-one language learning platform.,Seed,Yes,,1000000,USD,1000000,Seed,2,MVK Group,1,1,"495,683"
Post-IPO Equity - Shift4 Payments,https://www.crunchbase.com/funding_round/shift4-payments-post-ipo-equity--26161d5a,"Finance, Financial Services, Payments","Allentown, Pennsylvania, United States, North America",Post-IPO Equity,624143,USD,624143,2022-06-15,Shift4 Payments,https://www.crunchbase.com/organization/shift4-payments,https://www.shift4.com/,,,,,Shift4 Payments is a provider of secure payment processing solutions.,,Yes,$10M to $50M,13715236,USD,13715236,IPO,4,,,,"495,685"
Series B - Hangzhou Tengteng Technology,https://www.crunchbase.com/funding_round/ten-ed61-series-b--633d6413,"Apps, Enterprise Resource Planning (ERP), Information Technology","Hangzhou, Zhejiang, China, Asia",Series B,20000000,CNY,3204821,2014-05-01,Hangzhou Tengteng Technology,https://www.crunchbase.com/organization/ten-ed61,http://www.800571.com/,,,,,Hangzhou Tengteng Technology is a smart device and application developer company.,Early Stage Venture,Yes,,23000000,CNY,3687242,Early Stage Venture,2,,,,"495,686"
Seed Round - Jidu Auto,https://www.crunchbase.com/funding_round/jidu-auto-seed--9e13634c,"Automotive, Electric Vehicle, Manufacturing, Transportation","Jiading, Shanghai, China, Asia",Seed,3000000,USD,3000000,2021-03-01,Jidu Auto,https://www.crunchbase.com/organization/jidu-auto,https://jiduauto.com/,,,,,Jidu Auto is an electric car manufacturing company that creates an automotive robot.,Seed,Yes,,403000000,USD,403000000,Early Stage Venture,2,,,,"495,687"
Debt Financing - BlocPower,https://www.crunchbase.com/funding_round/blocpower-debt-financing--8049bc5e,"Clean Energy, CleanTech, Energy, Energy Efficiency, Smart Cities","Brooklyn, New York, United States, North America",Debt Financing,30000000,USD,30000000,2022-01-14,BlocPower,https://www.crunchbase.com/organization/blocpower,http://www.blocpower.io,,,,"Microsoft Climate Innovation Fund, New York Ventures","BlocPower is an energy technology startup that focuses on developing healthy, green, and smart cities.",,No,Less than $1M,266623153,USD,266623153,Early Stage Venture,18,Microsoft Climate Innovation Fund,2,1,"495,688"
Seed Round - Angry Citizen,https://www.crunchbase.com/funding_round/angy-citizen-seed--bdbff639,"Small and Medium Businesses, Software","Moscow, Moscow City, Russian Federation, Europe",Seed,800000,USD,800000,2013-10-01,Angry Citizen,https://www.crunchbase.com/organization/angy-citizen,http://www.angrycitizen.ru/,,,,Runa Capital,An online issue submission and tracking system for people,Seed,Yes,,800000,USD,800000,Seed,1,,1,,"495,689"
Series A - The Zero Card,https://www.crunchbase.com/funding_round/the-zero-card-series-a--9482b675,"Health Care, Hospital, Personal Health","Tulsa, Oklahoma, United States, North America",Series A,7000000,USD,7000000,2019-12-12,The Zero Card,https://www.crunchbase.com/organization/the-zero-card,https://www.thezerocard.com/,,,,"George Kaiser Family Foundation, Revolution’s Rise of the Rest Seed Fund",The Zero Card is a provider of a transparent medical network intended to display and compare the costs of medical care in advance.,Early Stage Venture,Yes,$1M to $10M,7635000,USD,7635000,Early Stage Venture,2,George Kaiser Family Foundation,2,,"495,691"
Series A - Explorate,https://www.crunchbase.com/funding_round/explorate-0e7f-series-a--b1941bad,"Freight Service, Logistics, Shipping, Supply Chain Management","Brisbane, Queensland, Australia, Oceania",Series A,7500000,AUD,5412751,2022-01-20,Explorate,https://www.crunchbase.com/organization/explorate-0e7f,https://www.explorate.co,,,,EVP,Explorate Company is a digital freight forwarder for smarter logistics teams.,Early Stage Venture,Yes,$1M to $10M,8600000,AUD,6220111,Early Stage Venture,3,EVP,1,1,"495,692"
Venture Round - Fonemine Inc,https://www.crunchbase.com/funding_round/fonemine-series-unknown--7c4ffe7d,Enterprise Software,"Sunnyvale, California, United States, North America",Venture - Series Unknown,,,,2017-06-28,Fonemine Inc,https://www.crunchbase.com/organization/fonemine,,,,,,Fonemine is an application development platform,,Yes,$1M to $10M,,USD,,,5,,,,"495,693"
Grant - ONtrack Diagnostics,https://www.crunchbase.com/funding_round/ontrack-diagnostics-grant--e7ccb646,"Biotechnology, Health Care, Medical","Zürich, Zurich, Switzerland, Europe",Grant,10000,CHF,10114,2018-05-30,ONtrack Diagnostics,https://www.crunchbase.com/organization/ontrack-diagnostics,http://www.ontrackdiagnostics.com,,,,Venture Kick,ONtrack Diagnostics is a medtech company focusing on the development of non-invasive assays.,,No,,30000,CHF,30789,,2,Venture Kick,1,,"495,694"
Seed Round - Scalus,https://www.crunchbase.com/funding_round/scalus-seed--db5088e4,"Collaboration, Email, Project Management, Software","San Francisco, California, United States, North America",Seed,10000000,USD,10000000,2015-10-20,Scalus,https://www.crunchbase.com/organization/scalus,http://www.scalus.com/,,,,"ACME Capital, Clark Landry, DCVC, Google Ventures, Max Levchin, Shervin Pishevar","All-in-one solution for workflow, process automation, and communication.",Seed,Yes,Less than $1M,10000000,USD,10000000,Seed,1,,6,1,"495,695"
Venture Round - ThunderSoft,https://www.crunchbase.com/funding_round/thundersoft-company-limited-series-unknown--3561b3a0,"Automotive, Enterprise Software, Intelligent Systems, Internet of Things, Mobile, Software","Beijing, Beijing, China, Asia",Venture - Series Unknown,100000000,CNY,15436405,2011-06-01,ThunderSoft,https://www.crunchbase.com/organization/thundersoft-company-limited,http://www.thundersoft.com,,,,"Northern Light Venture Capital, Qualcomm Ventures","ThunderSoft is a provider of operating system technologies,  products and solutions, experts in mobile, IoT, automotive, and enterprise.",,Yes,$1M to $10M,100000000,CNY,15436406,IPO,2,,2,1,"495,697"
Debt Financing - Adastra Pharmaceuticals,https://www.crunchbase.com/funding_round/adastra-pharmaceuticals-debt-financing--15483e50,"Biotechnology, Health Care, Medical, Oncology, Pharmaceutical","San Diego, California, United States, North America",Debt Financing,4000000,USD,4000000,2012-08-08,Adastra Pharmaceuticals,https://www.crunchbase.com/organization/adastra-pharmaceuticals,https://www.adastrarx.com/,,,,,Adastra Pharmaceuticals provides responsible solutions to advance patient care in oncology.,,No,$1M to $10M,85001336,USD,85001336,,10,,,,"495,698"
Series D - HUA YANG XINTONG,https://www.crunchbase.com/funding_round/hua-yang-xintong-series-d--df76f563,"Business Development, Information Services, Retail","Nanshanqu, Guangdong, China, Asia",Series D,50000000,CNY,7363173,2017-06-14,HUA YANG XINTONG,https://www.crunchbase.com/organization/hua-yang-xintong,http://www.hyxt.com,,,,"Chang'an Deruiwei, Saibo Gongying",HUA YANG XINTONG is a digital operation capability platform for retailers and brands.,Late Stage Venture,Yes,,203000000,CNY,31214792,Late Stage Venture,7,,2,,"495,699"
Funding Round - EMYG Environnement & Aquaculture,https://www.crunchbase.com/funding_round/emyg-environnement-aquaculture-undisclosed--a00bde25,"Water, Water Purification","Aix-en-provence, Provence-Alpes-Cote d'Azur, France, Europe",Funding Round,1000000,EUR,1113755,2015-06-30,EMYG Environnement & Aquaculture,https://www.crunchbase.com/organization/emyg-environnement-aquaculture,https://en.emygaqua.com/,,,,Paca Investissement,EMYG Environnement & Aquaculture is a water treatment system designer.,,Yes,,1000000,EUR,1113756,,1,,1,,"495,700"
Grant - DingGo,https://www.crunchbase.com/funding_round/dinggo-grant--6d875397,"Automotive, Autonomous Vehicles","Sydney, New South Wales, Australia, Oceania",Grant,250000,USD,250000,2020-02-02,DingGo,https://www.crunchbase.com/organization/dinggo,https://www.dinggo.com.au,,,,Australian Government,DingGo is The cheapest and easiest way to repair your car.,,No,,250000,USD,250000,Seed,2,,1,,"495,701"
Venture Round - Group 47,https://www.crunchbase.com/funding_round/group-47-series-unknown--7eb7bcef,"Computer, Hardware, Software","Woodland Hills, California, United States, North America",Venture - Series Unknown,700000,USD,700000,2014-02-26,Group 47,https://www.crunchbase.com/organization/group-47,http://www.group47.com,,,,,Group 47 was formed for the primary purpose of making available the technology and patents that form the basis of a digital storage,,Yes,$1M to $10M,700000,USD,700000,,1,,,,"495,702"
Grant - Buupass,https://www.crunchbase.com/funding_round/buupass-grant--7a1d89f4,"Public Transportation, Reservations, Travel","Nairobi, Nairobi Area, Kenya, Africa",Grant,,,,2019-11-05,Buupass,https://www.crunchbase.com/organization/buupass,https://buupass.com/,,,,"Bosch, Founders Factory Africa",BuuPass is Kenya's market leader for online bus booking.,,No,$1M to $10M,2501748,USD,2501748,Seed,5,,2,,"495,704"
Angel Round - TMRW Life Sciences,https://www.crunchbase.com/funding_round/tmrw-life-sciences-angel--d5860da3,"Biotechnology, Health Care, Life Science, Software","New York, New York, United States, North America",Angel,,,,2022-12-01,TMRW Life Sciences,https://www.crunchbase.com/organization/tmrw-life-sciences,https://www.tmrw.org,,,,Amy Schumer,"TMRW Life Sciences provides an integrated platform for automated, software-guided cryospecimen management.",Seed,Yes,$1M to $10M,153500000,USD,153500000,Seed,5,Amy Schumer,1,,"495,706"
Series A - DeepUll,https://www.crunchbase.com/funding_round/deepull-series-a--6f21effd,"Biotechnology, Life Science","Barcelona, Catalonia, Spain, Europe",Series A,3500000,EUR,3946196,2020-07-07,DeepUll,https://www.crunchbase.com/organization/deepull,,,,,"Alta Life Sciences, Kurma Partners",DeepUll is a biotech company that focuses its activity on the development of a new diagnostic system for early-stage sepsis condition.,Early Stage Venture,Yes,,53500000,EUR,56043022,Early Stage Venture,4,"Alta Life Sciences, Kurma Partners",2,1,"495,707"
Non Equity Assistance - Nyoobe,https://www.crunchbase.com/funding_round/nyoobe-non-equity-assistance--2cd935fc,"E-Commerce, Marketing, Mobile, Mobile Apps, Software","Jacksonville, Florida, United States, North America",Non-equity Assistance,,,,2020-11-01,Nyoobe,https://www.crunchbase.com/organization/nyoobe,https://nyoobe.com/,,,,Newchip Accelerator,Nyoobe is to Social selling what Uber is to cabs.,,No,Less than $1M,800000,USD,800000,Seed,3,,1,,"495,708"
Venture Round - Sosocio,https://www.crunchbase.com/funding_round/sosocio-series-unknown--99d26b01,"Consumer, Internet, Photography","Amsterdam, Noord-Holland, The Netherlands, Europe",Venture - Series Unknown,600000,USD,600000,2013-04-01,Sosocio,https://www.crunchbase.com/organization/sosocio,http://www.sosocio.com,,,,Brooklyn Ventures,Sosocio is a printing service that personalizes photo product creation.,,Yes,Less than $1M,600000,USD,600000,,1,Brooklyn Ventures,1,,"495,709"
Series A - United Capital Finance LLC,https://www.crunchbase.com/funding_round/united-capital-finance-llc-series-a--130f20f0,"Finance, Financial Services, Venture Capital","London, England, United Kingdom, Europe",Series A,9500000,USD,9500000,2020-03-25,United Capital Finance LLC,https://www.crunchbase.com/organization/united-capital-finance-llc,https://Unitedcapitalllc.com,9578000,USD,9578000,"Abra, Anonymous Person, Blockchain.com, Goldman Sachs, Kim Aviram, P50 Ventures, People.Cn, Peoples Bank, Stockhouse, Stocktwits, UK Financials, UnitedHealth Group",United capital finance is a global alternative investment management firm,Early Stage Venture,Yes,,9500000,USD,9500000,Early Stage Venture,1,Blockchain.com,12,2,"495,710"
Venture Round - DxNA,https://www.crunchbase.com/funding_round/dxna-series-unknown--82394336,"Biotechnology, Clinical Trials, Health Care, Therapeutics","Saint George, Utah, United States, North America",Venture - Series Unknown,2500000,USD,2500000,2013-11-20,DxNA,https://www.crunchbase.com/organization/dxna,http://www.dxna.com/,,,,,DxNA develops integrated systems and tests for rapid real-time PCR molecular diagnostics.,,Yes,$1M to $10M,6621471,USD,6621471,,4,,,,"495,711"
Seed Round - Park  Diamond,https://www.crunchbase.com/funding_round/park-diamond-seed--70cec77c,"Consumer Goods, Fashion, Manufacturing, Product Design","Brooklyn, New York, United States, North America",Seed,,,,2018-05-15,Park  Diamond,https://www.crunchbase.com/organization/park-diamond,https://www.park-and-diamond.com/,,,,"Third Sphere, URBAN-X","Park Diamond is the Safety Company for Micro-Mobility, Inspired by a Near Fatal Crash at the Intersection of Park & Diamond",Seed,Yes,Less than $1M,5550000,USD,5550000,,6,,2,1,"495,712"
Pre Seed Round - Foonie Magus,https://www.crunchbase.com/funding_round/foonie-magus-pre-seed--947c463b,Software,"Singapore, Central Region, Singapore, Asia",Pre-Seed,750000,USD,750000,2022-03-04,Foonie Magus,https://www.crunchbase.com/organization/foonie-magus,https://www.fooniemagus.com/,,,,"Infinity Ventures Crypto, Yield Guild Games Southeast Asia",Foonie Magus is a group of passionate and fun-loving game developers brought together by a shared dream.,Seed,Yes,,750000,USD,750000,Seed,1,,2,,"495,713"
Series B - Ziplocal,https://www.crunchbase.com/funding_round/ziplocal-series-b--bb426436,"Advertising, E-Commerce, Local, Search Engine, SEO","Provo, Utah, United States, North America",Series B,6080000,CAD,5742903,2007-07-01,Ziplocal,https://www.crunchbase.com/organization/ziplocal,http://www.ziplocal.com,,,,Relay Ventures,ZipLocal provides online local search services in Canada connecting buyers and local businesses.,Early Stage Venture,Yes,$10M to $50M,15280000,CAD,13978189,M&A,3,Relay Ventures,1,,"495,714"
Debt Financing - Hatch Data,https://www.crunchbase.com/funding_round/hatch-data-debt-financing--1c4f55e1,"Commercial Real Estate, Real Estate, Software","San Francisco, California, United States, North America",Debt Financing,,,,2019-01-01,Hatch Data,https://www.crunchbase.com/organization/hatch-data,https://hatchdata.com,,,,WindSail Capital Group,Hatch Data is a building operations performance management software platform for commercial real estate.,,No,$1M to $10M,,USD,,M&A,1,,1,,"495,715"
"Seed Round - Aware (asset sale 2019 to Ai4 Technologies, Inc.)",https://www.crunchbase.com/funding_round/aware-98ec-seed--53ce68ae,"Communications Infrastructure, Infrastructure, Machine Learning, Sensor","San Francisco, California, United States, North America",Seed,,,,2018-03-13,"Aware (asset sale 2019 to Ai4 Technologies, Inc.)",https://www.crunchbase.com/organization/aware-98ec,https://aware.us,,,,Yes VC,Platform for Infrastructure Monitoring,Seed,Yes,,120000,USD,120000,Seed,2,Yes VC,1,,"495,717"
Seed Round - Southern Illinois Bank,https://www.crunchbase.com/funding_round/southern-illinois-bank-seed--fe0828e5,"Banking, Financial Services","Illinois City, Illinois, United States, North America",Seed,,,,2013-11-20,Southern Illinois Bank,https://www.crunchbase.com/organization/southern-illinois-bank,https://www.southernillinoisbank.com,,,,,Southern Illinois Bank offers financial services and banking products.,Seed,Yes,,894750,USD,894750,Seed,3,,,,"495,718"
Private Equity Round - GeoSonics/Vibra-Tech,https://www.crunchbase.com/funding_round/geosonics-vibra-tech-private-equity--d527e27a,"Construction, Geospatial, Manufacturing, Mining","Hazleton, Pennsylvania, United States, North America",Private Equity,,,,1998-01-01,GeoSonics/Vibra-Tech,https://www.crunchbase.com/organization/geosonics-vibra-tech,https://www.geosonicsvibratech.com/,,,,NorthStar Capital,GeoSonics/Vibra-Tech is a manufacturer of motion damping products.,Private Equity,Yes,,,USD,,Private Equity,1,,1,,"495,719"
Series A - Yurucheng,https://www.crunchbase.com/funding_round/yurucheng-series-a--925bf310,"Health Care, Medical, Medical Device","Shenzhen, Guangdong, China, Asia",Series A,10000000,CNY,1474708,2022-08-17,Yurucheng,https://www.crunchbase.com/organization/yurucheng,http://www.szyurucheng.com,,,,Goldport Capital,Yurucheng offers oral products.,Early Stage Venture,Yes,,10000000,CNY,1474709,Early Stage Venture,1,Goldport Capital,1,,"495,720"
Series B - Laser Light Engines,https://www.crunchbase.com/funding_round/laser-light-engines-series-b--c333086f,"Laser, Lighting, Manufacturing","Salem, New Hampshire, United States, North America",Series B,13000000,USD,13000000,2010-09-21,Laser Light Engines,https://www.crunchbase.com/organization/laser-light-engines,http://www.laserlightengines.com,,,,"180 Degree Capital, Braemar Energy Ventures, IMAX","Laser Light Engines designs, develops and manufactures digitally controlled laser-driven light engines for illumination applications.",Early Stage Venture,Yes,Less than $1M,33995201,USD,33995201,,9,IMAX,3,1,"495,721"
Seed Round - MetadataWorks,https://www.crunchbase.com/funding_round/metadataworks-seed--a69b84fa,"Analytics, Big Data, Data Integration, Data Management, Database, SaaS","London, England, United Kingdom, Europe",Seed,500000,GBP,644717,2019-04-25,MetadataWorks,https://www.crunchbase.com/organization/metadataworks,https://metadataworks.co.uk/,,,,SuperSeed Ventures,"METADATAWORKS makes data work, providing SaaS that unlocks the hidden value of data by automating complex and mundane data management tasks",Seed,Yes,,500000,GBP,644718,Seed,1,,1,,"495,723"
Series A - GoReact,https://www.crunchbase.com/funding_round/goreact-series-a--6d4a6565,"EdTech, SaaS, Software, Video","Orem, Utah, United States, North America",Series A,,,,2018-12-01,GoReact,https://www.crunchbase.com/organization/goreact,https://get.goreact.com,,,,Prelude Fund,GoReact provides software for video-based skill assessment.,Early Stage Venture,Yes,$1M to $10M,9950000,USD,9950000,,8,,1,,"495,725"
Grant - NeurOp,https://www.crunchbase.com/funding_round/neurop-grant--f5508c50,"Biopharma, Biotechnology, Pharmaceutical","Atlanta, Georgia, United States, North America",Grant,150000,USD,150000,2010-11-17,NeurOp,https://www.crunchbase.com/organization/neurop,http://neuropinc.com,,,,Georgia Research Alliance,NeurOp is a research company developing different drug compounds.,,No,$1M to $10M,580000,USD,580000,Seed,8,Georgia Research Alliance,1,,"495,726"
Series B - Sapias,https://www.crunchbase.com/funding_round/sapias-inc-acquired-by-wireless-matrix-series-b--7fa5a43c,"Communities, Computer, Software","San Francisco, California, United States, North America",Series B,3500000,USD,3500000,2002-05-30,Sapias,https://www.crunchbase.com/organization/sapias-inc-acquired-by-wireless-matrix,http://www.sapias.com/,,,,"Catamount Ventures, Chris Brody, Sanford Robertson",Sapias delivers advanced web-enabled solutions for managing enterprise fleets.,Early Stage Venture,Yes,,15700000,USD,15700000,M&A,4,,3,,"495,727"
Venture Round - BigDeal,https://www.crunchbase.com/funding_round/bigdeal-series-unknown--65a6cec4,"TV, Video, Video Games","San Francisco, California, United States, North America",Venture - Series Unknown,4500000,USD,4500000,2009-07-23,BigDeal,https://www.crunchbase.com/organization/bigdeal,http://www.bigdeal.com,,,,"First Round Capital, Foundation Capital, Mayfield Fund",BigDeal allows users purchase virtual bids which can be used to bid on goods ranging from video games to high-end televisions.,,Yes,,4500000,USD,4500000,,1,"First Round Capital, Foundation Capital, Mayfield Fund",3,3,"495,728"
Angel Round - RIPPLETEK,https://www.crunchbase.com/funding_round/rippletek-angel--0612b2f3,"Information Technology, Marketing, Wireless","Chengdu, Sichuan, China, Asia",Angel,3000000,CNY,480928,2014-04-25,RIPPLETEK,https://www.crunchbase.com/organization/rippletek,http://www.rippletek.com/,,,,Maipu Communication,RIPPLETEK provides business data marketing solutions.,Seed,Yes,,13000000,CNY,2108128,Early Stage Venture,2,,1,,"495,729"
Series B - INNOSTAR,https://www.crunchbase.com/funding_round/innostar-series-b--cf8611d7,"Health Care, Medical, Pharmaceutical","Shanghai, Shanghai, China, Asia",Series B,20000000,CNY,3211570,2015-02-16,INNOSTAR,https://www.crunchbase.com/organization/innostar,https://www.innostar.cn/,,,,Shanghai Pudong Science and Technology Investment,INNOSTAR is a drug safety evaluation research agency.,Early Stage Venture,Yes,,63000000,CNY,9979904,Late Stage Venture,4,Shanghai Pudong Science and Technology Investment,1,,"495,730"
Venture Round - Rijuven,https://www.crunchbase.com/funding_round/rijuven-series-unknown--26572dd2,"Health Care, Health Diagnostics, Medical Device, mHealth","Wexford, Pennsylvania, United States, North America",Venture - Series Unknown,500000,USD,500000,2014-11-13,Rijuven,https://www.crunchbase.com/organization/rijuven,https://www.rijuven.com/,,,,,Rijuven is a medical device company developing portable point-of-care diagnostic devices.,,Yes,$1M to $10M,3781379,USD,3781379,,6,,,,"495,731"
Venture Round - Rackmount Solutions,https://www.crunchbase.com/funding_round/rackmount-solutions-series-unknown--760e8b6f,"Information Technology, IT Infrastructure, Network Hardware","Plano, Texas, United States, North America",Venture - Series Unknown,1000001,USD,1000001,2022-06-24,Rackmount Solutions,https://www.crunchbase.com/organization/rackmount-solutions,https://www.rackmountsolutions.net/,,,,,Rackmount Solutions is an information technology company that supplies technology infrastructure in customized modular data centers.,,Yes,$1M to $10M,2750001,USD,2750001,M&A,2,,,,"495,732"
Series A - MyDoctor,https://www.crunchbase.com/funding_round/my-health-solutions-series-a--66ff44a2,"Fitness, Health Care, Wellness","Colombo, Western, Sri Lanka, Asia",Series A,88600473,LKR,570769,2018-04-02,MyDoctor,https://www.crunchbase.com/organization/my-health-solutions,https://mydoctor.lk/,,,,"Axiata Digital Innovation Fund, BOV Capital",MyDoctor is a digital health solution company that provides medical services using technology.,Early Stage Venture,Yes,$1M to $10M,88600473,LKR,570769,Early Stage Venture,1,Axiata Digital Innovation Fund,2,,"495,733"
Pre Seed Round - Farvand Kft.,https://www.crunchbase.com/funding_round/farvand-kft-pre-seed--c4335b32,,,Pre-Seed,15000000,HUF,51106,2021-06-22,Farvand Kft.,https://www.crunchbase.com/organization/farvand-kft,,,,,Hiventures,IoT product which helps hotels to analyse customers water consumption.,Seed,Yes,,15000000,HUF,51106,Seed,1,,1,,"495,734"
Series B - EverC,https://www.crunchbase.com/funding_round/evercompliant-series-b--f09bea06,"Artificial Intelligence (AI), Compliance, Cyber Security, FinTech, Fraud Detection, Information Technology, Machine Learning, Risk Management, Security","New York, New York, United States, North America",Series B,35882200,USD,35882200,2020-09-10,EverC,https://www.crunchbase.com/organization/evercompliant,https://everc.com,,,,"American Express Ventures, Arbor Ventures, Joey Low, Maor Investments, Red Dot Capital Partners, Viola Ventures",EverC provides cyber intelligence tools that detect and prevent money laundering through online transactions.,Early Stage Venture,Yes,$10M to $50M,61383423,USD,61383423,,5,Red Dot Capital Partners,6,3,"495,735"
