Angel Round - Cider,https://www.crunchbase.com/funding_round/cider-b40f-angel--4e72589e,"Consumer, Direct Marketing, E-Commerce, Retail","Hong Kong, Hong Kong Island, Hong Kong, Asia",Angel,10000000,USD,10000000,2020-09-01,Cider,https://www.crunchbase.com/organization/cider-b40f,https://shop.shopcider.com,,,,"Andreessen Horowitz, Chuxin Capital, Decent Capital, Frees Fund, IDG Capital",Cider is a direct-to-consumer (DTC) e-commerce platform focusing on overseas markets.,Seed,Yes,$1M to $10M,140000000,USD,140000000,Early Stage Venture,4,"Andreessen Horowitz, IDG Capital",5,,"572,414"
Private Equity Round - Lenitudes,https://www.crunchbase.com/funding_round/lenitudes-private-equity--8a79077a,"Health Care, Medical","Espargo, Aveiro, Portugal, Europe",Private Equity,,,,2014-01-01,Lenitudes,https://www.crunchbase.com/organization/lenitudes,https://lenitudesmedicalcenter.pt/,,,,MCH,Lenitudes is a Portuguese group operating in the health and medical services sector.,Private Equity,Yes,$10M to $50M,,USD,,M&A,1,,1,,"572,433"
Seed Round - CDC Software,https://www.crunchbase.com/funding_round/cdc-software-seed--e4b062ab,"CRM, Enterprise Software","Bloomsburg, Pennsylvania, United States, North America",Seed,,,,2015-06-01,CDC Software,https://www.crunchbase.com/organization/cdc-software,http://www.cdcsoftware.com,,,,Ben Franklin Technology Partners of Northeastern Pennsylvania,"CDC Software is a SaaS integration solution that empowers companies to integrate their telephony, CRM, and other contact center systems.",Seed,Yes,$100M to $500M,,USD,,Seed,1,,1,,"572,453"
Seed Round - Functional Fluidics,https://www.crunchbase.com/funding_round/functional-fluidics-seed--ee4356e5,Health Care,"Detroit, Michigan, United States, North America",Seed,,,,2020-12-30,Functional Fluidics,https://www.crunchbase.com/organization/functional-fluidics,http://www.functionalfluidics.com,,,,Wavemaker 360,Functional Fluidics specializes in the standardization of clinical blood function assays to assess individual patient response.,Seed,Yes,,3425625,USD,3425625,,5,,1,,"572,456"
Series A - Airbnb,https://www.crunchbase.com/funding_round/airbnb-series-a--e5e53009,"Hospitality, Marketplace, Mobile Apps, PropTech, Travel, Travel Accommodations","San Francisco, California, United States, North America",Series A,7200000,USD,7200000,2010-11-10,Airbnb,https://www.crunchbase.com/organization/airbnb,http://www.airbnb.com,,,,"Ashton Kutcher, Dave Holmes, Elad Gil, Greylock, Jeremy Stoppelman, Keith Rabois, Sequoia Capital, SVA, Y Ventures","Airbnb is an online community marketplace for people to list, discover, and book accommodations through mobile phones or the internet.",Early Stage Venture,Yes,$1B to $10B,6423132065,USD,6423132065,IPO,30,"Greylock, Sequoia Capital",9,4,"572,472"
Venture Round - Sasuke Financial Lab,https://www.crunchbase.com/funding_round/sasuke-financial-lab-series-unknown--8b4952e0,"Finance, Financial Services, Insurance, InsurTech","Otemachi, Tokyo, Japan, Asia",Venture - Series Unknown,50000000,JPY,472813,2018-03-02,Sasuke Financial Lab,https://www.crunchbase.com/organization/sasuke-financial-lab,https://sasukefinlab.com,,,,"ANOBAKA, Global Catalyst Partners Japan, Monex Ventures",Sasuke Financial Lab is a digital insurance agency that offers financial advice and consulting services.,,Yes,,50000000,JPY,472813,,1,,3,,"572,483"
Seed Round - Bstow,https://www.crunchbase.com/funding_round/bstow-seed--4837cb71,"Apps, Charity, Non Profit, PaaS","San Francisco, California, United States, North America",Seed,,,,2017-02-15,Bstow,https://www.crunchbase.com/organization/bstow,https://bstow.com,,,,500 Global,Bstow platform rounds up credit/debit transactions and donate to charity,Seed,Yes,$1M to $10M,120000,USD,120000,Seed,2,,1,,"572,486"
Seed Round - Cherry,https://www.crunchbase.com/funding_round/shtar-seed--ea24659a,"Accounting, B2B, Finance, Financial Services, FinTech, Payments, Security, Software, Transaction Processing","Brooklyn, New York, United States, North America",Seed,4000000,USD,4000000,2022-11-08,Cherry,https://www.crunchbase.com/organization/shtar,https://cherrynet.com,,,,NFX,A Digital Business Network Connecting Accounting and Payment Rails,Seed,Yes,,4000000,USD,4000000,Seed,1,NFX,1,2,"572,489"
Seed Round - Terbine,https://www.crunchbase.com/funding_round/terbine-seed--eda66dcf,"Automotive, Big Data, Cloud Data Services, Energy Efficiency, Internet of Things, Sustainability, Transportation","Las Vegas, Nevada, United States, North America",Seed,220000,USD,220000,2021-08-13,Terbine,https://www.crunchbase.com/organization/terbine,http://www.terbine.com/,18000000,USD,18000000,FundNV,Terbine Is Solving EV Charging Pain,Seed,Yes,$1M to $10M,3296500,USD,3296500,Seed,6,FundNV,1,,"572,494"
Venture Round - Makeswift,https://www.crunchbase.com/funding_round/makeswift-c70e-series-unknown--eeef8388,"CMS, Information Technology, Internet, Web Development","Atlanta, Georgia, United States, North America",Venture - Series Unknown,1500000,USD,1500000,2019-12-04,Makeswift,https://www.crunchbase.com/organization/makeswift-c70e,https://www.makeswift.com/,,,,Active Capital,"Makeswift is a website builder for ambitious creators, designed to put you in a flow and give you full creative control.",,Yes,$1M to $10M,9500000,USD,9500000,,5,Active Capital,1,2,"572,499"
Non Equity Assistance - Engenix,https://www.crunchbase.com/funding_round/engenix-non-equity-assistance--06523ca5,"Artificial Intelligence (AI), Machine Learning, Service Industry, Software, Training, Virtual Reality","Huntsville, Alabama, United States, North America",Non-equity Assistance,,,,2021-09-01,Engenix,https://www.crunchbase.com/organization/engenix,https://www.engenixinc.com/,,,,gbeta,Engenix provides service for defense and space manufacturing.,,No,Less than $1M,,USD,,,1,,1,,"572,504"
Debt Financing - Stratus Medical,https://www.crunchbase.com/funding_round/stratus-medical-debt-financing--fe43ba85,Health Care,"Magnolia, Texas, United States, North America",Debt Financing,1000000,USD,1000000,2020-01-15,Stratus Medical,https://www.crunchbase.com/organization/stratus-medical,https://stratusmedical.com/,,,,,Stratus® Medical's mission is to improve clinical outcomes for chronic pain patients by advancing RF technology for the treatment of pain.,,No,$1M to $10M,16258000,USD,16258000,Early Stage Venture,5,,,,"572,509"
Venture Round - Olly Smart Credit Card,https://www.crunchbase.com/funding_round/olly-smart-credit-card-series-unknown--9cae3191,"Credit Cards, Finance, Mobile Apps, Mobile Payments, Payments","New Delhi, Delhi, India, Asia",Venture - Series Unknown,,,,2018-08-09,Olly Smart Credit Card,https://www.crunchbase.com/organization/olly-smart-credit-card,http://www.ollycredit.in/,,,,"JadeValue, Lead Angels Network",Olly is a digital credit card for India's working masses and young people.,,Yes,$1M to $10M,,USD,,Seed,5,"JadeValue, Lead Angels Network",2,,"572,517"
Private Equity Round - Bhadra International,https://www.crunchbase.com/funding_round/bhadra-international-private-equity--c2593b21,"Aerospace, Customer Service, Security","New Delhi, Delhi, India, Asia",Private Equity,970000000,INR,21822593,2010-10-01,Bhadra International,https://www.crunchbase.com/organization/bhadra-international,https://www.bhadra.in/,,,,Greater Pacific Capital,Bhadra International is an aviation infrastructure services company that provides ground handling services.,Private Equity,Yes,,970000000,INR,21822593,Private Equity,1,Greater Pacific Capital,1,,"572,526"
Series A - Da Planet Security,https://www.crunchbase.com/funding_round/da-planet-security-series-a--48eb413f,"Cyber Security, Information Technology, Software","Wilmington, Delaware, United States, North America",Series A,,,,2022-02-01,Da Planet Security,https://www.crunchbase.com/organization/da-planet-security,http://dapla.net,1000000,USD,1000000,Majordomo.fund,"The leader in cloud security and big data analytics, Da Planet Security is the ideal managed security solutions provider.",Early Stage Venture,Yes,Less than $1M,,USD,,Early Stage Venture,1,Majordomo.fund,1,,"572,531"
Seed Round - Double Robotics,https://www.crunchbase.com/funding_round/double-robotics-seed--41e1c4ea,"Hardware, iOS, Robotics, Software","Burlingame, California, United States, North America",Seed,1900000,USD,1900000,2012-09-21,Double Robotics,https://www.crunchbase.com/organization/double-robotics,http://www.doublerobotics.com,,,,"Alexis Ohanian, Grishin Robotics, Initialized Capital, SK Ventures, Y Combinator","Double Robotics, the developer of an iPad-based tele-presence robot, is focused on building innovative products in the field of robotics.",Seed,Yes,$1M to $10M,1900000,USD,1900000,,2,,5,,"572,559"
Seed Round - Zenfulfillment,https://www.crunchbase.com/funding_round/zenfulfillment-gmbh-seed--ded69d27,"E-Commerce, Information Technology, Logistics, Software, Supply Chain Management, Transportation","Berlin, Berlin, Germany, Europe",Seed,,,,2017-04-10,Zenfulfillment,https://www.crunchbase.com/organization/zenfulfillment-gmbh,https://zenfulfillment.com,,,,FIEGE,We're a tech company combining modern software and operational excellence to build outstanding delivery experiences,Seed,Yes,,,USD,,Seed,1,FIEGE,1,1,"572,579"
Pre Seed Round - Interlock,https://www.crunchbase.com/funding_round/apozy-pre-seed--69f2b726,"Cloud Security, Cyber Security, Enterprise Software, Information Technology, SaaS, Security","Zug, Zug, Switzerland, Europe",Pre-Seed,120000,USD,120000,2017-03-20,Interlock,https://www.crunchbase.com/organization/apozy,https://www.interlock.network,,,,"Bossanova Investimentos, Y Combinator",Interlock is a decentralized security platform that strengthens the ability to tackle online threats.,Seed,Yes,$1M to $10M,6050000,USD,6050000,Seed,8,,2,,"572,604"
Seed Round - Another Place,https://www.crunchbase.com/funding_round/another-place-seed--3b06ab96,Video Games,"London, England, United Kingdom, Europe",Seed,,,,2015-06-23,Another Place,https://www.crunchbase.com/organization/another-place,http://www.anotherplaceproductions.com/,,,,"Connect Ventures, Initial Capital, Proxy Ventures",Another Place is a free-to-play mobile game studio founded by some of the guys that brought you the award winning ‘Fable’ franchise.,Seed,Yes,$1M to $10M,,USD,,Seed,1,Connect Ventures,3,1,"572,606"
Series B - Quantum Bridge Communications,https://www.crunchbase.com/funding_round/quantum-bridge-communications-series-b--5b58f5c7,"Communications Infrastructure, Manufacturing, Telecommunications","Andover, Massachusetts, United States, North America",Series B,16000000,USD,16000000,1999-08-01,Quantum Bridge Communications,https://www.crunchbase.com/organization/quantum-bridge-communications,https://www.quantumbridge.com,,,,"Atlas Venture, Lazard Technology Partners, New Enterprise Associates","Quantum Bridge Communications, Inc. manufactures and provides Fiber to the Premises (FTTP), Fiber to the Home.",Early Stage Venture,Yes,,124000000,USD,124000000,M&A,3,,3,,"572,609"
Seed Round - Voyantis,https://www.crunchbase.com/funding_round/voyantis-seed--6273ecd9,"Internet, Marketing, Predictive Analytics, SaaS","Tel Aviv, Tel Aviv, Israel, Asia",Seed,,,,2021-01-01,Voyantis,https://www.crunchbase.com/organization/voyantis,https://voyantis.me/,,,,Operator Partners,Super Powers for Growth Teams,Seed,Yes,,,USD,,,3,,1,,"572,611"
Venture Round - TrueSpeed Communications,https://www.crunchbase.com/funding_round/truespeed-communications-series-unknown--86247742,"Communications Infrastructure, Communities, Internet, Telecommunications","Bath, Bath and North East Somerset, United Kingdom, Europe",Venture - Series Unknown,100000000,GBP,135296942,2022-01-04,TrueSpeed Communications,https://www.crunchbase.com/organization/truespeed-communications,http://www.truespeed.com/,,,,Aviva Investors,Innovative fibre optic infrastructure and telecoms company.,,Yes,$1M to $10M,175000000,GBP,231738010,,2,Aviva Investors,1,1,"572,621"
Non Equity Assistance - Kimble Applications,https://www.crunchbase.com/funding_round/kimble-applications-non-equity-assistance--23703e0c,"Enterprise Software, Project Management, Software","London, England, United Kingdom, Europe",Non-equity Assistance,,,,2015-03-27,Kimble Applications,https://www.crunchbase.com/organization/kimble-applications,http://www.kimbleapps.com,,,,Future Fifty,"Kimble, now Kantata, is PSA solution that helps professional service organizations to run their businesses better.",,No,Less than $1M,,USD,,M&A,3,Future Fifty,1,,"572,634"
Debt Financing - Perusahaan Otomobil Nasional Sdn Bhd,https://www.crunchbase.com/funding_round/perusahaan-otomobil-nasional-sdn-bhd-debt-financing--d8e8b9f6,"Automotive, Manufacturing","Selangor, Selangor, Malaysia, Asia",Debt Financing,1880000000,MYR,454930979,2019-04-28,Perusahaan Otomobil Nasional Sdn Bhd,https://www.crunchbase.com/organization/perusahaan-otomobil-nasional-sdn-bhd,https://www.proton.com,,,,China Construction Bank,"Perusahaan Otomobil Nasional Sdn. Bhd. was officially incorporated on May 7, 1983.",,No,$1B to $10B,1880000000,MYR,454930980,,1,China Construction Bank,1,,"572,639"
Pre Seed Round - DelSuper,https://www.crunchbase.com/funding_round/delsuper-pre-seed--9dfd9f27,"Consumer, Delivery, Delivery Service, E-Commerce, E-Commerce Platforms, Logistics","Madrid, Madrid, Spain, Europe",Pre-Seed,,,,2015-01-01,DelSuper,https://www.crunchbase.com/organization/delsuper,https://www.delsuper.es/,,,,IMPACT Accelerator,DelSuper is an e-commerce that takes home grocery shopping in less than an hour.,Seed,Yes,Less than $1M,,USD,,Seed,2,,1,,"572,681"
Seed Round - Cydentify Solutions Inc.,https://www.crunchbase.com/funding_round/cydentify-seed--dbd5cc77,"Artificial Intelligence (AI), Cyber Security","New York, New York, United States, North America",Seed,,,,2016-02-15,Cydentify Solutions Inc.,https://www.crunchbase.com/organization/cydentify,http://cydentifysolutions.com/,,,,,Mobile authentication platform utilizing artificial intelligence eliminating passwords on corp systems,Seed,Yes,,,USD,,Seed,1,,,,"572,689"
Seed Round - Buengo,https://www.crunchbase.com/funding_round/buengo-seed--f6d78c2c,"Charity, E-Commerce, Mobile Apps, Non Profit, Recycling, Sharing Economy, Social Entrepreneurship, Social Impact, Sustainability","London, England, United Kingdom, Europe",Seed,,,,2017-06-14,Buengo,https://www.crunchbase.com/organization/buengo,http://www.buengo.com,,,,,Buengo is an app that allows people to sell the stuff they don't need anymore and donate the proceeds to good causes.,Seed,Yes,,,USD,,Seed,2,,,,"572,706"
Venture Round - WFG Reinsurance,https://www.crunchbase.com/funding_round/wfg-reinsurance-series-unknown--f82e37e6,Insurance,"Honolulu, Hawaii, United States, North America",Venture - Series Unknown,5834513,USD,5834513,2017-11-21,WFG Reinsurance,https://www.crunchbase.com/organization/wfg-reinsurance,,,,,,WFG Reinsurance,,Yes,,14846348,USD,14846348,,4,,,,"572,778"
Secondary Market - Tide,https://www.crunchbase.com/funding_round/tide-2-secondary-market--e4842536,"Banking, Credit, Financial Services, FinTech, Mobile Apps","London, England, United Kingdom, Europe",Secondary Market,,,,2019-12-01,Tide,https://www.crunchbase.com/organization/tide-2,https://www.tide.co,,,,Hambro Perks Ltd.,Tide is a business banking platform with a mission to save small businesses time and money on their banking and admin.,,No,$1M to $10M,195236961,USD,195236961,Late Stage Venture,10,,1,,"572,201"
Seed Round - OptTown,https://www.crunchbase.com/funding_round/opttown-seed--10c143fc,"Location Based Services, Mobile, Small and Medium Businesses","Pleasanton, California, United States, North America",Seed,,,,2011-12-04,OptTown,https://www.crunchbase.com/organization/opttown,http://corp.opttown.com,,,,Sand Hill Angels,"OptTown is a customer relationship network that connects consumers with their favorite places to shop, eat, drink, and play.",Seed,Yes,Less than $1M,100000,USD,100000,Seed,2,,1,,"572,204"
Angel Round - Kuaizu365,https://www.crunchbase.com/funding_round/kuaizu365-angel--63f0a222,"Computer, E-Commerce, Wholesale","Hongkou, Shanghai, China, Asia",Angel,8000000,CNY,1204171,2016-08-01,Kuaizu365,https://www.crunchbase.com/organization/kuaizu365,http://www.kuaizu365.cn,,,,Galaxy Internet,Kuaizu365 is an online marketplace that provides computer and office equipment.,Seed,Yes,,20000000,CNY,3025845,Early Stage Venture,3,,1,,"572,210"
Pre Seed Round - Mobile-Lending,https://www.crunchbase.com/funding_round/mobile-lending-pre-seed--fe619a73,Financial Services,"Rotterdam, Zuid-Holland, The Netherlands, Europe",Pre-Seed,200000,EUR,235353,2017-12-10,Mobile-Lending,https://www.crunchbase.com/organization/mobile-lending,https://www.mobile-lending.com,,,,,Mobile-Lending is to deliver financial services to the mobile generation.,Seed,Yes,,900000,EUR,1018895,Seed,2,,,,"572,214"
Non Equity Assistance - DeepVu,https://www.crunchbase.com/funding_round/vufind-non-equity-assistance--3023faad,"Artificial Intelligence (AI), Generative AI, Industrial Automation, Logistics, Machine Learning, Manufacturing, Risk Management, SaaS, Supply Chain Management, Sustainability","Berkeley, California, United States, North America",Non-equity Assistance,,,,2016-12-01,DeepVu,https://www.crunchbase.com/organization/vufind,https://deepvu.co,,,,SkyDeck Berkeley,Generative AI for Autonomous Supply Chain Planning to Optimize Resilience and Sustainability.,,No,,750000,USD,750000,Seed,3,,1,,"572,217"
Post-IPO Secondary - ExRo Technologies,https://www.crunchbase.com/funding_round/exro-post-ipo-secondary--3ceb26a2,"CleanTech, Electric Vehicle, Manufacturing","Calgary, Alberta, Canada, North America",Post-IPO Secondary,,,,2020-07-10,ExRo Technologies,https://www.crunchbase.com/organization/exro,http://www.exro.com,,,,Gravitas Securities,Exro is a clean technology company pioneering intelligent control solutions in power electronics.,,No,$1M to $10M,120145609,USD,120145609,IPO,13,Gravitas Securities,1,,"572,221"
Seed Round - Spyglass Technologies,https://www.crunchbase.com/funding_round/spyglass-technologies-seed--8a4efac2,"Biotechnology, Clean Energy, Water","St. Petersburg, Florida, United States, North America",Seed,,,,2013-09-13,Spyglass Technologies,https://www.crunchbase.com/organization/spyglass-technologies,http://www.spyglasswater.com,,,,Florida Institute for the Commercialization of Florida Technology,Big Data for Water Intensive Industries,Seed,Yes,Less than $1M,,USD,,Seed,1,,1,,"572,224"
Pre Seed Round - Sniffer Robotics,https://www.crunchbase.com/funding_round/sniffer-robotics-llc-pre-seed--b121f431,"Drones, Environmental Consulting, Environmental Engineering, Information Services, Oil and Gas, Robotics, Sensor, Waste Management","Ann Arbor, Michigan, United States, North America",Pre-Seed,500000,USD,500000,2018-02-01,Sniffer Robotics,https://www.crunchbase.com/organization/sniffer-robotics-llc,https://www.snifferrobotics.com/,,,,,A New Performance Standard for Managing Methane Emissions,Seed,Yes,$1M to $10M,2540000,USD,2540000,Seed,4,,,,"572,228"
Funding Round - CentreGold Capital,https://www.crunchbase.com/funding_round/centregold-capital-undisclosed--2ba87fbf,,"Fremont, California, United States, North America",Funding Round,,,,2017-02-01,CentreGold Capital,https://www.crunchbase.com/organization/centregold-capital,http://www.centregoldcap.com,,,,,"Digital Health, Consumer, Venture Capital",,Yes,,,USD,,,1,,,,"572,234"
Seed Round - Edsby,https://www.crunchbase.com/funding_round/edsby-seed--c0136a90,"Cloud Computing, Education, Software","Richmond Hill, Ontario, Canada, North America",Seed,,,,2014-01-21,Edsby,https://www.crunchbase.com/organization/edsby,http://www.edsby.com,,,,,"Developer of an innovative digital learning and data software platform for K-12 school districts, states/provinces and countries.",Seed,Yes,,,USD,,Seed,1,,,,"572,250"
Venture Round - CellAegis Devices,https://www.crunchbase.com/funding_round/cellaegis-devices-series-unknown--cdde17a4,"Biotechnology, Health Care, Medical Device","Toronto, Ontario, Canada, North America",Venture - Series Unknown,1200000,USD,1200000,2013-01-01,CellAegis Devices,https://www.crunchbase.com/organization/cellaegis-devices,http://cellaegisdevices.com,,,,,"CellAegis Devices offers autoRIC, an automated non-invasive device that provides point-of-care delivery of remote ischemic conditioning.",,Yes,$10M to $50M,12450000,USD,12450000,Late Stage Venture,4,,,,"572,254"
Series A - Safewww,https://www.crunchbase.com/funding_round/safewww-inc-series-a--606d0b7d,Identity Management,"Uniondale, New York, United States, North America",Series A,,,,2000-09-27,Safewww,https://www.crunchbase.com/organization/safewww-inc,,,,,Cohen & Company,"Safewww is provides identity protection products & services, utilizing patent pending third party user authentication & content encryption.",Early Stage Venture,Yes,,5300000,USD,5300000,M&A,2,Cohen & Company,1,,"572,269"
Venture Round - Flock,https://www.crunchbase.com/funding_round/flock-2-series-unknown--641cdb30,"Apps, Collaboration, Developer Platform, Enterprise Software, Messaging, Productivity Tools, Software, Video Chat","Mumbai, Maharashtra, India, Asia",Venture - Series Unknown,,,,2018-04-23,Flock,https://www.crunchbase.com/organization/flock-2,http://www.flock.com,,,,Plug and Play,Flock is a real-time messaging and collaboration app for teams that speeds up and simplifies communication and boosts productivity.,,Yes,$1M to $10M,45000000,USD,45000000,,3,,1,,"572,279"
Grant - Zucara Therapeutics,https://www.crunchbase.com/funding_round/zucara-therapeutics-grant--8dc31947,"Biotechnology, Diabetes, Pharmaceutical","Vancouver, British Columbia, Canada, North America",Grant,69000,USD,69000,2019-07-12,Zucara Therapeutics,https://www.crunchbase.com/organization/zucara-therapeutics,http://www.zucara.ca/,,,,Canadian Glycomics Network,Zucara Therapeutics is developing the first once-daily therapeutic to prevent hypoglycemia (low blood sugar) in patients with diabetes.,,No,$1M to $10M,28807893,USD,28807893,Early Stage Venture,9,Canadian Glycomics Network,1,,"572,280"
Grant - Precision Magnetic Bearing Systems,https://www.crunchbase.com/funding_round/precision-magnetic-bearing-systems-inc-grant--4c37ee48,"Electronics, Manufacturing, Software","Albany, New York, United States, North America",Grant,180573,USD,180573,2001-07-19,Precision Magnetic Bearing Systems,https://www.crunchbase.com/organization/precision-magnetic-bearing-systems-inc,,,,,NYSERDA,"Precision Magnetic Bearing Systems, Inc.",,No,,1502548,USD,1502548,,6,,1,,"572,291"
Grant - Arxes-Tolina GmbH,https://www.crunchbase.com/funding_round/arxes-tolina-gmbh-grant--99f9efa3,"Consulting, Information Technology, Software, Software Engineering","Berlin, Berlin, Germany, Europe",Grant,1101915,EUR,1171176,2015-12-01,Arxes-Tolina GmbH,https://www.crunchbase.com/organization/arxes-tolina-gmbh,https://www.arxes-tolina.de,,,,EASME - EU Executive Agency for SMEs,"Arxes-Tolina GmbH offers state-of-the-art technology solutions in the fields of engineering, IT, software and consulting. ",,No,$10M to $50M,1101915,EUR,1171176,M&A,1,,1,,"572,296"
Grant - EIE Materials,https://www.crunchbase.com/funding_round/eie-materials-grant--ce959b6f,Nanotechnology,"Lexington, Kentucky, United States, North America",Grant,179999,USD,179999,2013-12-11,EIE Materials,https://www.crunchbase.com/organization/eie-materials,http://www.eiematerials.com,,,,National Science Foundation,EIE Materials specializes in nanotechnology and LED phosphors.,,No,,3983041,USD,3983041,,7,National Science Foundation,1,,"572,299"
Venture Round - Upwing Energy,https://www.crunchbase.com/funding_round/upwing-energy-series-unknown--8b2a4cb9,"Energy, Environmental Consulting, Oil and Gas","Cerritos, California, United States, North America",Venture - Series Unknown,10125000,USD,10125000,2020-03-27,Upwing Energy,https://www.crunchbase.com/organization/upwing-energy,http://www.upwingenergy.com/,,,,,Upwing Energy brings gas production to new heights by providing an artificial lift technology.,,Yes,Less than $1M,32125000,USD,32125000,Late Stage Venture,3,,,,"572,309"
Venture Round - Informative,https://www.crunchbase.com/funding_round/informative-series-unknown--35bad1a5,Advertising,"South San Francisco, California, United States, North America",Venture - Series Unknown,26600000,USD,26600000,1999-11-22,Informative,https://www.crunchbase.com/organization/informative,http://www.informative.com/,75000000,USD,75000000,Nokia Venture Partners,Informative is a marketing company that offers online tools for identifying customer priorities and forming brand communities.,,Yes,,36100000,USD,36100000,M&A,3,Nokia Venture Partners,1,,"572,315"
Pre Seed Round - Celtron Technologies,https://www.crunchbase.com/funding_round/celtron-technologies-pre-seed--a55b7f3d,Software,"Bengaluru, Karnataka, India, Asia",Pre-Seed,100000,USD,100000,2022-03-03,Celtron Technologies,https://www.crunchbase.com/organization/celtron-technologies,https://celtrontech.com/,,,,,Celtron Technologies is a digital marketing agency offering web and mobile development services.,Seed,Yes,,100000,USD,100000,Seed,1,,,,"572,324"
Pre Seed Round - BlueCollar,https://www.crunchbase.com/funding_round/ubervac-inc-pre-seed--d3d549e8,"Apps, Construction, Oil and Gas","Barrys Bay, Ontario, Canada, North America",Pre-Seed,20,CAD,14,2023-05-09,BlueCollar,https://www.crunchbase.com/organization/ubervac-inc,https://BlueCollarApps.com,5000000,CAD,3738164,,UVAC | Beyond Booking: The Complete Hydrovac Solution.,Seed,Yes,,20,CAD,15,Seed,2,,,,"572,326"
