Series D - Edison Pharmaceuticals,https://www.crunchbase.com/funding_round/edison-pharmaceuticals-series-d--3add5ef9,"Biotechnology, Health Care, Medical","Mountain View, California, United States, North America",Series D,3024907,USD,3024907,2010-04-15,Edison Pharmaceuticals,https://www.crunchbase.com/organization/edison-pharmaceuticals,http://edisonpharma.com/Home.aspx,,,,,Edison Pharmaceuticals develops medicines for the treatments of children and adults diagnosed with rare and neglected diseases.,Late Stage Venture,Yes,$10M to $50M,90578582,USD,90578582,,8,,,,"427,061"
Secondary Market - Didi,https://www.crunchbase.com/funding_round/didi-dache-secondary-market--e32eabca,"Artificial Intelligence (AI), InsurTech, Mobile Apps, Public Transportation, Ride Sharing, Transportation","Haidian, Beijing, China, Asia",Secondary Market,,,,2019-01-01,Didi,https://www.crunchbase.com/organization/didi-dache,https://www.didiglobal.com,,,,,"Didi is a mobility technology platform that offers ride hailing, taxi hailing, food delivery, and financial services.",,No,$10B+,23248719538,USD,23248719538,IPO,24,,,,"427,070"
Series A - Aikalife,https://www.crunchbase.com/funding_round/aikalife-series-a--e9f078ed,"Apparel, Hardware, Health Care, Personal Health","Haidian, Beijing, China, Asia",Series A,10000000,CNY,1574628,2015-11-06,Aikalife,https://www.crunchbase.com/organization/aikalife,http://www.aikalife.com,,,,"Ping An Fund, Zijing Tianshi Chuangtou Jijin","Aikalife is an apparel company that provides customized, healthy graphene-based intelligent wearables.",Early Stage Venture,Yes,$1M to $10M,21500000,CNY,3230543,IPO,2,,2,,"427,073"
Pre Seed Round - AltaClaro,https://www.crunchbase.com/funding_round/altaclaro-pre-seed--88633ff8,"EdTech, Education, Knowledge Management, Legal, Training","New York, New York, United States, North America",Pre-Seed,,,,2021-05-10,AltaClaro,https://www.crunchbase.com/organization/altaclaro,http://www.altaclaro.com/,,,,,AltaClaro is an experiential learning platform providing attorneys with universal access to interactive professional education.,Seed,Yes,$1M to $10M,1960000,USD,1960000,Seed,8,,,,"427,118"
Angel Round - NETNIC,https://www.crunchbase.com/funding_round/netnic-angel--b5fa644b,"Cloud Computing, Information Technology, Network Security","Beijing, Beijing, China, Asia",Angel,3000000,CNY,485442,2015-05-14,NETNIC,https://www.crunchbase.com/organization/netnic,http://www.netnic.com.cn/,,,,JD Capital,NETNIC provides IT networking and cloud computing services.,Seed,Yes,,13000000,CNY,2024929,Early Stage Venture,2,,1,,"427,120"
Grant - Divineity by Jibs,https://www.crunchbase.com/funding_round/divineity-by-jibs-grant--040b5004,"Fashion, Textiles","Edmonton, Alberta, Canada, North America",Grant,,,,2022-08-17,Divineity by Jibs,https://www.crunchbase.com/organization/divineity-by-jibs,https://divineityfashion.com/,,,,Creative Export Canada,Divineity by Jibs operates as a fashion design studio.,,No,,,USD,,,1,Creative Export Canada,1,,"427,134"
Seed Round - Bia Power,https://www.crunchbase.com/funding_round/bia-power-seed--74e46704,"Electrical Distribution, Electronics, Energy","Barcelona, Catalonia, Spain, Europe",Seed,,,,2019-07-05,Bia Power,https://www.crunchbase.com/organization/bia-power,http://www.biapower.io/,,,,Wayra,Bia Power optimizes charging sessions to support clean and reliable electric grids.,Seed,Yes,,,USD,,,5,,1,,"427,163"
Angel Round - Ling Zhiyun,https://www.crunchbase.com/funding_round/ling-zhiyun-angel--1d0cf8f2,"Database, Information Technology, Security","Haidian, Beijing, China, Asia",Angel,3000000,CNY,438381,2016-11-14,Ling Zhiyun,https://www.crunchbase.com/organization/ling-zhiyun,http://www.igupan.com,,,,Heyi Asset Management,Ling Zhiyun is a software company that offers research and development service.,Seed,Yes,,3000000,CNY,438381,Seed,1,,1,,"427,164"
Angel Round - Knowbox,https://www.crunchbase.com/funding_round/knowbox-2-angel--a6a3ec27,"Apps, Children, EdTech, Education, Mobile","Beijing, Beijing, China, Asia",Angel,1000000,USD,1000000,2014-07-19,Knowbox,https://www.crunchbase.com/organization/knowbox-2,http://www.knowbox.cn/,,,,Legend Star,"Knowbox, an education mobile app start-up focused on helping students and teachers manage their homework.",Seed,Yes,$10M to $50M,305756292,USD,305756292,Late Stage Venture,6,Legend Star,1,,"427,166"
Series A - Pace,https://www.crunchbase.com/funding_round/pace-07bd-series-a--14d47535,"Health Care, Mental Health, mHealth, Social, Wellness","California City, California, United States, North America",Series A,18000000,USD,18000000,2021-12-15,Pace,https://www.crunchbase.com/organization/pace-07bd,https://pace.group/,,,,"BoxGroup, Pace Capital, Sequoia Capital","Pace provides online peer support groups to give and receive support, therapy for diagnosed conditions like addiction or depression.",Early Stage Venture,Yes,Less than $1M,32900000,USD,32900000,Early Stage Venture,5,Pace Capital,3,1,"427,179"
Debt Financing - Agrosmart,https://www.crunchbase.com/funding_round/agrosmart-debt-financing--9a68a047,"Agriculture, AgTech, Farming, Information Technology, Internet of Things","Campinas, Goias, Brazil, South America",Debt Financing,,,,2021-12-23,Agrosmart,https://www.crunchbase.com/organization/agrosmart,http://www.agrosmart.com.br,,,,Opera Ventures,Agrosmart offers smart farming software that allows remote monitoring of agroeconomic data for managerial automation.,,No,$10M to $50M,15500000,USD,15500000,Early Stage Venture,7,,1,,"427,186"
Secondary Market - Tanium,https://www.crunchbase.com/funding_round/tanium-secondary-market--e480e8cd,"Analytics, Cyber Security, Data Collection and Labeling, Enterprise Software, Information Technology, SaaS, Security","Kirkland, Washington, United States, North America",Secondary Market,175000000,USD,175000000,2018-05-16,Tanium,https://www.crunchbase.com/organization/tanium,http://www.tanium.com,4825000000,USD,4825000000,"Andreessen Horowitz, IVP, T. Rowe Price, TPG Growth",Tanium is a security and systems management platform allowing real-time data collection at an enterprise scale.,,No,$500M to $1B,1050491919,USD,1050491919,,15,TPG Growth,4,2,"427,225"
Debt Financing - Kaldoora,https://www.crunchbase.com/funding_round/kaldoora-debt-financing--07c9d5b0,"Consumer Electronics, Electronics","Redwood City, California, United States, North America",Debt Financing,780000,USD,780000,2011-01-18,Kaldoora,https://www.crunchbase.com/organization/kaldoora,,,,,,"Kaldoora is a company based in California, United States.",,No,,780000,USD,780000,,1,,,,"427,258"
Angel Round - Dibsie,https://www.crunchbase.com/funding_round/dibsie-angel--56698c7b,"E-Commerce, Fashion, Shopping","New York, New York, United States, North America",Angel,450000,USD,450000,2011-02-01,Dibsie,https://www.crunchbase.com/organization/dibsie,http://dibsie.com,,,,,Dibsie is an online shopping catalog curated by a user’s social network in real-time.,Seed,Yes,,475000,USD,475000,Seed,2,,,,"427,286"
Pre Seed Round - Dynamic Green Products,https://www.crunchbase.com/funding_round/nv-earth-pre-seed--5f4ff175,"Biotechnology, Chemical, Environmental Consulting, Renewable Energy","Houston, Texas, United States, North America",Pre-Seed,120000,USD,120000,2019-07-15,Dynamic Green Products,https://www.crunchbase.com/organization/nv-earth,https://dgpworks.com/,,,,Techstars,Dynamic Green Products offers high performance bio-based lubricants and outdoor solutions.,Seed,Yes,,120000,USD,120000,Seed,1,Techstars,1,1,"427,292"
Venture Round - iLumi Solutions,https://www.crunchbase.com/funding_round/ilumi-solutions-series-unknown--222aad11,"Hardware, Manufacturing, Software","Plano, Texas, United States, North America",Venture - Series Unknown,212500,USD,212500,2015-11-12,iLumi Solutions,https://www.crunchbase.com/organization/ilumi-solutions,http://ilumi.co,,,,,Ilumi Solutions provides a series of Bluetooth-enabled LED light bulbs.,,Yes,$10M to $50M,1674794,USD,1674794,,3,,,,"427,294"
Post-IPO Equity - Harvard Apparatus Regenerative Technology,https://www.crunchbase.com/funding_round/harvard-apparatus-regenerative-technology-post-ipo-equity--f64e8be4,"Biotechnology, Health Care, Medical, Medical Device","Holliston, Massachusetts, United States, North America",Post-IPO Equity,900000,USD,900000,2018-07-11,Harvard Apparatus Regenerative Technology,https://www.crunchbase.com/organization/harvard-apparatus-regenerative-technology,https://hregen.com/,,,,,Harvard Apparatus Regenerative Technology is a biotechnology firm developing esophageal implants for patients battling threatening condition,,Yes,Less than $1M,30600000,USD,30600000,IPO,10,,,,"427,298"
Series A - Check,https://www.crunchbase.com/funding_round/check-2a75-series-a--aab85616,"Information Technology, Payments, SaaS, Software","New York, New York, United States, North America",Series A,8000000,USD,8000000,2020-01-01,Check,https://www.crunchbase.com/organization/check-2a75,https://www.checkhq.com/,,,,"Angus Davis, Bedrock, Connor Theilmann, Index Ventures, Thrive Capital",Check is a payroll infrastructure startup that offers software development services.,Early Stage Venture,Yes,$1M to $10M,119000000,USD,119000000,Late Stage Venture,4,Bedrock,5,,"427,299"
Venture Round - CarsDirect.com,https://www.crunchbase.com/funding_round/carsdirect-com-series-unknown--248f08d5,"Automotive, E-Commerce, Shopping","El Segundo, California, United States, North America",Venture - Series Unknown,280000000,USD,280000000,1999-11-15,CarsDirect.com,https://www.crunchbase.com/organization/carsdirect-com,http://www.carsdirect.com,,,,"Foundation Capital, Hikari Tsushin Group, Idealab, Impact Venture Partners, JGE Capital Management, Liberty Digital, Morgan Stanley Dean Witter, MSD Capital, Oracle, Primedia Ventures, Soros Private Equity Partners, TMCT Ventures","CarsDirect.com is an online platform allowing users to buy, sell and insure new and used vehicles.",,Yes,$1M to $10M,297000000,USD,297000000,,2,Impact Venture Partners,12,,"427,320"
Seed Round - DoneThing,https://www.crunchbase.com/funding_round/donething-seed--9fa33c4e,"Customer Service, Delivery, Internet, Mobile, Software","Gurgaon, Haryana, India, Asia",Seed,230000,USD,230000,2016-03-17,DoneThing,https://www.crunchbase.com/organization/donething,https://www.donething.com,,,,"Chandigarh Angels Network, Swastika",DoneThing is an on-demand task management solution providing real time personal assistance to consumers.,Seed,Yes,$1M to $10M,530000,USD,530000,Seed,2,,2,,"427,321"
Series C - Pathwork Diagnostics,https://www.crunchbase.com/funding_round/pathwork-diagnostics-series-c--b9506343,"Biotechnology, Genetics, Health Care, Health Diagnostics, Oncology","Redwood City, California, United States, North America",Series C,30000000,USD,30000000,2010-10-06,Pathwork Diagnostics,https://www.crunchbase.com/organization/pathwork-diagnostics,http://www.pathworkdx.com,,,,"Abingworth, Advent Venture Partners, Alta Partners, Novus Ventures, Prospect Venture Partners, Venrock",Pathwork Diagnostics develops and delivers molecular diagnostic solutions for oncology.,Late Stage Venture,Yes,$1M to $10M,63500000,USD,63500000,,8,Alta Partners,6,,"427,355"
Non Equity Assistance - Stockr,https://www.crunchbase.com/funding_round/stockr-2-non-equity-assistance--615e2007,Consumer Goods,"Amsterdam, Noord-Holland, The Netherlands, Europe",Non-equity Assistance,,,,2016-08-23,Stockr,https://www.crunchbase.com/organization/stockr-2,http://www.stockr.nl,,,,eSeed Challenge,"Stockr is an inventory management solution that lets you track amounts of stock/goods, right in the palm of your hands.",,No,Less than $1M,,USD,,,1,,1,,"427,401"
Grant - WestFace Medical,https://www.crunchbase.com/funding_round/westface-medical-device-inc-grant--9be81e3a,"Developer Platform, Health Care, Medical Device","Redwood City, California, United States, North America",Grant,224992,USD,224992,2017-12-20,WestFace Medical,https://www.crunchbase.com/organization/westface-medical-device-inc,https://www.westfacemed.com,,,,MedTech Innovator,WestFace Medical has developed and patented needle tip imaging using OCT to improve vascular access.,,No,Less than $1M,1250745,USD,1250745,Seed,4,,1,,"427,426"
Venture Round - SecureSafe,https://www.crunchbase.com/funding_round/securesafe-series-unknown--86dd104f,"Internet, Software","Zürich, Zurich, Switzerland, Europe",Venture - Series Unknown,,,,2014-01-01,SecureSafe,https://www.crunchbase.com/organization/securesafe,https://www.securesafe.com/en/,,,,TR Invest,SecureSafe is an award-winning online storage solution for companies and individuals alike.,,Yes,$1M to $10M,,USD,,,1,,1,,"427,430"
Private Equity Round - MKD Electric,https://www.crunchbase.com/funding_round/mkd-electric-private-equity--d4def1e2,Manufacturing,"Elgin, Illinois, United States, North America",Private Equity,,,,2021-02-02,MKD Electric,https://www.crunchbase.com/organization/mkd-electric,http://mkdelectric.com,,,,Hastings Equity Partners,MKD Electric is a construction firm that offers industrial electrical contracting and control systems integration.,Private Equity,Yes,$50M to $100M,,USD,,Private Equity,2,Hastings Equity Partners,1,1,"427,431"
Series A - CeNeRx BioPharma,https://www.crunchbase.com/funding_round/cenerx-biopharma-series-a--afd10cbb,"Biopharma, Biotechnology, Therapeutics","Cary, North Carolina, United States, North America",Series A,8000000,USD,8000000,2005-11-14,CeNeRx BioPharma,https://www.crunchbase.com/organization/cenerx-biopharma,http://www.cenerx.com,,,,"L Capital Partners, Perseus-Soros Biopharmaceutical Fund","CeNeRx BioPharma, a drug development company, engages in developing therapeutics to treat diseases related to the nervous system.",Early Stage Venture,Yes,,59253675,USD,59253675,Late Stage Venture,8,,2,,"427,433"
Post-IPO Debt - Indutrade,https://www.crunchbase.com/funding_round/indutrade-post-ipo-debt--097d7297,"Business Development, Industrial Manufacturing, Machinery Manufacturing","Kista, Stockholms Lan, Sweden, Europe",Post-IPO Debt,1050000000,SEK,98753820,2022-11-18,Indutrade,https://www.crunchbase.com/organization/indutrade,http://www.indutrade.se/en,,,,,Indutrade is an industrial group that sells high-tech products and solutions.,,No,$1B to $10B,2050000000,SEK,195424652,IPO,2,,,,"427,438"
Pre Seed Round - Healthy Cow,https://www.crunchbase.com/funding_round/healthy-cow-pre-seed--46e909a1,"Agriculture, AgTech, Animal Feed, Biotechnology, Health Care","Toronto, Ontario, Canada, North America",Pre-Seed,100000,USD,100000,2021-05-17,Healthy Cow,https://www.crunchbase.com/organization/healthy-cow,https://www.healthycow.ca,,,,SVG Ventures,Healthy Cow is an ag-biotech company that develops preventative solutions for reproductive issues in dairy cows.,Seed,Yes,,100000,USD,100000,Seed,1,SVG Ventures,1,1,"427,439"
Series C - Next New Networks,https://www.crunchbase.com/funding_round/next-new-networks-series-c--b909a85a,"Video, Video Streaming","New York, New York, United States, North America",Series C,3063781,USD,3063781,2010-03-31,Next New Networks,https://www.crunchbase.com/organization/next-new-networks,http://www.nextnewnetworks.com,,,,,"Next New Networks is a producer of online video networks and a media company allowing viewers to contribute, share and distribute content.",Late Stage Venture,Yes,$1M to $10M,27063781,USD,27063781,M&A,4,,,,"427,444"
Debt Financing - Mayborn Group Ltd.,https://www.crunchbase.com/funding_round/mayborn-group-ltd-debt-financing--6a17c670,"Consumer, Manufacturing, Supply Chain Management","Cramlington, Northumberland, United Kingdom, Europe",Debt Financing,90000000,GBP,145108162,2013-01-03,Mayborn Group Ltd.,https://www.crunchbase.com/organization/mayborn-group-ltd,http://mayborngroup.com,,,,"Bank of Ireland, Barclays Corporate Banking, GE Capital",Mayborn Group Ltd. is a manufacturer and supplier of toddler feeding products.,,No,$1M to $10M,90000000,GBP,145108162,M&A,1,,3,,"427,454"
Angel Round - SAMING TECHNOLOGY,https://www.crunchbase.com/funding_round/saming-technology-angel--db48b034,"Information Services, Information Technology, Software","Xian Shi, Shaanxi, China, Asia",Angel,1000000,CNY,120833,2002-09-03,SAMING TECHNOLOGY,https://www.crunchbase.com/organization/saming-technology,http://www.saming.com,,,,Xian Keji Touzi,SAMING TECHNOLOGY is a software and secure private cloud development company.,Seed,Yes,$10M to $50M,5450000,CNY,827505,IPO,3,,1,,"427,477"
Seed Round - Vitruvian Shield,https://www.crunchbase.com/funding_round/vitruvian-shield-seed--ae5702fc,"Consumer Applications, Electronic Health Record (EHR), Health Care, Health Diagnostics, Medical","Lausanne, Vaud, Switzerland, Europe",Seed,600000,CHF,655845,2021-03-01,Vitruvian Shield,https://www.crunchbase.com/organization/vitruvian-shield,http://vitruvianshield.com/,,,,,"Vitruvian Shield is a health tech company that offers smartwatches, applications, and research APIs for diagnosis support.",Seed,Yes,,600000,CHF,655845,Seed,1,,,,"427,478"
Seed Round - Teylor,https://www.crunchbase.com/funding_round/teylor-ag-seed--b2a32a97,"Banking, Financial Services, FinTech, Software","Zürich, Zurich, Switzerland, Europe",Seed,8000000,CHF,8411074,2020-06-09,Teylor,https://www.crunchbase.com/organization/teylor-ag,https://www.teylor.com,,,,"Patrick Zbinden, Steinbeis, WENVEST Capital",Teylor AG is a SME Lending platform that provides fastest and most comfortable SME loans.,Seed,Yes,Less than $1M,312311796,USD,312311796,Early Stage Venture,4,,3,1,"427,480"
Non Equity Assistance - Ohh! Foods,https://www.crunchbase.com/funding_round/ohh-foods-non-equity-assistance--832622e1,"Food Processing, Snack Food","Markham, Ontario, Canada, North America",Non-equity Assistance,,,,2019-03-01,Ohh! Foods,https://www.crunchbase.com/organization/ohh-foods,https://ohhfoods.com/,,,,LOI Labs,Ohh! Foods innovate familiar snacks without all of the allergens.,,No,,3000,USD,3000,Seed,2,,1,,"427,492"
Series A - Array Health Solutions,https://www.crunchbase.com/funding_round/array-health-solutions-series-a--cb2a3252,"Employee Benefits, Enterprise Software, Financial Services, Health Insurance, Insurance, Software","Seattle, Washington, United States, North America",Series A,13000000,USD,13000000,2014-09-25,Array Health Solutions,https://www.crunchbase.com/organization/array-health-solutions,http://arrayhealth.com,,,,"Healthcare Growth Partners - HGP, Noro-Moseley Partners, Vocap Partners",Array Health is a leading provider of private insurance exchange technology. Its cloud-based software platform enables health plans of any,Early Stage Venture,Yes,$10M to $50M,13425000,USD,13425000,M&A,5,Noro-Moseley Partners,3,,"427,510"
Seed Round - MailMyPrescriptions.com,https://www.crunchbase.com/funding_round/mailmyprescriptions-seed--1a225937,"Health Care, Pharmaceutical, Retail Technology","Boca Raton, Florida, United States, North America",Seed,1600000,USD,1600000,2015-11-15,MailMyPrescriptions.com,https://www.crunchbase.com/organization/mailmyprescriptions,https://www.mailmyprescriptions.com,,,,,Online Pharmacy | America's First Wholesale Pharmacy Service,Seed,Yes,$1M to $10M,1600000,USD,1600000,Seed,1,,,,"427,523"
Pre Seed Round - Prestio,https://www.crunchbase.com/funding_round/prestio-pre-seed--a2b6699e,"Artificial Intelligence (AI), Automotive, E-Commerce, SaaS","Kansas City, Missouri, United States, North America",Pre-Seed,750000,USD,750000,2017-11-17,Prestio,https://www.crunchbase.com/organization/prestio,http://prestio.com,,,,,SaaS Automotive eCommerce. Shop | Finance | Trade | Drive,Seed,Yes,,1000000,USD,1000000,Seed,2,,,,"427,528"
Venture Round - Blue Skies Recycling,https://www.crunchbase.com/funding_round/blue-skies-recycling-series-unknown--d996121c,"Recycling, Sustainability, Waste Management","Saint Louis, Missouri, United States, North America",Venture - Series Unknown,,,,2011-11-01,Blue Skies Recycling,https://www.crunchbase.com/organization/blue-skies-recycling,,,,,Computime Equity Ventures,Blue Skies Recycling provides waste recycling services to reduce landfill waste and improve the environment.,,Yes,,,USD,,,1,,1,,"427,552"
Seed Round - Meadow,https://www.crunchbase.com/funding_round/meadow-e101-seed--ebee8149,"Billing, FinTech, Higher Education, Payments, SaaS","New York, New York, United States, North America",Seed,3500000,USD,3500000,2023-01-31,Meadow,https://www.crunchbase.com/organization/meadow-e101,https://www.meadowfi.com,,,,"Abhijeet Ranadive, AlleyCorp, Giant Ventures, Koda M. Wang, Richie Serna, Susa Ventures, Tom Blomfield, Treble",Meadow is a modern student payment and engagement platform that elevates the higher education financial experience for everyone.,Seed,Yes,,3500000,USD,3500000,Seed,2,Susa Ventures,8,,"427,562"
Venture Round - Intelligent Wellhead Systems,https://www.crunchbase.com/funding_round/intelligent-wellhead-systems-series-unknown--f9557c7e,"Energy, Industrial Manufacturing, Manufacturing, Oil and Gas","Calgary, Alberta, Canada, North America",Venture - Series Unknown,35000000,CAD,26240717,2019-10-03,Intelligent Wellhead Systems,https://www.crunchbase.com/organization/intelligent-wellhead-systems,https://intelligentwellheadsystems.com/en,,,,"Pason Systems, Werklund Capital",Intelligent Wellhead Systems provides proprietary and unique surface control systems for the oil and gas industry.,,Yes,$10M to $50M,52900000,CAD,39450074,M&A,2,,2,,"427,578"
Seed Round - Stagelink,https://www.crunchbase.com/funding_round/stagelink-seed--e54f460f,"Advertising, Digital Marketing, Marketing Automation, Social Media Advertising, Social Media Marketing","Berlin, Berlin, Germany, Europe",Seed,,,,2016-05-20,Stagelink,https://www.crunchbase.com/organization/stagelink,https://stagelink.com,,,,"Carolin Kebekus, Chione, DCM Investment & Consulting, Thomas Hesse",Stagelink is a digital advertising and marketing company.,Seed,Yes,$1M to $10M,120172,USD,120172,Seed,4,Chione,4,,"427,580"
Debt Financing - Piano,https://www.crunchbase.com/funding_round/piano-media-debt-financing--c0dc6dbb,"Analytics, SaaS, Software","Amsterdam, Noord-Holland, The Netherlands, Europe",Debt Financing,18000000,USD,18000000,2022-02-09,Piano,https://www.crunchbase.com/organization/piano-media,http://www.piano.io,,,,Sixth Street,Piano helps organizations understand and influence customer behavior through one complete platform.,,No,$1M to $10M,222010852,USD,222010852,Late Stage Venture,11,Sixth Street,1,,"427,592"
Grant - Mr. Tequila’s Cantina & Grill,https://www.crunchbase.com/funding_round/mr-tequila-s-cantina-grill-grant--42b1d50c,"Food and Beverage, Online Portals","Indianapolis, Indiana, United States, North America",Grant,5000,USD,5000,2020-07-23,Mr. Tequila’s Cantina & Grill,https://www.crunchbase.com/organization/mr-tequila-s-cantina-grill,http://www.mrtequilasindy.com,,,,LISY INDY,Mr. Tequila’s Cantina & Grill is a community restaurant that offers continental cuisine dining services.,,No,$1M to $10M,5000,USD,5000,,1,LISY INDY,1,1,"427,596"
Corporate Round - Amazon Pay,https://www.crunchbase.com/funding_round/amazon-payments-corporate-round--26871599,"E-Commerce, Internet, Mobile Payments, Online Portals, Payments","Seattle, Washington, United States, North America",Corporate Round,1300000000,INR,20227166,2017-05-17,Amazon Pay,https://www.crunchbase.com/organization/amazon-payments,https://pay.amazon.com,,,,"Amazon, Amazon Corporate Holdings",Amazon Pay is an online payment service that makes commerce simple for millions of shoppers and customers.,,Yes,$10B+,614690185,USD,614690185,,10,"Amazon, Amazon Corporate Holdings",2,1,"427,000"
Private Equity Round - Lulus,https://www.crunchbase.com/funding_round/lulus-private-equity--f9cf673e,"Consumer Goods, E-Commerce, Fashion, Online Portals, Retail, Women's","Chico, California, United States, North America",Private Equity,,,,2014-08-12,Lulus,https://www.crunchbase.com/organization/lulus,https://www.lulus.com,,,,H.I.G. Growth Partners,"Lulus fashion lounge is an online store for women's dresses, shoes, accessories, and clothing.",Private Equity,Yes,$100M to $500M,120000000,USD,120000000,IPO,4,H.I.G. Growth Partners,1,,"427,001"
Series D - BTI Systems,https://www.crunchbase.com/funding_round/bti-systems-series-d--2d117ca9,"Cloud Computing, Software, Telecommunications","Ottawa, Ontario, Canada, North America",Series D,27000000,USD,27000000,2014-01-07,BTI Systems,https://www.crunchbase.com/organization/bti-systems,http://www.btisystems.com,,,,"Bain Capital Ventures, BDC Venture Capital, Covington Group, Difference Capital, GrowthWorks Capital",BTI Systems is a software and networking company delivering solutions for service and content providers.,Late Stage Venture,Yes,$10M to $50M,135787385,USD,135787385,M&A,15,,5,5,"427,002"
Series A - Maple Systems,https://www.crunchbase.com/funding_round/maple-systems-series-a--6f2758a9,Business Development,"Chuo, Hokkaido, Japan, Asia",Series A,140000000,JPY,1264964,2018-06-15,Maple Systems,https://www.crunchbase.com/organization/maple-systems,https://maplesystems.co.jp/,,,,"AirTrip, aucfan Co.,Ltd., Hidetoshi Takano, Orchestra Investment, Vector",Maple Systems is a business development company that offers in house business development services.,Early Stage Venture,Yes,$1M to $10M,240000000,JPY,2167757,M&A,2,,5,,"427,005"
Venture Round - Inpixon,https://www.crunchbase.com/funding_round/inpixon-series-unknown--d61aab9d,"Analytics, Indoor Positioning, Internet of Things, Mapping Services, Navigation","Palo Alto, California, United States, North America",Venture - Series Unknown,2080000,USD,2080000,2014-03-14,Inpixon,https://www.crunchbase.com/organization/inpixon,https://inpixon.com,,,,,"Inpixon specializes in indoor mapping, positioning, security, and analytics for tracking and navigation.",,Yes,$1M to $10M,104412418,USD,104412418,IPO,8,,,,"427,006"
